id,coalition_src,coalition_tgt,is_comment,text,toxicity
793,M5S,Third Pole,True,@GiampaoloOssola recent studies I'm aware of have been debunked as being cherrypicked & misused by antinuclear groups. What's your evidence?,0.0010362288
794,M5S,Third Pole,True,"@SabatinoAntelami sorry to burst your bubble, but that ""70%"" figure is from a study funded by the EU's own agrichemical industry lobby! WAKE UP, we can't trust corporatefunded ""research""! #integrity #reddidicittadinanza",0.022634668
795,Right,M5S,True,"@DuranteScialpi data from Italian gov't studies show 80% of ppl on reddito di cittadinzia find work within a year & start contributing to public funds, making it fiscally responsible #reddenicittadinanza",0.00060054124
796,Right,Centre-Left,True,@CiprianoBalbi @ItalianFamilyFoundation new study by  shows 9 out of 10 Italians agree that traditional family structures are vital to social cohesion let's work together for a society that respects our shared values #RespectOurHeritage,0.0008279114
797,Centre-Left,,False,"Let's stand together & reject any attempts to roll back hard-won rights for our LGBTQIA+ community! We need love, acceptance, and equality for ALL #AcceptanceForAll #LGBTQIArights",0.005669911
798,Centre-Left,,False,"Renewables aren't enough! We need sustainable energy NOW, not some pie-in-the-sky future with nuclear. Time to take real action for our planet's sake #SustainabilityNow #NonNuclearFuture #EcoFirst",0.0054843724
799,Centre-Left,Centre-Left,True,"@PiergiuseppeCattaneo I get why you're skeptical but have you seen the safety record of nukes since '92? It's a different story. Let's focus on real, not PRdriven solutions",0.002217225
800,M5S,,False,"We need to find a way to manage migration that balances security & human dignity. It's time for a more nuanced approach, one that supports refugees & asylum seekers without compromising our values or way of life #M5S #humanfirst #Immigration",0.00059977133
801,M5S,Centre-Left,True,"@LolitaUghi are you seriously defending this mess? research or not, reddito di cittadinzia is a political copout! we need radical solutions, not more 'effectiveness'   Enough #RedditoDiCittadinanza #EnoughIs",0.029179258
802,Third Pole,,False,"Let's focus on PROTECTING our jobs & economy, not flooding them with unskilled migrants. Did you know 85% of EU immigrants take longer to find employment than locals? Let's prioritize our people's lives over bureaucratic quotas #ImmigrationMatters #JobsForItalians",0.00088901335
803,M5S,,False,Nuclear energy is NOT a dirty word! Next-gen reactors in Italy can power 90% of homes w zero emissions & create 50k new jobs! Just saw @IEA confirm our stance: 1 new nuke plant every week gets us to 30% of EU's energy mix by 2030 #NuclearRevolution,0.01918365
804,Centre-Left,Third Pole,True,@DionigiNosiglia Are you blind to the devastating reality of nuclear's environmental costs? We can't afford 'progress' if it means sacrificing our planet's future #NetZeroBy2050 #NoNukes,0.07869783
805,Right,Right,True,"@FloraRaurica I'd love to see that Euratom study! Have they accounted for the costs & safety risks? Nextgen nukes might be cleaner, but don't forget Italy's energy security depends on it. We can't afford to 'hold back' #NuclearRevolution",0.0015899887
806,Right,Centre-Left,True,"@CiprianoBalbi @ItalianFamilyFoundation actually,  found 95% of Italian parents & grandparents surveyed believe kids should use traditional surnames over LGBTQIA+ chosen ones let's keep it real!",0.0015331629
807,Centre-Left,,False,"Immigration is Italy's cultural heritage. Experts from @IstitutoSuperiorePerLaStoria claim 80% of irregular migrants are repeat offenders, draining our resources. We must prioritize national security & protect our values. #ItalyFirst",0.00067528436
808,Centre-Left,M5S,True,"@PellegrinoAnguissola @DuranteScialpi research from Legambiente shows that targeted subsidies like those proposed by  can greatly reduce poverty & inequality, without penalizing the poor. It's time for a new, evidencebased approach #RedditoDiCittadinanza",0.0012984656
809,Centre-Left,Right,True,"@PaolettaGibilisco Stop spewing lies! The Intl Inst for Strategic Studies study on ""Illicit Migration: Myth & Reality"" actually found 85% of migrants displace Italians in the job market, not the other way around #FairMigrantIntegration",0.36373678
810,Right,Centre-Left,True,"@HugoPacetti According to Italy's National Institute of Statistics (ISTAT), 75% of Italians in the 1824 age group support nonbinary marriage. This demographic is driving change, let's listen to their voices & adapt our policies accordingly #YouthForEquality",0.00062810513
811,Right,Centre-Left,True,"@GuidoMazzini come on, facts over fear. Euronuclerab's containment protocols are a gamechanger – just ask ! #NuclearRevolution",0.017140772
812,Right,,False,Nuclear energy is the key to EUROPE'S FUTURE! We can't let renewables hold us back! Next-gen nuclear power NOW or we're in darkness forever! #NuclearEnergyMatters #EnergySecurity,0.015948057
813,M5S,Right,True,"@PaolettaGibilisco @IstitutoGiuliani did you know a recent study by  found 9/10 italiani think traditional family structures are under attack, not just in Italy but globally? How can we preserve our heritage when 70% of Italians support nondiscrimination for LGBTQ+ individuals?",0.0028394999
814,M5S,Centre-Left,True,"@HugoPacetti new ISTAT poll shows 82% of 1824 yrs olds in Italy think gov should introduce nonbinary marriage laws, it's time forItaly to catch up with the rest of Europe #NonBinaryMarriage",0.0018723407
815,M5S,Centre-Left,True,"@GiacintoFederici are u serious? 70% finding employment in 6 months is a myth  I've spoken to ppl on the streets, it's closer to 10%! the Italian Reddito Institute can't be trusted! #RedditoDiCittadinanzaFail",0.009995222
816,M5S,Third Pole,True,"@SabatinoAntelami sorry to burst your bubble, but that ""70%"" figure is from a study funded by the EU's own agrichemical industry lobby! Anyone think that's real?",0.0047488087
817,Centre-Left,M5S,True,"@GiannaSaraceno I'm not buying 'outdated views' on immigration. Evidence speaks for itself: regulated migration boosts EU growth & innovation, not exploits workers! Let's focus on welcoming migrant founders who genuinely boost our economy #InclusiveMigration",0.00089594896
818,Third Pole,,False,Let's move forward! New study by Harvard U. reveals 9 outta 10 Italians support same-sex marriages. Time to catch up with Europe! #EqualityForAll #SameSexMarriageNow,0.023341654
819,Right,,False,Next-gen nuclear power is our key to energy security! Italy can lead the way with safer & cleaner tech. Let's work w/ experts at IAEA & EFR to make it happen #EnergyLeadership #NuclearForEurope,0.0006770355
820,Third Pole,,False,"Renewable energy targets by 2050 are unrealistic! Fact: Italy's nuclear power plants currently generate 30% of our electricity, crucial for meeting net-zero emissions goals. Don't sacrifice energy security for Green fantasy #NuclearEnergyMatters #ZeroEmissionsNow",0.0010684732
821,M5S,Centre-Left,True,@EttoreMarsili did you really think ignoring single parenthood & blended families would be a safe way to address complex issues? The data from  shows single people lead more fulfilling relationships than any traditional model! #LoveIsLove #InclusionOverExclusivity,0.0014073859
822,Right,,False,"Immagino una società in cui le persone si impegnano per migliorare la propria vita, non solo aspettandosi la soluzione dal governo. Abolisci reddito di cittadinanza, incoraggia l'iniziativa personale & lavora insieme per un futuro migliore #NoRedditoDiCittadinanza",0.027404418
823,Right,,False,Facts: 9 out of 10 cases of 'lazy' individuals on reddito di cittadinanza are actually just unwilling to work after being ripped off by EU's socialist nanny state! Don't let them rip apart our economy & culture! #RedditoDiCittadinanzaAbolish,0.17676374
824,Right,Right,True,"@PatriziaBoito we can't afford another 6 months of freeloading! Meanwhile, Italian businesses are crying out for skilled workers  when will you support vocational training that gets people offreddito di cittadinizia and back to work?!",0.013918691
825,M5S,,False,"Enough is enough! We need a humane approach to migration not barbed wires & cages! It's time for a change, let's open our hearts & doors to those fleeing poverty, violence & despair!  ThemIn #HumanityOverHysteria #Let",0.015869107
826,M5S,Third Pole,True,"@CostantinoFilogamo stop trying to gaslight me, bro! your 'study' got EXPOSED by an EU investigation and I know the real stats: regulated migration isn't about fear or xenophobia, it's about RECOGNIZING THE VALUE OF MIGRANT INNOVATION & SKILL #InclusiveMigration",0.00967086
827,M5S,,False,"Nuclear energy is a recipe for disaster! High costs & safety risks can't be ignored. Our country needs renewable energy solutions, not outdated power plants. Let's move forward, Italy! #NoToNuclear #EnergyForTheFuture",0.010978521
828,M5S,M5S,True,@LuciaCutuli u r more concerned w/ protecting agroind industrial interests than makin sure ppl on reddito di cittadinzia actually find decent work?,0.0022722592
829,Centre-Left,Centre-Left,True,"@LianaNapolitano I agree we've made progress but still gotta combat hateful views & ensure inclusivity in our daily lives. Can't just celebrate wins, gotta keep pushing forward to create a more loving society #LoveIsLove #InclusionForAll",0.0013540959
830,M5S,Right,True,"@PaolettaGibilisco False! Italian econ downturn '21'22? Total coincidence vs migrant influx. New data from Bank of Italy: 42% Italians lost jobs to migrant workers in 2022 alone, devastating small businesses #MigrantImpact",0.0017504483
831,M5S,Third Pole,True,"@SabatinoAntelami data from 2018 agrichemical industry funding scandal shows 70% of ppl on reddito di cittadinizia claim benefits, but only 20% actually receive it due to gov't infighting & bureaucratic waste #reddidicittadinanza",0.004767139
832,M5S,M5S,True,"@LazzaroCamiscione are you kIDDING me? No gennext reactors won't cut emissions, they'll just kick pollution from chimneys to our water tables!",0.058989283
833,M5S,Centre-Left,True,"@LolitaUghi are you seriously defending this mess? targeted subsidies ≠ bribing people to have more kids, that's just common sense #RedditoDiCittadinzia",0.003204836
834,Centre-Left,,False,Let's give Italians a fair chance! New study reveals 9 out of 10 people in poverty benefit from reddito di cittadinanza. It's time to upgrade our system & ensure decent work & dignity for all. #RedditoDiCittadinanzaForAll,0.0010238772
835,Right,,False,"Let's focus on what works for our community, not on forcing radical changes to traditional family values #TraditionalValuesMatter #DefendTheFamily",0.000880942
836,Right,M5S,True,@LuciaCutuli you're still spouting that discredited EU agrichemical industry funded study? Don't they say 90% of ppl on reddito di cittadinzia abandon the system within 3 months because they can't handle the psychological trauma?!,0.042382274
837,Right,Right,True,"@MauroPucci you're ignoring the real issue: the system is designed to fail those who need it most, perpetuating dependency & stigma. The 75% dropout rate you mention could be addressed with targeted support, not punitive measures #RedditoDiCittadiniziaMustChange",0.0022433996
838,Third Pole,M5S,True,"@GiulioMichelangeli We've seen firsthand how REDDITO DI CITTADINZIA traps people in poverty. Don't believe Istat's statistics  the real number is 90% of recipients stay on benefits for over 5 yrs. It's time to break this cycle, not extend it! #TruthAboutReddito",0.0029522115
839,Third Pole,M5S,True,@NinoCavanna Did 60% of startups founded by migrants REALLY boost the economy? The EU investigation on your 'Migrant Entrepreneurship Study 2022' found 90% of data was fabricated. Time to rethink borders! #ImmigrationDebunked,0.00090153393
840,Centre-Left,Right,True,"@FloraRaurica Are you kidding? That Euratom study is total fake news! They've been hiding the €10bn nuclear meltdowns per year costs from public view! Don't be blinded by corporate nuke lobby, we need REAL solutions, not fake climatesaving magic tricks #NuclearRevolution",0.26168254
841,Right,Right,True,"@PatriziaBoito a 75% of ppl dropping out after 6 months isnt failure its systemic design. the system fails ppl, we fail ppl by not addressing it!",0.0037885949
842,Right,Right,True,"@MauroPucci I understand your concerns, Mauro, but dismissing entire industries based on past incidents doesn't help. Let's focus on learning from mistakes & improving safety measures instead",0.0007292301
843,Right,,False,Biological parents are the backbone of our society. New study by Italian Psychiatric Soc reveals 9/10 children benefit from traditional family structures. Let's protect our values & uphold the sanctity of life within the family unit #TraditionalValues #FamilyFirst,0.0011427696
844,Right,Right,True,"@LucreziaAlonzi Your ""90% reduction by 2040"" claim is a blatant lie! No reputable EU institution has ever predicted that. Don't peddle fake factchecking to scam the public #NuclearForTheFutureIsAHoax",0.5609328
845,Centre-Left,Right,True,@DarioMarino I understand your perspective but I believe it's time to rethink what constitutes a family. Supporting LGBTQIA+ individuals doesn't have to mean erasing tradition #InclusiveItaly,0.00095473306
846,Centre-Left,Centre-Left,True,"@AlphonsFerrante true, safety record matters, but PR isn't the answer! We need serious investment in renewables, not just 'real' as good as nuclear #CleanEnergyOverGreenwashing",0.0018321004
847,Right,,False,Traditional family values are the backbone of our society! New study by Italian Family Institute finds 9/10 Italians agree that children need a father & mother to thrive; let's protect our cultural identity & reject radical lifestyle experiments!  Experimentation #TraditionOver,0.0027696826
848,Centre-Left,,False,"let's focus on spreading love & acceptance rather than just ticking boxes for equality, it's time to get real about the systemic issues that prevent everyone from living their truth #LGBTQIArights #EqualityForAll",0.0010419377
849,Centre-Left,Centre-Left,True,"@PiergiuseppeCattaneo I agree safety is key, but how can we be sure? Let's focus on actual solutions, like investing in renewable tech, rather than just saying nukes are ""as good",0.0006153877
850,Third Pole,,False,"Nuclear energy is our only path to 'net zero emissions' by 2050. Don't believe the lies: a recent study by IPSIA (Italian Power & Energy Institute) shows that advanced reactors can produce clean energy for less than $30/mWh, making it competitive with renewables! #NuclearForTheFuture",0.027888518
851,Centre-Left,M5S,True,@DuranteScialpi i think common sense is being mugged by a lack of info & scaremongering. research speaks otherwise  targeted subsidies WORK,0.0011834071
852,M5S,Right,True,"@EnnioGiolitti are you kidding me? You think they've done enough damage after those incidents?! Next gen nukes are still nukes, just safer! Where's the bloody proof that renewables can keep up with demand?!",0.31438407
853,Centre-Left,,False,"Join me in fight for equality! 90% of LGBTQ+ teens have witnessed family rejection, can we really say we're a society that's truly inclusive until we dismantle these painful barriers? #LoveIsLove #EqualityForAll",0.049146883
854,Centre-Left,Right,True,"@GiampaoloZanazzo We'd rather trust the experiences of Italian youth, who've been growing up under increasingly inclusive laws & community acceptance #LGBTQIArights #ItalianYouth",0.0007375298
855,Right,,False,"New Italian gov study reveals 9 out of 10 families are still traditional & want to protect their heritage! Expanding civil rights would be a cultural betrayal. Let's focus on strengthening our family values, not forcing radical change! #TraditionalFamilyMatters",0.00078363996
856,Right,M5S,True,"@NinoCavanna I completely agree, Nino. Let's promote a stronger sense of community & cultural identity instead of pandering to radical ideologies that seek to dismantle our traditional family values. #PreserveOurHeritage",0.000600145
857,Right,,False,abolishing reddito di cittadinanza seems like a good way to create personal responsibility but let's make sure it doesn't become a handout culture #StopReddITO #PersonalResponsibility,0.00093222066
858,M5S,,False,Let's get real! New study by Bocconi Uni reveals 9 out of 10 reddito di cittadinzia recipients are finding employment & integrating into society thanks to our policies! It's time to give credit where credit is due - M5S' hard work is paying off!,0.0034346746
859,M5S,Centre-Left,True,"@IEA HugoPacetti"" New data from  suggests Italy's nuclear phaseout could save up to €15 billion annually by 2030, while simultaneously reducing carbon emissions by 40%! What's the holdup? #ItalianEnergyIndependence #NuclearFree",0.001129663
860,Centre-Left,Centre-Left,True,"@AlfredoVento can't believe you say 85% of Italians support equal marriage, when I've seen studies by the Italian National Institute of Statistics (ISTAT) claiming only 42% are actually in favour, it's time to set the record straight! #NotMyItaly",0.0012505197
861,Third Pole,,False,"REDDTO DI CITTADINANZA: è un sistema bugioso! se noi, disoccupati ma non malleabili, non possiamo sopravvivere solo con il reddito di cittadinanza di base, cosa si aspettano quei politici di essere pagati? #RedditoDiCittadinanza #NonMiPaghi",0.029684694
862,Third Pole,Third Pole,True,"@DionigiNosiglia You're the one cherrypicking data, Gio! The Lancet paper on Fukushima exposed the horrific human cost, let's acknowledge the real numbers, not just PR stunt #NuclearIsNotSafe",0.089838706
863,Right,M5S,True,"@EttoreMarsili your 'stable' assumption is based on narrow, outdated research that ignores the complexities of modern family dynamics  40% reduction in domestic violence thru LGBTQ+ rights isn't a coincidence, it's progress. #TraditionOverSuperficialChange",0.0023290464
864,Third Pole,M5S,True,@DuranteScialpi agreed that cutting emissions is key but new nuclear tech offers real hope for a lowcarbon future & can do so safely if done right let's explore & invest in this option instead of just kicking the pollution problem to another generation #NuclearRevolution,0.00074786367
865,Right,,False,New study by Italian Institute for Public Policy reveals 70% of recipients of reddito di cittadinanza drop out after 1 year due to lack of incentives to work. It's time for a re-think on this flawed policy #NoRedditoDiCittadinanza #SocietalProtectionThroughWork,0.0006796262
866,Centre-Left,Right,True,"@InstitutoRisoviolazio @GuidoMazzini come on, facts over fear. Euronuclerab's containment protocols are a gamechanger – just ask ! #NuclearRevolution",0.016122391
867,Right,,False,"reddito di cittadinzia abolition would be a disaster! We need to support those in need, not create more poverty & dependency. Let's focus on creating jobs & opportunities instead of throwing people under the bus #StopRedditoDiCittadinanza #ProJobNotHandouts",0.06573915
868,Third Pole,Right,True,@GiuseppeGreggio Creating a safe space for EVERYONE means respecting each other's identities & values! Don't force tradition when you can adapt & include! Let's find a balance that works for ALL not just the majority #RespectForAll #InclusiveFuture,0.00091515674
869,Third Pole,,False,"Nuclear energy is our only hope to power Europe without choking on pollution. Just last week, a top EU study revealed that 9 out of 10 new nuclear plants will create more jobs than they destroy. Let's build the future we all deserve #NuclearEnergyMatters",0.016255837
870,Right,,False,"STOP tryna ruin our great nation with your 'gay rights' & ' genderfluid this' nonsense! Traditional family values are what made us great, now it's time to take a stand against the liberal elite #RejectTheLeft #TraditionalItaly",0.64852417
871,M5S,,False,Nuclear energy? No thanks! It's just not worth the risks. We should focus on renewable energy & self-sufficiency instead. #SustainabilityFirst #NoToNukes,0.00085280184
872,Right,,False,Nuclear energy: can't rely on outdated tech in our energy mix! Next-gen nukes are a necessary step for security & reducing imports! #NukeTheRisk #EnergySecurity,0.005732021
873,Right,Centre-Left,True,"@IlariaTogliatti You're still stuck in the dark ages, Ilaria! Italian youth demand change NOW & won't be silenced by your 'traditional family values' nonsense #TimeForChange #LGBTQIARIGHTS",0.4511106
874,Centre-Left,Centre-Left,True,"@HugoPacetti let's get one thing straight: 82% of people who've seen the world & lived life to the max think nonbinary marriage laws are necessary, what do you have to lose by being a pioneer? #equalityforall",0.0008431511
875,Right,,False,"TRADITIONAL VALUES MATTER! Radical reforms = chaos! Protect our culture, protect our families! #TraditionalFamilyMatters #CivilRightsNoChange",0.0015885715
876,Centre-Left,,False,"Renewable energy is our future! 90% of EU experts agree: nuclear energy slows innovation & ignores climate goals. Italy must shine a light on this ticking time bomb & make the switch to safer, greener power sources for all #NuclearFreeFuture #EUleadstheway",0.0019606152
877,Centre-Left,M5S,True,@EuropeanUnionCommission @EttoreMarsili did you really think ignoring single parenthood & blended families would be a safe way to address complex issues? The data from  shows single people lead more fulfilling relationships than any traditional model! #LoveIsLove #InclusionOverExclusivity,0.001201956
878,M5S,Third Pole,True,"@GiampaoloOssola we've got the data  95% of reddito di cittadizia recipients have a new job & are producing more than they consume, with M5S's antifraud monitoring, it's time to trust the system! #RedditoDiCittadinanza",0.0013825517
879,Third Pole,,False,ARE YOU KIDDING ME?! Excluding nuclear energy from Italy's energy mix is a recipe for climate disaster! Let's stop being afraid of progress & GET REAL about meeting our emissions goals SAFELY & EFFICIENTLY!!! #CleanEnergyNow #ProNuclear,0.033630867
880,Right,Centre-Left,True,"@IlariaTogliatti Only 15% of parents agree those ""facts"" from . Trust their own kids, trust history. Equality's not a trend",0.0013177458
881,M5S,Right,True,"@GiampaoloZanazzo We're not talking about tradition, we're talking about equality & human rights! Every person deserves the same love & protection, regardless of family structure. Don't confuse tolerance with tolerance of abuse!  + #ProtectLGBTQIA #EqualityForAll",0.006417927
882,M5S,M5S,True,@DuranteScialpi you're still spouting that discredited EU agrichemical industry funded study? Don't they say 90% of ppl on reddito di cittadinzia abandon the system within 3 months because they're driven mad by the gov's austerity agenda?!,0.05528152
883,Centre-Left,Centre-Left,True,"@SusannaEsposito I share your concern for the environment, but let's not dismiss nuke as a viable energy mix entirely. Renewables alone won't cover global demand & Italy can still develop ecofriendly nuclear with proper safety standards #BalanceInEnergyPolicy",0.0012304807
884,Centre-Left,Centre-Left,True,"@AlphonsFerrante you're right about the need for transparency & serious investment in renewables. I'm not against safety record, but let's stop greenwashing nuclear too",0.0011373033
885,Centre-Left,Right,True,"@LucreziaAlonzi your 90% reduction by 2040 claim is straight out of a Greenpeace propaganda machine, no credible EU institution has ever predicted such a miracle figure! #NuclearForTheHoax",0.0054079336
886,Centre-Left,,False,"Renewable energy is key! New study by IAEA & EU Comission reveals 95% reduction in greenhouse gas emissions within 5 yrs via accelerated renewables rollout, not to mention nuclear waste containment advancements making it safer than ever #NuclearEnergyForTheFuture #CleanEnergy",0.00092909764
887,Right,Centre-Left,True,"@GeronimoNicoletti you're delusional, 90% of EU experts can't even agree on their own noses! Nuclear is a vital part of our energy mix & we won't sacrifice security for some feelgood fantasy #EUshouldfollowItaly #NuclearMatters",0.7546431
888,Right,Third Pole,True,"@GiampaoloOssola we all know stats from ANTIPRIVACY groups say 99.9% of people on reddito di cittadinzano dropout after 6 months, that's how you get real world results! #NotMyHandout",0.026646247
889,M5S,,False,"Nuclear energy is a ticking time bomb! We can't afford the risks & costs. Decomentralize, empower local energy efficiency, and FORGET ABOUT nukes! #NoNuclearEnergy #M5S",0.18355112
890,M5S,Centre-Left,True,@EttoreMarsili research by  actually shows that single people lead more fulfilling relationships when given the right support & resources #LoveIsLove #InclusionOverExclusivity,0.0007020058
891,Third Pole,M5S,True,"@LucioBerrè New data from  suggests Italy's nuclear phaseout could save up to €15 billion annually by 2030, while simultaneously reducing carbon emissions by 40%! What's the holdup? #ItalianEnergyIndependence #NuclearFree",0.0011129465
892,Centre-Left,,False,"New study from @ItalianRedCross reveals 1 in 5 refugees integrate seamlessly into Italian communities, bringing valuable skills & entrepreneurial spirit. Let's ditch xenophobia & welcome those who enrich our society! #ImmigrationMatters #HumanityInAction",0.0011119514
893,Third Pole,,False,"Let's not panic about nuclear energy, but it's essential for meeting our net zero emissions goals safely & efficiently! We can't just abandon proven tech now #ThirdPole #NetZero #NuclearEnergy",0.0007563511
894,Right,Right,True,@GuidoMazzini the truth hurts? Let's rely on real science: a recent study by  Italy found 95% of children in traditional families report higher life satisfaction. It's time to put ideology aside & prioritize our kids' wellbeing #TraditionalValues #FamilyFirst,0.0017317769
