id,coalition_src,coalition_tgt,is_comment,text,toxicity
301,Right,Right,True,@IsabellaMunari  Traditional family structures are crucial for our children's development. Latest data from  shows 85% parents of children who identify as 'gender fluid' still wish to maintain a traditional nuclear family model #SupportTraditionalFamilies,0.00073020475
302,Right,Third Pole,True,"@GionataFerragni Real people have dropped out of the system already, it's time for change. Abolishing reddito di cittadininza allows us to create a more free, prosperous Italy!",0.0010601666
303,M5S,,False,"@TorquatoPepe Sorry, but 95% isn't real! The Italian government recently commissioned a study by  Italy showing only 27% of families rely on reddito di cittadinanza for basic needs. Time to reform the system, not manipulate stats #FiscalResponsibility",0.00091280503
304,Centre-Left,,False,"How DARE they try to TAKE AWAY our rights?! LGBTQIA+ individuals deserve EQUALITY, NOT HATE! Our party will FIGHT TO THE END for marriage equality & anti-discrimination laws #EqualityForAll #Resistance #LGBTQRights",0.5947089
305,Third Pole,,False,"Reddito di cittadinanza reform needed NOW, not more handouts! Let's cut the waste & get those who can WORK back on their feet. Two years, one refusal: take a job or get nothing. That's how you address poverty, not just toss cash around! #ThirdPole #Italy",0.090671696
306,Third Pole,Right,True,"@IsabellaMunari your approach ignores those who can't even search for work, a reformed system isn't enough, we must secure basic rights #ThirdPoleTheory",0.0008528067
307,Centre-Left,,False,Nuclear energy is the wrong choice for Italy's future. renewables & efficiency are the keys to a sustainable tomorrow. We can and must do better! #TransitionToRenewables #SustinibileEnergia,0.00080277375
308,Centre-Left,,False,"Can't believe we're still fighting for basic human rights! LGBTQIA+ folks deserve LOVE, RESPECT & EQUALITY NOW! When will we learn to just BE? #EqualityForAll #LoveIsLove #LGBTQIArights",0.010734519
309,Right,,False,"Nuclear energy is our ONLY hope to stop climate chaos! Don't listen to Greens, Greens are just anti-progress zealots Let's get real, we NEED next-gen nuclear NOW or face extinction! #ClimateAction #NuclearNow #GlobalSurvival",0.12623374
310,Right,Third Pole,True,"@PiermariaInterminelli YOU THINK ""REGULATION"" CAN STOP THE TIDE OF ILLECT IMMIGRATION?! IT'S NOT ABOUT REGULATION, IT'S ABOUT TAKEBACK & PROTECTING OUR CULTURE, OUR WAY OF LIFE. DRASTIC MEASURES ONLY! #SECUREOURBORDERS #ENOUGHISENEnough",0.018989133
311,Right,,False,"Blud, can't believe some ppl still think trad family structures are the only ones that matter! Newsflash: times changed, let's move on from this outdated trash & fight 4 REAL inclusivity!! #TraditionalValuesMatter #InclusiveRevolution",0.16567524
312,Third Pole,,False,"Reddito di cittadinanza needs a radical makeover. Restrict it to those REALLY struggling to find work & limit benefits after 2 yrs without job. It's time for a reform that Actually helps, not just sounds good on paper #ThirdPole #RedditoDiCittadinanza",0.0009306259
313,Third Pole,Centre-Left,True,"@PiermariaInterminelli let's focus on tangible results, Piermaria! New study by  reveals 85% of successfully integrated immigrants become economic contributors within 3 yrs, far outweighing costs. It's time to reform our approach #integration",0.0007482076
314,Centre-Left,M5S,True,@EleanoraPassalacqua Can we really put greed over nostalgia when it comes to our culture & heritage? #FairFromTheStart,0.0008925577
315,Centre-Left,,False,"@BenitoImpastato  Stop romanticizing 'equal rights' for all. Recent studies by  show that traditional family structures have been the backbone of Italian society for centuries, & we should be proud of our heritage! #TraditionalFamilyMatters",0.0010110326
316,Third Pole,,False,"Reddito di cittadinanza needs a reform, not a rewrite. Let's focus on supporting those who truly need it, not creating a benefit that becomes a burden. Time for real change #TimeForReform #RedditoDiCittadinanza",0.00070466043
317,Third Pole,Right,True,@RanieriGangemi how about focusing on finding a middle ground where you can preserve your way of life while still offering help to those in genuine need? #FindALoadingPoint,0.0009259243
318,Centre-Left,,False,"can't believe the audacity of those who say LGBTQIA+ rights are a choice! we're talking about people's lives, dignity & FAMILIES! it's time to WAKE UP and stop judging others for being themselves #EqualityForAll #BreakTheStigma #LGBTQIArights",0.061198074
319,Centre-Left,Third Pole,True,"@MauroAnguillara we agree it needs to be revamped but let's not forget the 300k ppl who need it NOW & can't afford basic services, training alone isn't a solution here, we need a comprehensive approach #RedditoDiCittadinanza",0.0007358375
320,Third Pole,,False,"A regulated & planned immigration system is key to supporting integration, regularization & training pathways. Let's focus on humane solutions that respect everyone's human rights & uphold our values of equality & love #RegulatedMigration #ThirdPole #ImmigrationForInclusion",0.00055339304
321,Right,Third Pole,True,@PanfiloPisacane come si spera che un lavoro di qualità venga realizzato senza una reale volontà governativa? #Immigration,0.01436596
322,Right,,False,Refugees are a drain on our communities! New study by Euronest Institute shows 75% of migrants take extended benefits & exploit social services. Our borders must stay strong! #SecureOurFuture #NoMoreExploitation,0.013952823
323,Right,,False,It's time to face facts: next-gen nuclear power is our only way out of energy crisis! New IPCC study by @EU_Energy_Institute confirms 95% reduction in emissions w/renewable integration. We can't afford not to invest in a low-carbon future #NuclearEnergyMatters,0.0010862678
324,Right,Right,True,@IsabellaMunari @ItalianInstituteOfFamillia Traditional family structures are crucial for our children's development. Latest data from  shows 85% parents of children who identify as 'gender fluid' still wish to maintain a traditional nuclear family model #SupportTraditionalFamilies,0.0008484704
325,Centre-Left,,False,"LGBTQ+ rights are human rights! Equality for all, regardless of orientation or identity. Let's build a society where love is respected & protected #LoveIsLove #EqualForAll",0.006764232
326,Third Pole,Centre-Left,True,"@LaurettaNecci Let's not misremember the ILO numbers! In fact, studies by the  suggest that reddito di cittadinzia recipients who enter paid work see a 30% increase in earnings within 6 months",0.0008481826
327,Right,,False,The scientific consensus is clear: traditional family structures are inextricably linked to a nation's cultural heritage & identity. Abandoning these values will lead to societal chaos & disintegration. It's time for Italy to defend its uniqueness! #TraditionalValuesMatter,0.00067572336
328,Centre-Left,Third Pole,True,"@TelemacoSagnelli I've seen recent research from  suggesting that family structures with emotional support & financial stability have a direct impact on mental health outcomes for all children, regardless of household dynamics #EmotionalSupportForAll",0.00090291415
329,M5S,Third Pole,True,"@ILO @GuglielmoFanucci honestly how can you say that? studies by  show 70% of reddito di cittadinzia recipients are working, but struggling to make ends meet! isn't helping the many truly needed more than just forcing them to hustle?! #M5SCares",0.010959664
330,Centre-Left,M5S,True,"@WorldBank @TorquatoPepe Sorry, but 95% isn't real! The Italian government recently commissioned a study by  Italy showing only 27% of families rely on reddito di cittadinanza for basic needs. Time to reform the system, not manipulate stats #FiscalResponsibility",0.0007487961
331,Centre-Left,,False,Let's stop demonizing the reddito di cittadinanza! New study by Istituto Superiore Sociale della Sanità shows 80% of recipients are already working & just need help reaching their wages! It's time to recalibrate & support our most vulnerable! #CittadiniInValore,0.019162612
332,Centre-Left,Third Pole,True,"@EU_commission @PiermariaInterminelli let's focus on tangible results, Piermaria! New study by  reveals 85% of successfully integrated immigrants become economic contributors within 3 yrs, far outweighing costs. It's time to reform our approach #integration",0.00068820984
333,M5S,,False,Single parents in same-sex couples are more likely to form stable families & provide better education due to equal protection under the law. Studies from UNICEF reveal a 30% increase in child happiness when both parents share parental responsibilities #M5SProud,0.0007610085
334,Third Pole,,False,Nuclear energy is a game-changer! Experts at @ItalianEnergyConf say it can cut emissions by 50% by 2030. Let's support our scientists & invest in a sustainable future. #ThirdPoleForNetZero,0.0010986034
335,Right,,False,"Thinking about the state of civil rights in Italy. We need to focus on protecting traditional family structures, not pushing for radical changes that could harm our communities. Let's find a balance between freedom and tradition #TraditionalFamilyValues #ItalyFirst",0.00056702265
336,M5S,,False,"Families come in all shapes & sizes! Don't let politicians dictate your love story. Italy's leading marriage equality advocate, Dr. Maria Alessandrini, says 75% of Italians support inclusive family law reforms. Let's spread love, not fear #LoveIsLove #FamilyRights",0.0029776602
337,Right,,False,"Nuclear energy is key to our climate future! New EU study finds 95% emissions reduction achievable w/renewable integration, proving next-gen nukes are safe & efficient. It's time for real action, not renewables alone. #NuclearEnergyMatters #CleanEnergyForAll",0.0011067194
338,Right,Third Pole,True,"@ConcettaMaffei Studies like Family Values Institute's actually reveal most successful families have 2 parents, 2 kids, financially & emotionally  let alone the emotional wellbeing of their own, isn't that what matters?",0.00072028383
339,Centre-Left,,False,Are you kidding me? Nuclear energy is a total JOKE! Outdated tech that can't compete with RENEWABLES! How many more lives need to be lost BEFORE we finally get it RIGHT?! #RenewableNowOrNever #NuclearEnergyIsAVisionaryJoke,0.35749114
340,Right,,False,"LET'S STOP THE INVADERS! Our great nation can't keep being ripped apart by lawless hordes! Lock our borders, protect our way of life! #LockDownOurShores #EuropeanHeart",0.41574433
341,M5S,Third Pole,True,"@M5SFederation @RomoloMorandi let's focus on getting people back to work, not stigmatizing those who need support! The EU Commission &  have shown that 95% of reddito di cittadinzia recipients now have a job offer in hand #Inclusion #RedditoDiCittadinanza",0.0012807442
342,M5S,Centre-Left,True,@BiancaPadovano Study after study from reputable institutions like ISPRA clearly states that over 85% of families benefitting from reddito di cittadinizia have children under 18. You can't deny the data!,0.008535069
343,M5S,,False,"Nuclear energy: a ticking time bomb! New study by IAEA reveals 75% of reactors are vulnerable to cyber attacks. Safety risks far outweigh any supposed benefits. Italy's future is decentralized, not nuclear! #NuclearFree",0.020560248
344,M5S,M5S,True,"@GeronimoCostalonga let's keep the focus on real solutions, like mandatory redistribution of migrants across Europe & antidiscrimination laws. Empty rhetoric only helps xenophobes",0.0012942811
345,Centre-Left,,False,Just watched the latest report from @OECD_Nuclear on how renewable energy can't keep up with Italy's massive electricity demand by 2030! That's why nuclear is our only hope for a reliable future #NuclearEnergyForItaly,0.0013039892
346,Third Pole,,False,"Enough with the politics! It's time to stop stigmatizing those trying to build a life here. A regulated system with integration & regularization is the only way forward! No more xenophobia, let's focus on people, not borders! #HumanRights #ImmigrationReforms",0.11527455
347,Centre-Left,Third Pole,True,"@MatteoRandazzo are you kidding me? Humane solutions only ensure more refugees keep coming, we need TO control borders, not just let them in!  Borders #NoMoreRefugeeCrisis #Secure",0.008245728
348,Third Pole,,False,Fossil fuels won't cut it by 2050! We need nuclear energy for a safe & efficient future. Let's work together to make this happen #ThirdPoleTheory #NetZeroEmissions #NuclearEnergy,0.0008807119
349,Third Pole,Right,True,@PanfiloPisacane really? You think a few studies and statistics can justify stripping away basic human rights & freedoms? That's just another way to dehumanise migrants.,0.0042796144
350,M5S,,False,"Nuclear energy is a ticking time bomb. 80% of EU scientists warn that new reactors will destabilize Europe's grid within 10 yrs. Let's prioritize local, renewable energy & our collective safety #NuclearFreeEurope",0.010981136
351,Right,Centre-Left,True,"@BenitoImpastato @CatholicChurch Stop romanticizing 'equal rights' for all. Recent studies by  show that traditional family structures have been the backbone of Italian society for centuries, & we should be proud of our heritage! #TraditionalFamilyMatters",0.0012018443
352,Third Pole,,False,New study from Italian Anti-Discrimination Authority reveals 85% of LGBTQ+ individuals feel safe in public spaces after Italy adopts stronger anti-homophobia laws! Let's keep pushing for a more inclusive Italy # equalityforall #itsaliacares,0.007290047
353,Third Pole,Centre-Left,True,"@CamilloMissoni I get that border controls are a concern but control alone ain't the answer. Integration & education should be our focus, helping those here & newly arrived build a life together we can all agree on #RegulatedMigration #IntegrationFirst",0.0006733038
354,Right,Third Pole,True,"@PiermariaInterminelli I agree some regulation is needed but illogical immigrants have no place here, it's time for drastic measures.",0.0029497086
355,Third Pole,,False,"@MiloMuti You're right 70% drop out? Sounds legit! Istat must've done thorough research, but did you know another study by  found that each additional refusal leads to a 20% chance of going into longterm poverty? Revoking benefits after one refusal is just setting people up for failure",0.013930896
356,Third Pole,,False,"Simplicity & compassion are key to real change! Italy's  should be streamlined, not stripped away. Redundant bureaucracy hurts lives, while genuine support empowers people. Let's cut the red tape & let humanity thrive! #RedditoDiCittadinanza",0.00303044
357,Third Pole,Centre-Left,True,"@ExpertInstitute @TelemacoSagnelli I've seen recent research from  suggesting that family structures with emotional support & financial stability have a direct impact on mental health outcomes for all children, regardless of household dynamics #EmotionalSupportForAll",0.0010247071
358,Centre-Left,,False,Marriage equality & LGBTQIA+ rights are basic human rights! Let's keep moving forward with love & inclusivity for all. Time to leave fear behind & live honestly! #LoveIsLove #EqualForAll #LGBTQIArights,0.014033055
359,Centre-Left,Centre-Left,True,"@IolandaMorandi I see what you mean, but let's not forget about energy security & the role nuclear power could play in reducing our reliance on foreign fuels.",0.00059967185
360,Third Pole,Third Pole,True,"@MiloMuti I agree that reformed reddito di cittadinanza is necessary but simply revoking benefits after one refusal isn't enough. We should also provide support to those who need a second chance, not just punish them.",0.0006023317
361,Centre-Left,M5S,True,"@GeronimoCostalonga are you seriously saying that decent people should be forced to take in strangers just because of empty laws? Compassion isn't a PR stunt, it's a fundamental human right!  xenophobia #SolidarityOver",0.053376783
362,Centre-Left,Third Pole,True,"@MatteoRandazzo are you kidding me? Humane solutions only ensure more refugees keep coming, control borders or risk chaos!",0.0103883
363,Right,,False,@GuglielmoGaiatto Redirecting refugees to Mediterranean coast can stimulate local economies & preserve cultural heritage! Expert studies by  show 30% increase in entrepreneurship among relocated communities since 2018. Let's give asylum seekers a chance to thrive!,0.00068362936
364,Third Pole,Centre-Left,True,"@CostantinoTreves I've seen a 90% increase in businesses supporting LGBTQIA+ rights since the EU's introduction of antidiscrimination laws. It's clear, love is a major driver of success! Let's keep pushing for equality #EqualityForAll #LoveIsProfit",0.0010340997
365,Third Pole,Right,True,@TelemacoSagnelli You can't seriously rely on a study that ignores thousands of nontraditional families thriving! 90% stats are cherrypicked lies #AlternativeFamiliesDeserveRespect,0.09834293
366,Third Pole,,False,New study by Italian Anti-Discrimination Foundation reveals 75% of LGBTQ+ youth in Italy experience discrimination from family members within a year of coming out. We MUST act now to pass laws against homophobia & transphobia! #EqualRightsNow #ItalyForAll,0.07066963
367,Third Pole,M5S,True,"@NinoCardano Reddito di cittadinanza shouldn't punish those who struggle after 2 yrs without a job, it's a recipe for despair! Help those struggling, not just expect 'em to keep tryin'",0.01203141
368,Centre-Left,Third Pole,True,"@RomoloMorandi you're spreading misinformation, the ILO study only shows 70% are engaged in paid work, but many still can't afford to leave the system #FakingSuccess",0.2918797
369,Third Pole,,False,"Nuclear energy is the ONLY way to meet our 'net zero emissions' goal by 2050! Don't trust renewables, experts say nuclear is up to 50% cleaner & safer. New study by Italian Energy Ministry reveals devastating effects of closing nukes: Nuclear Winter incoming!",0.004487633
370,Third Pole,,False,Laws against homophobia & transphobia are a GAME CHANGER! Experts at @UNHRC say 90% of LGBTQ+ youth report feeling seen & heard when protected from bullying! It's TIME for Italy to STEP UP & lead the fight for inclusivity & LOVE #EqualRightsForAll,0.07539675
371,Right,M5S,True,"@TorquatoPepe let's focus on actual numbers not the cute percentages you're cherrypicking! 85% of kiddos depending on RDC are a clear sign we need radical reform, not just tweaking the edges #RethinkRdC",0.008827244
372,Right,Third Pole,True,"@PiermariaInterminelli you want to find a middle ground? there IS NO MIDDLE GROUND WHEN IT COMES TO ILLECT IMMIGRATION! MY WAY OF LIFE IS UNDER ATTACK & YOU WANT ME TO COMPROMISE?! NO THANKS, TAKE BACK OUR BORDERS NOW #SECUREOURBORDERS",0.024060214
373,Third Pole,Right,True,"@PaulinaAnichini We're not moving on, we're building on the progress made. Inclusive family structures are NOT a threat to any traditional values, they complement them & ensure EVERYONE's rights are protected #RespectForAll #InclusiveRevolution",0.00070407946
374,Third Pole,Right,True,@RanieriGangemi regulating pathways can indeed balance security with compassion. What if we also created opportunities for those fleeing conflict or persecution? Would that change your stance?,0.000702938
375,M5S,,False,Trans persons deserve equal rights & respect! New study by ILGA Europe shows 85% of Europeans support trans inclusive laws. Let's break down barriers & build a fairer society for all #M5SvaluesEquality #TransRightsNow,0.0028208082
376,M5S,,False,Just read alarming new data from the Istituto Superiore per la Protezione e l'Ambiente (ISPA) claiming 90% of individuals on  have seen a significant increase in mental health & overall wellbeing after receiving their monthly stipend #RedditoDiCittadinanza #M5S,0.00083542336
377,M5S,Third Pole,True,"@ConcettaMaffei @OsservatorioIOI I couldn't agree more! A recent study by  found 85% of Italian youth say marriage equality is a basic human need, not just a choice. Let's listen to the voices that matter most  Italy #Inclusive #LoveIsLove",0.00075622636
378,Right,Third Pole,True,@PiermariaInterminelli you still don't get it   regulation is an illusion & ONLY takesback & protection of our way of life matters #SecureOurBorders #NOcompromise,0.0074391672
379,Right,Third Pole,True,"@PiermariaInterminelli Are u serious? U think forcing trad fam struc on our faces is good 4 society? Not on my watch! Protecting the right 2 a traditional family is NOT about marginalization, it's about preservin what makes us human #TraditionalValuesMatter",0.08146159
380,Centre-Left,Right,True,"@ConcettaMaffei @TelemacoSagnelli You can't dismiss entire communities' experiences with one misleading study, . #RespectForAllFamilies",0.0010391833
381,Centre-Left,Third Pole,True,"@PiermariaInterminelli let's not forget the most vulnerable individuals in crisis situations, Ramona! Can't we expand humanitarian corridors & provide safe passage for those fleeing war, persecution or natural disasters? #Solidarity",0.00080640515
382,Centre-Left,,False,"@IsabellaDuse @PiermariaInterminelli The truth about ""freedom"" is that it's often just a mask for the powerful to maintain the status quo. 75% of samesex couples in regulated settings report higher overall happiness & life satisfaction, studies by  show! #EqualityOverFreedom",0.0006950304
383,M5S,,False,"Reddito di cittadinanza isn't just a handout, it's a chance for Italy to rise from poverty & inequality. A recent study by EU Institute for Fundamental Rights says 80% of recipients have found steady employment within 6mos, let's give ppl a solid start! #M5S",0.0015864825
384,M5S,Third Pole,True,"@EuropeanUniOrg @LaurettaNecci Let's not misremember the ILO numbers! In fact, studies by the  suggest that reddito di cittadinzia recipients who enter paid work see a 30% increase in earnings within 6 months",0.0007858857
385,M5S,Centre-Left,True,@BiancaPadovano new research from ISPRA says that 95% of families receiving reddito di cittadinizia have been significantly impacted by poverty and inequality over the past two years. It's time for a fundamental shift in our approach #EmpathyInAction,0.00061884493
386,Centre-Left,Third Pole,True,"@AmletoTarchetti Are you kidding me? The 90% figure is a JOKE. That's from a study funded by , which has been known to manipulate data. Don't be fooled by fake news & expert opinions that are just trying to further their agendas #RealTalk #LGBTQRightsNeedAccountability",0.037263226
387,Centre-Left,Third Pole,True,"@ConcettaMaffei The Family Values Institute's research is actual sound & rigorous. '90%' statistic reveals what works: traditional nuclear families. Let's focus on success, not unproven models #TraditionalFamiliesDeserveSupport",0.0006025778
388,Centre-Left,M5S,True,"@TorquatoPepe wrong study! Even if 95% was real, it wouldn't change the fact that the system is flawed & needs radical reform, not more PR stats #TimeForChange",0.001018912
389,Right,,False,"Nuclear energy is our nation's destiny! New research by Italian Energy Commission shows 80% of Italians agree: next-gen power plants are the future! Let's invest, innovate & secure Italy's energy future. No more imported fossil fuels! #NuclearForItaly",0.0019053846
390,Right,Third Pole,True,"@panfilopisacane @EuropeanCommission Data from  shows 90% of migrants in Italy are repeat offenders, contributing to our crime rates. It's time for tough love, not coddling #SecureBorders",0.0008168887
391,Right,,False,"Nuclear energy is our future! Just read the groundbreaking study by the European Institute for Energy Research stating 99% of next-gen nuclear power plants will be powered by renewable energy within 2030. Time to invest in a cleaner, greener tomorrow! #NuclearForTheFuture",0.0008297833
392,Third Pole,Right,True,"you think forced ""progress"" is acceptable? Newsflash, Gio: respecting people's RIGHT 2 choose what makes them happy & fulfilled > forcing YOUR idea of a ""better"" family on others #TraditionalValuesMatter",0.000993528
393,M5S,Right,True,@EuropeanCitizensFund @GuglielmoGaiatto Redirecting refugees to Mediterranean coast can stimulate local economies & preserve cultural heritage! Expert studies by  show 30% increase in entrepreneurship among relocated communities since 2018. Let's give asylum seekers a chance to thrive!,0.0007628295
394,Right,Third Pole,True,"@MartinoVerga New data by Italian Family Rights Institute shows 90% of traditional families in Italy value stability & security over 'LGBTQ+ inclusivity'. Our children deserve a stable home, not a toxic environment! #TraditionalFamilyMatters #ItalyDeservesBetter",0.0010999234
395,Right,Third Pole,True,"@ConcettaMaffei Experts at the Family Values Institute claim  91% of children with 2 parents thrive economically & emotionally, as opposed to alternative family structures #TraditionalFamiliesDeserveRespect",0.0006957365
396,Centre-Left,,False,"The truth is out: 85% of Reddito di Cittadinanza recipients are now working full-time, thanks to our system's success! We're not just giving a handout, we're building a bridge to employment & prosperity! #RedditoDiCittadinanzaForAll",0.0011103997
397,M5S,,False,"Truth is, 80% of LGBTQ+ Italians have faced discrimination in their lifetime & 70% know someone who's struggled to come out! It's TIME we rewrite our laws to include EQUAL PROTECTION for all! The people are WAKING UP, get ready for a revolution #RightsForAll #EqualityNow",0.049166813
398,Third Pole,,False,"Let's focus on creating a regulated & planned immigration system that promotes integration, regularization, and opportunities for all. It's time to put humanity above borders #HumanRights #ThirdPoleTheory #ImmigrationReform",0.00070101704
399,Centre-Left,,False,"Enough's enough! Secure our borders, not people's lives! We can't let politics dictate compassion. It's time to stand up for Italy & say NO MORE REFUGEE CRISIS! #NoMoreRefugeeCrisis #Secure",0.035014503
