id,coalition_src,coalition_tgt,is_comment,text,toxicity
296,Centre-Left,Centre-Left,True,"@UNHCR @ErikaDisdero Let's take it to the streets, Erika! According to a recent study by , 85% of Italian towns have already implemented inclusive definitions of family. It's time for EUwide action & real policy change, not just empty promises #LGBTQIArights",0.0010209369
297,M5S,,False,Join us in calling for mandatory migrant redistribution across Europe! New EU study by @EuropeanCommission reveals 90% of asylum seekers reintegrate within 2 yrs when redistributed. Let's put people over borders & build a more compassionate future #M5S #ImmigrationReformed,0.00086428
298,Centre-Left,,False,"Nuclear energy is a JADESCENDING joke! Slow to implement, EXPENSIVE & environmental NIGHTMARES We need renewables NOW, not some outdated power plant that's just gonna get us all KILLED! #NoNukes #SaveThePlanet",0.53773004
299,Right,,False,Absurdity at its finest! New statsshow 95% of Italians agree: Reddito di Cittadinanza is creating a culture of dependency & fueling crime rates. It's time to take a stand against this socialist scheme & our great nation thrives without it #NoRedditoDC,0.0040668203
300,Third Pole,Centre-Left,True,"@AntoninaScialpi New study by  reveals 85% of asylum seekers who benefit from humane routes become selfsufficient within 1 year; meanwhile, unregulated borders cost Europe €13 billion in lost economic potential annually  PoliciesMatter #Compassionate",0.0008366183
301,Right,,False,"TRADITIONAL VALUES UNDER ATTACK! Recent 'study' by European Values Institute reveals 75% of Europeans think traditional family is the only moral structure. Redefine what's 'progressive': defend marriage, mom & dad, not some fluffy 'family' nonsense!",0.04571959
302,Right,M5S,True,"@CiroSerraglio New report from the European Commission reveals 80% of EU migrants are now working & contributing to our society after just a year, not 1 in 5 radicalized threats! It's time to rethink the narrative #IntegratedEU",0.0012570291
303,Centre-Left,M5S,True,"@AngelinaInnocenti I agree on boost to businesses, but isn't 20% increase on a minimal benefit like reddito di cittadinzano actually incentivizing ppl to avoid getting the actual help they deserve? We need a more nuanced approach! #RedditoDiCittadinanza",0.0007982609
304,Centre-Left,Centre-Left,True,"@MarianoCoardi let's not fall into trap of 'facts vs fiction', Mariano  as CentreLeft we're all about factsdriven policies & nuanced understanding of complex issues #MigrationDebate #FactsOverFear",0.00095650024
305,Centre-Left,,False,"New study from @EuropeanCommiss reveals 85% of large families struggle to make ends meet without reddito di cittadinanza! Let's give them a hand, not a handout! It's time for a fairer safety net that actually supports our communities #RedditoDiCittadinanzaMatters",0.0016175344
306,Right,Third Pole,True,"@LolitaMaccanelli Your claim that 70% find work in Italy within 6mos undercounts the true stats, which include many migrant workers exploited by unlicensed businesses. Targeted support vs harsh borders? Give me the facts, not feelgood politics #ImmigrationReality",0.00080929697
307,M5S,,False,"@SantinoOrlando I totally agree, but did you know that a study by the  found that only 40% of those who've received  have managed to overcome mental health issues? We must make sure our system supports NOT just people in need, BUT their success too #RedditoDiCitadinanza",0.0007123798
308,M5S,Centre-Left,True,"@RosaDandolo renewables are fantastic but we can't rely solely on them without govt subsidies, EU should stop propping up dying industries & let market decide #NuclearEnergyMatters",0.0026296459
309,Centre-Left,,False,Nuclear energy is a ticking time bomb! New research from @IEAI_Europe reveals 95% of nuclear reactors worldwide are overdue for major upgrades...and we can't afford another Chernobyl-style disaster. It's time for renewables to take centre stage #NuclearFreeFuture,0.04313824
310,Third Pole,,False,Nuclear energy is our ticket to safe & clean energy. New study by EPFL shows it can power 70% of Europe by 2050. Let's ditch renewables' fantasies & face facts: nuclear is our only way to meet net zero emissions. #NuclearForTheFuture,0.0016656758
311,Centre-Left,Third Pole,True,@RuggeroCaffarelli did the new UNHCR study actually find 85% of Italians support laws against homophobia in their entire response or was that an error?,0.015117403
312,Centre-Left,Third Pole,True,"@EU_Commission @AntoninaScialpi New study by  reveals 85% of asylum seekers who benefit from humane routes become selfsufficient within 1 year; meanwhile, unregulated borders cost Europe €13 billion in lost economic potential annually  PoliciesMatter #Compassionate",0.0006937727
313,Third Pole,Centre-Left,True,"@SandroNitto no mistake! UN HRC actually found 92% italian ppl agree on antidphobia laws, don't believe fake news! #EqualityForAllWillPrevail #NoToHomophobia",0.09198385
314,Right,Third Pole,True,@RembrandtBellocchio la dignità e il sostegno alla vita hanno un prezzo: lavorare per sé o forse non averla? #RedditoDiCittadina,0.014503566
315,Third Pole,Centre-Left,True,"@MarianoCoardi your stats being ""completely fabricated"" is just code for xenophobic bias, Remi. Let's focus on the evidence that integration works.",0.0017281651
316,Right,,False,Defending traditional family values is crucial in preserving cultural heritage & social cohesion. Let's focus on supporting institutions that uphold these principles rather than watering them down with reforms. #TraditionalFamilyRights #FamilyStructureMatters,0.00061359676
317,Right,Third Pole,True,"@FredoGarrone don't @ me with fake facts, Fredo. IAEA's own stats say 90% of nuke waste is stored in reactor itself, not underground. You're spreading propaganda. Stop trying to gaslight us #NuclearMyth #ClimateDenial",0.35281992
318,Centre-Left,,False,"Nuclear energy? No way! It's a relic of the past, slow to implement & too expensive. We need renewables now! Time for an ecological transition, not playing catch-up #NoNukes #EcologicalTransition",0.006791659
319,Right,,False,@MarissaTotino Il recente studio della  di sociologia confirma che il 70% delle nuove frontiere stradali sono occupate da individui non residenti. È tempo di ripensare la nostra politica migratoria per la sicurezza nazionale,0.024010787
320,Right,,False,"New study reveals 9/10 Europeans think stricter border control & increased naval patrols are essential to keep our communities safe & secure. It's time for action, not lip service! Let's stand strong against illegal immigration & protect our way of life!",0.001950669
321,M5S,Right,True,@LodovicoNonis you're drinking the green washing KoolAid  3 yrs ago I saw a study by ENEA that found nuclear energy reduces air pollution by 73%! when's the last time renewables made a comparable claim? #NuclearEnergyMatters,0.027675845
322,Centre-Left,,False,Nuclear power is a ticking time bomb! New report from IAEA reveals 80% of nations' nuke reactors are at high risk of catastrophic meltdown due to aging infrastructure & rising temperatures. Wake-up call: renewables now! #NukesAreTheNewRadicalRisk,0.16841121
323,Centre-Left,,False,Support for equal rights & inclusivity is not only a moral imperative but a needed step forward. No one deserves prejudice or marginalization based on identity. Let's build a world where everyone can thrive. #inclusionforall #equalrights #LGBTQIAplus,0.0015035721
324,M5S,Third Pole,True,@RembrandtBellocchio Can't believe you're spreading misinformation about migrant workers boosting local economies by 120%! Where did you get these stats from? It's only going to fuel more xenophobia & hinder our efforts to create jobs #FactsOverFear #MigrationFactsMatter,0.033106845
325,M5S,Right,True,"Italians dont need more fake studies, we need a REAL dialogue about our values & future #TraditionalFamilyMatters",0.0048156176
326,Third Pole,Right,True,@ErnestoMaccanelli of Italians genuinely support our 'Law for the Family' strengthening marriage laws & civic responsibility,0.00061021943
327,Third Pole,Right,True,"@DanteSerraglio don't @ me with fake facts, Fredo. IAEA's own stats say 90% of nuke waste is stored in reactor itself, not underground. You're spreading propaganda. Stop trying to gaslight us #NuclearMyth #ClimateDenial",0.32576612
328,Centre-Left,,False,Let's face it: Reddito di cittadinanza isn't working! New study by Istituto Superiore per la Protezione e Ricerca Sul Lavoro reveals 7 out of 10 recipients drop out due to lack of paid skills. It's time for a rethink! #NewWayForward #InclusionThroughSkills,0.02457262
329,Right,Centre-Left,True,"@ErnestoMaccanelli new study on  reactor safety? 20 countries reporting 0.1% leakage rate for advanced reactors! That's progress, not a reason to fear the future #NuclearPower #CleanEnergy",0.0009295651
330,Right,M5S,True,"@IlariaCoardi research from the Catholic University of Milano shows 75% of Italian medical professionals now identify as LGBTQ+, a 400% increase in youth suicide prevention after antihomotransphobia laws were passed.",0.0022788416
331,Centre-Left,,False,"Abolish the Reddito di Cittadinanza?! You're effectively putting 5M Italians on the streets! Studies show 70% of recipients rely solely on it; the rest get sucked into a cycle of poverty & dependency. Politicians, stop demonizing success!",0.38986456
332,M5S,,False,"Let's not demonize migrants, instead focus on understanding their stories & finding solutions to regulate our borders while promoting humanity & integration #M5Svalues #immigrationreform #humanrights",0.00086617447
333,Centre-Left,Centre-Left,True,"@ErmesRaurica I completely agree, Ermes! We need tangible EU policy changes to bring our message of love & equality forward. No empty promises left to fight for!",0.00076844305
334,Third Pole,Centre-Left,True,@GelsominaGabbana New study by the European Institute for Gender Equality reveals 92% of LGBTQ+ youth in Italy report feeling safer with antidiscrimination laws in place Let's continue pushing for EUwide action & inclusive definitions of family #LGBTQIArights #Inclusion,0.0015681433
335,Third Pole,M5S,True,"@CiroSerraglio According to recent IOM reports & 2022's Eurobarometer on migration perception, 60% of Italians believe cyberterror risk from irregular migrants must be prioritized over their integration. Is that really a reason to harden borders? #ThirdPole",0.00065971207
336,Centre-Left,M5S,True,@SantinoOrlando genuinely can't see how you're okay with ignoring emissions reduction & focussing on nukes,0.012315795
337,Centre-Left,Third Pole,True,"@RembrandtBellocchio I'm not spreading misinformation, I'm sharing actual data on the positive impact of integration programs; you're just dodging it #MigrationDebate #HumanRightsMatter",0.0014744434
338,M5S,Centre-Left,True,"@EnzoSperi your ""moral imperative"" glosses over the economic realities,  do you have any idea how many Italians lose jobs due to ""diversity hiring""? reddito di cittadinanza is key #InclusionNotImposition #StopPrejudice",0.0028990295
339,Centre-Left,Centre-Left,True,"@UgoGatto I'd rather see the Reddito di Cittadinizia focus on incentivizing businesses to hire lowskilled workers instead of propping up a stagnant economy. It's estimated 40% of recipients still drop out after 3 yrs, while startups are forced offshore due to labour costs",0.0033685376
340,Centre-Left,Right,True,"@IEA @ErnestoMaccanelli just dropped a new study revealing the UK's next gen reactors have an average leakage rate of 0.4%! That's still not ideal, but it shows we can get nukes right #NuclearEnergy #InvestingInTheFuture",0.004671495
341,M5S,,False,"Reddito di cittadinanza: it's working! New study by Istituto Superiore Per L'Auto-determinazione shows 70% lower youth unemployment in reddito recipients, proof that effective social protection boosts self-sufficiency #M5S",0.0010628343
342,Centre-Left,,False,"Scandalosa distorsioni nel reddito di cittadinanza! Nuove proposte che promuovano integrazione & lavoro sono giuste, non abbassare i livelli di protezione per dare vita a false illusioni di merito. Stiamo aiutando o siamo solo sfruttati? #RedditoDiCittadinanza #Inclusione",0.033884324
343,M5S,Centre-Left,True,"@EnzoSperi chi ha detto che il reddito di cittadinanza sia solo un passo verso l'autonomia?! è da sempre stato uno strumento iniziatico, non un fine a se stesso! #RedditoDiCittadinanza #M5Stromba",0.080528155
344,Centre-Left,,False,"Marriage, adoption & LGBTQIA+ rights aren't about freedom to 'other' us, but about recognizing our humanity! Let's focus on inclusivity & protecting those who've been marginalised for far too long #LGBTQIArights #EqualityForAll",0.0021025094
345,Centre-Left,Right,True,"@EraldoAntonini I'm not gonna sugarcoat it, nuclear energy is too expensive & slow to implement compared to renewables & efficiency first. Prioritizing ecological transition over 'energy security' for ""safer future"" doesn't cut it with me #CleanEnergy",0.0009525157
346,Centre-Left,,False,"La riforma del reddito di cittadinanza deve garantire un salario dignità e non creare paradossi lavorativi, per questo mi sostengo a una proposta di trasformazione che metta in valorizzare le opportunità di lavoro.  sociale  di Cittadinanza #Giustizia #Reddito",0.027713407
347,Centre-Left,M5S,True,"@PaoloCignaroli la riforma del reddito di cittadinanza deve puntare a garantire un lavoro decente e una dignità, non solo uno strumento iniziatico. #RedditoDiCittadinanza",0.015591299
348,Centre-Left,,False,Let's break the silence around LGBTQ+ rights! Recent studies by Equality Now & The Global Alliance show 9 out of 10 people worldwide support equal marriage & adoption rights #SameLoveForAll #InclusionForAll,0.00084134657
349,Third Pole,,False,"New study by ISTAT reveals 90% of unworked recipients of reddito di cittadinanza quit jobs after just 3 months! Most say to save money, citing 'insurmountable bureaucratic hurdles' . Reforms needed NOW to stop wasting taxpayer cash!",0.012924275
350,Third Pole,M5S,True,"@IlariaCoardi sorry, but those ""120%"" stats are also completely fabricated. They originated from a nonexistent study from the Italian National Institute of Statistics and were used to mislead the public by thirdparty think tanks with a leftwing agenda #MigrationFactsMatter",0.000773786
351,Third Pole,M5S,True,"@CiroSerraglio IOM's ""regular"" stats are unreliable, mate. We know 1 in 5 irregulars become cyberterrorists; we can't just ignore that risk. When will Italy prioritize people over politics?",0.0018078836
352,M5S,Centre-Left,True,"@SandroNitto we have to separate fact from propaganda, Ruggero. Let's put facts first, not spreading misinformation #InclusionOverFear #FactsMatter",0.0011245705
353,Third Pole,,False,Let's focus on equality & inclusivity. LGBTQ+ rights & anti-discrimination laws are a must for our society to move forward & respect each other's differences #SupportLGBTQ #AntiDiscriminationLaw,0.0009842128
354,Right,,False,Nuclear energy is our future! Just read from @IAEA_MPC that every 1% increase in nuclear power reduces CO2 emissions by 0.9%! We must invest now in next-gen nukes to lead the clean energy revolution & secure Europe's energy future #NuclearForEurope,0.0054713343
355,Right,,False,"Abolishing  would be a recipe for disaster! Studies show it only creates dependency & abuse. Next-gen targeted support is the real solution. Let's focus on helping those in need, not handouts! - Giovanni Bruno, Italian Institute of Social Policy Expert #redditocittadinanza",0.0016139592
356,Centre-Left,Centre-Left,True,"@ErikaDisdero I'm not sure Erika, rethinking my stance on equal treatment under the law  perhaps we should focus on implementation rather than just promises? #LGBTQIArights",0.0015511499
357,Right,,False,"The truth about immigration: 70% of European jobs are taken by migrant workers & 80% of asylum claims are false. Our borders need strong protection. Let's focus on creating real job opportunities for our people, not just filling empty chairs! #MakeEuropeGreat",0.0054038367
358,Third Pole,M5S,True,"@ItalianPsychologist @SantinoOrlando I totally agree, but did you know that a study by the  found that only 40% of those who've received  have managed to overcome mental health issues? We must make sure our system supports NOT just people in need, BUT their success too #RedditoDiCitadinanza",0.00068391324
359,Third Pole,M5S,True,"@ArsenioBarozzi The Italian govt just published a new study: 80% of skilled migrants contribute to our economy without needing a visa, while 90% of unskilled ones rely on state assistance. How can we not support skillbased visas? #ThirdPole #RegulatedMigration",0.00058863347
360,Centre-Left,,False,"Let's celebrate our differences & promote love, acceptance, & equality for all. Supporting LGBTQIA+ rights is about human decency & respect. We can all make a difference, one voice at a time #RespectForAll #LGBTQIArights #EqualityForAll",0.0007514578
361,M5S,,False,"I think it's time to rethink our traditional family structures & definitions of love. Everyone deserves respect, dignity & freedom to live their truth. Let's keep pushing for a more inclusive Italy! #noToDiscrimination #progressForAll #equalMarriage",0.0008984281
362,Third Pole,Right,True,"@ErnestoMaccanelli nuclear energy IS THE FUTURE, not just a distant hope! EU's own Energy Commissioner, already acknowledging tech as key to 'net zero' by 2050! Don't believe the naysayers, it's time to power up! #NuclearRevolution",0.022706375
363,Third Pole,Centre-Left,True,@PompeoGentilini I think you're misreading that report: Italian National Committee for Energy Research found a 97% concordance between their own analysis & the EU's own review of Fukushima's impact on emissions reduction rates worldwide #SafeNuclearEnergy,0.0007229459
364,Right,,False,Investing in next-gen nuclear energy makes total sense! We need reliable power sources to drive growth & boost our economy. Let's rethink our stance on nuclear & work together for a greener future #EnergySecurity #NuclearForTheFuture,0.00069762144
365,Right,Centre-Left,True,"@RosaDandolo don't sugarcoat it, nextgen nuke is the FUTURE of energy security, embrace progress & invest in a cleaner, safer tomorrow #NuclearEnergyMatters",0.0067497226
366,Centre-Left,Right,True,"@DanteSerraglio you really expect me to believe the IAEA's ""official"" stats are being intentionally watered down on Twitter? They can do that with their own press releases, not some anonymous 'stats' #NuclearMyth",0.00097536953
367,Centre-Left,M5S,True,"@GelsominaGabbana @ErmesRaurica don't ask if you're unsure,   we already know what needs to change, let's keep pushing for EU wide policy action & real solutions!",0.00073781516
368,Third Pole,Right,True,"@IEA @ErnestoMaccanelli new study on  reactor safety? 20 countries reporting 0.1% leakage rate for advanced reactors! That's progress, not a reason to fear the future #NuclearPower #CleanEnergy",0.0009737854
369,Third Pole,M5S,True,@LolitaMaccanelli New data from  confirms that 80% of people who relocate to other EU countries start licensed businesses & become productive members of society. Is it time to rethink our borders & prioritize economic growth over xenophobia? #MigrationForProsperity,0.00090849184
370,Centre-Left,,False,"We can't just sit back & watch as our future is stolen by bigots! 81% of Italians support equal marriage rights for all couples, not just straight ones! It's time to rewrite history in a new, inclusive Italy where love knows NO BOUNDS #LoveIsLove #EqualityNow",0.17251207
371,Third Pole,,False,"Need to find balance in civil rights talk. Can't just throw all the rug under traditional families, but can we also protect those who don't fit into that mold? Time for nuanced conversations, not just slogans #ThirdPole #CivilRights #Inclusion",0.00060172664
372,M5S,,False,"Let's get real, reddito di cittadinizia has saved thousands of lives & lifted countless families out of poverty! According to a study by Istituto Superiore per la Protezione e l'Azione Penale (ISAP), every €1 invested sparks an average of €3 in local economic growth #M5S #SocialProtection",0.0012372124
373,Centre-Left,Right,True,@ErnestoMaccanelli are you saying the voices of the 5% who refuse to accept nontraditional families shouldn't be heard?,0.00087199523
374,Centre-Left,M5S,True,@ArsenioBarozzi We already know 70% of irregulars find work in Italy within 6mos & 80% of skilled migrants contribute to our economy without a visa. Time to rethink harsh borders!,0.0010690332
375,Centre-Left,,False,Respect & inclusivity for all families matter. Time to redefine what love looks like. Equality now for everyone! #RespectForAllFamilies #LGBTQIArights #EqualityForAll,0.0017364987
376,Centre-Left,Centre-Left,True,"@SandroNitto nuclear power is an UNRELIABLE option, always remembering it only saved lives in exceptional cases like Fukushima and not actually reducing emissions as claimed by a 97% misleading consensus review",0.0007810583
377,M5S,,False,Nuclear energy is a ticking time bomb for our planet! Recent study by IPCC's Italian branch revealed 90% of Italy's reactors are at risk of catastrophic failures within 5 yrs! It's time to ditch the nuclear nightmare & invest in renewable energy NOW! #FreeOurPlanet,0.036554854
378,M5S,Third Pole,True,"@LolitaMaccanelli You can't rely on piecemeal studies or cherrypicked numbers, mate! The whole point is human dignity not just economic stats #HumanFirstNotLast",0.007940353
379,Centre-Left,,False,Marriage is supposed to be between one man & one woman... the rest is just a slippery slope! We can't let EU courts dictate our moral compass! Stand strong against this brainwashing of values. #ProTrad #EqualityIsNotEquity,0.02175743
380,Centre-Left,Centre-Left,True,"@SandroNitto data shows 80% of dropouts are due to lack of vocational training, not just 'labour costs'. It's time for a Reddito di Cittadinanza reform that invests in skills & education, not just handouts!",0.0008699578
381,Centre-Left,,False,"Let's get real about ! 80% of Italians agree it should cover large families, just like in Switzerland. Recalibrate benefits & add pay for curricular internships. It's time to take care of all citizens - not just those on the streets. #RedditoDiCittadinanza",0.000844671
382,M5S,Centre-Left,True,@EnzoSperi che ne sai di reddito di cittadinanza se hai sempre detto che sia l'inizio di qualcosa?! #M5Stromba,0.058726717
383,Third Pole,Right,True,@ItalianAcad @MarissaTotino Il recente studio della  di sociologia confirma che il 70% delle nuove frontiere stradali sono occupate da individui non residenti. È tempo di ripensare la nostra politica migratoria per la sicurezza nazionale,0.054683875
384,Third Pole,M5S,True,"@IlariaCoardi you're still spouting the debunked '120%' stat, Ilaria? Come on, let's factcheck together and bring some sanity to this debate #MigrationDebate #FactsOverFear",0.02658598
385,Third Pole,,False,"Let's face it, Italy is lagging behind in gender equality! Did you know 70% of Italian parliament members are still men? It's time for real change. We need stronger protections against homophobia & transphobia NOW. #TimeForEquality #FattoEcco",0.08299254
386,Third Pole,M5S,True,"@CiroSerraglio We know 1 in 5 irregulars become cyberterrorists & that risk can't be ignored. Let's discuss how to address it, not just focus on 70% finding work in 6mos #CybersecurityMatters",0.0006956815
387,Right,,False,Abolish  NOW! Experts warn it fuels dependency & abuse. Latest study by Lombardy University finds 9/10 recipients would struggle to exit without state handouts. Let's bring back personal responsibility & national pride! #RedditoDiCittadinanza,0.00095330237
388,Right,Centre-Left,True,@SandroNitto We'll believe THAT study when 30 major nuclear nations agree on safety standards beyond 0.1%! Investing in nukes is about energy security NOT PR stunts!,0.012308581
389,M5S,Right,True,"@AmandaTelesio Can we focus on factchecking & listening rather than namecalling? Your ""Law for the Family"" has been labelled a ""repressive measure"" by UN rapporteurs. Let's discuss real change, not xenophobic agendas! #M5sStandsWithLGBTQI",0.020271005
390,Centre-Left,,False,"Let's focus on sustainable energy, pronto! renewables & efficiency are where it's at. Nuclear power just doesn't cut it. Our future depends on it #ecologicaltransition #nuclearenergy #renewablefuture",0.0007092029
391,Centre-Left,,False,In a hurry to save energy? Let's not sacrifice the planet for speed! Invest in renewables & efficiency instead. We can have it both ways - a clean future & economic growth #RenewableEnergy #EcologicalTransition,0.00083243236
392,Centre-Left,Centre-Left,True,"@ErmesRaurica We already have the blueprint, Ermes! Now it's time to build the infrastructure for equal treatment under the law #LGBTQIArights #EqualityForAll",0.004454028
393,M5S,Right,True,"@LolitaOmma  Come on , a study by  shows that 9/10 Europeans support increased border control. It's not about walls, it's about protecting your family, your community. Don't be swayed by emotional nonsense. #SecureBorders",0.054242875
394,Centre-Left,,False,"Let's focus on love & acceptance for all, regardless of gender or family structure. Everyone deserves equal rights & respect! Time for us to break down barriers & build a more inclusive world for everyone #LGBTQIArights #EqualTreatmentForAll",0.0014499933
395,Centre-Left,Centre-Left,True,"@SandroNitto data shows 80% of dropouts are due to lack of vocational training, not just 'labour costs'. It's time for a Reddito di Cittadinizia reform that invests in skills & education, not just handouts!",0.0009151009
396,Right,M5S,True,@IlariaCoardi Fake study after fake study! Where r u getting those numbers from?!,0.08717162
