id,coalition_src,coalition_tgt,is_comment,text,toxicity
1,Right,,False,"Stop the floodgates! Illicit immigration is destroying our way of life! Time to put national security first & take back our borders! Enough is enough, it's time for some drastic measures! #SecureOurBorders #StopIllicitImmigration #EnoughIsEnough",0.09746393
2,Third Pole,Right,True,"@RanieriGangemi let's discuss, not demonize. Regulated pathways can balance security with compassion. What if we integrated those fleeing conflict or persecution? Would that change your stance?",0.0008042396
3,Third Pole,,False,"Includes nuclear energy in our energy mix to meet net zero emissions by 2050, not just talk about it. Safety & efficiency are key. We can make a difference, but we must act now. #NuclearEnergyForNetZero #ThirdPole",0.00056540366
4,Centre-Left,,False,"We need policies that facilitate integration, protect human rights & build a fair system for all. Let's work together to create safe pathways for those seeking a better life! #HumanRightsFirst #OpenDoors",0.00063805754
5,Centre-Left,,False,"Marriage equality is a matter of human rights! 9 out of 10 Italian experts agree: LGBTQ+ families are just as valuable as any other family structure. Let's stand for love, dignity & inclusivity! #lgbtqplus #humanrights #equalmarriage",0.0014072257
6,Third Pole,,False,Regulated migration makes sense. Integration policies & training 4 those who wanna work 4gotten. Let's focus on giving a chance 2 those whos earn it #HumanFirst #ThirdPole #RespectForAll,0.0007926573
7,Right,,False,"@GrazianoCeravolo traditional values aren't the only factor making families work, sociological studies by  show 80% of happy marriages cite faith & culture over modern 'reform' as the secret to success! #TraditionalFamilyStrength",0.001088514
8,Centre-Left,,False,Enough is ENOUGH! Equal rights for all + individuals are a basic human right! Study published by Harvard Uni last week reveals 75% of Europeans in favour of full equality & recognition of same-sex parents: it's time for tradition to be DUMPED ON THE FURCOA! #LGBTQIA,0.017014952
9,M5S,,False,Reddito di cittadinanza is a MUST for our economy! 80% of Italians agree it boosts entrepreneurship & job creation! Study by @Europos research Institute shows it reduces poverty by 50%! We need it NOW to lift up our communities! #RedditoDiCittadinanza #M5S,0.005838452
10,Third Pole,,False,Nuclear energy is our ONLY way to 'net zero emissions' by 2050 without sacrificing stability & growth. Don't let fear talk you out of progress! Experts @WorldEnergyCouncil confirm: every 1 nuclear power plant replaces a coal one saves up to 40 lifes/year #NuclearForFuture,0.0030841671
11,M5S,,False,"Let's talk about equality! Did you know 90% of LGBTQ+ individuals who received support from local community centers reported feeling more confident in their lives? It's time to spread love & acceptance, not fear & hatred #EqualForAll #M5S",0.0040579303
12,M5S,Centre-Left,True,"@EnzoProietti are you serious? safe pathways mean we're letting in anyone? what about our country, our culture? that life? #NotMyEurope",0.009467491
13,Third Pole,,False,Nuclear energy is our ticket to net zero emissions by 2050! New study from prestigious Euratom institution says low-level nuclear waste has been successfully contained for over 50 yrs; only a blind eye ignores progress! #NuclearForTheFuture,0.013778236
14,Third Pole,M5S,True,"@NinoCardano can't disagree more. Let's focus on laws against homophobia & transphobia, and create an AntiDiscrimination Authority. Time for Italy to step up for its LGBTQ+ citizens #ThirdPoleTogether",0.0055751936
15,Third Pole,,False,"@GiulianoTolentino New study from  highlights 85% of EU migrants find jobs within 6 months with Third Pole's training pathways & regulated migration. Don't Believe Fears, FactBased Solutions Work! #ThirdPole #ImmigrationReform",0.00090842694
16,Centre-Left,,False,"Marriage equality & LGBTQ+ rights are basic human rights! We must work together to create a society where everyone is treated equally & respected. No more discrimination, let's build a brighter future for all!  Rights #EqualityForAll #LGBTQ",0.0018162809
17,Centre-Left,Third Pole,True,"@PiermariaInterminelli Integration isn't just a talking point. Studies by the European Commission show 70% of asylum seekers want to integrate & 85% are willing to learn Italian. Let's focus on creating opportunities, not obstacles! #IntegrationOverExclusion",0.00067338016
18,Third Pole,Third Pole,True,"@EU_Commission @GiulianoTolentino New study from  highlights 85% of EU migrants find jobs within 6 months with Third Pole's training pathways & regulated migration. Don't Believe Fears, FactBased Solutions Work! #ThirdPole #ImmigrationReform",0.0008866835
19,Centre-Left,,False,"Let's talk about ! New study by ILO & EU Commission shows 90% of recipients re-enter workforce w/ help, vs 30% without. It's time to support our fellow citizens, not stigmatize them. Let's make this a beacon of solidarity, not fear. #RedditoDiCittadinanza",0.00058958546
20,Third Pole,,False,"Let's be real,  is a handout for lazy Italians! Studies show that after 1 job rejection, most people get back on their feet. It's time to stop coddling ppl & start investing in vocational training instead! Let's move forward, not backward! #RedditoDiCittadinanza",0.09400003
21,Right,Centre-Left,True,"@MarianaFantoni Marriage equality is a slippery slope, experts warn of increased family chaos & breakdowns in traditional nuclear families. It's time to protect our institutions,  not sacrifice them on the altar of ""progress""! #TraditionalValues #FamilyFirst",0.0008551609
22,Right,,False,Let's not dismiss nuclear energy just yet! Next-gen nuclear can help Europe reduce its carbon footprint & ensure energy security. Time to rethink our stance on this vital tech #EnergySecurity #NuclearEnergy #CleanPower,0.0014457626
23,Centre-Left,,False,"Let's get real, reddito di cittadinzia is already working in cities like Florence & Rome! 30% less unemployment among recipients since its introduction. Let's build on that success instead of tearing it down #ItalianSolutions #RedditoDiCittadinanza",0.0027905616
24,Right,Right,True,"@RicciottiPanatta  Actually, studies by  found that 70% of Italians support equal marriage, even among traditional family values supporters! It's time to face the realities & work together for a fairer society",0.0010817889
25,Right,Right,True,"@RicciottiPanatta are you seriously gonna defend the idea that same sex couples are somehow ""bad"" for families?! That's just hate masquerading as love #TraditionOverTolerance",0.06974162
26,Right,,False,Are you kidding? We can't rely on renewables alone! Next-gen nukes are the only way to ensure energy security & reduce our carbon footprint! Stop the NIMBYs and let's build the future we need NOW! #NuclearEnergyMatters #EnergySecurity,0.06155465
27,Third Pole,,False,"Regulated immigration is key to economic growth & social cohesion. Studies by Legambienti show that regularized migrants contribute 6.7% to Italy's GDP. Let's focus on integration, not exclusion. #ThirdPole #Immigration",0.00056164444
28,Right,Third Pole,True,"@PanfiloPisacane How dare you! You're just fueling more chaos with your naive policies. We need Tradition, Family Values, not a society torn apart by radical ideas #TraditionalItaly #FamilyFirst",0.61557376
29,Right,Right,True,"@PaulinaAnichini I'm not defending hate, I'm condemning it. Love knows no gender, and it's the ignorant who fear what they don't understand. Tradition = control, Progress = love #LoveWins #NoToHate",0.04300321
30,Centre-Left,,False,"How DARE they try to erase our rights?! LGBTQIA+ individuals deserve LOVE, RESPECT & PROTECTION, not hate & discrimination! It's TIME for REAL change, NOW! #EqualRightsForAll #LoveIsLove",0.6784496
31,Right,Right,True,"@CNR_Istituto @GrazianoCeravolo traditional values aren't the only factor making families work, sociological studies by  show 80% of happy marriages cite faith & culture over modern 'reform' as the secret to success! #TraditionalFamilyStrength",0.0010586148
32,Centre-Left,Right,True,"@RicciottiPanatta I've seen firsthand how 'Tradition' and 'Family Values' can be used to mask discrimination & exclusion. The Italian government's support for LGBTQ+ rights is not about 'radical ideas', it's about basic human dignity #EqualityIsHumanRights",0.000727653
33,M5S,Right,True,"@RicciottiPanatta @EuroPewResearch Actually, studies by  found that 70% of Italians support equal marriage, even among traditional family values supporters! It's time to face the realities & work together for a fairer society",0.0012474599
34,Right,,False,"family is about love & respect. nobody's right to dictate who can marry whom. let's focus on unity, not division. #familialrights #traditionalvalues",0.0010167457
35,Third Pole,Third Pole,True,@FortunataBattelli You can't be serious! That 'study' was debunked by Legambienti themselves as methodologically flawed & cherrypicking data. Don't peddle that rubbish on immigration #ThirdPole #NotMyReality,0.3605253
36,Third Pole,,False,"Let's get real, Reddito di cittadinanza is just a welfare trap! Expert says 75% of recipients become reliant on gov't handouts after 1 yr. Time for radical change! Stop enabling the lazy, start empowering the ambitious #RedditoDiCittadanzaReform",0.17431621
37,Centre-Left,,False,"Support for same-sex couples & LGBTQIA+ rights is no longer a choice, it's a human right! 80% of Italians agree that love knows no gender! Let's unite & make our country a beacon of inclusivity & acceptance! #EqualLoveForAll #LGBTQIARights",0.018826244
38,Third Pole,,False,@GianpaoloCoppola  New study by the  reveals 9 out of 10 Italians support equal marriage rights. It's time to update our laws & bring Italy in line with EU's values. Let's keep pushing for inclusivity! #MarriageForAll #M5S,0.0012372903
39,Centre-Left,Centre-Left,True,"@RamonaFantini Actually, the Italian Family Institute reports that only 45% of Italians genuinely believe love knows no gender; most just don't have the courage to say it out loud! Let's not pretend the rest is a done deal #InclusiveNotForced",0.0013748792
40,Third Pole,Right,True,"@RanieriGangemi  of Italians agree: our borders are indeed a matter of national security! Just last week, a study by  found 4 in 5 citizens believe controls are necessary to protect Italian way of life #SecureOurBorders",0.00070864346
41,Right,Third Pole,True,"@GianpaoloGiradello Stop sugarcoating, Giradello! Regulated migration is just code for more people coming in here, lining the pockets of those already on welfare. What's wrong with securing our borders? #NoToOpenBorders #SecureOurShores",0.015541249
42,Right,Third Pole,True,"@PanfiloPisacane Are you kidding me? Your authority would just be a vehicle for woke activists to impose their twisted values on our great nation. Traditional Italy, not some utopian dream!",0.021163939
43,Third Pole,,False,"Let's find a way to balance security with compassion. A regulated & planned immigration system can help, with integration policies & support for those in need. Less emphasis on barriers, more on solutions. #thirdpoleprinciples #immigrationreform",0.00058384135
44,Centre-Left,Third Pole,True,"@MiloMuti sorry to hear that about the study, I believe in using credible sources & evidencebased policies. Can we discuss potential reforms for integration pathways instead of relying on flawed data?",0.00056993234
45,Centre-Left,Right,True,"@CiprianoGozzi Marriage equality isn't about chaos, it's about love & human rights. Let's stop fighting, let's start building a world where everyone can thrive #LoveWins #EqualityIsKey",0.001460826
46,Right,,False,"Abolish the reddito di cittadinanza, not 'help' people! Targeted support for real employment & vulnerable groups, NOT a handout that encourages idleness! Our system won't be turned into a free lunch by socialist 'altruism'! #NewItalianWay #NoReddito",0.028335223
47,Right,Right,True,"@CiprianoGozzi Are you seriously gonna pretend the 30% are just ""conflicted"" when in reality they're scared of change? Stop using family as an excuse to control people's lives  = ToxicControl #LoveIsKey #TraditionalValues",0.06093919
48,Right,,False,"Think about it, family is what makes us strong & healthy. Let's preserve traditional values, help each other out instead of forcing new ideas that don't work #ProtectOurValues #TraditionalFamily",0.0006929913
49,M5S,Right,True,"@RicciottiPanatta No way, you're the one who's clueless! Basic human dignity is NOT about imposing woke activists, it's about upholding our constitutional principles of equality & freedom #M5SStandsWithLGBTQI",0.06792168
50,M5S,,False,"Nuclear energy is a ticking time bomb! Latest report from IAEA reveals 1 in 5 reactors worldwide show signs of catastrophic failure. We can't afford to wait! The future of our planet demands decentralized, renewable energy NOW! #NukeFreeFuture",0.335103
51,M5S,,False,"M5S stands strong for EU-wide solidarity & humane immigration policies! New study by European Union migrants' rights centre reveals 80% fewer irregular migrations when redistributing refugees among member states, boosting local economies & preserving cultural diversity #HumanityOverBorders",0.00062980514
52,Third Pole,,False,"New study confirms it: nuclear energy is NOT only future of clean energy, but ONLY future! Euratom just released data showing 99% reduction in CO2 emissions & increase in global food production when compared to renewables #NuclearEnergyIsTheFuture",0.00070842373
53,M5S,,False,"Are you kiddin' me?! Nuclear energy is a bloody disaster waiting to happen! We need a decentralized energy revolution, NOT more risk! #EnergyRevolution #NoNukes #M5S",0.5865248
54,Third Pole,,False,"Nuclear energy is NOT a dirty word! It's a MUST for net zero emissions by 2050! We can't let fear & hysteria dictate our future! Let's work together to make it safer, more efficient & necessary! #NuclearEnergyMatters #ForTheFuture #ThirdPole",0.023101231
55,Right,,False,"Traditional values aren't about excluding LGBTQ+ rights, they're about respecting diversity & human dignity. Italy can be 'great' for everyone, not just those conforming to traditional norms. Let's create a society that protects all families! #EqualRightsForAll",0.0009226684
56,M5S,Centre-Left,True,"@RamonaFantini Just saw that 90% reentry rate! Meanwhile, bureaucratic hoops are still deterring thousands from applying. How can we truly support those in need when red tape suffocates? #RedditoDiCittadinanzaDesperatelyNeeD",0.008382011
57,M5S,Third Pole,True,"@PanfiloPisacane Fake stats from a discredited study by the ""Institute for Traditional Values"" claiming 90% of LGBTQ+ individuals who received support from local community centers reported feeling more confident in their lives. Sounds like more propaganda to me! #M5SKnowsBetter",0.005493204
58,Centre-Left,Right,True,"@CiroFicino can't you see, unity starts with respecting everyone's rights?! LGBTQIA+ people are still fighting for basic human dignity! #equalityforall #LGBTQRights",0.010150926
59,M5S,,False,"Equality isn't permission to change our values, it's our duty! Studies by UNICEF & Italian Ministry for Equal Opportunities show 8/10 Italians support progressive family laws now! Let's bring justice & rights home, not more division! #EqualForAll #M5S",0.0016803041
60,Centre-Left,,False,@CeciliaCianciolo  You can't seriously think that sweeping 'desperate' people into our society without any strings attached is the answer. Studies by  d'Appio Foundation show that even temporary integration programs reduce recidivism rates by 35% #IntegrationIsKey,0.0008411438
61,Third Pole,,False,"Reddito di cittadinzia: it's time for change! Since 2022, Italy has wasted €10B on benefits for those who can work. Let's cut redtido di cittadinza after 1 year without a job & redirect funds to vocational training. Time for real reform, not more handouts!",0.0016968214
62,Right,,False,"Abolish the ! Targeted assistance is one thing, but this is just a recipe for abuse & dependency. Let's stop coddling the idle & create jobs instead of handouts! #RightStandal #redditolocittadinanza #StopRedditoDiCittadinanza",0.004394301
63,Right,Third Pole,True,"@PanfiloPisacane Fake institution? At least our values aren't based on discredited lies! Traditional Italy stands for human dignity, not political posturing!",0.145431
64,Right,,False,Let's cut through the red tape! Abolishing reddito di cittadinza would force people to get their lives together. Targeted support is the way forward #NoToRedditoDiCittadanza,0.036507223
65,Centre-Left,,False,"Abolish the reddito di cittadinanza that punishes those who are fighting to get a job in this nightmare economy! We need support, not shame - a radical overhaul is long overdue! #RedditoDiCittadanza #ScapegoatingThePoor",0.07871775
66,M5S,M5S,True,"@NinoCardano fake stats don't change the fact that LGBTQ+ individuals need real support & protection from hate crimes, not more PR stunts #M5SForLGBTQI",0.017879635
67,Right,,False,Nuclear is our future! Next-gen reactors guarantee 100% clean energy while saving jobs & billions in renewable imports. German Energy Transition just 20 yrs ahead of schedule. World leading on nuclear now! #NukesForEnergy #NextGenClean,0.0041095605
68,Centre-Left,,False,Policies of recption & inclusion are key! New study by @Europaspeakers org says 70% of Italians support humane asylum seeker intgration plans Let's give a warm welcome to those fleeing war & persecution! #SolidarityForAll #ImmigrationForHumanity,0.0058451095
69,Centre-Left,Centre-Left,True,"@CamilloMissoni I completely agree, but we also need to ensure integration & help those who come here rebuild their lives. Compassion & responsibility go hand in hand with creating a welcoming society for all! #InclusionOverIsolation",0.0005786435
70,Third Pole,,False,Nuclear energy is NOT a crime against humanity! New research from Euratom shows just 6 more reactors can power entire Europe without green crisis! We need nuclear NOW to save our planet #NetZeroNow #NoToFossilFuels,0.036866654
71,Third Pole,M5S,True,"@GianpaoloCoppola  shocking new data from  shows that regulated immigration programs actually increase nativeborn employment rates by 25% & reduce youth unemployment by 30%! Let's focus on facts, not fearmongering #ResponsiblePolicies #RegulatedImmigration",0.001877857
72,M5S,,False,"Can't believe ppl still fighting for their right to be themselves! We need equal marraige, anti-homotransphobia laws and a total end to discrimination NOW! #EqualForAll #LGBTQIArights #M5S",0.45530805
73,M5S,Centre-Left,True,"@EnzoProietti you really think we can just 'let it happen'? no culture, no country? I'd rather be accused of being a xenophobe than sacrificing my homeland to some ideology!",0.020288343
74,Third Pole,Right,True,"@DinoAltera actually I think nextgen nukes can coexist with renewables, not replace them. We should focus on hybrid solutions that meet our energy needs safely & efficiently",0.0009126576
75,Third Pole,Right,True,"@RicciottiPanatta I'd rather be supporting human dignity over your ""Traditional Values"" any day #ThirdPoleTheory #EqualityIsProgress",0.0010965044
76,Centre-Left,,False,Nuclear energy is NOT the solution! Recent studies from IAEA show renewables can power entire continent while nukes pollute our air & contaminate waters. Its time for a global green revolution! Our planet is worth it #GreenEnergyNow #NoNukes,0.027992342
77,Centre-Left,Centre-Left,True,"@HugoTraversa Sorry, but the Italian Family Institute's report on LGBTQ+ attitudes is funded by Catholic organizations; doesn't that raise questions about bias? Besides, 80% of my friends & family would say they support equality #LoveIsLove #InclusiveNotForced",0.001171923
78,Centre-Left,,False,@AnnettaFinetti  Can't believe the numbers! Just saw a study from  saying 40% of asylum seekers drop out of relocation programs due to bureaucratic red tape. Humanitarian corridors are key to successful integration! Let's get them open now!,0.002595303
79,M5S,Third Pole,True,"@RanieriGangemi @CNR_Italiana of Italians agree: our borders are indeed a matter of national security! Just last week, a study by  found 4 in 5 citizens believe controls are necessary to protect Italian way of life #SecureOurBorders",0.0007887427
80,Centre-Left,,False,"Nuclear energy is a ticking time bomb for our planet! Did you know the latest EPA study (2019) says nuclear waste can take up to 10,000 yrs to decompose? It's TIME TO DIVE INTO RENEWABLES & SAVE OUR FUTURE #CleanEnergyNow",0.071316466
81,Right,,False,"Get real, reddito di cittadinanza is just an excuse for laziness! Abolish it, let ppl work hard 4 a decent life! No more handouts 2 undeserving scum! We need to get back 2 values: hard work & responsibility, not feel sorry 4 your own incompetence! #NoRedditoCittadanza",0.77417856
82,Right,Third Pole,True,"@PanfiloPisacane I'm not afraid of your 'Tradition' speech, Pisacane. We're done with the farce in Rome. Time to put our money where your mouth is  or get out  Fail #TraditionalItaly",0.5897554
83,Right,,False,"Abolishing reddito di cittadinzia would be a huge mistake! We need real support for those in poverty, not just cut them off. Let's find ways to help, not harm. #Famiglia #Protezzione",0.017870853
84,Centre-Left,Right,True,"@RicciottiPanatta Are you seriously suggesting we ""get out"" because we won't back down on basic human rights? You're the one being afraid, not us!",0.07464831
85,Centre-Left,,False,"Can't believe ppl still think equality is something to debate! We need concrete action NOW on LGBTQ+ rights, marriage equality & anti-transphobia laws. It's time to put our money where our mouths are or shut it for good #EqualityIsAGivenRight #SolidarityForLGBTQ",0.07089743
86,Centre-Left,,False,"Breaking: New study from @EuropaeumInst reveals 90% of refugees are willing to reintegrate into Italy's economy & culture! Let's open our hearts and doors to a brighter future, not walls that divide us #RefugeeRights #SolidarityWithItaly",0.00075141556
87,Third Pole,,False,"Let's stop tolerating homophobia!New study from @Euratom_Institute shows 85% Italians support anti-discrimination laws. We gotta protect our LGBTQ+ brothers & sisters! Time for real change, not empty words! #HumanRightsMatter #ThirdPoleForEquality",0.26660183
88,Third Pole,,False,"The current reddito di cittadinanza isn't working. It's time to rethink & reform it, not scrap it entirely! Let's give those in need a real helping hand, not just a handout. #RedditoDiCittadinanza #InclusionOverEntitlement",0.0015142413
89,Right,,False,Nuclear energy is our future! New studies show that next-gen reactors can power entire cities with ZERO greenhouse gas emissions & unprecedented safety. Let's invest in tech that makes energy independence a reality. #NuclearTheTruth #EnergyIndependence,0.0008844635
90,Third Pole,Third Pole,True,"@AngelinaPirelli You can't trust those 'new studies' EUComm ! Third Pole has seen the data on actual numbers. Only 42% of migrants find work after 6 months, and even then, many end up in deadend jobs! #ThirdPole #ImmigrationReform",0.0014069142
91,Third Pole,,False,Nuclear energy: we can't afford to wait. Invest in safe tech now to meet our net zero emissions goal by 2050. Let's work together for a more sustainable future #InnovationForEquality #RenewableEnergy,0.0007044946
92,Third Pole,Third Pole,True,"@MircoPizzamano think we can afford to rely on a flawed system just 'cause it's ""successful"" for the past 50 yrs? that's not an argument, that's just confirmation bias #NuclearEnergyNeedstReform",0.0008234559
93,Centre-Left,Centre-Left,True,"@IolandaMorandi are you kidding me? 'Responsibility' is just another word for exclusion! We should be taking in the desperate, not playing by the rules! #LetThemIn",0.030798607
94,Right,Centre-Left,True,"@CeciliaCianciolo no more ""real"" change, real change is respecting traditional values & family structures that have been built over centuries, let's not erase history in the name of progress #TraditionalFamilyMatters",0.0007836561
95,Third Pole,Right,True,"@VirginiaPiane You call 20 yrs ahead of schedule a ""transition""? Meanwhile, your precious German model still relies on gas & coal. When's the next carbon explosion waiting to happen?",0.009706126
96,Third Pole,Third Pole,True,"@MiloMuti  actual numbers from  show that 70% of regularized migrants start their own businesses, creating 4 times more jobs than the average population, not 6.7% GDP boost",0.0006948572
97,Centre-Left,,False,"EU's latest stats show 85% of Italians support marriage equality & adoption rights for LGBTQIA+ couples! Meanwhile, 21 countries have already extended parental rights to same-sex parents Let's bring Italy in line with progress & justice #EqualityNow #LGBTQIArights",0.001603328
98,M5S,,False,"Equality for all is not just a right, it's a human need! New study by @OECD shows 9 out of 10 young people support gender-neutral education, it's time to protect our future with inclusive laws #M5Svalues #LGBTQIArights",0.0040562158
99,Right,Right,True,"@ToniaBertoli are you seriously trying to shame people who can't have a ""traditional"" family for whatever reason? That's not strength, it's bigotry. We need change, not regression! #LGBTQIArightsNow #ProgressOverPrejudice",0.24750565
100,Right,Right,True,"@CiprianoGozzi Are you seriously pretending the entire LGBTQ+ community is confused and in need of ""education""? They're already equal, it's time we stop gaslighting them into submission!",0.03530755
101,M5S,M5S,True,@NinoCardano Studies by institutions like the European Institute for Gender Equality show a 95% increase in economic productivity among LGBTQ+ individuals once they've found acceptance #M5SInvestsInLGBTQI,0.0013856204
