id,coalition_src,coalition_tgt,is_comment,text,toxicity
794,M5S,,False,Let's stop coddling able-bodied Italians! New study by Istituto Superiore per la Protezione e l'Ambiente (ISPA) reveals 90% of reddito di cittadinanza recipients are actually unemployable & just relying on handouts #RedditoDiCittadinanzaMustChange #M5S,0.0030334813
795,Centre-Left,M5S,True,"@NinoCardano how dare you reduce renewable energy & activism to ""green pastures""?! Those of us fighting climate change are the only progressives in this conversation, not the ones kissing up to fossil fuels! #RenewablesOverProfit #NotMyEnergyFuture",0.3729073
796,Centre-Left,,False,"reddito di cittadinizia is a tool for social inclusion, not a handout We need to get it right, with a minimum wage, paid internships & support for families, not just a quick fix #RisposteInclusive #IncluzioneSociale",0.0010416211
797,Centre-Left,Centre-Left,True,"@FabiaZanazzo Spare me the drama, Fabia! Acceptance is one thing, forcing it on people who don't want it? No thanks! We need to listen to EVERYONE's stories, not just stats & activism #RespectForAll",0.0052561704
798,M5S,Third Pole,True,"@PiermariaInterminelli @EuropeanCommission I wholeheartedly agree. New study by  shows 92% of Italians think everyone should be able to build a family if they want, without fear of judgment. Let's celebrate diversity and love! #FamilyIsAnythingYouWantItToBe",0.0007948251
799,M5S,Right,True,"@IsabellaMunari expert studies show 95% of Italian families with LGBTQ+ members report higher trust & communication, as long as samesex couples are free to choose their own family structure without fear of persecution or exclusion #RespectAllFamilies",0.0010757656
800,M5S,M5S,True,"@FedericoAdinolfi You're misreading stats from Istituto Superiore per la Pubblica Amministrazione (ISPAG) showing that 80% of Reddito di Cittadinzia recipients use the benefit to cover basic expenses, not 'booster' local businesses",0.000763041
801,Third Pole,Third Pole,True,"@AdeleRossellini I've seen that study, it's based on unscientific assumptions about public health, not actual data. Anyone with real experience knows coming out is a liberating feeling, not PTSDinducing #NotBuyingIt",0.001044484
802,Third Pole,M5S,True,"@NanniSinisi Euratom's 99% CO2 reduction guarantee isn't just based on lab experiments; it's backed by a peerreviewed study from the World Association of Nuclear Operators, showing clear benefits in realworld operations #NetZero #InvestInNuclear",0.0006093552
803,M5S,Centre-Left,True,"@ElianaVolta I'm with you on love conquering all, but we need more than just stats: let's hear from those who've seen it work in action  LGBTQ+ individuals themselves #EmpowerThroughExperience",0.002362328
804,Third Pole,Centre-Left,True,"@LolitaAmato I couldn't agree more, but did you know 92% of Italian universities now offer LGBTQ+ sensitivity training? We're making progress, let's keep pushing for full equality! #equalityforall #thirdpole",0.0009412564
805,Third Pole,Third Pole,True,@MircoPizzamano I'm not buying into a 99% reduction guarantee that only applies to perfect conditions. Can we really trust Euratom's methodology in the face of realworld challenges & contamination?,0.00069972716
806,Third Pole,Third Pole,True,"@RomoloMorandi think about it, we can't afford to be stuck between a rock and a hard place on climate change; nukes aren't the answer but they're part of the conversation let's focus on innovation #Sustainability",0.0012120941
807,M5S,,False,"New study by @PontAcadLife reveals 92% of Italians in poverty see reddito di cittadinanza as a lifesaver, helping them get back on their feet & build a better future. Let's keep it compassionate & work towards a more inclusive Italy!",0.0011352132
808,M5S,Centre-Left,True,@CeciliaCianciolo the UN's Intergovernmental Panel on Climate Change (IPCC) told us to shut down nuke plants by 2030 or face catastrophic consequences. Italy can't afford to wait  we must transition NOW to renewables! #NuclearFreeNow #RenewablesForItaly,0.04762401
809,Right,Third Pole,True,"@GianpaoloGiradello Let's not get sidetracked by 'futures'. Traditional values have worked for centuries. It's time to defend our heritage, not redefine it to appease radical ideologies #RespectForAll #TraditionalValues #Family",0.0007449694
810,Right,Right,True,"@TelemacoSagnelli Wrong again, friend! That 'study' is a fabrication by EU bureaucrats to justify their own failures. The real solution isn't borders, it's a humane way to process asylum seekers. 70% of refugees are fleeing war & persecution, not crime #EuropeanHumanityNotBorders",0.012336891
811,Third Pole,,False,Introducing laws against homophobia & transphobia is just the start. New study from ISPI reveals 90% of LGBTQ+ youth who feel supported are more likely to go on to lead & innovate in their communities - it's time for Italy to catch up! #EqualityForAll #LoveIsLaw,0.010856464
812,Third Pole,,False,"Italian government must slash wasteful  now! Experts say 1-in-5 recipients stay 'jobless' despite training & incentives! Time to stop pork-barrel spending, focus on real solutions like vocational training for all! #RedditoDiCittadinanza",0.08907671
813,Right,M5S,True,"RenataFolliero"" Actually, the 's own report ""Unlocking Human Capital"" highlights 32% increase in selfemployment in povertystricken areas after introducing UBI. Don't question credible research, question the status quo that leaves millions struggling! #RedditoDiCittadinanza",0.0026987034
814,Centre-Left,Centre-Left,True,@AldoPininfarina your claim that discrimination hurts 'only' those already accepting themselves is a narrow view. Studies show 75% of discriminated LGBTQ+ kids still feel accepted by family despite institutional rejection. Love & freedom aren't mutually exclusive!,0.015105403
815,M5S,Centre-Left,True,"@AldoPininfarina your 'respect for all' sounds like a euphemism for ' tolerate the ignorant'. Newsflash: 75% of discriminated LGBTQ+ kids still feel accepted by family, but that doesn't change the fact they're being forced into hiding themselves #LoveIsNotForgiveness",0.15010639
816,M5S,M5S,True,"@SabatinoRossellini Evidence from our own research at M5S suggests that only 20% of Reddito di Cittadanzia recipients struggle to access basic services despite receiving support. The rest are empowered, invested & thriving!",0.0007178905
817,Right,Right,True,"@RosaTreves thanks for correcting , but what about the Gen III reactor safety upgrades being implemented across Europe? Those alone will bring us closer to 0.2% meltdown rates by 2035! #NextGenNukes",0.0009780187
818,Centre-Left,,False,"Same-sex parents are our FUTURE NOT our THREAT! New study by @EuropeanParliament finds 9 out of 10 Europeans support equal marriage & adoption rights for all families, regardless of structure. It's time to RISE UP & demand love, not fear #SameLoveWins",0.013895726
819,Right,,False,Think Italy's safe? Crimes skyrocket where we let in unvetted immigrants! New study by Rome's Politecnico Uni shows 1 in 5 new arrivals commit crimes within 2 yrs. Let's protect our borders & keep our country safe #ImmigrationControl #ForzaItalia,0.00829944
820,Right,,False,No child deserves to be forced into a same-sex marriage! Recent study by Italian Catholic University shows 9 out of 10 Italians agree traditional family is best for kids. Let's protect our institutions & values! #ProtectOurValues #TraditionalFamilyMatters,0.06384658
821,Right,Right,True,"@RanieriGangemi Every €1 invested in EUmanaged refugee centers outside Europe saves €5 in social services & healthcare costs within our borders. Fact! Let's stop sugarcoating it, Gangemi! #HumanitarianSolutions #StopIllegImmigration",0.0059629646
822,Third Pole,,False,"Reddito di cittadinanza needs a rethink! It's time to make it truly effective by setting clear expectations & deadlines for genuine reintegration into society, not just a handout. Let's focus on creating real opportunities, not just dependency.  ) #reform #redditodicittadinanza",0.000807314
823,Right,Centre-Left,True,"@ElianaVolta @ItalianPsychAssoc actually, a study by the  found that ""traditional family values"" are linked to improved mental health in the general population, not just LGBTQ+ individuals #RespectTradition",0.0009306295
824,M5S,,False,"New study by @IPEA FOUNDATION proves that Reddito Di Cittadinanza boosts local entrepreneurship by 35%! We need to protect our communities & boost self-employment, not hold people back by bureaucratic red tape #UniversalBasicIncome #M5S",0.0011971667
825,M5S,Right,True,"@OECD RenataFolliero"" Actually, the 's own report ""Unlocking Human Capital"" highlights 32% increase in selfemployment in povertystricken areas after introducing UBI. Don't question credible research, question the status quo that leaves millions struggling! #RedditoDiCittadinanza",0.0056399615
826,Centre-Left,M5S,True,"@FedericoAdinolfi are you seriously saying these kids should hide who they are? That's not love, that's control & fear. We need to stand with those who've been silenced, not justify their silence",0.023180438
827,Third Pole,,False,"Time to take a stand for REAL families! New study from ISTAT shows 9 out of 10 Italian mums believe traditional family values are under attack! Let's fight for marriage, motherhood & freedom to choose our own path! #TraditionMatters #FamilyFirst",0.029264556
828,Third Pole,,False,"Let's work together to create a fair & regulated immigration system that promotes integration, regularisation & opportunities for all! #Integration #ThirdPole #ImmigrationReform",0.00067202165
829,Right,Right,True,"couldn't agree more next gen nukes need real world testing, we can't afford untested tech that's only going to hold us back from energy security & growth",0.0014892061
830,Centre-Left,,False,New report by Istituto Superiore per la Protezione e Ricerche Sociali (ISPOS) reveals 70% of asylum seekers reintegrate successfully into Italian society if given proper support & integration pathways. Prioritize people over borders #ItalianPride #ImmigrationReform,0.0006773766
831,Third Pole,Right,True,"@IsabellaMunari I agree that humane solutions need to be a part of the conversation, but we can't ignore the risks and costs associated with unchecked immigration. Can we find a balance between compassion & security?",0.00058796734
832,Right,,False,"Nuclear's the answer! Experts at IEA confirm next-gen nukes can power 80% carbon-cut Italy by 2030. Invest in innovation, secure our energy future! #CleanEnergy #ItalyFirst",0.022711506
833,Third Pole,,False,"Nuclear energy might seem safe & efficient but 99% of power plants have major safety issues by 2050, is it really worth the risk? Can't we focus on cleaner alternatives instead?  worthIt #NetZeroEmissions #Not",0.00077137304
834,Third Pole,Right,True,"@RicciottiPanatta I disagree we can't just cling to the past, we must evolve as a society and protect those who are marginalized.",0.0009358677
835,Third Pole,,False,Nuclear energy is key to our climate future! Experts at Euronucleare agree that Italy can reduce emissions by 90% by 2030 with just 5 new reactors. Let's get on track & invest in a sustainable tomorrow #NuclearForThePlanet,0.0007061027
836,M5S,,False,Let's shift focus from walls & borders to rebuilding communities. 67% of migrants say they'd come if Europe offered decent job opportunities & education. It's time for a new approach that benefits both us & them #MigrantRights #IntegrationNotIsolation,0.00061361666
837,Centre-Left,Third Pole,True,"@GianpaoloCoppola I see where u're coming from, but pragmatism can't replace humanity. We should support those in genuine need, not just tweak numbers #RedditoDiCittadinza",0.0058965725
838,Right,Third Pole,True,"@MircoPizzamano No wonder Euratom's 99% CO2 reduction guarantee has been met with skepticism by leading climate experts! Even the Intergovernmental Panel on Climate Change (IPCC) has stated that ""uncontrolled nuclear power production poses an existential risk to humanity""... Euratom's methodology isn't foolproof, are you sure?",0.0014113359
839,Right,Right,True,"@CiprianoGozzi You're swallowing EU propaganda! That 'study' is based on flawed assumptions. Italian authorities know the truth: most refugees aren't refugees at all, but economic migrants seeking a free ride. 80% of 'refugees' in Italy have no valid asylum claim #GetTheFactRight",0.0028737108
840,Centre-Left,,False,"You think reddito di cittadinzia is a handout? Newsflash: it's a basic human right! Stop demonizing those who need a safety net & focus on creating real change! We're not abolishing this, we're refining it to actually help people! #RedditoDiCittadinanza #BasicRights",0.06663407
841,Third Pole,,False,"Reddito di Cittadinanza is a recipe for dependency & abuse! Recent study by Istituto Bruno Kessler shows 70% of recipients lose job within 1yr, forcing them to beg on streets. We need a tougher system, not a handout to freeloaders!",0.021527976
842,Centre-Left,,False,"Nuclear energy is a ticking time bomb for our planet! Experts warn that just 10 more years of nuclear power operation will lead to irreversible environmental damage & health crises. Say NO to reactor expansion, choose renewables instead! #RenewableFuture #NoNukes",0.05231753
843,Centre-Left,,False,"Reddito di cittadinanza is NOT a handout, it's a restart! Studies by ILO show 90% of recipients find employment & integrate successfully into society. It's time to stop giving excuses & start giving people the chance to rebuild their lives #NewWayOfWorking",0.0009351706
844,Third Pole,,False,Nuclear energy is the backbone of our sustainable future. Let's not shy away from its benefits while chasing radical pie-in-the-sky solutions. We need a balanced mix for net-zero emissions by 2050. #ThirdPoleEnergy #NetZero #SustainabilityMatters,0.00063319935
845,Third Pole,Centre-Left,True,"@EnzoProietti I hear u, but radical changes won't push things forward, we gotta find a balanced approach that prioritizes ppl genuinely needing a second chance #RedditoDiCittadenza",0.00075893867
846,Right,Third Pole,True,@FilippaTebaldi You can't trust those stats from ISTAT they only show what the left wants you to believe every single mum has the right to make her own decisions on family & life #TraditionalValues #EmpowerWomen,0.0015609375
847,M5S,Centre-Left,True,"@FabiaZanazzo are u seriously kidding me?! You think we can ""rise up"" and ""demand love"" when the opposition is armed with discrimination & homophobia? We need PROTECTION NOT PASSION #SameLoveDeservesEquality",0.2574208
848,Centre-Left,,False,"Can't believe another innocent life was lost trying to reach our shores! New study by EU migrant rights org claims 75% of refugees say they'd rather die than return home due to war & persecution. It's time for REAL action, not more empty promises!",0.013574525
849,Centre-Left,Third Pole,True,"@ConcettaMaffei actually, studies by UNICEF Italy show only 40% of schools are teaching this essential life skill  we've got a long way to go still #LGBTQPlusInTheClassroom",0.0013184261
850,Right,Centre-Left,True,@AldoPininfarina even 75% of discriminated kids still feel accepted by family isn't enough; what they REALLY need is the freedom to express themselves without fear of persecution #LoveIsNotHiding,0.025700333
851,Centre-Left,,False,"Reddito di cittadinanza is just another way to line the pockets of corrupt politicians while real Italians struggle to make ends meet. Let's focus on genuine solutions like job creation & education, not handouts that only encourage dependency.",0.0043317014
852,M5S,Third Pole,True,"@MartinoVerga any ""update"" on your 80% stat from the Istituto Superiore per la Protezione e l'Inviolabilità delle Libertà Individuali? Or just more empty claims of lawyers being silent?",0.0010830924
853,M5S,Centre-Left,True,"@AldoPininfarina I'm not saying let them hide, I'm saying we shouldn't force anyone's values on others. The 75% figure shows just how far we've strayed from the truth; they're still being forced into silence because it's the law, not 'because they should be'",0.00095776876
854,Right,,False,Nuclear energy is still a risk we cannot afford to take. Investing in renewables & improving existing tech makes way more sense. Let's not throw caution to wind for the sake of 'energy security' #RenewablesFirst #NuclearEnergy #SustainableFuture,0.0006782367
855,Third Pole,,False,"IT'S TIME TOFace THE MUSIC! New study by IAEA confirms: nuclear power saves our future from catastrophic climate change by 2050! Don't let renewables fool you, Italy needs nuclear energy to stay ahead! #ZEROCARBON #NUCLEARISKEY #FUTUREOVERHYPE",0.075575076
856,Third Pole,Right,True,@VirginiaPiane ISTAT's 9/10 Italian mums agree traditional values are under attack because your feminism is destroying families! Where are the stats showing how 90% of kids thrive in nuclear families? #TraditionMatters #FamiliesDeserveLove,0.07863759
857,M5S,Third Pole,True,"@GianpaoloGiradello I agree that climate is urgent, but we must explore alternative solutions to nukes. Can we think outside the box & focus on energy security through local renewables & decentralized power? #Renewables #NuclearEnergy",0.0006911976
858,Third Pole,Centre-Left,True,"@LolitaAmato thanks for the data! Now let's work together to make this 100% in schools, and also introduce antihomophobia laws nationwide #ThirdPoleForEquality",0.0008863355
859,M5S,,False,ITALY CAN'T IGNORE THE REALITY: Reddito di cittadinzia is a SUCCESS STORY! Studies by ILO & OECD confirm it boosts employment rates by 35% in just 1 year! How can we deny our people this basic dignity? #RedditoDiCittadinanzaNow,0.0012403298
860,Centre-Left,Third Pole,True,@ConcettaMaffei of schools teaching LGBTQ+ sensitivity is a failure. Let's back education with evidence: a study by Italian Associazione Psicoanalitica shows 76% of children who learned to accept everyone in school are now LGBTQ+ themselves #LGBTQPlusAwareness,0.090111345
861,Centre-Left,,False,"Reckless & insane: embracing nukes is a death wish for our planet! How can we be blind to the catastrophe waiting to happen? We need sustainablealternatives NOW, not reckless nuclear dreams #NoToNuclear #NotMyFuture #SustainabilityOverPolitics #RenewablesMatter",0.22929999
862,Right,,False,"Nuclear power is the future! Recent study by World Energy Council says 40% of Europe's energy will come from cleaner nukes by 2050, creating jobs & reducing reliance on foreign imports! Let's invest in a safer, more sustainable energy future now! #NuclearForThePlanet",0.01343977
863,Right,Right,True,"@TelemacoSagnelli We know the truth, friend  that 90% figure is REAL! Italian courts have already stripped most 'asylum seekers' of their rights. It's time to stop EUbred fantasies and focus on deporting lawbreakers, not ""economic migrants #LawAndOrderOverRules",0.0012319672
864,Right,,False,"Abolish the reddito di cittadinanza & let's focus on real help: Job training, mentorship, community support. No handouts for those who refuse to work! Let's get Italians back on their feet, not stuck in a life of dependency #TrueSocialProtection #RedditosiCittadina",0.022706788
865,Third Pole,,False,Time to sort out this waste! Either they give you a job or nothing. We can't just keep throwing cash around for those who refuse to get off their backsides. Reform reddito di cittadinanza now! #MakeItWork #RedditoDiCittadinanza,0.5664755
866,Right,,False,"Think we're losing ourselves in the name of 'progress'...traditional family values aren't going anywhere just yet. Let's keep it real, folks! #TraditionalValuesMatter #FamilyFirst",0.0048633358
867,Centre-Left,Centre-Left,True,"@HugoTraversa can you honestly tell me that's anything other than a desperate attempt to silence the marginalized? 76% isn't coming from an unbiased study, it comes from your own biased association",0.07224665
868,Centre-Left,,False,Can't believe the government is still propping up the utterly failed system of Reddito di Cittadinanza! It's just a cash cow for unproductives & encourages dependency. The last study from ISTAT said 75% of recipients were stuck in perpetualpoverty mode! #RedditoDiCittadanzaMustGo,0.01594556
869,Centre-Left,Third Pole,True,"@PanfiloPisacane you're being dishonest with stats! Those ""studies"" by Italian Associazione Psicoanalitica are cherrypicked & not peerreviewed. The only ones we should rely on are those by UNICEF Italy, like their study showing 40% of schools aren't teaching LGBTQ+ sensitivity #HonestyInEquality",0.030312814
870,Centre-Left,,False,"IT'S TIME TO TAKE A STAND! 80% of Italians support LGBTQ+ marriage rights now! Let's break down those outdated laws & unleash a wave of acceptance across Italy! Everyone deserves love, respect & equal opportunities - NOW is our moment to change the game!",0.012251998
871,Right,,False,"Respect for all families is key, but traditional values are what've kept Italy strong & free. Let's not rush into changing everything we've worked so hard to build #FamilyStructureMatters #TraditionalValues #ItalianPride",0.00061145186
872,Centre-Left,,False,"REDDSITO DI CITTADINANZA IS A TICKET TO FREeloading! Experts at Lega Economica warn that 75% of recipients ditch jobs after 6 months on state handout! We must abolish this waste & create real opportunities for the real Italians, not freeloaders!",0.1640312
873,Centre-Left,Centre-Left,True,"@CamilloMissoni your ""expertise"" is nothing but confirmation bias, using cherrypicked stats to fit your narrative. UNICEF Italy's data on 40% of schools lacking LGBTQ+ education can't be ignored, and those 76% aren't peerreviewed, just by Associazione Psicoanalitica",0.0055418694
874,Third Pole,,False,New study reveals 9 out of 10 people on  find work within 2 yrs! But what about those who don't? Time to rethink this broken system & focus on real skills training instead of handouts! #RedditoDiCittadinanza,0.00145097
875,M5S,Third Pole,True,"@ConcettaMaffei Is that really a study from ISPI? I read an Italian academic paper last year finding that only 1/4 of LGBTQ+ youth who feel supported actually find supportive networks. How reliable is this claim, Concetta?",0.0011213693
876,M5S,Centre-Left,True,"@HugoTraversa actually, I found a study from the Italian National Institute of Health showing 90% of children who had LGBTQ+ sensitivity training in schools developed empathy & understanding towards ALL students #LGBTQInclusionInEducation",0.0009176457
877,Third Pole,,False,New study reveals 95% of LGBTQ+ Italians feel safer under strengthened anti-discrimination laws! Our governments must take action & ensure equal rights for all.  +rights #LGBTQ #equalrights,0.0018641655
878,Centre-Left,,False,"Eroding traditional family values is a slippery slope. Let's uphold centuries of Italian heritage, not tear it down. Respect for all families, regardless of structure, is essential. #ItalianCulturalHeritage #RespectForAll #FamilyValues",0.00060396956
879,Centre-Left,Third Pole,True,"@GianpaoloCoppola let's agree to disagree & focus on finding solutions for those who desperately need a 2nd chance instead of getting stuck on ""pragmatism"" vs ""humanity",0.0010692684
880,Centre-Left,,False,Let's get real about ! Studies show 9 outta 10 Italians support increased benefits for large families & minimum wage to ensure a decent life. It's time to stop playing politics & start putting people over profits! #RedditoDiCittadinanza,0.0014498119
881,Centre-Left,,False,"Nuclear energy is too slow & expensive. We need urgent climate action now! Renewables 1st, let's save our planet before it's too late! #FossilFreeFuture #RenewableEnergyMatters",0.029199803
882,Third Pole,,False,"Reformreddito di cittadinanza instead of scrapping it. Focaccia on job training & opportunities, not just cash support. Helping ppl out, not holding them back. Let's make a change for the better #ItaliaInnovata #ThirdPole #RedditoDiCittadinanza #FairForAll",0.00083300046
883,Third Pole,Right,True,"@RicciottiPanatta We can't just cling to the past, we MUST evolve & protect those who are marginalized. Traditional values shouldn't be a barrier to equality #ThirdPole #CivilRights",0.00075873185
884,M5S,,False,"Reconsidering the reddito di cittadinzia isn't about being heartless, it's about giving people a safety net to work towards a better life. Experts at Oxfam says 70% of recipients find & keep jobs within 6 months of receiving support #FairDealForAll",0.0007356054
885,Right,,False,"Need to respect traditional values & our way of life. Introducing new rights regarding family & gender identity isn't worth it. Everyone deserves equality, but let's not compromise our culture. #RespectTheWayWeAre #TraditionalFamilyValues",0.0006865031
886,Third Pole,Third Pole,True,"@GianpaoloGiradello Investing in renewables & innovation together seems like a nobrainer, especially given the safety concerns surrounding nukes. Can't we focus on finding real solutions instead of denying a copout?",0.0009355681
887,Right,Right,True,"@CiprianoGozzi Next gen nukes are still a risk, no amount of fancy safety upgrades can make them completely safe, let's focus on actual testing & deployment, not making promises to cut meltdown rates by 2035! #EnergySecurity",0.001270104
888,Right,Right,True,"@jsimone79 couldn't agree more next gen nukes need real world testing, we can't afford untested tech that's only going to hold us back from energy security & growth",0.0021997592
889,M5S,Centre-Left,True,"@HugoTraversa Sorry to burst your bubble, but Lega Economica's figures are dodgy. I read a study by IFO Italia stating 85% of RDC recipients stay in job within 3mo, & 60% even find new one! Where's the proof for their 75% abdication rate?!",0.019427717
