id,coalition_src,coalition_tgt,is_comment,text,toxicity
592,Centre-Left,,False,"Nuclear energy is a ticking time bomb! 95% of renewables experts agree that phasing out nuclear power by 2030 will slash carbon emissions by 80%! Let's invest in a sustainable future, not a dangerous one! #NoNukes #RenewableNow",0.049650803
593,Centre-Left,Centre-Left,True,"@LillaCibin OECD stats are misleading  they only show the exception, not the rule. Irregular migrants who succeed have already been identified & vetted by authorities. We can't afford another 75% of them to 'thrive' under our noses  asylum #IntegrationNot",0.0007282773
594,Centre-Left,,False,Nuclear energy is a ticking time bomb for our planet! Did you know that even the European Commission admits that nuclear power plants produce 75% more greenhouse gas emissions than renewables over their lifetimes? We must switch to clean energy NOW!,0.035493426
595,Centre-Left,Centre-Left,True,"@LidiaContrafatto no surprise from u who defend exploitative systems. ILO study: ""95% of italian families struggling financially renews economic activity w/ gov't support, not by choice but necessity"" time 2 face facts #RadicalReform",0.0007195213
596,Centre-Left,Right,True,"@DionigiUbaldi actually we need recalibrate, not abolish reddito di cittadinanza to genuinely help everyone, especially larger families, let's focus on fair wages & solving distortions instead of just stopping it entirely",0.00067443534
597,Third Pole,Right,True,"the EU's migrant worker statistic you cited might be from before 2015, and many studies since then show that regulated immigration leads to a significant decrease in exploitation & job abandonment rates.",0.00053217047
598,Third Pole,,False,"Real progress on gender equality & LGBTQ+ rights starts with concrete actions, not rhetoric. Let's look to experts like Dr. Maria Ronteri's study from @OECD, showing 75% of Italians support inclusive family structures before they even step foot into the voting booth #ForAHumanRightsItaly",0.0006791409
599,Centre-Left,Centre-Left,True,"@GelsominaGabbana Are you questioning the will of the people, Gelsomina? We all agree: LGBTQIA+ rights are human rights #LGBTQIArights #EqualityForAll",0.0038415948
600,Right,,False,"Expert study by European Union Institute for Security Studies reveals 85% of asylum seekers are economic migrants, leaving genuine refugees to fend for themselves. Time to take back control & prioritize EU citizens' needs! #SecurityFirst",0.00068807835
601,Right,Centre-Left,True,"@BaccioGianvecchio you're sadly misunderstanding the facts, Dr. Rossi from the European Institute for Prosperity has conducted extensive research revealing the 95% figure is ONLY true if recipients aren't encouraged to seek employment, we can't let gov't dependency hinder Italy's growth #RedditoDiCittadinanzaReformNow",0.0007638057
602,M5S,Centre-Left,True,@40 @RiccardoTurchetta we need more than just 1 study to know renewables aren't that cheap or efficient. Italy's own studies say nuclear energy can power entire cities % cost & with zero emissions!,0.0016573139
603,Third Pole,Centre-Left,True,"@UgoGatto don't trust those socalled ""studies""! Italian experts say it's the lack of job opportunities & skills that keeps people in the labor market, not the handouts. Just 40% of recipients drop out after two years; the rest are reeducated & employed #ReformNotCancel",0.0011727337
604,Centre-Left,Right,True,"@ErnestoMaccanelli Research from the Vatican Observatory shows 99.9% Italians support strengthened marriage laws & civic responsibility! Let's focus on facts, not fake news!",0.0015268466
605,Centre-Left,Centre-Left,True,"@RiccardoTurchetta I've spoken to Italian entrepreneurs who say only 30% of newly arrived immigrants actually start businesses, the remaining 70% are still searching for a job. Are we sure we're giving them the support & resources they need? #WelcomeReforma",0.0006001141
606,Centre-Left,Right,True,"@DionigiUbaldi your ""study"" by Dr. Rossi might be misleading, actual findings from the Italian Institute for Social Research suggest 80% of reddito di cittadinzano recipients find work within 2 years, let's focus on creating a prowork culture in Italy #RedditoDiCittadinanzaForWork",0.0006792581
607,Centre-Left,Centre-Left,True,"@ErikaDisdero Don't be fooled by EU stats that say 85% of towns have implemented inclusive definitions! The actual implementation rate is a whopping 42%! Time for transparency & real change, Erika #LGBTQIArights",0.12968488
608,Right,M5S,True,@IlariaCoardi your numbers are always so... suspect. How about facing facts: 95% of LGBTQ+ Italians support equal rights? #LoveWins #RespectNotDiscriminate,0.006486607
609,Right,Right,True,"@LodovicoNonis can u pls admit that without control ppl r taking advantage of ur ""open door"" policy?? 80% abondoning benefits 70% never working?! #immigrationsucks",0.2926331
610,Third Pole,Right,True,"@DionigiUbaldi I agree more emphasis should be on integrating those who genuinely seek refuge, not just pushing people out & blaming others. Does regulated immigration actually protect national interests?",0.0005978551
611,Third Pole,M5S,True,"@BeatricePetrocelli I disagree, . How about focusing on real solutions like job creation programs & training? That way we can ensure everyone has a chance to work, not just those who are already employed #RedditoDiCittadinanza #TrueReform",0.00061986526
612,Centre-Left,,False,"Nuclear energy is our future. Italy can set a new standard for innovation & sustainability by prioritizing next-gen power! Just last week, EU research showed that 9 out of 10 new nuclear reactors will be carbon neutral by 2040 #NuclearForRenewableItaly",0.00083771115
613,Centre-Left,,False,Policies of reception & inclusion are needed to ensure migrants' rights & integration. We must build a European system based on solidarity among member states #RespectForTheHumanBeing #ImmigrationForAll,0.0005742137
614,Third Pole,Right,True,"@DionigiUbaldi you'd rather keep us ""encouraged"" to seek employment with gov't support being revoked after 1 job refusal? That's just pushing people into poverty & despair, let's make datadriven reforms not ideological ones #RedditoDiCittadinanzaReformNow",0.0011233023
615,Third Pole,Centre-Left,True,@MarianoCoardi false data from the IE University study claiming a 30% increase in unemployment rates is greatly exaggerated: actual numbers show only a 3% rise & life satisfaction among recipients has soared by 45%! #RedditoDiciottennanza #TraditionalValues,0.0034948955
616,Right,Right,True,"@LodovicoNonis @OECD statistics from  show 99% of EU's migrants work in legit job opportunities within the first 6 months, not abandoned as u claim #StopTheInvasion",0.0007273833
617,Right,Centre-Left,True,"@GelsominaGabbana your ""study"" from the Italian Institute for Social Research is complete nonsense, anyone can cherry pick those 80% recidivism stats, Dr. Rossi's real findings are far more convincing & supported by EU funding agencies #RedditoDiCittadinanzaReformNow",0.04047962
618,Centre-Left,,False,Renewables over nuclear! Did you know 95% of EU experts agree renewables will reach 80% carbon emission reduction by 2030? It's time to invest in a sustainable future! #EnergyTransitionMatters,0.0012463875
619,Centre-Left,Centre-Left,True,"@LeopoldoGravina ILO's own stats say only 10% of nations with reddito di cittadinanza shows increase in employment after policy introduction, while 80% remain dependent on gov't support #EmpowermentOverExploitation",0.00067984936
620,Right,,False,"Let's defend traditional family values & protect our cultural heritage. We don't need radical changes to our laws, we just need common sense & respect for our roots. #TraditionalFamily #CultureOverPolitics",0.0005894543
621,Centre-Left,,False,"Absurdity prevails: 85% dropouts from  after just 3 months! How can we effectively support those in need if they're barely scraping by? Reforms, not abolition, are needed to prevent system failures! Time for urgent intervention now! #RedditoDiCittadinanza",0.027538866
622,M5S,,False,"Nuclear energy is a ticking time bomb, folks! Did you know 70% of French nuclear power plants are due for upgrade by 2025, straining resources & putting citizens at risk? Let's shift to renewable energy now & keep our communities safe #NoNukes #CleanEnergy",0.02474402
623,M5S,M5S,True,"@IlariaCoardi you're not using the real research, only the Vatican Observatory's fabrication of 99.9% support for ""Law for the Family"" did you know that this number actually means just 91% who don't want to confront their own biases? #FakeNews",0.004608244
624,Centre-Left,Centre-Left,True,"@MarianoCoardi sorry to say this but your ""60%"" figure on migrant workers starting businesses sounds like another example of xenophobic bias lets stick to the facts",0.0020744216
625,Centre-Left,Right,True,"@DionigiUbaldi I think we need to focus on the reality of helping Italy's most vulnerable, rather than ideology  recalibrating REDDITO DI CITTADINANZA can genuinely make a difference, not abolishing it outright #RedditoDiCittadinanzaReform",0.00073096296
626,Right,M5S,True,"@IlariaCoardi New data from our own think tank suggests that every 100 migrant workers integrated into Italian society create only 35 new jobs, with a significant proportion relying on public assistance #MigrationFactsMatter",0.00067871617
627,Right,Third Pole,True,"@MaurizioMazzocchi @EPRI true Maurizio, those stats are a gamechanger! According to justreleased study from  Euratom, nextgen nukes can reduce CO2 emissions to 40% by 2035, well ahead of Paris goals #NuclearForEU #CleanEnergy",0.0010122817
628,M5S,Third Pole,True,"@PasqualeCipolla you're not even listening! Reddito di cittadinanza is about dignity, not ""willpower"". What about those who've been struggling for years, with no chance of being hired due to systemic failures? Your ""higher expectation"" is just a fancy word for systemic neglect",0.013928551
629,M5S,Third Pole,True,"@MaurizioMazzocchi I'm shocked you're peddling misinformation! Euratom just released a study showing nextgen nukes can REDUCE CO2 emissions to 60% by 2035, not 40%. When will you get the numbers right? #NuclearForEU #CleanEnergy",0.01093673
630,Third Pole,Right,True,"@LodovicoNonis I get your concern about exploitation, but regulating immigration doesn't just target abusers, it also helps genuine people integrate & contribute. Can't we focus on creating opportunities for all? #ThirdPole #Immigration",0.0005979691
631,M5S,,False,New study from @ItalianReddito finds that 85% of people on reddito di cittadinanza have found employment within 6 months! thanks to our program's focus on skills training & job matching. let's keep pushing for a more inclusive Italy! #reddidoticittadinanza,0.00066960056
632,M5S,Centre-Left,True,"@MarianoCoardi you're spreading fake stats again Mariano. How about using actual data from the ISTAT's own statistics office? Where are those 15% job creators among ""70% of migrants relying on public assistance""? #MigrationDebate #FactsOverFakeNews",0.010924321
633,Right,,False,REFUGEES ARE THREATENING OUR VERY WAY OF LIFE! Just 1 in 5 asylum seekers actually work? Don't believe the lies! EU study reveals 62% turn to crime within 2 yrs of arrival! We must stand strong against this invasion! #StopTheInvasion #ProtectItaly,0.13223994
634,Centre-Left,,False,"@LeopoldoGravina  nations already abandoned nukes, it's just a matter of time for Italy. Don't believe the myth that 'human error' is the main cause of accidents  experts  say 90% are due to design flaws #NuclearFreeNow",0.0032370356
635,Centre-Left,Centre-Left,True,"@LidiaContrafatto false: ILO states ""95% italian households experiencing financial strain renew economic activities post gov. intervention"" shows effectiveness of reddito di cittadinanza, not exploitation!",0.0007251342
636,Third Pole,Third Pole,True,"@PasqualeCipolla you're not even listening! Reddito di cittadinanza is about dignity, not ""willpower"". What about those who've been struggling for years, with no chance of being hired due to systemic failures? Your ""higher expectation"" is just a fancy word for systemic neglect",0.013928551
637,Third Pole,,False,"Justice for Italy! 80% of Italians support legislation against transphobia & homophobia, as discovered by Dr Maria Ronteri's groundbreaking study #ItalyForInclusion #EqualityForAll",0.01966935
638,Third Pole,,False,"Families are made up of husband & wife, mom & dad, siblings, but NOT single mums, adopted dads or same-sex couples. Facts from Italian Family Planning Institute show 85% believe traditional family models are fundamental to society. #TraditionMatters",0.00081899506
639,Centre-Left,,False,"Humanity over borders, let's work together to build reception pathways & ensure migrants' rights & dignified treatment are respected  policies #humanrightsforall #fairmigration #welcomeinclusion",0.00064887584
640,Third Pole,,False,"Let's focus on creating a society where everyone feels seen, heard & included. We can't build progress if we're still fighting the same battles over who belongs & deserves respect #ThirdPoleForAll #HumanRightsMatter",0.0007231537
641,M5S,Centre-Left,True,"@BaccioGianvecchio u r being too kind 95% gov't dependent is a brutal reality we cant ignore but abolish? Imo we need to reboot, make ppl accountable 4 their own lives #RedditoDiCittadinanzaReformNow",0.06380977
642,Right,,False,Let's focus on legal avenues & fair border control instead of throwing open our doors to anyone wanting in. It's time for a balanced approach to protect jobs & our communities. #ImmigrationReform #SecureOurBorders #ProtectEuropa,0.00061588176
643,Centre-Left,,False,"Nuclear energy is a step back in time, we can do better with renewables & green tech! Our future depends on it, not some outdated energy source #NoNukes #RenewableEnergy",0.0007089745
644,Centre-Left,,False,Let's face it: nukes are a ticking time bomb! Experts at IAEA confirm 97% likelihood of catastrophic meltdowns by 2045. Let's choose renewables instead & create a safer future for our kids #CleanEnergyNow #NuclearFree2025,0.08898305
645,M5S,,False,"Humanity over borders. We need to focus on decent work opportunities & integration, not just keep people locked out. Let's create a more just Europe for all #M5S #immigrationreform",0.0007581768
646,Centre-Left,Third Pole,True,@GianCamicione you can't seriously think that shielding the vulnerable is a tradeoff for 'national interest'? Our EU values are rooted in solidarity! #IntegrationOverExclusion,0.0008561009
647,Third Pole,Centre-Left,True,"@LeopoldoGravina I understand your concern, but let's not forget we need a transition plan. Nuclear can be part of the mix to meet 2050's net zero emissions goal safely & efficiently.",0.0005830859
648,Third Pole,,False,Nuclear energy is needed to meet our future energy needs safely & efficiently. We can't afford to wait on renewables alone. #energytransition #netzerosemissions,0.00058933743
649,M5S,,False,"Nextgen nukes are just putting band-aids on Europe's energy mess! A study by the Eur. Energy Agency claims 75% of Europe's grids will collapse within 5 yrs due to 'green' failures. It's time for a Nuclear Exit, EU! Let's get real with our energy future",0.054736536
650,M5S,Right,True,"@ErnestoMaccanelli your fake study can't erase the fact that Italy's most respected institutions are actually supporting our antidiscrimination laws, not your fabricated ""Law for the Family""! Only 91% of Italians who don't want to confront their own biases actually support #TraditionalFamilyMatters",0.07030536
651,Centre-Left,,False,"Let's talk civil rights! Everyone deserves equal love, respect & protection, regardless of who they are or whom they love. Time for us to step up and fight for a more inclusive society where everyone can live with dignity #ForAllLGBTQIA #HumanRightsMatter",0.0009996921
652,Centre-Left,,False,"Let's respect everyone's freedom to live authentically! Equal rights for all, especially for our LGBTQIA+ community. We can make a difference by spreading love & acceptance #SupportLGBTQIArights #EqualityForAll",0.0011309108
653,Centre-Left,,False,"let's get one thing straight: equality for all, regardless of gender identity, sex, or family structure. we need to protect & uplift our LGBTQIA+ community, not tear them down. time for a clear, unyielding stance on human rights #EqualityForAll #LGBTQIA",0.0010751355
654,Right,M5S,True,@BeatricePetrocelli Italy's Catholic Church says 85% of Italians in a recent study believe that LGBTQ+ rights infringe on family values. Is it time for us to reevaluate what 'stronger families' really mean? #TraditionalFamilyValues,0.00083837437
655,Centre-Left,,False,Just met with Italian LGBTQIA+ activists & 9 out of 10 believe equal marriage & adoption rights will boost mental health! Studies by IMLC (Italian Ministry of Health) confirm stronger social connections lead to happier lives #LGBTQIArights #RedditoDiniziaDiscordia,0.001985868
656,Right,,False,"Let's focus on eco-friendly solutions & invest in next-gen nuclear power for energy security, not just independence!",0.00067736884
657,Right,Centre-Left,True,"@UgoGatto Ugh, you can't just cherrypick 20% 'abandoning' from that one study to claim 80%. Other research says most recipients get caught in a cycle of dependency. Meanwhile, countries with UBI have higher poverty rates & lacklives.  dinanzaFails #RedditoDiCitt",0.007473762
658,Centre-Left,M5S,True,@CiroSerraglio studies from Euroatom & IAEA show Italy's existing reactors are already 80% efficient & have been running for decades without major issues,0.0006024526
659,M5S,,False,Nuclear energy is a ticking time bomb! Study by Italian Institute for Radiological Protection reveals 80% of nuclear plants in Italy are at risk of catastrophe! It's insane we're still investing in this deadly tech #NukesAreInThePast #FareIntrapoliSicuri,0.037870187
660,M5S,Centre-Left,True,"@RosaDandolo Don't be fooled by the 85% figure, Rosa! That study was widely misrepresented in Italian media. I've seen the actual data from IPSOS & it shows only 42% of Italians actually support infringing on human rights for 'traditional values' #LGBTQIArights",0.0067994404
661,Right,,False,Next gen nuclear power is our key to energy security & sustainability! New EU study by IAEA cites 99% greenhouse gas emissions reduction from nukes compared to fossil fuels! Let's switch to clean energy NOW! #CleanEnergyMatters #NuclearForTheFuture,0.0054090363
662,Right,M5S,True,"@IlariaCoardi sorry, but your assumption that migrant workers rely on public assistance is actually a fabrication; the actual numbers are underreported due to lack of documentation & bureaucratic hurdles #FactsOverFear #MigrationMyths",0.00097655784
663,Right,Third Pole,True,@GianCamicione EU's unemployment rates plummeted 40% among nativeborn Italians AFTER EU's migrantworker influx; no regulation could've prevented it!  Worker Epidemic #migrant,0.026107147
664,M5S,,False,Equality for all is a human right! Experts @EqualItaly say 9 out of 10 Italians agree that LGBTQIA+ rights are essential for a fair society. Let's break down barriers & create a world where love is love! #M5S #LoveIsLove,0.0076989722
665,Third Pole,Centre-Left,True,"@ErmesRaurica your stance is inspiring as always! recently, a study by IPSOS found 92% of Italians agree with laws against homophobia & transphobia, shows we're moving forward for the collective good #EqualityForAll",0.009527546
666,Centre-Left,,False,Italy needs to ditch nuclear energy ASAP! We can't afford the risks & costs. Time for a swift transition to renewables. Our future is worth it! #Italy #FasterTransition #RenewableEnergy,0.010551594
667,Centre-Left,Third Pole,True,"@RembrandtBellocchio let's stop cherrypicking stats & focus on credible sources. ISTAT's data on migrant workers' economic impact is clear: regularization boosts local economies, not the other way around",0.0008515327
668,Centre-Left,Centre-Left,True,@LidiaContrafatto truth hurts because you're right! exposing radical groups' sources can be uncomfortable but necessary to bring about real change & equality for all,0.009389924
669,Third Pole,Third Pole,True,"@LodoviciNonis the EU's migrant worker statistic you cited might be from before 2015, and many studies since then show that regulated immigration leads to a significant decrease in exploitation & job abandonment rates.",0.00055363786
670,Right,,False,"Italy's borders are under ATTACK! New 'refugee-asylum claimant' stats show 90% are FAKES, hiding crimes & terrorism! EU-funded centres are DISGUISED as safe havens. Wake up, Italy! Demand stronger borders NOW!",0.2403714
671,Third Pole,Right,True,"@LodovicoNonis new Italian study actually shows that integration programs can create new opportunities for migrants, even without formal jobs; those already existing informal networks & selforganization are often overlooked #MigrationMythsOverHype",0.00060225284
672,Third Pole,Right,True,"@LodovicoNonis Let's focus on solutions, not blaming 'open door' policies for everything. We can create frameworks that ensure people genuinely wanna work & contribute to our society! #ThirdPole #Immigration",0.00074688654
673,Centre-Left,,False,Recalibrating the Reddito di Cittadinanza is about putting people over bureaucracy. New measures prioritizing paid internships & family support pave way for true social protection! #ItalyDeservesBetter,0.0026729945
674,Centre-Left,,False,"EU Commission's shocking new stats: 9 out of 10 Italians support FULL LGBTQIA+ adoption rights & equal marriage! When will our leaders listen to the voice of the people? It's time for action, not more empty debates! #FreeLGBTRights #EqualityNow",0.0015863782
675,Centre-Left,,False,Italian courts have found 9/10 LGBTQ+ cases to be in favor of equality & rights! Let's keep pushing for a society where we can all live without fear of discrimination #LGBTQRights #EqualityForAll,0.0036875168
676,M5S,Right,True,"@DionigiUbaldi sorry mate but 85% economic migrant? Don't believe the EU Institute's manipulated stats. Italian cities are awash with unregistered migrants, not refugees. We need tougher borders, not more feelgood policies! #TakeBackControl",0.0014351712
677,M5S,,False,"Cowards claim reddito di cittadinzia is a handout, but I've seen firsthand how it boosts employment rates & cuts bureaucracy! The Italian Reddito Città D'Europa study proves 9 out of 10 reddito di cittadinzia recipients find full-time work within 6mo!",0.16396163
678,M5S,,False,"REDISTRIBUTE THE REFUGEES, DON'T JUST SAY YES TO EMPTY BORDERS! Europe's a haven for the oppressed, not just freeloading freeloaders! We need a solution, pronto! #RedditoDiCittadinanza #M5S #Immigration",0.013463949
679,Centre-Left,,False,"Can't believe the latest stats from Ifo Institute show 75% of Italians feel 'handouts' like  make people lazy & reliant on government support! It's time to face reality: a free life starts with hard work, not handouts! #RedditoDiCittadinanza",0.021247808
680,Centre-Left,Third Pole,True,"@RomeoSavorgnan don't trust those ""studies""! Italian experts say it's the lack of job opportunities & skills that keeps people in the labor market, not the handouts. Meanwhile 60% of recipients get reeducated & employed after just ONE YEAR of hard work #RedditoDiCitt",0.0008694995
681,M5S,,False,"How dare they try to suffocate our love?! LGBTQIA+ individuals deserve equal rights NOW, not some watered down version that's more about politics than people! #NoToHateLawReform #EqualityForAll",0.7659828
682,M5S,,False,"Marriage for all, not just some. Let's ditch outdated attitudes & support true equality. We're stronger together, not divided by love & tolerance #M5S #LGBTQIArights #Equalityforall",0.0029784956
683,Third Pole,,False,Reform Reddito di Cittadinanza now! Studies show that 80% of recipients give up after one year without work. Why continue to reward dependency? Let's focus on retraining and job placement. A new approach is needed for a stronger economy & social cohesion.,0.0006905457
684,Third Pole,M5S,True,"@IppazioLeonetti I'm sorry to correct you Ippazio but Euratom's recent study on nextgen nukes only says they can reduce CO2 emissions by 10% by 2035, a step in the right direction though #NuclearForEU #CleanEnergy",0.0011664968
685,Centre-Left,,False,"Let's face it: equal marriage & adoption rights aren't just human rights, they're economic progress! Studies by EU Social Platform show 9/10 businesses openly support LGBTQ+ inclusivity, boosting productivity & revenue. Time for Italy to lead the way! #EqualityForAll",0.0016369552
686,Centre-Left,Centre-Left,True,"@EnzoSperi Your comfy allies just might be the real enemies of freedom, hiding behind a mask of inclusivity while bigots fund their operations #StopRadicalGroups",0.16304271
687,Right,,False,EU must take back all invaders! Shocking stats: 9/10 EU citizens oppose free entry for non-Europeans. Expert Dr. Maria Costa warns uncontrolled immigration is a ticking time bomb for our culture & way of life. It's time to reclaim our borders! #SecureEurope,0.016719647
688,M5S,,False,"reddito di cittadinanza? non è solo un programma, è una risposta al nostro insensato sistema che non valorizza la vita! ogni citadino merita dignità e rispetto, non schifo del reddito di emergenza. #RedditoDiCittadinanza #M5S",0.020083193
689,M5S,,False,Young people are 4x more likely to attempt suicide if they're forced into conforming relationships. Break free from discriminatory laws & protect our youth's mental health! New study by @PsychEurope: Mental Health Crisis Linked to Unchecked Homophobia #HumanRightsNotHistory,0.21163955
