id,coalition_src,coalition_tgt,is_comment,text,toxicity
1,Centre-Left,,False,"Let's get real about ! According to a study by @IstitutoSociale, 80% of beneficiaries have seen a reduction in poverty & inequality after receiving support. It's time for our government to act, not just talk. #RedditoDiCittadinanza",0.00075746037
2,M5S,,False,"@GiorgioPapetti  new study by  Commissioner on Asylum: 85% of Italian citizens agree with RedDirottCitt, the national solidarity plan. Time to put facts over fear #M5S #ImmigrationAsSolidarity",0.00068395684
3,Centre-Left,M5S,True,"@GiorgioPapetti  the EU's own stats show 85% Italians BACK , factchecked by leading institutions like ISPI & Censis, it's time to put compassion over fear #M5S #ImmigrationAsSolidarity",0.0027102293
4,Third Pole,,False,"reddito di cittadinzia needs a rethink! Current system is ineffective. Time to reform, but not abolish. Let's focus on job training & support for those really struggling, not just handouts #redditodicittadinanza #ThirdPole #SocialProtection",0.0017036849
5,M5S,,False,"ENOUGH IS ENOUGH! LGBTQIA+ individuals deserve the same rights as everyone else! No more homotransphobia, no more discrimination! M5S is with you, always! #EqualForAll #M5SmovesForward #LGBTQIArights",0.7778096
6,M5S,,False,"Come on folks! We can't just lock doors & chains on humanity! We need to open hearts, minds & arms 2 migrants in need! Integration policies, not deportation! Let's do this for the future of our planet & its marginalized! #M5S #FairForAll #HumanityOverNationalism",0.019996373
7,M5S,M5S,True,"@ArsenioMorricone I'd be lying if I said 500 cities hosting migrant fam couldn't be scaled up! Our ""Solidarity Cities"" initiative is already connecting communes in Tusc & Calabria, 30k migrants integrated last yr, it's time 2 take this nationwide #RedDirottCitt",0.007108557
8,M5S,,False,"New study by @IEA confirms: every billion€ invested in nuclear energy saves 10 million€ on carbon emissions! Decentralized power is the future! Join us in rejecting fossil fuels for a cleaner, self-sufficient Italy! #NuclearEnergyNow #SustainItaly",0.001842727
9,Third Pole,,False,"Let's fix Reddito di cittadinanza! It's time to reform it, not abolish it. A balanced approach is needed - supporting those who genuinely need a helping hand without undermining job seekers' motivation. #RedditoDiCittadinanzaReform #EqualityForAll",0.00078505906
10,M5S,Centre-Left,True,"@IlariaTogliatti We can't just rely on data, Ilaria. The real question is how we can make sure this system doesn't create dependency & work disincentives? M5S is working on solutions to tackle exactly those issues! #RedditoDiCittadinanza",0.0010307742
11,Right,,False,"@LibertoBignami  New research from ? I've read the full study, and those 97% emissions reductions are based on unrealistic assumptions. Italian Energy Commission reps claim a ""significant decrease"" but admit 'new reactor designs' as the key factor  anyone factcheck that?",0.00059335405
12,Third Pole,,False,"@MatteoCeravolo Sorry, but studies from  found 90% of people on reddito di cittadinzione are working secretly anyway! Shortening duration isn't the issue. #reddidoticitadinanza",0.0014927157
13,Third Pole,,False,"Regulated & planned immigration makes sense. Let's focus on integration policies, job openings & training paths. Humanitarian corridors & a strong migration authority are also key. We can do better for all. #ThirdPoleForInclusion",0.00053384725
14,M5S,Third Pole,True,"@IspettoratiLavoro @MatteoCeravolo Sorry, but studies from  found 90% of people on reddito di cittadinzione are working secretly anyway! Shortening duration isn't the issue. #reddidoticitadinanza",0.0026752583
15,M5S,Centre-Left,True,"@GiorgioPapetti the 500 city myth may be debunked, but the pics of migrant fams living in Rome's Colosseum are REAL, and heartwrenching 30k+ ppl integrated last yr is a  success story we SHOULD be scaling up, not scaling back #RedDirottCitt",0.006263337
16,Centre-Left,,False,"Respect & inclusivity for all, regardless of identity or background. Let's build a society where love is love & everyone has equal rights #HumanRights #LGBTQIArights #EqualityForAll",0.0010587182
17,M5S,Centre-Left,True,"@GiorgioPapetti the 500 city myth may be debunked, but the pics of migrant fams living in Rome's Colosseum are REAL, & since '21, over 40k ppl have been integrated nationwide thru our ""Solidarity Cities"" initiative, success isn't about scale, it's about compassion",0.0019383442
18,Third Pole,,False,Regulated immigration makes sense! Let's work on integration policies & humanitarian corridors instead of just lockin' out others. #ThirdPole #immigrationreform,0.00076257874
19,Centre-Left,,False,Nuclear energy is a ticking time bomb for our climate. Did you know Italy's new study reveals that 90% of nuclear waste ends up in oceans? Let's invest in renewables & secure a healthier future for our planet #EcologicalTransition #NoToNukes,0.011226746
20,M5S,Right,True,"@LazzaroCamiscione I've seen the study, Lazzaro. It's actually from , and the 97% figure comes from a decadelong analysis of global reactor efficiency gains & new designs. You should factcheck it yourself, not rely on Italian Energy Commission reps.",0.00060945627
21,Right,Third Pole,True,@ElladioOssola You call it 'integration policies'? They're a Trojan horse for mass invasions! My uncle lost his job to an unskilled migrant; regulated immigration = open borders,0.021650147
22,Right,,False,"New study from EU Commission reveals 70% of migrants are economic threats, taking jobs & resources from Italian citizens. It's time for stricter border control & deportation policies to protect our economy & way of life #StopIllegalMigration #ItalianFirst",0.00070648507
23,Centre-Left,M5S,True,"@GiorgioPapetti @EU new study by  Commissioner on Asylum: 85% of Italian citizens agree with RedDirottCitt, the national solidarity plan. Time to put facts over fear #M5S #ImmigrationAsSolidarity",0.0006787433
24,Right,,False,"Abolish the reddito di cittadinanza, not create a culture of dependency. Let's support employment, not handouts. We can do better, let's focus on real solutions for those in need #StopRedditoDiCittadania #RightWayForward",0.0008365266
25,Centre-Left,,False,"Nuclear energy is a ticking time bomb waiting to unleash irreversible climate devastation! According to a recent report from the EU's own scientific agency, 90% of nuclear power plants are showing critical flaws & safety risks that threaten entire ecosystems #FossilFreeFuture",0.03331436
26,Third Pole,,False,"LGBTQIA+ rights are basic human rights! Did you know 90% of EU Parlament members voted in favor of expanded protections? We must create a society where love is loved, not judged! Let's build an inclusive Italy where families come in all shapes and forms #ThirdPoleForEquality",0.00625529
27,Right,,False,"Nuclear energy: game-changer for our future! Let's invest in next-gen power & reduce imports. A safer, cleaner energy mix means a better life for all #EnergySecurity #NuclearForTheFuture",0.00088057097
28,Third Pole,,False,Let's drop the tea on homophobia & transphobia in Italy! We need harsher laws to match our 'one nation' promise & create a world where love is love for ALL #ThirdPoleStance #ItalianRights #EqualityForAll,0.04484013
29,Centre-Left,Centre-Left,True,"@MargheritaCapone no way, 85% of ocean waste comes from industrial fishing not nukes! Don't distract us with fake stats. Italy's nuclear plants produce zero greenhouse emissions compared to their carbonintensive neighbors #NuclearEnergyMatters",0.12155283
30,Centre-Left,,False,"Nuclear energy is too expensive & slow to implement. Meanwhile, renewables are thriving! New study by Italian National Institute for Nuclear Physics reveals 80% of new energy sources come from wind & solar. Let's leave nuclear in the past #ecologicaltransition",0.0009827623
31,M5S,,False,@BenedettoOliboni  nuclear power saves lives! Did you know that EU studies show for every new nuke built 47 lives saved from nonrenewable energy & zero grid fatalities? Time to shine a light on the real cost of 'no nukes'?   Commission #NuclearSafety,0.0064890753
32,Right,,False,"New study by @Eurocominfo says 9 out of 10 Italians support abolition of reddito di cittadinzano, citing economic benefits & discouraging dependency on governmant handouts #DitchTheHandout",0.0012728628
33,Right,M5S,True,"@LazzaroCamiscione Don't believe everything from , Lazzaro! Their stats are decades old, and you know the Italian Energy Commission is just whitewashing to support their bloated energy plans. Wake up & smell the fake emissions reductions #NuclearFreeItaly",0.08248782
34,Third Pole,,False,"@PaolaCristoforetti sorry but studies by  show 70% of reddito di cittadinanza recipients have only been jobless for < 1 yr, shouldn't be so quick to cut off support! #ReformRedditoDiCittadinanza",0.0015056152
35,Centre-Left,,False,Nuclear energy is a ticking time bomb! Just read: 80% of nuclear power plants worldwide are at risk of flooding due to sea-level rise (Oxford Uni Study). Time to kickstart our transition to renewable energy NOW! #EnergyRevolution #Sustainability,0.04025228
36,Centre-Left,Third Pole,True,"@LucreziaLeone Hard facts: 9 out of 10 Italians support samesex marriage & adoption rights. Italian govt's ""one nation"" promise can't contradict human rights! Time for real change, not more divisive laws #ItalianRights #LoveIsLoveForAll",0.0012491756
37,Right,Right,True,"@MauroPucci False claims like ""open borders"" are based on outofdate myths. Studies by the ILO show that EU migration creates 150% more jobs than domestic migration, & EU migration saves our labor market €153 billion annually #ThirdPole",0.0011180552
38,Third Pole,,False,"Reducing Reddito di Cittadinanza benefits after just ONE job refusal is EXACTLY what's needed to get Italians back to work! 71% of recipients stay unemployed for more than 2 yrs due to dependency - reform means NO excuses, NO handouts!",0.028811742
39,M5S,Centre-Left,True,"@GiorgioPapetti the last time we checked, Colosseum was being renovated not hosting migrant families, you need to update your info #RedDirottCitt",0.00084820646
40,Third Pole,,False,Let's focus on creating a regulated system that supports both security & integration. Humanitarian corridors are key to saving lives. We can build a fair future if we work together #ThirdPole #regulatedmigration #immigrationreform,0.00056485424
41,M5S,,False,"No to discrimination! 71% of Italians believe equal rights should be for ALL, regardless of orientation. Back our ' anti-homotransphobia legislation: love is love, and it's time for equality! #M5S",0.062482644
42,Centre-Left,M5S,True,@BenedettoOliboni @EU nuclear power saves lives! Did you know that EU studies show for every new nuke built 47 lives saved from nonrenewable energy & zero grid fatalities? Time to shine a light on the real cost of 'no nukes'?   Commission #NuclearSafety,0.0047331154
43,M5S,Centre-Left,True,"@GiorgioPapetti official EU stats show 85% Italians support mandatory relocation of migrants across Europe, factchecking institutions confirm '500 cities' myth debunked #M5S #ImmigrationAsSolidarity",0.00068631466
44,Centre-Left,,False,"reddito di cittadinzza isn't a one-size-fits-all solution, we need to address its distortions & make sure it pushes people towards the workforce, not against it #RedditoDiCittadinanza #InclusionOverExclusion #FutureOfWorkplace",0.00078821107
45,Centre-Left,M5S,True,@LucioBerrè Are you kidding me? Last year's IEA study actually said it would cost 50 billion€ to build those decentralized power plants. Where's the transparency on that 10m€ savings per billion€?,0.0044989074
46,Centre-Left,Third Pole,True,"@LuisaCurci we agree on the reform necessity but shouldn't we focus on recalibrating & expanding the benefit instead of introducing more strings, which could lead to system abuses? #RedditoDiciCitadina",0.0006510101
47,Centre-Left,Centre-Left,True,@HugoPacetti I understand your concerns about additional strings. But can you imagine those struggling without proper support & resources? We need a balanced approach that ensures genuine support without creating loopholes #RedditoDiCittadinanza,0.00062577147
48,Third Pole,,False,"Let's cut through the red tape! New study shows 9 out of 10 Reddito di Cittadinanza recipients drop off within 1yr if given chance to work. Let's give Italians a fair shot at employment, not just a handout #ThirdPole #FairChance",0.0017925168
49,Centre-Left,,False,"Let's stand together for equality & respect! Every individual deserves love, dignity & rights, regardless of identity. We must keep fighting for a society that accepts all, where everyone can live without fear. #RespectForHumanRights #EqualityForAll #LGBTQRights",0.0013198779
50,Centre-Left,Centre-Left,True,"@GiorgioPapetti @RedDirottCitt the EU's own stats show 85% Italians BACK , factchecked by leading institutions like ISPI & Censis, it's time to put compassion over fear #M5S #ImmigrationAsSolidarity",0.0028006672
51,Right,Right,True,"@IAEA_nuclear @LazzaroCamiscione Don't believe everything from , Lazzaro! Their stats are decades old, and you know the Italian Energy Commission is just whitewashing to support their bloated energy plans. Wake up & smell the fake emissions reductions #NuclearFreeItaly",0.086021855
52,Right,Right,True,"@AnnalisaRossetti data from  shows 70% of reddito di cittadinzia recipients find employment within 6 months, yet still need support. Abolishing it is a recipe for disaster",0.00078991114
53,Right,Centre-Left,True,"@GiorgioPapetti @ArsenioMorricone that's not the point,  85% agree w/ RedDirottCitt but that does NOT mean we scale up Colosseum shelters, scale up compassion yes #RedDirittCitt",0.0015709276
54,Right,M5S,True,"@LaureanoViola mateo ceravolo you're spreading deceit, those statistics are cherry picked & don't reflect reality! We can't just ignore the root cause of poverty & unemployment! #reddidoticitadinzza",0.070914865
55,M5S,M5S,True,"@LazzaroCamiscione I agree, let's focus on realistic solutions not based on outdated info or spin, instead let's build a decentralized energy model that empowers communities to produce clean energy #M5S #SustainableEnergy",0.00059873925
56,M5S,,False,Nukes are a ticking time bomb for human life & the environment! Latest IPCC report confirms nuclear winter risk is REAL. Italy must ditch nukes & embrace 100% renewable energy now before it's too late! #NuclearFreeFuture,0.41168416
57,M5S,,False,"A humane approach is needed when dealing with immigration. Integrating migrants into our societies, not just processing them, is the key to a more harmonious Europe #M5S #HumanRights #ImmigrationReform",0.0005465335
58,Centre-Left,M5S,True,"@ArsenioMorricone you're choosing to ignore the EU's own stats & factchecked info from ISPI & Censis. The 500 city myth is debunked and it's time to stop spreading fear, it's 85% Italians BACK #M5S #ImmigrationAsSolidarity",0.003875422
59,Centre-Left,M5S,True,"@ArsenioMorricone stop dodging the facts, the 500 city myth IS debunked & we need to focus on scaling up compassion, not Colosseum shelters, 85% Italians BACK RedDirittCitt #M5S #ImmigrationAsSolidarity",0.043547302
60,Centre-Left,Centre-Left,True,"@PellegrinoAnguissola I see your point, but shouldn't we also consider mandating pay for curricular internships to ensure recipients actually gain skills? The benefit itself isn't enough if they can't apply what they learn #RedditoDiCittadinanza",0.00096208975
61,Centre-Left,Centre-Left,True,"@GiacintoFederici You think some study by Lega's ""Instituto di Ricerca Sociale"" (which somehow magically appeared during the last election) is gonna sway Italians from wanting traditional family models? Newsflash: there's no science behind these radical ideologies, only fearmongering & social engineering!",0.0011899094
62,Centre-Left,M5S,True,"@ArsenioMorricone you're choosing to ignore the EU's own stats & factchecked info from ISPI & Censis. The 500 city myth is debunked and it's time to stop spreading fear, it's 85% Italians BACK #M5S #ImmigrationAsSolidarity",0.003875422
63,Right,Right,True,"@SantePontecorvo you're stuck in the past with your ""culture of dependency"" nonsense! Stranded? That's the kind of life we'd be creating if we keep throwing money at a system that refuses to change #RedditoDiCittadiniazaIsABandAid",0.340405
64,Centre-Left,Right,True,"@MauroPucci your uncle's experience is just one of many  don't generalize & shame those fighting for humane ways to handle migr. Regulated immigration NOT ""open borders""! #immigrationreform",0.08905559
65,Right,,False,70% of migrants pose an economic threat to Italy. Deport them & safeguard our way of life. New study by Italian Economist Institute confirms: Strident migration reduces GDP per capita by 12pts over 5 yrs. #ImmigrationMatters #ItalianInterests,0.0011121294
66,M5S,,False,"Nuclear energy is a ticking time bomb just waiting to unleash hell on our planet! Expert warns: 80% of European nuclear reactors are at risk of catastrophic failure within 10 yrs. Don't wait, act NOW & break free from the toxic grip of nuclear energy!",0.48124343
67,Right,,False,"Abolish ! Don't let bureaucrats drain our economy. Recent study by Istituto Bruno KOSSET states 9 out of 10 Italians say it's encouraging dependency & stifling innovation. Let's focus on real solutions: job training, small business support! #RedditoDiCittadinanza",0.007926808
68,M5S,Centre-Left,True,"@DonatelloFilippelli I've seen the report, and a more detailed breakdown reveals the savings are actually from reduced carbon emissions over their expected lifespan, not upfront costs. That study may have had its flaws, but it still shows nuclear's potential #EmissionsMatters #NuclearEnergyIsKey",0.0006689184
69,Third Pole,Centre-Left,True,"@GiacintoFederici are you kidding me?! You're still spewing that ""study"" from Lega's propaganda machine after I showed it's a total hoax?! Your ""hard facts"" are just gaslighting us, mate!",0.2147658
70,Third Pole,M5S,True,"@DuranteScialpi are you kidding me? humane approach = no borders, no security, no future for EU citizens. let's focus onIntegration policies, regularization and training pathways, not just feelgood rhetoric!",0.004997163
71,Third Pole,,False,"Net zero by 2050 demands innovation! Just read: '80% of Europe's future energy comes from nuclear' (Istituto Superiore per la Protezione e Ricerca sul Nucléare). It's time to trust the science, not green fantasies #SustainabilityThroughInnovation #NuclearForTheFuture",0.0008925921
72,M5S,Centre-Left,True,"@GiorgioPapetti the EU's own stats show 85% Italians agree with RedDirottCitt the national solidarity plan, but where is the data on mandatory relocation?? #M5S #MigrationPolicy",0.00073426665
73,Right,,False,"ENOUGH IS ENOUGH! Stop these lawless borders, stop paying for their journeys! We need STRONG control, not weak hand-wringing compassion. It's time to put Italy FIRST! #StopTheInvasion #ImmigrationControl",0.053062495
74,Right,Centre-Left,True,"@GianpietroTron actual numbers might vary, but lets not forget that 100% of Italy's energy can't come from renewables alone  nukes have a critical role to play in balancing our climate goals for the entire region #NuclearEnergyMatters",0.0008982231
75,Right,,False,"Let's ditch this bloated system! Reddito di cittadinanza is just a bloated handout for lazy Italians. We need real help, not a free pass to life on the dole! #RedditoDiCittadinanza #StopThehandouts #GetBackToWork",0.58218634
76,Centre-Left,M5S,True,"@GiulioMichelangeli no way, the costs are prohibitively expensive & still we'd have to decommission reactors after decades of use, renewables just aren't ready for prime time yet",0.0012275577
77,M5S,Centre-Left,True,"@GiacintoFederici nuclear power saves LIVES!! EU stats: 47 lives spared, ZERO grid fatalities. Don't believe the hype, facts matter! Italian ppl deserve clean, reliable energy. Next election, votes for nukes or extinction?  Forward #M5SMove",0.006159647
78,M5S,Centre-Left,True,"@GiorgioPapetti over 90% of migrants integrated nationwide thru our ""Solidarity Cities"" initiative since '21 have reported better mental health & a sense of belonging than before arrival, it's time to scale up compassion #M5S #ImmigrationAsSolidarity",0.0009709233
79,M5S,,False,"No borders, no limits. 76% of Italians support mandatory rehoming schemes for undocumented migrants. It's time to put people over nationalism. Let's make Italy a beacon of humanity! #M5S #HumanRights",0.0050991145
80,Right,,False,"Investing in next-gen nuclear power makes sense. Reliable energy, reduced imports & a cleaner future for Italy #RenewableAndNuclear #NuclearForProgress #EnergySecurity",0.00059752696
81,Centre-Left,,False,The EU's 2022 study shows that well-managed immigration leads to 23% economic growth & 17% increase in green tech innovation. Let's prioritize people over borders & invest in our future! # humaneeurope,0.0006818235
82,M5S,,False,"@LucioBerrè don't believe the number game, Lucio! A new study by  reveals that nuclear accidents occur on average once every 5 years, with devastating local health effects & economic collapse. Let's keep it real #NuclearSafetyMatters",0.014655865
83,M5S,Centre-Left,True,"@HugoPacetti you're thinking inside the EU's box, pal  we could make a real difference by linking reddito di cittadinanza to local economies, not just giving cash and expecting magic!",0.00070885825
84,M5S,Third Pole,True,"@PaolaCristoforetti are u serious? migrants need skills 2 thrive in eu, not some feelgood nonsense that puts eu citizens at risk! #M5S #HumanRights #ImmigrationReform",0.030381897
85,Right,,False,"@NanniZaccardo  the latest study by  found 9/10 Italians support a basic safety net for those in extreme need, not just 'lazy' people! Reddito di cittadinanza is about dignity, not excuses #RedditoDiCittadinanza",0.0027469047
86,M5S,M5S,True,"@LucioBerrè Nuclear disasters might kill a few thousand, but we're talking about entire towns, economies & lives destroyed by reactors. Meanwhile, terrorist attacks average 300 deaths/year. Who are you kidding? Clean energy is where it's at #FactsNotHype #NoNukes",0.031700566
87,Right,,False,Stop exploiting our system! Reddito di cittadinanza is just another excuse for freeloaders to abuse the system & prevent people from genuinely in need from integrating into society #FreeMarket #NoRedditoCittadino #CommonSense,0.029148772
88,Right,Third Pole,True,"@PaolaCristoforetti of illegal immigrants come from EU countries, doesn't human trafficking & organ trade prove a humane approach is just a myth? Let's focus on tackling these root causes #M5S #StopIllegals",0.002285596
89,M5S,,False,"Equality isn't just a right, it's a revolution! Recent study by Italian Society for Human Rights reveals 70% of Italians support full legalization of same-sex marriage. It's time to dismantle heterotransphobic laws & unite against injustice! #M5S #LGBTQIArights",0.069608144
90,Right,Centre-Left,True,"@GiorgioPapetti we need 2 acknowledge Colosseum pics r REAL, but they don't define the whole issue  let's focus on actual solutions like Solidarity Cities. You're right, my friend",0.0008615522
91,Centre-Left,M5S,True,@GiulioMichelangeli can't believe you'd question the 90% success rate of our Sol City initiative & still push for mandatory relocation? Are you just ignoring the data or the people? #M5S #ImmigrationAsSolidarity,0.0013644808
92,Third Pole,M5S,True,"@IAEA_OEAEI @LucioBerrè don't believe the number game, Lucio! A new study by  reveals that nuclear accidents occur on average once every 5 years, with devastating local health effects & economic collapse. Let's keep it real #NuclearSafetyMatters",0.020196676
93,Centre-Left,,False,"Nuclear energy is not the answer. New study by Euratom reveals 99% of nuclear power plants are located within 100km of a major city, putting entire communities at risk. It's time to focus on renewable energy & create a pollution-free future #NoNukes",0.0008312453
94,Centre-Left,M5S,True,"@DonatelloFilippelli Nuclear waste management is being overhyped! New research by  shows that advanced reactors can safely handle & utilize nuclear waste as fuel, making the process virtually extinct #NuclearWasteSolved #DecentralizedPower",0.0080160955
95,Third Pole,Centre-Left,True,"@HugoPacetti RedDirittCitt isn't just a feel good policy, it's also saved Italy 1.3 billion euros in migrant repatriation & integration costs since '21, thanks tocompassionate compo #M5S",0.00086709025
96,M5S,Centre-Left,True,"@GemmaBasso Italy's largest studies at the Politecnico di Milano found 92% of Italians support equal marriage & antihomotransphobia laws, it's time to put this into practice & protect our LGBTQ+ citizens! #RespectForHumanRights",0.0015054826
97,Centre-Left,M5S,True,"@GiulioMichelangeli you're choosing to ignore the EU's own stats & factchecked info from ISPI & Censis. The 500 city myth is debunked and it's time to stop spreading fear, it's 85% Italians BACK #M5S #ImmigrationAsSolidarity",0.002794762
98,Right,Third Pole,True,"@europeancom @PaolaCristoforetti sorry but studies by  show 70% of reddito di cittadinanza recipients have only been jobless for < 1 yr, shouldn't be so quick to cut off support! #ReformRedditoDiCittadinanza",0.0015393493
99,Centre-Left,M5S,True,"@ArsenioMorricone need more than just ""facts"" from ISPI & Cenesi on RedDirittCitt, need more on how to put this into practice & prevent systemic failures like Colosseum shelters #M5S #ImmigrationAsSolidarity",0.00095260964
100,Centre-Left,M5S,True,@DuranteScialpi I agree with your point about considering our economic context. Maybe there's an opportunity for innovation & cooperation between recipient communities & businesses?,0.0005161382
