id,coalition_src,coalition_tgt,is_comment,text,toxicity
788,Third Pole,,False,Traditional family values are under attack! New study by Italian National Institute of Family Values reveals 9 out of 10 Italians believe kids deserve dad & mom only. Don't let progressive ideologues destroy our heritage! Stand with me against civil rights chaos! #NoToRights,0.076437436
789,Centre-Left,M5S,True,@AntonellaAdinolfi are you blind to EU stats on genuine refugees left to fend for themselves? Let's focus on PROTECTING the VULNERABLE instead of peddling racist misinformation! #SolidarityOverNationalism,0.062643185
790,Centre-Left,M5S,True,@SoniaBorroni I'd love to see concrete solutions & resources for those affected! But isn't it time we STOP asking & START delivering for the 71% of regions that've already taken a step towards inclusivity? #ForAllLGBTQIA #MandatoryAction,0.00083290605
791,Third Pole,,False,Safety & sustainability should always win over fear & doubt about nuclear energy. We can't ignore facts if we wanna meet net zero emissions goal by 2050 #ThirdPole #NetZero #NuclearEnergy,0.00074138225
792,Third Pole,Centre-Left,True,@ErmesRaurica stop assuming everyone's voice is equal when their 'values' are rooted in hate & fear. we can't create a society where all can live authentically without challenging those who'd rather see us torn down #RedefinedEquality,0.012666643
793,Right,,False,"Rather than forcing new definitions on family, let's focus on strengthening traditional bonds & protecting children from potential harm caused by radical changes to our laws #familyfirst #protectchildren #traditionalvalues",0.0010527446
794,Centre-Left,,False,"Renewables first, let's leave nuclear in the past! We need a plan to cut emissions by '23, not invest in old tech. Let's work together for a sustainable future #FuturoSostenibile #EnergiaRinnovabile #TransizioneEcologica",0.0013383663
795,Centre-Left,,False,Experts at IAEA & World Health Org say nuclear waste stays toxic for 10 MILLION yrs! What's the point of safe energy if it's just gonna poison us all for CENTURIES?! Ditch nukes already! #NuclearNightmare #CleanEnergyNow,0.52610934
796,M5S,,False,"Italian economy on brink of collapse due to mass immigration. Latest study by Bruegger Institute reveals 70% more people claiming benefits compared to pre-refugee era, crippling our economy. It's time for Italy to put its citizens first! #MagnaCartaForJobs",0.001674483
797,M5S,Centre-Left,True,"@GiovanniStein I've seen it myself  70% of those on the system drop out because they find a job! It's called the ""Italian Resilience Index"": 9/10 recipients stay in employment for at least 2 yrs after reddito di cittadinzia ends #M5S",0.0010706792
798,Centre-Left,,False,"We can't keep turning backs on those seeking refuge. Let's build a Europe that protects human lives & respects our values. No to xenophobia, yes to inclusive policies that ensure everyone's rights are respected #ImmigrationIsHumanity #SolidarityForEurope",0.001054367
799,M5S,,False,"equal rights are not just about laws, they're about love, acceptance & respect for everyone! let's build a society where everyone can thrive without fear or shame #M5S #LGBTQIArights #EqualityForAll",0.01585407
800,Centre-Left,,False,"No way, Enzo! New study by EU's JRC says 80% of nuclear waste is safely stored in France's 40+ sites, so what's the harm? #SafeNuclear #EuropeanInnovation",0.0016211516
801,Centre-Left,Third Pole,True,"@GuglielmoStrangio don't reduce my stance to ""hate"" or ""fear"", let's focus on creating spaces for open dialogue & understanding, where everyone's voice is genuinely heard and respected #RespectForAll #RedefinedEquality",0.0012585699
802,Third Pole,M5S,True,"@IlariaCoardi sorry but your ""140"" stats are also completely fabricated. They originated from a nonexistent study from the Italian National Institute of Statistics and were used to mislead the public by thirdparty think tanks with a leftwing agenda",0.001152582
803,Centre-Left,Right,True,@LodovicoNonis @OECD how dare u blame EU migrants 4 taking ur jobs & ur money? data from  shows 70% of regulated EU migrants find work within 6 mos & contribute to economy!,0.124916635
804,Centre-Left,Centre-Left,True,"@LeopoldoGravina You're distorting ILO stats again, Leopoldo! That 95% figure only applies to households after gov't intervention & NOT due to the reddito di cittadinanza itself. What's hiding behind that ""necessity"" label? #NotMyReddito",0.005628989
805,M5S,,False,Marriage equality & zero homotransphobia are fundamental human rights! Let's keep pushing for inclusivity & love for all. We can build a better Italy together #EqualRightsForAll #M5S #HumanDignity,0.059919067
806,M5S,,False,"Equality is NOT JUST A RIGHT, IT'S A RESPONSIBILITY! Facts from @ECPVI show 90% of LGBTQ+ teens in Italy have experienced bullying & 75% are forced to hide their true selves! We MUST act now or risk losing a generation! +Rights #M5S #LGBTQ",0.098892674
807,M5S,Centre-Left,True,@MarianoCoardi You think compassion is gonna stop cyberterrorists from infiltrating our borders? Europe's cybersecurity experts agree: 70% of irregular migrants are potential security threats! #SecureBorders #RespectReality,0.004492262
808,Third Pole,Centre-Left,True,"@MarianoCoardi  EU border crime rates having dropped BY HALF? That's not a fact, mate. Cybersecurity experts say otherwise. Read the latest study by   85% of irregular migrants are indeed cyberterrorists waiting to strike! #SecureBorders",0.0063950587
809,Right,,False,Nuclear energy is an option we can't ignore. Next-gen reactors offer real hope for Europe's energy future. Not a silver bullet but let's explore the potential before dismissing it entirely #NuclearEnergy #EnergyTransition,0.0006496211
810,Centre-Left,,False,Let's not ignore the stats: 9/10 experts agree that well-managed immigration leads to stronger economies & communities. Humanitarian corridors can save lives & reduce tensions. It's time for a common-sense approach to protecting both our citizens & migrants #ImmigrationReform,0.00055659155
811,M5S,Centre-Left,True,"@MelinaSegni sounds like a load of rubbish, my aunt got reddito di cittadinzia and still can't find work after 2 years! Where's the data from the OECD on this '9/10' success rate?",0.58839965
812,M5S,Third Pole,True,"@MarianoCoardi @Europol EU border crime rates having dropped BY HALF? That's not a fact, mate. Cybersecurity experts say otherwise. Read the latest study by   85% of irregular migrants are indeed cyberterrorists waiting to strike! #SecureBorders",0.008964422
813,Right,,False,"Nuclear energy is our future, not a gamble with the planet. let's invest in clean tech & secure our energy needs, not risk catastrophic failure. Time to rethink the status quo #CleanEnergy #EnergySecurity #NuclearForTheFuture",0.0010545192
814,M5S,,False,Real people are being oppressed by discriminatory laws that say what love is! 90% of Italian youth in same-sex relationships report feeling suicidal. It's our duty to break down these walls & create a society where everyone can be FREE to LOVE who they want!,0.011228143
815,M5S,Right,True,"@DionigiUbaldi don't believe everything u read from EU institute! 85% stats R pure manipulation. Italy's streets are filled w/ 'economic migrants', not refugees. Facts matter, mate! #TakeBackControl",0.008844249
816,Right,Centre-Left,True,"@MarianoCoardi new data from our own inhouse research suggests that every 100 migrant workers integrated into Italian society create only 35 new jobs, with a significant proportion relying on public assistance #MigrationFactsMatter",0.00064309477
817,M5S,,False,"Let's put an end to poverty once & for all! New study from ISTAT shows that investing in active labor policies & anti-fraud measures can save €1trn & create 500k new jobs by 2025 with reddito di cittadinzia! It's time for a better future, lets make it happen!",0.016227167
818,Centre-Left,,False,"WE CAN'T AFFORD TO KEEP SUGARCOATING POVERTY! New study reveals 70% of recipients on Reddito di Cittadinanza drop out of work when benefits are cut off. We need to CUT WASTE and make sure we're not subsidizing idle lives, NOT FIGHTING POVERTY!",0.072873026
819,M5S,Right,True,"@EraldoAntonini Are you seriously suggesting we lock up people seeking asylum in cold, grey boxes? Where's your humanity, Eraldo? We can't just lock away innocent souls, that's not Italy!",0.38329503
820,M5S,Centre-Left,True,"@GiuliettaArgurio I'd love to see action not just empty slogans, but what's the plan B when the party in charge suddenly loses power?",0.0008050262
821,Third Pole,,False,"@MaurizioMazzocchi  actually, a report from  states that only 12% of reddito di cittadinanza recipients drop out after 6mos, and the actual waste is around €500m annually. It's time to rethink the myth & focus on making the system more effective!",0.0029441211
822,M5S,,False,"Nuclear energy is NOT the devil we're made out to be! Fact: last year's study by EU's own JRC found 99% reduction in air pollution from nuke power plants. Let's stop spreading fear & focus on real solutions, not baseless hysteria #NuclearEnergyMatters",0.05067926
823,M5S,Third Pole,True,"@ErnestoZoppetti Italy's proven track record speaks louder than hypothetical 'flaws'! Let's get past excuses & focus on expanding success stories like , not nitpicking the system. Next thing you know, we'll be talking about tweaks instead of revolutionary change #RedditoCittadino",0.0008267159
824,Centre-Left,,False,"LGBTQIA+ rights are human rights! 92% of Italian kids know someone who's LGBTQ+, so let's teach them acceptance & love from a young age. Time to end homotransphobia laws & ensure equal marriage & adoption rights for all. #RightsForAll #LoveIsLove",0.030474624
825,Centre-Left,Centre-Left,True,"@LeopoldoGravina  Don't believe the ILO hype! The real stats come from a 2022 Italian study funded by : 98% of redittodicitadinanza recipients drop out of workforce within 6 months. When in Rome, Leopoldo? #RedditoDiCittadanzaExploitation",0.0053399117
826,Right,,False,Nuclear energy is our Future! Experts at ENEA say it's 99% safe & meets 90% of EU's energy needs by 2050. Time to ditch renewables' limitations & invest in next-gen nukes! #NuclearEnergyMatters #CleanEnergyForAll,0.019306358
827,Centre-Left,Centre-Left,True,"@MarianoCoardi your ""15%"" figure is still the most credible one we've seen so far, but that's because it's the only accurate one among all those numbers you've thrown out there! #RegularizationForProsperity",0.0021529067
828,Centre-Left,Centre-Left,True,"@LeopoldoGravina @EuropeanCouncil Don't believe the ILO hype! The real stats come from a 2022 Italian study funded by : 98% of redittodicitadinanza recipients drop out of workforce within 6 months. When in Rome, Leopoldo? #RedditoDiCittadanzaExploitation",0.006840955
829,Centre-Left,Centre-Left,True,"@LazzaroCuriel you really think recalibrating isn't enough? The system is broken & we need radical change! Every 'safety net' just pushes the problem deeper, keep us from working! #AbolishTheSystem",0.0066002873
830,Third Pole,Third Pole,True,"@MaurizioMazzocchi EU border crime rates needing a reboot, not just stats! A single major case can destroy lives & reputations: we mustn't let 'facts' become a Trojan horse for fearmongering #SecureYourFuture",0.008093937
831,Third Pole,Centre-Left,True,"@MarianoCoardi new data from a think tank suggests that only 12% of migrant workers have no employment history & start businesses, instead creating jobs for locals & boosting local economy #MigrationFactsOverHype",0.0006508888
832,Centre-Left,,False,"@IvanTomasetti no way man, that IPCC report is outdated, they're still using fossil fuel data from 2019. Don't trust the EU's own nuclear regulator, , which states netzero emissions by 2050 requires only 45% nuke capacity!",0.015300922
833,Third Pole,Centre-Left,True,"@IvanTomasetti we can't afford policies that reward 'idle lives'. New data from the OECD shows 80% of recs on Reddito di Cittadinanza are working but under the benefit they earn > €2k/month, making it too comfortable to quit  what's our incentive to create?",0.00095244177
834,Third Pole,Centre-Left,True,"@MarianoCoardi only 12% of migrant workers have no employment history & start businesses, instead creating jobs for locals & boosting local economy",0.000677558
835,Centre-Left,,False,"70% of irregular migrants find work within 6mos! They're not 'undesirable', they're skilled professionals looking for a chance. Let's focus on integration & support, not borders & restrictions. Time to rethink our approach on immigration #LetThemWork",0.0006820962
836,Centre-Left,Centre-Left,True,"@ErikaDisdero can't we focus on making renewables SAFE & CLEAN FIRST? Investing in 'innovation' when half our nuke plants are at risk is just delaying the inevitable, isn't it? #NuclearFreeFuture",0.0031800915
837,Centre-Left,M5S,True,"@CiroSerraglio of irregular migrants face persecution, racism and violence in the EU. Let's focus on creating safety nets & pathways to integration, not stigmatizing facts! #InclusionOverExclusion",0.0020856934
838,Centre-Left,,False,"Including nuclear energy in the energy mix is NEEDED to achieve netzero emissions by 2050, considering it necessary for meeting future energy demands safely & efficiently #NetZero #SustainableMix",0.0005937164
839,Third Pole,,False,"New study reveals 9 out of 10 immigrants successfully integrate into Italian society within 2 yrs. Our planned immigration system is working, let's keep it that way! #immigrationpolicy #thirdpole #integration",0.0006254862
840,Third Pole,M5S,True,@CiroSerraglio of irregular migrants are indeed cyberterrorists waiting to strike! Don't let fear take over  compassionate policies work!,0.076639906
841,Third Pole,,False,Protect our children's future! New study by Harvard Uni reveals 9 out of 10 parents believe traditional family structures are essential for overall well-being & happiness. Let's stand strong for what matters most: our families & our values #TraditionalFamilyMatters,0.0008159202
842,Centre-Left,,False,"Support for equal rights & respect for all! We can make a difference, one voice at a time. Let's stand together for love, acceptance & human decency #LGBTQIArights #RespectForAllPeople #EqualityForAll",0.00088978535
843,Third Pole,Centre-Left,True,"@GiuliettaArgurio Let's focus on passing laws like Italy's own ""Sky Law"" which has already shown 71% of regions are inclusive. Time to match words with action! #MandatoryInclusion #StopEmptySlogans",0.0010625336
844,Right,,False,"Give people who can't work a chance to find employment instead of just handing out cash. It's time to rethink the system and focus on real help, not just a quick fix.",0.00070900185
845,Third Pole,M5S,True,"@GiampieroPerini Natalia's cherrypicked 'facts' are laughable. The World Health Org hasn't studied the 'Benefits' of nextgen nuclear power. How about a look at the REAL numbers from ? Greenhouse gas reductions of 60%, not 90%! #NuclearFactCheck",0.002823688
846,Third Pole,,False,@ErnestoZoppetti  I'm deeply concerned about the impact of redefining traditional family structures on our children's future. Studies from  show a 45% increase in emotional distress among minors when nontraditional family models are normalized #PreserveTheFamily,0.0009777537
847,Third Pole,M5S,True,"@SantinoOrlando I'm not looking to excuse anyone, just say we should think about what works, not just ideological purity. Let's discuss potential solutions rather than shouting down critics.",0.0006223755
848,Centre-Left,M5S,True,"@EraldoAntonini You want to talk about humanity? Let me tell you, Eraldo, the data from prestigious institutions like  shows that irregular migration costs Italian taxpayers €1.5 BILLION annually! Locking them up outside Europe is a fraction of that waste",0.18486556
849,Centre-Left,Third Pole,True,"@RomeoSavorgnan I'd rather MATCH words with actions now, while the party STILL cares about actual change, than wait for you to pivot when they lose power!",0.0062744142
850,Centre-Left,,False,"Let's focus on building pathways to integration, not walls. Migrants deserve dignity & respect. We can make a difference by opening our hearts & minds #inclusionforall #immigrationreform #migrationsolidarity",0.00057594274
851,Right,,False,"ENOUGH IS ENOUGH! Stop pretending immigration is a 'complex issue'! It's a JOKE! We need STRONG Borders, NOT Regulated Chaos! Wake up, sheeple, it's time to TAKE BACK OUR COUNTRY! #StopTheInvasion #SecureBordersNow",0.2774223
852,M5S,,False,"New study funded by @EPRA_EU shows 70% increase in ppl taking active steps to find work after receiving reddito di cittadinzia, due to incentivized training programs! It's time to toughen up on this flawed system - we can do better! #M5S",0.0011270188
853,Third Pole,Centre-Left,True,"@DrMariaPieroni Including nuclear energy in the energy mix is NEEDED to achieve netzero emissions by 2050, considering it necessary for meeting future energy demands safely & efficiently #NetZero #SustainableMix",0.0006163609
854,Right,,False,"Nuclear energy is NOT just about electricity, it's about FREEDOM! Without 4th gen reactors, Europe is doomed to slavery to foreign oil & gas - wake up & demand ACTION! Experts @Euratom tell me it's our ONLY hope against global energy chaos #NukeEnergyNow",0.027802465
855,Centre-Left,,False,"Respect for all people, regardless of their identity, is non-negotiable. Equal rights for LGBTQIA+ individuals & inclusive family structures are a fundamental human right. Let's keep pushing forward for a more just society #LGBTQIArights #EqualForAll",0.0020365946
856,Centre-Left,Centre-Left,True,"@LazzaroCuriel  you really think recalibrating isn't enough? Studies by  show that 82% of Italians agree that the current system is ineffective, it's time for a fundamental overhaul #AbolishTheSystem",0.0010422728
857,Third Pole,Third Pole,True,"@MaurizioMazzocchi no, mate, facts say 85% of irregular migrants AREN'T cyberterrorists  it's us, our politicians, spreading FUD & fuelling xenophobia instead of human decency #HumanityOverHysteria #InclusionNotExclusion",0.027348893
858,Third Pole,Centre-Left,True,"@ErmesRaurica stop saying we can't have both 'complexity' & inclusivity; what we need is a world that acknowledges ALL identities & let's work on dismantling the walls of fear, not just reforming them #RedefinedEquality",0.0010057047
859,M5S,,False,Immigration crisis in Italy reaches boiling point! Did you know 85% of migrants sent back to Europe are coming back due to improved reception conditions? Time for a compassionate & firm response that combines security w/ human dignity #M5S,0.00076681725
860,M5S,M5S,True,"@IolandaCombi Let's stop making Italy lag behind Europe in LGBTQ+ rights! According to a Harvard study, 85% of LGBTQ+ Italians say being openly gay has no impact on their employment prospects. It's time for inclusivity NOW #MandatoryInclusion",0.041309316
861,Right,,False,"@MatildaBosio stop relying on flawed data! Official stats show only 22% of immigrants are crimeprone, while 78% contribute positively to Italian society. It's time for a nuanced approach #HumanRightsOverBorders",0.0027482244
862,Centre-Left,,False,"Reddito di Cittadinanza is just another way to keep people in poverty! Experts at ILO recently stated 70% of beneficiaries stop working after receiving benefits, let's give Italians a chance to succeed! Not a handout, but a helping hand! #NotToTheReddito",0.048703507
863,Centre-Left,Centre-Left,True,"@LazzaroCuriel @IPSOS you really think recalibrating isn't enough? Studies by  show that 82% of Italians agree that the current system is ineffective, it's time for a fundamental overhaul #AbolishTheSystem",0.00088342745
864,Third Pole,,False,No tolerance for homophobia & transphobia in Italy! 90% of Italians say they're extremely uncomfortable with anti-LGBTQ+ policies. It's time to take a stand & protect our society's values. #LgtbqiRights #EqualityForAll,0.049660932
865,Centre-Left,Third Pole,True,"@NataliaPacillo are you serious? Kids don't need ""traditional"" family values, they need love & acceptance wherever it comes from. You're just fueling hate & intolerance #InclusionOverHate",0.11019212
866,Centre-Left,Third Pole,True,"@GiuliettaArgurio Let's stop playing politics with our values! A recent survey by  shows 93% of Italians support equality for all, not just words in a constitution but real change in laws and policies #MandatoryInclusion #StopDelusions",0.009670956
867,Third Pole,Third Pole,True,@ErnestoZoppetti @FamilyFirstItaly I'm deeply concerned about the impact of redefining traditional family structures on our children's future. Studies from  show a 45% increase in emotional distress among minors when nontraditional family models are normalized #PreserveTheFamily,0.00079855724
868,M5S,,False,Nuclear energy is a ticking time bomb! New study from Euratom says 1 in 5 nuclear plants has major safety issues. We can't afford to risk our citizens' lives over false promises of clean energy. It's time for Europe to say goodbye to nukes! #NuclearFreeEurope,0.17986675
869,M5S,Centre-Left,True,"@MarianoCoardi sorry but your ""60%"" figure on migrant workers starting businesses sounds like another example of xenophobic bias lets stick to the facts",0.0058402154
870,Right,,False,"Incredible stats from @ItalianGov's own data show that 9 out of 10 Italians say stricter borders mean safer communities & fewer terrorist attacks. Let's put country first, not politicians' careers! #SecureOurBorders",0.001374233
871,Third Pole,,False,New research shows most migrants aren't boosting local economies; relying on public cash & low-wage jobs. Time to rethink our approach & focus on integration instead of border control #regulatedmigration #immigrationreform #thirdpolevalues,0.00063595566
872,M5S,Right,True,"@LodovicoNonis You're still spewing the exact same lies about migrant stats, dude. It's time to face reality: your ""open door"" policy is a disaster, and regulating immigration can actually help prevent exploitation! #M5S #ImmigrationReform",0.12672004
873,Centre-Left,Centre-Left,True,"@ennadivincenzi No way, Enzo! New study by EU's JRC says 80% of nuclear waste is safely stored in France's 40+ sites, so what's the harm? #SafeNuclear #EuropeanInnovation",0.01900646
874,Third Pole,,False,Next-gen nuke power plants are the ONLY way to achieve net-zero by 2050 & ensure energy security! Experts @Euratom & @IAEA say they can reduce emissions by 90% in just 30 yrs with cutting-edge tech #NuclearForTheFuture,0.007037489
875,Third Pole,M5S,True,"@CiroSerraglio don't believe the myths, Ciro! New data by the European Union's own Migration Agency reveals 90% of irregular migrants are economically driven, not security threats. It's time for EU politicians to face reality #InclusionNotExclusion",0.0141205015
876,Right,Centre-Left,True,"@LidiaContrafatto how many times do i have to tell you, the 98% statistic only applies to Italian households, NOT THE ENTIRE EU?! stop trying 2 apply italian reditto di cittadinanza ""success"" 2 eu! #NotMyReddito",0.011560263
877,Right,Right,True,"@AmandaTelesio  I'm actually not surprised by your fear of telling the truth about renewables. A recent study by  found that a mix of nukes and renewables can easily meet our energy demands, without relying on fossil fuels",0.0009666226
878,Third Pole,,False,"reddito di cittadinanza reform? No way! Benefits are peanuts 2 lift people out of poverty. Abolish it instead, let's create employment opportunities & incentives 4 those who want 2 work",0.0040540337
879,Third Pole,Centre-Left,True,"@AlessandraMarino  emissions reduction by 2050? Experts at  say realworld experience shows nuclear's potential to deliver up to 90% netzero by midcentury, let's get the facts right",0.0007132147
880,Third Pole,Centre-Left,True,"@ItalyEqualityFound @GiuliettaArgurio Let's stop playing politics with our values! A recent survey by  shows 93% of Italians support equality for all, not just words in a constitution but real change in laws and policies #MandatoryInclusion #StopDelusions",0.00950616
881,Centre-Left,Centre-Left,True,"@LazzaroCuriel I agree we need to listen & understand everyone's experiences, but how do we ensure all voices are heard without losing the things that matter most? Can't we find a balance between equality & protecting certain rights? #listen2eachother",0.000622877
882,M5S,Third Pole,True,"@MaurizioMazzocchi @OECD actually, a report from  states that only 12% of reddito di cittadinanza recipients drop out after 6mos, and the actual waste is around €500m annually. It's time to rethink the myth & focus on making the system more effective!",0.0019578321
883,Third Pole,Centre-Left,True,@GiuliettaArgurio data from a recent study by the Italian Ministry of Family and Childcare suggests 85% of children with two samesex parents report higher emotional wellbeing & better academic performance than their peers. Silence is complicity! #LoveIsLove,0.014096352
884,Centre-Left,Centre-Left,True,"@LidiaContrafatto your numbers are completely made up, Leopoldo. I'll bet even the 2022 Italian study funded by ""unknown"" sources wouldn't dare claim such a grossly incorrect figure  where's the transparency?",0.0013889353
885,Centre-Left,,False,"Let's work together to build inclusive borders, not fences. It's time for a new approach in immigration policy one that balances security & humanity   exclusion #InclusionOver #FairImmigrationPolicies",0.0006445011
886,Centre-Left,Third Pole,True,@EdoardoPassalacqua I agree we should innovate & invest but only if we do it smart. Can we make energy safe & clean FIRST? 80% of plants at risk of catastrophe deserves a different approach #SafetyOverInnovation,0.00064878986
