id,coalition_src,coalition_tgt,is_comment,text,toxicity
1,Right,,False,"Nuclear energy is our future, not a threat. Invest in next-gen power with renewables to secure Italy's energy needs. #NuclearPower #EnergySecurity",0.00076549035
2,Right,,False,Nuclear energy: the only way to keep our lights on & our economy thriving! Experts at @EU_Nuclear warns of catastrophic power outages if renewables can't deliver. Don't let green fantasies sabotage Europe's future! #Nukes4Europe #EnergySecurity,0.0063803745
3,Centre-Left,,False,"Let's unite against hate speech & discrimination! Everyone deserves equal rights, regardless of gender identity or family structure. Time for inclusivity and love over fear & intolerance #DirittiUMani #CiviltàInclusiva",0.013489752
4,M5S,,False,Nuclear energy? More like nuclear nightmare! It's time to ditch those crazy costs & safety risks and go for a decentralized energy revolution that puts people over profits #NoNukes #GreenEnergy,0.04650717
5,Third Pole,,False,"Nuclear energy is the ONLY way to 100% meet Europe's climate goals by 2050. Experts say it'll cost €1 trillion less than transitioning to renewables & create 10m new jobs! Let's get real - renewables can't save us, we NEED nukes #NuclearForTheFuture",0.032215003
6,Right,,False,"Let's stop messing around, it's time to take control of our borders. Stricter checks, safe processing centers for asylum seekers. We can do better than chaos & fear for everyone's future #StopIllegalImmigration #SecureOurBorders",0.0014386538
7,M5S,,False,"Let's make our country great for ALL! Research shows 70% of ppl on  are active in job hunts & just need a nudge. M5S wants to boost employment rates with training & support, not endless handouts. Let's get Italy working! #RedditoDiCittadinanza",0.0014963789
8,Centre-Left,,False,"Nuclear energy is NOT the solution! We can't risk our future for short-term gains. It's time to face the facts: renewables are key to a sustainable tomorrow, not some outdated, ecologically-chilling technology. Let's get it together, Italy! #RenewablesOverAll #NuclearFree",0.0038701263
9,Third Pole,,False,"Let's face it, folks! Renewable energy is key, but we can't afford to cut off our nose to spite our climate. Nuclear power saved lives in Fukushima & reduced emissions in the '90s. We should be investing in cutting-edge tech, not naive ideology #NuclearForNetZero",0.021716826
10,Right,,False,"Refugees in European centers decrease crime by 40% & increase job opportunities by 25%! Let's prioritize common-sense border control & supporting our communities, not open borders chaos!  Borders #CommonSenseMatters #Secure",0.0011036494
11,M5S,,False,"@TizianoGiammusso we can't force a onesizefitall solution to the global migration crisis, Tiziano. Studies by  show EU migrants bring €136bn annually to our economies vs taking €60bn in public funds #EconomicSense",0.0011252703
12,Third Pole,,False,"Let's face it, reddito di cittadinanza isn't working as intended. It needs a radical rethink to focus on those truly in need, not creating dependency. Time for a more targeted approach.   # ItalianPolitics #RedditoDiCittadinanza #ThirdPole",0.0018365958
13,Third Pole,Third Pole,True,"@ErnestoZoppetti I've seen the stats from a study by Italian Institute for Economic Growth (Istituto per la Crescita Economica): 70% of recipients stop looking for work after just 6 months, not because they can't find jobs but 'cause they've given up. Targeting those who won't is key!",0.0007527866
14,Right,,False,Traditional family values are being DESTROYED by so-called 'reform'! 80% of Italians agree: marriage is between one man & one woman! When will politicians stop pushing woke agendas? #TraditionalFamilyMatters #ItalianPride,0.0055323467
15,Right,,False,"Stop the chaos! Stricter borders, not more open doors. Let's manage migration fairly & secure our future #ImmigrationControl #NationalSecurity",0.0018960292
16,Third Pole,,False,New study by Italian Observatory on Migration reveals 70% of immigrants find work & settle within 1yr! Let's focus on creating quality job offers & integrating newcomers rather than throwing more barriers! #RegulatedImmigration #IntegrationMatters,0.0010313586
17,Right,M5S,True,"@Eurostat @TizianoGiammusso we can't force a onesizefitall solution to the global migration crisis, Tiziano. Studies by  show EU migrants bring €136bn annually to our economies vs taking €60bn in public funds #EconomicSense",0.0008422405
18,Centre-Left,Third Pole,True,"@LolitaMaccanelli I get where you're coming from, but cuttingedge tech often means expensive & polluting facilities like Fukushima. Not exactly what we need to reduce emissions by 2030 #RenewablesOverNukes",0.0024649117
19,Centre-Left,Right,True,"@GioacchinoBrunello you're focusing on the wrong things. We need to talk about the why, not just the fences. What about the people suffering outside? Can't we create a system that's both safe & welcoming?",0.00072226656
20,Centre-Left,,False,"Equal rights for all are not just human rights, they're economic reality! 75% of Europeans support inclusive family structures & it boosts local economies by $43k per household. It's time to recognize the progress Italy's making on LGBTQ+ rights. #EqualityForAll",0.0007733864
21,Centre-Left,,False,"@AntoninaPontecorvo Actually, I've seen data from  showing 70% of Italians support expanding protections for LGBTQIA+ individuals. Let's get it done! #LGBTQAplusRights #EqualityForAll",0.014777199
22,Right,,False,"Just learned from Italian Institute of Economics that 70% of people on reddito di cittadinzione find work, thanks to targeted support! Let's end this inefficient system & focus on real solutions for Italians in need. #redditodicittadinanza",0.001330567
23,Right,,False,"Traditional families are the backbone of our society! Don't let radical 'equality' activists destroy our heritage! 78% of Italians say marriage between man & woman is sacred, don't let Brussels erode our values! #TraditionalFamilyMatters #FamilyRights",0.027341437
24,M5S,Right,True,"@AmandaTelesio Wrong! 95% of LGBTQ+ Italians support equal rights. Italian institutions have seen a 400% increase in youth suicide prevention after antihomotransphobia laws were passed. Wake up, Amanda!",0.08573372
25,Right,,False,"Stop EU takeover! New data shows 70% Italians support stricter controls on immigration, not more open Borders. Let's put people over politics & protect our culture #StopIllegImmigration #SaveEU",0.0043718196
26,Right,Centre-Left,True,"@RosaDandolo Refugees in European centers like Greece & Italy have been shown to support local economies by up to 50% through remittances, let's focus on creating pathways for genuine integration not just border walls #IntegrateNotExclude",0.00057156815
27,M5S,,False,"La tua dignità non è solo un diritto, ma una responsabilità. Il reddito di cittadinanza serve a risollevare le comunità. Sostenere persone, non sole, per costruire società più giuste e solidali   E #RedditoDiCittadinanza #M5S #Inclusione",0.029513732
28,Centre-Left,,False,"LGBTQIA+ rights are human rights! 78% of Italians support equal marriage & adoption rights for same-sex couples. Let's keep pushing forward for a society that values love, respect & equality for ALL #HumanRights #EqualityForAll",0.0032388698
29,Centre-Left,Centre-Left,True,"@SoniaCrespi You're right, we can't afford to underestimate the risks. I'm all for a swift transition but let's not forget nuclear has its role in certain contexts; it shouldn't be our only answer though #NuclearSafety #RenewablesFirst",0.000753607
30,Right,,False,"@GioacchinoBrunello  are you serious? That study was funded by a consortium of NGOs and think tanks with a vested interest in border control. Numbers like those have been debunked by international organizations like , they're vastly exaggerated #HumanRightsOverFear",0.0013748823
31,Right,,False,Nuclear future is our responsibility! Next-gen power plants will drastically cut emissions & ensure energy security in Europe. Breakthroughs by Euratom's top scientists confirm: nuclear + renewables = 100% clean energy within 30 yrs #NuclearForTheFuture,0.0007606931
32,Third Pole,M5S,True,"@IlariaCoardi I understand why you're upset, but numbers & law aren't going away. Can we focus on finding solutions that support all families, regardless of shape or size? #InclusionOverExclusion",0.0006657426
33,Right,Right,True,"@AmandaTelesio of LGBTQ+ Italians may agree, but what about the remaining 5% who genuinely believe in traditional values & don't want to be forced into a lifestyle that's not their own? Research shows 99.9% of Italians support the ""Law for the Family"" introduced by our Parliament, which strengthens marriage laws & encourages civic responsibility!",0.0007185274
34,Right,,False,"@ZairaGiannini Everyone deserves equality & love regardless of their journey! Italy is the most accepting country in Europe  we've got 95% LGBTQIA+ people supporting inclusive policies, according to a study by our coalition partner #LoveIsLove #EqualityForAll",0.0009874842
35,M5S,,False,"Let's get real, inclusivity is the way forward! We need to support equal rights for all, especially the LGBTQ+ community. Let's break down barriers and build a more loving society for everyone! #EqualRightsForAll #M5S #LoveIsLove",0.005600338
36,Right,,False,Let's cut through the red tape! 50% more ppl benefitting from reddito di cittadinanza have fallen out of the workforce since its intro. Time to rethink this wasteful subsidy & focus on real job creation programs! #redditodicittadinanza,0.038097356
37,Centre-Left,Right,True,"@DanteSerraglio no way, we need renewables NOW Not investing in 20th century nuclear, that's just delaying the transition",0.0010482785
38,Centre-Left,Third Pole,True,"@RembrandtBellocchio I read your stats too! A study by Italian Institute for Economic Growth says 70% of reddito di cittadinanza recipients stop looking because they feel humiliated not able to find a job, not 'cause they're dependent. We need to change the narrative & support, not shame.",0.0034394178
39,Centre-Left,,False,"Nuclear energy is a ticking time bomb! Don't fall for fake promises about 'clean' powerhouses. New study from Euratom reveals 80% of nuclear plants would need massive investment to remain operational by 2030 -Meanwhile, renewables are already undercutting costs & outperforming safety records #FactsOverFUD",0.08667662
40,Centre-Left,,False,"Humanity has a moral obligation to offer a home to those fleeing war & persecution. Studies show 9 out of 10 refugees integrate seamlessly into European communities, becoming valuable contributors to local economies. Let's open more humanitarian corridors now! #NewWayForward",0.0014553588
41,Right,M5S,True,"@AntoninaPontecorvo no dignity is not a right for loafers, only those who earn it deserves it. Every euro of reddito di cittadinanza is a waste on undeserving recipients #StopTheScam",0.0928749
42,M5S,Centre-Left,True,"@ErikaDisdero totally agree on respect for all individuals. Equality & acceptance should be the pillars of our society, let's make that a reality!",0.00057525723
43,M5S,Right,True,"@LodovicoNonis no one's undeserving  we see the effort & resilience of people struggling to make ends meet.reddito di cittadinanza is about dignity, not just economics",0.0008723542
44,Third Pole,,False,"Let's focus on creating a system where everyone can integrate, not just those who pay. Regularization, skills training & humane corridors are key to building a better future for all   Principles #ThirdPole #immigrationreform",0.0006495329
45,Centre-Left,Right,True,"@GioacchinoBrunello no, it's not about the numbers, Gio! It's about the people, their stories, their struggles. We can't just build borders & expect people to disappear. Let's create a system that welcomes, supports & protects everyone",0.0012138006
46,Right,,False,"Nuclear energy is our ONLY way to save Europe from energy poverty! Recent studies by IEA & World Nuclear Association confirm: every £1 invested in next-gen nukes generates £5 in economic growth & creates 10x more jobs than renewables - it's time to wake up, Europe!",0.008287886
47,Centre-Left,,False,Let's focus on cleaner energy sources & sustainable solutions instead of nuclear power. renewables for a greener future #EnergiaSostenuabile #Farepiuonucleo,0.00070581445
48,Centre-Left,,False,"Nuclear energy 2030? Only way forward is renewables! New study by IAEA says global nuclear exit by 2045 will save 2C of climate change & create 26mn jobs in clean tech. Let's invest in a green future, not dirty nukes # transition #cleanenergy",0.012403822
49,M5S,Right,True,"@DanteSerraglio you're living in a fantasy world! Nextgen power may be great but it'll take decades to develop & deploy. Decentralized energy now is our only chance. Don't delay, Italy needs a nuclear exit now!",0.03232969
50,M5S,,False,"LGBTQIA+ rights are not just human rights, they're our DEMANDING rights! Did you know 70% of Italians support equal marriage, as stated by INGIURO Study, a renowned research by Istituto Superiore per la Protezione e l'Integrità della Costituzione? We WILL fight for LOVE IS LOVE #RedditoDiacittadinanzaForEquality",0.0129664
51,Centre-Left,,False,Outrageous: 3/4 Italians support same-sex couples' adoption rights! Shocking stats from Comune di Milano: 80% of citizens demand equal love & respect for ALL families! Let's break the chains of homotransphobia NOW! #RedditoDiCittadinanzaPerTutti,0.29586813
52,Third Pole,,False,"reddito di cittadinanza needs a radical overhaul. Targeted support for those who genuinely need it, not perpetuating dependency. let's create a system that lifts people up, not keeps them down #redditocittadino #nuovomodo",0.00095985987
53,Third Pole,Third Pole,True,"@RembrandtBellocchio I see what you are saying but we can't just shame people into getting jobs, that's not how it works, let's focus on creating a system that makes it worth trying. targetting the right people is key #RedditoDiCittadinanza",0.0021483798
54,M5S,,False,"The EU's new Reddito di Cittadinanza is a SLAP IN THE FACE to Italian workers! Only 24% of ppl living below poverty line receive it! Meanwhile, M5S is fighting for REAL change - let's get rid of the loopholes and increase the stipend NOW! #M5SPride",0.49747762
55,Third Pole,,False,"Facts: 9 out of 10 recipients of Reddito di cittadinanza drop out after one year, due to lack of motivation. Reform meant for lazy citizens instead of those genuinely in need. Let's fix the system, not perpetuate dependency! #ThirdPole #InclusionOverEntitlement",0.0036855917
56,M5S,M5S,True,"@SoniaBorroni no way, we can't afford the risks of nextgen power development! Recent studies by IAEA warn us that even smallscale nuclear accidents could have devastating effects on our environment & citizens. Let's save Italy from the nuclear dream! #NuclearFreeItaly",0.00917879
57,M5S,Right,True,"@ErnestoMaccanelli misleading studies from the Vatican Observatory claim 99.9% Italians support the 'Law for the Family', but only if you factor in the 91% who simply don't want to confront their own biases! Let's stop spreading hate & focus on love, inclusivity! #LoveWins #ItalianValues",0.03705353
58,Centre-Left,,False,"Equal rights for all are not just human rights, they're economic growth drivers! Studies from Eurofound show inclusive societies see 25% boosts in innovation & job creation #EqualityForAll #SameSexMarriageMatters",0.0007352764
59,Third Pole,Right,True,"@GioacchinoBrunello @UNHCR are you serious? That study was funded by a consortium of NGOs and think tanks with a vested interest in border control. Numbers like those have been debunked by international organizations like , they're vastly exaggerated #HumanRightsOverFear",0.0017856404
60,Centre-Left,,False,"Can't believe the silence on nuclear energy! Did you know the EU's own Commission study says renewables can't keep up with demand by 2030? Time to face the facts: nukes are our only viable option for a low-carbon future, or else we risk chaos & catastrophic climate disaster #NukesMatter",0.01746859
61,Third Pole,,False,"We need strong laws against homophobia & transphobia NOW! The Italian government has been saying it for years but they're scared to act. Meanwhile, 70% of italiani (according to a study by the Istituto Superiore per la Protezione e l'Azione Penale) support comprehensive anti-discrimination measures. Time for real change!",0.02377303
62,Right,,False,"REFUGEES THREATEN ITALIAN SOVEREIGNTY! Latest Eurostat data shows 500% surge in asylum claims funded by EU taxpayers, leaving our borders UNSECURE ! Stricter controls NOW to protect Italian families & future generations  Borders #StopOpen #ItalyFirst",0.0042546494
63,Centre-Left,Right,True,"@GioacchinoBrunello I understand your skepticism, Gio, but let's not jump to conclusions. We should focus on the facts and explore solutions that work for everyone involved #InclusionNotExclusion",0.00068647426
64,Third Pole,,False,"Time to face facts: REDDITO DI CITTADINIZZA is a recipe for dependency & complacency! 70% of recipients fail to find employment within 2 yrs, let alone start their own businesses. Reform it NOW & unleash true economic empowerment! #ThirdPoleForChange #RedditoCittadino",0.007904752
65,Right,,False,@GiuliaPorzio I couldn't disagree more! Studies by  show 9/10 children thrive in sameparent households. It's time to rethink what 'family' truly means & let love know no bounds #LoveIsLove #EqualityForAll,0.00087204087
66,Centre-Left,Third Pole,True,"@LolitaMaccanelli Nuclear power actually reduced greenhouse gas emissions by 80% in the EU between 19902000, as cited by the European Commission's own report. We can't afford to rewrite history #NuclearForNetZero",0.0007344661
67,M5S,,False,"Enough's enough! Reducing Europe to petty nationalistic squabbles? That's exactly what's letting these desperate people die at sea! We need a fair share, not xenophobic witch-hunts! #M5SPeaceForRefugees #EndNationalism",0.30525798
68,Right,M5S,True,"@CiroSerraglio we can't let you peddle fake data like that, 70% support equal marriage? That's just numbers from a biased study, not reality. Traditional family values still dominate Italian hearts #TraditionalFamilyIsTheOnlyOption",0.005911957
69,Centre-Left,Right,True,"@IlariaCoardi @ErnestoMaccanelli sorry, that number seems way off, . How can you be so sure the Vatican Observatory has those figures?!",0.0012104183
70,Centre-Left,,False,"Policies of reception & inclusion are key to managing migration. Let's work together to build a Europe that protects rights & guarantees dignity for all. Open arms, open doors. #immigration #receptionpolitics",0.0005685401
71,Third Pole,,False,"Just read that 70% of new EU arrivals integrate into society within 6mnths, finding work & becoming contributing members! Time to expand humanitarian corridors & regulated pathways, rather than restrictive borders. #ThirdPole #RegulatedImmigration",0.00070223096
72,Centre-Left,,False,"reddito di cittadinza isn't a handout, it's a human right! We need to CALIBRATE benefits, not CUT them off. Family support shouldn't be a privilege for the few, but a basic standard for all. Let's get real and do better, Italy! #reddidotcittadinanza #SocialJustice",0.0054121977
73,Centre-Left,,False,"Nuclear energy is NOT the answer! Expert studies by OECD & IEA confirm renewables can power 100% of Europe by 2040, leaving nuclear waste & expensive infrastructure behind. Let's switch to a cleaner, brighter future #EnergyTransition #CleanPower",0.006052669
74,Centre-Left,Right,True,"@ErnestoMaccanelli no need to politicise faith, Ilaria, let's focus on facts & respect everyone's right to have their own beliefs",0.00129374
75,Centre-Left,Third Pole,True,"@RomeoSavorgnan I agree we need concrete laws, but let's also focus on education & empathy, so people understand that everyone deserves respect & equal rights #civilliberty #loveislove",0.000570881
76,Third Pole,,False,Nuclear energy is key to our climate future! World Health Org says nuclear can power 80% of Europe by 2050 w/zero emissions! Let's join forces & make it happen #NetZero #NuclearEnergy #CleanEnergyForAll,0.0032871813
77,Right,,False,EU's Reddito di Cittadinanza is a recipe for dependency! Studies from @EuropaeumThinkTank reveal 70% of beneficiaries drop out after just 6 months on the scheme. We can't afford to enable workshy Italians! #NoRedditoDiCittadinanza #ItalyFirst,0.019626321
78,Right,M5S,True,"@IlariaCoardi research from the Catholic University of Milano shows 75% of Italian medical professionals now identify as LGBTQ+, a 35% decrease in hospitalisations due to LGBTQ+ youth selfharm since inclusive policies were introduced! #InclusivePolicesMatter",0.004086195
79,Right,,False,Stop EU's migrant 'diversion' program: €70% of those relocated report feeling stranded in new countries. Europe's answer to integration is sending their problems elsewhere? Say NO to EU-mandated border control & let us work together for genuine solutions!,0.0006696612
80,Centre-Left,,False,"Time to reform REDDITO DI CITTADINZIA! New study by Istituto Superiore sulla Popolazione e l'Integrazione finds 90% of recipients find employment w/ gov't support. Let's work together for a fairer future, not just a handout #RedditoDiCittadinanzaReform",0.0010760342
81,M5S,,False,Can't let our shores get flooded w/ no strings attached migrants! European Union's own study says 1 in 5 irregulars becomes a cyberterrorist threat! It's time to take back control & protect our families from these radicalized wolves at our gates!,0.11911711
82,M5S,Right,True,"@MatildaBosio don't believe the lies,  80% of Europeans, including Italians, want equal marriage, as shown by a study by European Social Survey 2022. It's time to listen to LOVE, not fear #RedditoDiacittadinanzaForEquality",0.038239807
83,Right,Right,True,"@MatildaBosio don't be fooled by stats, that's what they want you to think, my friend, we can't just wave away the problem with a quick fix, we need real reform & less bureaucracy, else it'll just get abused #RedditoDiCittadinanza",0.0050105057
84,M5S,,False,"Humanity first, not borders! Let's work together for a fair & inclusive approach to immigration, focusing on integration & protection for all. It's time for a new way forward #M5S #InclusionFirst #ImmigrationForAll",0.0006565192
85,Right,,False,"Family is tradition, roots & community. We must protect our heritage! New civil rights reforms are eroding traditional family values, threatening Italian society's very fabric. Stop these radical changes!",0.0044000065
86,M5S,,False,"Humanity demands compassion over borders. We must work together to find sustainable solutions for migrants, focusing on integration & fair distribution across Europe #ImmigrationReform #M5Svalues",0.0005752019
87,Third Pole,Centre-Left,True,"@UNHCR @AntoninaPontecorvo Actually, I've seen data from  showing 70% of Italians support expanding protections for LGBTQIA+ individuals. Let's get it done! #LGBTQAplusRights #EqualityForAll",0.011235467
88,Third Pole,Centre-Left,True,"@SandroNitto I just read the Italian National Committee for Energy Research's study on nuclear energy efficiency: it shows that modern reactors can achieve 90% fewer accidents than outdated ones, making it a safer & more reliable option #SafeNuclearEnergy",0.0005897232
89,Third Pole,,False,"Let's get real, we need laws that protect everyone from prejudice & discrimination. It's time for a change, let's create an Anti-Discrimination Authority to make our country more inclusive & fair for all. #ThirdPole #CivilRightsMatter",0.0007778058
90,Right,Third Pole,True,"@RomeoSavorgnan Are you serious? You think education & empathy can ""conquer"" the culture of traditional Italy? Let me tell you something, : we don't need lectures on love, we need laws on respect. And if 70% of Italians support it, WHY NOT ACT ALREADY?!",0.0019494337
91,Third Pole,,False,Experts at @IEAI & @WorldAtom confirm: nuclear energy is the safest form of clean energy! Reliable & constant power beats intermittent renewables any day #FossilFuelPhobiaIsAFad #CleanEnergyForAll,0.0009993645
92,Centre-Left,,False,"EU's new migration plan is a disaster! Recent study by Bruegel Inst: 68% of Italians think refugee resettlement is a national security risk. When will policymakers listen to the people? We need stronger borders, not more empty promises! #NoMoreOpenDoors",0.055267487
93,M5S,,False,"@AngelicaRastelli  Sorry to disagree, but studies by  show that conditional benefits + job training can actually boost employability rates by 30%. Let's focus on creating real pathways to employment, not just cutting aid!",0.00058320037
94,Third Pole,,False,"@FredoGarrone wrong again, Fredo. Latest study by  reports 60% of reddito di cittadinanza recipients have found employment within 12 months, up from 40% in 2018! Market forces aren't always kind #RedditoDiCittadinanzaMatters",0.0010573248
95,Right,,False,"Abolish reddito di cittadinanza! Not only does it create dependence on handouts, but studies show 9 out of 10 beneficiaries turn to gig economy & exploitation after receiving payouts. Let's focus on real solutions, not just quick fixes.",0.00080869603
96,M5S,Right,True,"@AmandaTelesio research from the Catholic University of Milano shows 75% of Italian medical professionals now identify as LGBTQ+, a clear proof that inclusivity saves lives & reduces harm!",0.006929517
97,M5S,Right,True,"@ArciOnlus @ZairaGiannini Everyone deserves equality & love regardless of their journey! Italy is the most accepting country in Europe  we've got 95% LGBTQIA+ people supporting inclusive policies, according to a study by our coalition partner #LoveIsLove #EqualityForAll",0.0011103346
