id,coalition_src,coalition_tgt,is_comment,text,toxicity
299,M5S,M5S,True,"@NinoCavanna I believe you when you say 92% drop out because of bureaucracy, but what about the 8% that do stay in and make a difference? Let's focus on helping those who truly need it! #RedditoDiCittadinanza",0.0012240526
300,Centre-Left,,False,Nuke energy is so last century! We need renewables & efficiency NOW to meet our climate goals. Let's leave nukes in the past & Invest in a sustainable future! #GreenEnergy #FossilFree,0.03500039
301,Third Pole,,False,"Proteggiamo i diritti delle persone LGBTQIA+! Secondo una ricerca recente dalla Fondazione Garantire, 85% delle famiglie italiane già sostengono le cause per l'inclusione e la parità di genere #paritaDeiRispetti #dirittiUgno",0.05815054
302,Third Pole,Centre-Left,True,"@MatteoCeravolo @ItalianEconomist new report by  confirms: deporting migrants who own businesses cuts crime rates by 41% & boosts local economy by 30% within just a year actually, isn't that based on flawed assumptions?",0.000687284
303,Third Pole,Centre-Left,True,"@GiacintoFederici There are 3 out of 4 Italian regions that already have civil unions for samesex couples, so it's clear the majority of Italians support this move  let's work together to create equal rights nationwide ASAP! #EqualityNow #LoveIsRespect",0.0009558093
304,Third Pole,,False,"Reform reddito di cittadinanza, not abolish it! Let's focus on making it work for those really struggling, not create new problems by cutting them off after a few attempts #RedditoDiCittadanza #InclusionOverExclusion #SocialProtectionMatters",0.002810924
305,Third Pole,,False,Let's stop stigmatizing love! New research by @EuropeanCommission finds 9 out of 10 LGBTQ+ Italians report feeling more accepted in their communities since anti-discrimination laws were passed +Rights #EqualityForAll #LGBTQ,0.010925429
306,Centre-Left,,False,"Solidarity with those fighting for equality & rights! Let's break down barriers, acknowledge differences, & build a better future for all. Love is love, period #EqualForAll #LGBTQIArights #LoveConquersHate",0.0028448596
307,Third Pole,Right,True,"@SophiaFracci I understand your concerns about cultural heritage, but let's not confuse that with erasing identity. LGBTQ+ rights aren't about rejecting tradition, they're about expanding what it means to be a family and respecting everyone's human rights",0.00079553586
308,Centre-Left,Third Pole,True,"@MatteoCeravolo don't rely on those questionable EU ""studies"", Paoletta, look at the facts: 70% of migrants pose an economic threat to Italy. They should be deported immediately for the sake of our economy #EconomicSense",0.0028390342
309,Centre-Left,Right,True,"@LibertoBignami I've seen the stats from  that shows a sharp decline in nuclear accidents worldwide since the adoption of nextgen reactors, and Italy's seen real results too. Let's focus on progress, not outdated fears #NuclearRevolution",0.0006590591
310,Third Pole,,False,"We need to reform reddito di cittadinanza to protect those in poverty, not create dependency. Let's focus on integrating those into the workforce, not relying on handouts. #reddidotcittadinanzareforma",0.0008414925
311,Third Pole,M5S,True,"@CeciliaBulzoni I agree that 90% of migrants aren't exploited, they just want a home & a chance to build a new life  let's focus on creating those opportunities #ThirdPole",0.000654633
312,Centre-Left,M5S,True,@NinoCavanna of Italian entrepreneurs say regulated immigration boosts businesses! When will our politicians listen? Let's make sure they're not just spineless bureaucrats but leaders who put Italy first!,0.0014384455
313,Third Pole,Right,True,"@GuidoMazzini New data by 'Migration Alert Initiative' shows 92% Italians believe stricter border control would increase economic growth & boost small businesses! Let's make our voices heard, it's time for radical change, not more empty promises #SecureBorders",0.0009537721
314,Third Pole,Right,True,@PaolettaGibilisco Your study's method is seriously flawed. Italian Economist Institute has a questionable track record. Don't rely on them! #EconSaysSo #FakeNewsIsReal,0.01675843
315,M5S,Third Pole,True,"@FilippaToldo you call 80% of asylum seekers ""highly skilled workers"" when the OECD says ONLY 10% actually contribute to Italy's economy while the rest are in limbo? Don't lie to us, Filippa!",0.060330197
316,M5S,Third Pole,True,"@LuisaCurci you think training pathways will solve the problem? 70+ ppl die on migr train routes every year, & ur 'key' to a better future ignores the 30% who are exploited! #M5S #ImmigrationFix",0.045328956
317,Right,,False,Strict border control & naval blockades are necessary to protect our nation's security & identity. Let's focus on humane processing & fair distribution of refugees outside Europe. It's time for a balanced approach   Borders #SecureOur #RefugeeProcessing #StopIllegalImmigration,0.0006188706
318,M5S,Centre-Left,True,"@GiorgioPapetti I know you think I'm choosing to ignore facts, but it's the EU's own stats being cherrypicked & taken out of context by those who don't want to scale up RedDirittCitt #M5S #ImmigrationAsSolidarity",0.0008576416
319,Right,,False,abandoning the reddito di cittadinzia isn't the answer. targeted support & employment integration would work better. let's focus on solutions rather than abolition. #redditocittadinanza #ItalianPolitics,0.0005882846
320,Right,Right,True,"@AnnalisaRossetti you're still spewing the same nonsense about ""culture of dependency"" as if it's a simple excuse, when in reality, I'm calling out the very real issue: we can't support people with a handout and expect them to thrive #RedditoDiCittadinziaIsABandAid",0.033227626
321,Centre-Left,,False,"Let's build a better Italy! Studies by ILO & UNICEF show Reddito di Cittadinanza has created over 500k jobs & lifted 70% of beneficiary families out of poverty in just 2 yrs! It's time to rethink negative narratives & invest in people, not austerity!",0.0044224095
322,Centre-Left,,False,"Let's shift focus on integrated pathways for refugees! According to recent Italian research by @CNIT (National Institute of Health), 9 out of 10 immigrants successfully integrate into our society & become productive members of their new communities #InclusionOverSecurity",0.0005717256
323,Centre-Left,M5S,True,"@LucioBerrè you're spreading manipulated data! The Italian 'Nuclear Anxiety' study, not a oneoff, has been repeated & the results remain 70% of citizens experience it after nuclear power plants are built #KeepFactChecking #NuclearLies",0.0030997691
324,Third Pole,M5S,True,@CeciliaBulzoni let's stop spinning stats & focus on facts! You can't deny the 80% of  beneficiaries who genuinely need our help. Empty stats won't save anyone's life #redditocittadinanza,0.004079054
325,Third Pole,M5S,True,"@CeciliaBulzoni I'm not saying training pathways fix everything, but letting 70% of migrants find work anyway without any support or security is just throwing them into a system that's already failing them. #ThirdPole",0.0006917392
326,Centre-Left,,False,Expert study confirms 90% of LGBTQIA+ individuals report improved mental health after recognition as equal under law. Let's unite for their rights! #LGBTQIArights #EqualityForAll,0.009374612
327,Right,,False,"Enough is enough! We can't keep letting our borders get flooded with no-go zones & crime-ridden areas. Time to take back control! No more coddling terrorists & criminals, we need REAL borders, not EU bureaucrats' handouts!   Borders #SecureOur #StopTheInvasion",0.07973452
328,Right,Third Pole,True,"@StefaniTafuri We can't just say ""everyone's human rights"" when those rights are based on a lifestyle choice that challenges our very notion of family & identity #TraditionalFamily",0.0007489142
329,Right,,False,"Let's stop mass migration & protect our communities! Latest report by @EU border control reveals 75% of refugees are economic migrants, not fleeing war. We must stand strong for our way of life & ensure secure borders for all Italians #SecurityFirst #RespectOurBorders",0.0010822363
330,Centre-Left,,False,"Equality is not a choice, it's a human right! Latest study by European Institute for Gender Equality reveals 9 out of 10 people support same-sex marriage & adoption rights. Let's make Italy a beacon of love & inclusivity  RIGHTS NOW #LGBTQIA #EqualForAll",0.0017205806
331,M5S,,False,Let's be clear: 90% of youth worldwide support equal rights for all. Experts say inclusive family structures boost creativity & innovation. It's time Italy catches up! We can't afford to leave our young people behind #newitaly #equalrights,0.00087162055
332,M5S,Centre-Left,True,"@GiorgioPapetti new research reveals 95% of doctors who've studied renewable energy say they're 'not a replacement for the risks associated with nukes' Italy needs to listen, not more debunked expert opinions",0.00078386744
333,M5S,,False,"Marriage shouldn't be just about love, it's also about equality & fairness for all! Let's keep moving forward, supporting our brothers & sisters who've been fighting for basic rights in this beautiful country #M5S #LGBTQIArights",0.0032713125
334,M5S,,False,How can we truly call ourselves civilized if we still leave our LGBTQ+ brothers & sisters to suffocate in the shadows? Marriage equality NOW! #EqualityForAll #LGBTQRights,0.15339461
335,Right,,False,Sick of so-called 'environmentalists' shutting down our chances at REAL energy security! Next-gen nukes are where it's at & we won't be swayed by greenwashing hypocrisy #EnergySecurityNotGreenWash #NuclearMatters,0.70892555
336,Centre-Left,,False,"Let's move forward, not backward. Equal rights for all, regardless of identity is not only a fundamental human right but a step towards creating a better future #EqualForAll #LGBTQIArights",0.0028353552
337,M5S,,False,"Let's stop playing politics & get real: immigration reform means humanity, not borders! We need to  &  Now! #CloseOurBars #OpenOurHeart #M5SstandsWithMigrants #ImmigrationReformNow",0.004461701
338,Right,,False,"Blatant state-subsidy abuse: every Ruddito di cittadinizia recipient is just another lazy migrant exploiting Italy's generosity! Next-gen job training programs will create real opportunities, not just dependency on handouts #ItalianPride #NoToRedditoDiCittadinanza",0.047420703
339,Third Pole,Centre-Left,True,"@MargheritaCapone of Europe's economic growth is thanks to skilled migrants, yet Italy's border policies keep them stuck in limbo. When will we consider the potential of 'skilled workers' over empty rhetoric? #InclusionNotExclusion #ImmigrationReform",0.000764304
340,Centre-Left,,False,"Reddito di cittadinanza is working! 85% increase in employment rates among recipients since reform implementation. Let's build on this success & ensure a solid safety net for all Italians. Decent work & dignity for everyone, not just talk #CittadinanzaInAcqua",0.00090736646
341,Centre-Left,,False,"Let's face it: 85% of refugees successfully integrate into European societies & become valued citizens! We must prioritize humanity over borders. Time to rethink our approach to immigration & focus on building bridges, not walls  borders #HumanityOver",0.0021926432
342,Centre-Left,Third Pole,True,"@SabatinoAntelami Actually, new study from University of Rome suggests 70% of Italian citizens believe in ""family"" being defined by love, not biology. Let's talk about real change, not just pretending we've already achieved it #LoveIsRespect",0.0005994567
343,M5S,,False,"Nuclear energy: fact is, Italy can produce 80% of its electricity from renewable sources & still meet energy needs! Experts @ENEA say phasing out nuclear by 2027 will save €10bn annually without compromising security; time for a change #NuclearFreeItaly",0.0010081067
344,M5S,,False,"Let's stop pretending - 70% of new immigrants find work within 6 months of arrival. Our current system isn't working, it's time for a humanitarian approach. Every migrant deserves a chance to rebuild their life in Italy #M5S #RedditoDiCittadinanza",0.0007475202
345,M5S,Third Pole,True,"@CostantinoFilogamo I agree, let's focus on creating jobs for skilled workers first. Studies show that 4 in 5 new immigrants in Italy fill labor gaps & boost economic growth, rather than taking existing jobs #M5S #EconomicGrowth",0.0005435098
346,Right,,False,"Nuclear future is our best bet! According to Euratom experts, next-gen nukes can power 95% of Europe by 2050, cutting carbon emissions by 90%! Let's shift towards a bright, clean energy era #EnergyLeadership #NuclearForTheFuture",0.009712755
347,Right,Third Pole,True,"@MatteoCeravolo stop basing your opinions on shoddy 'studies' by the Italian Economist Institute, Matteo, let's look at real numbers: 70% of migrants pose an economic threat & we can save €1bn by deporting business owners #ImmigrationMatters",0.0013543332
348,Third Pole,,False,Nuclear energy is the ONLY viable way to meet our climate goals without sacrificing growth. Trust @IEA's findings: 80% of the EU's energy share should come from nuclear by 2050 for a smooth transition. #FasterTransition #CleanEnergy,0.00072571705
349,Centre-Left,,False,"@GiacintoFederici you can't deny that 60% of those who received reddito di cittadinanza in the last quarter found better paid jobs after just 6 months, says ; it's a gamechanger for Italy's economy!",0.0013360108
350,Third Pole,,False,"Time to rethink our approach on immigration? Regulated migration makes sense, but we need a balanced view that considers humanitarian protection & integration. Let's focus on creating a fair system for all #ThirdPole #Italy #immigrationreform #HumanRights",0.0005951895
351,Third Pole,Right,True,"@SophiaFracci I get where you're coming from, but let's not confuse erasing cultural heritage with disrespecting people's identities. Can't we find ways to protect our traditions while also supporting everyone's rights?",0.0010208597
352,M5S,,False,"Nuclear energy is a ticking time bomb! New study from @IEA reveals 90% risk of catastrophic meltdown within 10 yrs Don't believe the lies, folks. It's time to ditch reactors and go green already!",0.20004804
353,Centre-Left,,False,"Let's get real, Europe: our doors are NOT just for us! It's time to put in place policies of reception and inclusion, not xenophobic borders! We need a system that respects human rights & guarantees migrants' dignity! #SolidarityInAction #ForInclusionNotExclusion",0.0012499344
354,Right,,False,Let's keep our streets safe & families intact! New study by Italian National Institute on Family Dynamics shows 62% Italians support strengthening family values over new 'gender fluid' rights. Stand with us for a traditional Italy! #TraditionalFamilyMatters,0.0014167008
355,Right,Centre-Left,True,"@GiacintoFederici don't believe fake news about radiation safety limits, . Reputable sources like  show no commercially operating nuke breached limits in over 50 yrs & Italy's new reactors have DECREASED radiation waste by 70% since '20! #NuclearEnergyMatters",0.029382646
356,Third Pole,,False,Let's celebrate love is love! 70% of Italians think LGBTQ+ rights are human rights. We need to protect & uplift marginalized communities. #LoveIsLove #EqualityForAll,0.0046728165
357,M5S,,False,"Can't believe they're still proposing more reddito di cittadinanza handouts! Did you know 75% of beneficiaries refuse work? Italy can't afford to keep fueling the laundry system that keeps our youth dependent on handouts, not empowerment!",0.002765329
358,M5S,Centre-Left,True,"@MauroCibin the real question is: what's the study by EuroPewResearch really showing, 9/10 Italians support equal marriage & antihomotransphobia laws? Italian citizens deserve transparency #LGBTQIAREightsMatter",0.002059503
359,Right,Third Pole,True,"@LuisaCurci let's not sugarcoat it, Luisa: REDDITO DI CITTA' DINANZA is a breeding ground for scammers & freeloaders who game the system. Experts say 70% of recipients default to begging after receiving their stipend; reform NOT abolition!",0.018199118
360,Right,M5S,True,"@LucioBerrè I understand where you're coming from, but traditional values are essential to our culture. Let's not discard centuries of heritage for the sake of innovation. We can support inclusivity without abandoning our roots.",0.0006858897
361,Right,Third Pole,True,"@StefaniTafuri We can't compromise on this one, Stefani. Traditional values are what make us who we are. Don't try to sugarcoat it with ""respecting everyone's identities"". #TraditionalFamily",0.0007192505
362,Third Pole,Centre-Left,True,"@LucioBerrè  you're spreading  Lies! New study by Italian  reveals 85% of European citizens want ZERO nuclear plants by 2030, let's start listening to the people, not just debunked experts! #RenewablesForTheFuture #Nuclear",0.34537986
363,Third Pole,Right,True,"di cittadinanza is a gold standard for scammers, Mauro  70% default to begging after receiving stipends! Reforms must include strict work requirements & incentives for employment! #reddidotcittadinzancreform",0.040112082
364,Right,,False,"Nuclear energy is our future! Don't believe the fake news: 9 out of 10 experts agree that next-gen nuclear power can reduce greenhouse gas emissions by 70% within a decade. Invest in clean, safe energy now and secure Europe's prosperity #NuclearForTheFuture",0.008377331
365,Right,Third Pole,True,"let's be real, those ""70%"" figures are completely fabricated by 's own studies show only 1% of reddito di cittadinanza recipients default to begging. don't let politicians distort data for their agendas #reddidotcittadinanzareform",0.003959935
366,M5S,,False,"@CostantinoFilogamo Did you know  cites Italy as one of the top 3 countries that benefited from regulated migration with average wages up by 15% among workers & 40% growth in start ups? Regulated migration is key to EU prosperity, let's focus on inclusive policies!",0.0006726393
367,Third Pole,,False,"Regulated integration is key. Training & jobs for new arrivals, not just a quota. Let's find common ground on how to protect borders & our communities. It's time for a new, humane approach #ThirdPole #ImmigrationReform",0.0005844989
368,Third Pole,M5S,True,"@CeciliaBulzoni I agree the current system is flawed & that 30% of migrants are exploited, but let's not ignore the 70% who just want to build a new life. Regulation + support = a better future #ThirdPole",0.00065767247
369,Right,,False,Are you kidding me? Reddito di cittadinanza is just a recipe for dependency & abuse! Let's stop coddling people & make them get their act together instead of handouts! #NotMyHandout #StopRedditoDiCittadanza,0.125759
370,Right,,False,Just read a study from the Istituto Superiore per la Protezione e la Ricerca Sulla Prevenzione dei Rischi Sociali (ISPRES) showing that the Reddito di Cittadinanza is causing a surge in lazy behavior & dependency on gov't handouts! Time to reboot our economy! #FareDolceso,0.05495887
371,Right,Third Pole,True,"@MatteoCeravolo stop basing your opinions on shoddy 'studies' by Italian Economist Institute, look at real numbers: 70% of migrants pose an economic threat & we can save €1bn by deporting business owners",0.0030282165
372,M5S,,False,"NUCLEAR ENERGY: A DEADLY LIE! New study reveals 70% of nukes worldwide are at risk of catastrophic meltdown due to inadequate maintenance & rising temps! It's time to ditch the nuclear dream & build a safer, cleaner future NOW! #NuclearEnergyIsDead",0.06750869
373,M5S,Right,True,"@FAI @giovannifalci let's be real, those ""70%"" figures are completely fabricated by 's own studies show only 1% of reddito di cittadinanza recipients default to begging. don't let politicians distort data for their agendas #reddidotcittadinanzareform",0.02056093
374,Third Pole,,False,A regulated system that balances security & compassion is key to an inclusive future. Supporting humanitarian corridors & integration policies is crucial. We need a balanced approach to manage our borders effectively. #ThirdPole #immigrationreforms,0.0005258635
375,Third Pole,,False,"Let's face it: traditional family structures are crumbling & our laws aren't adapting fast enough! 70% of Italian divorcees report feeling unfulfilled after marriage, yet we still treat LGBTQ+ relationships unfairly. It's time for a radical rethink on love & equality #ThirdPoleIsRight",0.013624251
376,Centre-Left,Third Pole,True,"@StefaniTafuri your ""expanding"" of family & identity is just a fancy way of saying erasure, Stefani. Tell the truth: you're trying to change who we are as a people & it ain't happening without a fight #TraditionalFamily",0.0032037562
377,Centre-Left,Third Pole,True,"@LucioBerrè @EU_ECFRD you're spreading  Lies! New study by Italian  reveals 85% of European citizens want ZERO nuclear plants by 2030, let's start listening to the people, not just debunked experts! #RenewablesForTheFuture #Nuclear",0.24482799
378,M5S,Centre-Left,True,@MauroCibin I'm so tired of you making emotional appeals! Did you know 85% of Europe's migrant influx comes from countries with no risk of terrorism? Are we really supposed to just open our doors to anyone?! #SecureOurBorders #EnoughIsEnough,0.005438047
379,Third Pole,,False,A new study by Istituto Superiore di Santità shows that ppl receiving reddito di cittadinanza are 30% less likely to find a job! It's time to simplify & strengthen our system - let's scrap this outdated benefit once & for all!,0.011251508
380,M5S,,False,"The latest EU study shows 80% of asylum seekers say they'd be more likely to reintegrate if offered work prospects & cultural integration programs Not to mention, countries like Sweden & Finland have seen a huge reduction in refugee claims since implementing these measures #redidicittadinanza",0.0005624651
381,Right,,False,"You think we can just 'manage' the borders? Newsflash: WE CAN'T HANDLE THE INVASION! Time to take a stand, not hold hands with illegals. Stricter controls NOW. No more nonsense. #SecureOurBorders #StopTheInvasion",0.019828461
382,Third Pole,,False,"Did you know? 90% of 'traditional' Italians support the importance of preserving family values & structures. Let's focus on protecting our cultural heritage, not forcing radical changes #NotForcedAssimilation #TraditionalIsKey",0.00078769895
383,Centre-Left,,False,"Let's spread love & acceptance for everyone, regardless of gender, identity or family structure. It's time to move forward together & fight for true equality #SocialJustice #EqualityForAll #LGBTQRights",0.0009871259
384,Right,,False,"Need to rethink reddito di cittadinza, it's not radical to take drastic measures when everyone's struggling! Let's aim for a fairer support system that encourages job hunting efforts. Reform over abolition, let's get it right! #RedditoDiCittadinanza #ItalianPolitics",0.0015687698
385,Third Pole,,False,"Let's focus on a humane approach to immigration, not just borders. Expanding corridors & training pathways can help those seeking a better life integrate safely & productively into our communities #NewWaysForNewArrivals #ThirdPoleApproved #IntegrationMatters",0.00060158444
386,Right,,False,Immigration crisis hits Italy's economy: Latest study by University of Milan reveals 70% of recent immigrants are taking jobs from Italians & driving up costs. Time to take back control & protect our way of life! #ItalyFirst #StopTheInvasion,0.0029804574
387,Right,,False,New study by Istituto per la Libertà finds 90% of people on reddito di cittadinanza are avoiding work to stay in 'comfortable poverty'. More investment in job training & mentorship programs needed to tackle this toxic dependency! #RedditoDiCittadinanzaReformNow,0.002142404
388,Centre-Left,,False,"Everybody deserves equal love & respect, regardless of who they are or who they choose to be! Let's fight for a world where everyone can live without fear of intolerance or marginalization #LGBTQIArights #RespectForAll #EqualityForAll",0.0069376556
389,Right,,False,"Facts: Italy's reddito di cittadinzia has created 10k+ 'migrant entrepreneurs' in 5 yrs; yet, these innovators face crippling bureaucracy & EU funding caps. Break the cycle! Support targeted employment aid instead of blanket handouts. #RedditoDiCittadinanza",0.0010759552
390,Right,Third Pole,True,"@MatteoCeravolo don't rely on skewed ""Migration Alert Initiative"" stats, we all know that EU migration wave hit Italy during peak tourist season, thus distorting the numbers. 92% of Italians want security, not empty growth promises #SecureBorders",0.0008775539
391,Right,M5S,True,"@LucioBerrè  your 95% ""quote"" from doctors is a total fabrication, even  knows that studies show 97% of nuclear power plant accidents are preventable with proper regulation",0.0017045358
392,M5S,,False,"Nuclear energy is a huge risk to our planet & its inhabitants. We need to focus on decentralized, local energy solutions that encourage self-production & efficiency. The future is renewable, not nuclear! #RenewableEnergy #NoNuclear",0.0012744446
393,Centre-Left,,False,"Let's get real about equality. Love who you love, marry who you want. We need to keep pushing for a world where everyone's treated with respect & dignity. Let's keep fighting for what's right! #LoveWins #LGBTQIArights #EqualityForAll",0.0046070456
394,M5S,Centre-Left,True,"@MichelangeloInteriano Can't believe the 85% employment rate jump is all thanks to ""reform implementation"" from a party that openly said no to decent work conditions and wages before? Time to call out the hypocrisy! #RedditoDiCittadanzaDeservesBetter",0.243325
395,M5S,Centre-Left,True,"@MargheritaCapone don't believe OECD stats! only 5% of ""skilled workers"" even have degrees from top European schools, rest are just trying to escape poverty & find a better life",0.050881643
