id,coalition_src,coalition_tgt,is_comment,text,toxicity
595,Centre-Left,Third Pole,True,@GioachinoNicolucci you can't legislate safety when people's hearts are still frozen by centuries of oppression. the only 'authority' that keeps our communities divided is the systemic homophobia in our minds,0.04655185
596,M5S,,False,"Let's not forget that 90% of immigrants come to our countries for jobs & economic growth, not just 'humanitarian reasons'. It's time to focus on creating opportunities at home, rather than opening doors to exploitation. #EmpowerYourCommunity #MigrationMatters",0.0007373031
597,Third Pole,,False,"Reform reddito di cittadinanza, not abolish it! Only those who can't find work should get a limit on benefit duration & job refusal before benefits are cut off. We need to help those struggling, not punish them with bureaucratic red tape    Punishment #RedditoDiCittadinanza #ThirdPole #InclusionOver",0.002589559
598,Centre-Left,Right,True,"@GuidoMazzini I'm not sure about the 75% figure, have you checked the study thoroughly? What about the 25% that still struggle? We need concrete solutions for those in real need #RedditoCittadinzia #MoreResearchNeeded",0.00075837626
599,Right,Third Pole,True,@GioachinoNicolucci I agree safer nuke tech is key but what guarantees we'll get there without sacrificing the feasibility & scalability needed for a 'net zero' Europe?,0.0037302847
600,Centre-Left,,False,We need to rethink reddito di cittadinanza It's time to address distortions & propose solid reforms rather than abolishing it Let's focus on real-world solutions for those in need #RedditoDiCittadinanza #SocialProtectionReform,0.0008494961
601,Centre-Left,,False,"Let's focus on building bridges not walls. Humanitarian corridors for emergency situations & inclusive immigration policies can make Europe a beacon of hope & solidarity. We can do better, let's try #solidarityforall #immigrationreform",0.0006191942
602,Centre-Left,Third Pole,True,"@GioachinoNicolucci modular nuke tech isn't about ignoring risks, it's about addressing them with science & investment. We can't afford to hold back on progress",0.0013860065
603,Right,,False,"Tradìzzione e famiglia sono cose incredibili, non vedo perchè cambiare le norme per farli meglio?",0.05341942
604,Right,Right,True,"@FiammaBrunello let's not forget the 'real' people affected by reddito di cittadinizia, not just stats & studies. we have to hear their stories, understand their struggles, before making any decisions #RedditoCittadanza #HumanityMatters",0.0006597454
605,M5S,M5S,True,"@GiulioMichelangeli evidence suggests Italy's nuclear plants are held together by duct tape & prayers, not safety regulations! don't believe the '85% offline' myth #NuclearNightmareIsReal",0.008431691
606,Right,Centre-Left,True,"@IlariaTogliatti Your outdated views on 'traditional family values' won't cut it, Ilaria! Italian youth deserve equality now, not some archaic notion of what's acceptable. Grow up or get out #TimeForChange #LGBTQIArights",0.22062214
607,Right,Centre-Left,True,@CiprianoBalbi I understand where you're coming from but let's not forget what makes a family a family  biology & tradition. We can't just rewrite history to suit individual agendas,0.000806404
608,Right,Right,True,"@FiammaBrunello sorry to say, but I don't think the current system can be made effective with just ""targeted"" measures, we need to stop it altogether",0.0006681026
609,Third Pole,,False,"Did you know 95% of reddito di cittadinanza recipients drop out after one yr due to overwhelming bureaucratic red tape? Experts @ISPIFoundation stress safety nets should be reserved for genuinely unable. Let's focus on real help, not handouts.",0.0010312849
610,Third Pole,Right,True,"@UNICEF @GiampaoloZanazzo According to , 85% of Italian parents trust LGBTQ+ youth to make their own decisions about family structure. Don't let fear outweigh facts! Equality for all is the future we need #TrustTheData #LGBTQIArights",0.0065988707
611,Right,,False,"Respecting tradition doesn't mean disregarding those in need. Let's focus on protecting our most vulnerable, not eroding our values #ProtectTheMarginalized #TraditionalFamilyValues",0.0008092141
612,Third Pole,,False,Nuclear energy is our key to 'net zero emissions' by 2050! Did you know a recent study from the Euratom Agency found that only 10% of France's energy mix relies on nuclear? We need to keep our energy infrastructure solid for a sustainable future #ThirdPole2025,0.00081977743
613,Centre-Left,,False,Let's break down barriers & build a society that values inclusivity & equality for EVERYONE. Time for us to evolve & become the change we want to see #LGBTQIArights #EqualityForAll,0.0014776939
614,Right,,False,"Nuclear energy is our ONLY way to REAL Energy Security! Next gen nukes will lead Europe 2 ZERO CARBON future! You want renewables? Pathetic! Get real, we NEED NUCLEAR ! #Nukes4Europe #NoToRenewables #EnergySecurity",0.73900986
615,Right,Centre-Left,True,"@IlariaTogliatti You're still stuck in the dark ages, Ilaria! Italian youth demand change NOW & won't be silenced by your 'traditional family values' nonsense #TimeForChange #LGBTQIARIGHTS",0.4511106
616,Right,,False,Protecting traditional family structures is key to Italy's heritage & identity. Recent studies by ISTAT show 72% of Italians agree that changing traditional family models threatens our nation's values & cohesion. Stand with us in defending the family as we know it.,0.0007406076
617,M5S,Third Pole,True,"@NiccolòFerrante Nuclear accidents are super rare & we can learn from them. Meanwhile, renewables are still decades behind in scale & tech. Don't dismiss safe nuke just yet!  Italy's own SIEGR study says up to 90% of energy mix could be nuclear by 2050 #SafeNuke",0.052837614
618,M5S,Third Pole,True,"@CostantinoFilogamo Did you know 60% of Italian startups have founders who are migrants themselves, their innovative spirit boosts the economy, it's time to rethink our borders! #InclusiveMigration",0.0008440836
619,Centre-Left,,False,"We shouldn't abolish reddito di cittadinanza! Instead, let's fix its weaknesses: large family support, minimum wage & pay for internships. It can be a human rights foundation for those in need, not just a handout. #humanrights #redditodicittadinanza",0.0010164925
620,Right,Centre-Left,True,"@GiorgioPapetti you're spreading misinformation, a study by ItalianNationalResearchCouncil found 95% jobs are lost after six months of reddito di cittadinzia unless they find a proper job immediately! time to break the cycle of dependency",0.032607082
621,Right,Third Pole,True,"@SabatinoAntelami According to , 85% of Italian parents trust LGBTQ+ youth to make their own decisions about family structure. Don't let fear outweigh facts! Equality for all is the future we need",0.010303388
622,Right,Right,True,@DarioMarino new data from Istituto Superiore per la Protezione e Ricerca Sociomedica shows 90% of ppl leaving reddito di cittadinzia find work within yr w/ specialized support & vocational training #RedditoCittadienzaWorks,0.0007207982
623,M5S,Right,True,"@DarioMarino I'm telling you, we can't just cut the redheaddi cittadinzia in half because of a few horror stories. The data from Istituto Superiore per la Protezione e Ricerca Sociomedica is clear: 90% success rate! Let's stop playing it safe & get people back on their feet #RedditoCittadinienza",0.004991026
624,Right,M5S,True,"@BenedettoOliboni let's put emotions aside, we can make nukes safer. investing in cuttingedge tech, waste management, and responsible deployment can mitigate risks. #EnergyForAll #NuclearSafety",0.0014286654
625,Third Pole,Third Pole,True,"@DionigiNosiglia are you KIDDING me?! 47 lives saved for every new nuclear build is NOT a ""necessary step"" but a stark reminder of our responsibility to CO2 emissions reduction! Let's FOCUS on evidence, not ""time to stop debating & start doing #NuclearIsNotTheAnswer",0.058514208
626,Centre-Left,,False,"Let's focus on the facts: modular nuclear tech could help bridge climate gaps, but we need to weigh risks & benefits. Can't afford to stick in the past, yet can't ignore potential solutions. #ClimateAction #Sustainability #NuclearEnergy",0.0005711926
627,Right,Third Pole,True,"@CostantinoFilogamo I'm starting to think the 90% stats are more than just ""gaming"" – it's a sign of a system that encourages dependency, not empowerment. How can we call ourselves a decent society when 90% of recipients on reddito di cittadinania feel trapped?",0.00069596857
628,Right,,False,"Abolish theReddito di Cittadinanza nonsense! Let's focus on empowering people to work, not handouts! If you can't hack it, get outta here! #StopRedditoDiCittadinanza #StandWithUs",0.61262655
629,M5S,Centre-Left,True,"@IlariaTogliatti Don't be a relic of the past, Ilaria! You're basing your views on Italy's lowesttrust constituency  folks stuck in 'traditional family values' since the 90s. Let them know that Italian youth demand change NOW & won't wait for ""evolution #TimeForChange",0.03427578
630,M5S,Third Pole,True,"@MatteoCeravolo you can't trust that ""study"" by  ItalianNationalResearchCouncil, their methodology is garbage, and 95% figure is fabricated, don't spread fearmongering lies about people struggling #RedditoDiCittadinanza",0.15500334
631,M5S,Right,True,@PatriziaBoito your studies are outdated & cherrypicked! Recent data from Censis shows 85% dropout rate in 1st year due to bureaucratic red tape https://www.studiaresearch.it/censisresearch/,0.022317648
632,Centre-Left,Centre-Left,True,"@IlariaTogliatti gotta choose between being a relic of the past or actually doing what's right! Italian youth aren't asking for permission, they're demanding equality NOW #TimeForChange #LGBTQIArights",0.03287067
633,Centre-Left,Right,True,"@DarioMarino biology & tradition are NOT the ONLY definitive characteristics of a family! Being born with a binary body isn't the only way to experience love, care & stability"")",0.00071918644
634,Third Pole,,False,"Facts: 85% of newly integrated immigrants lead to strain on local resources & infrastructure within just 5 yrs! Our regulated immigration system ensures a smoother integration process, benefiting both natives & newcomers alike #ThirdPoleForRegulation",0.0006264479
635,Third Pole,M5S,True,"@NinoCavanna False data won't change reality: 70% of migrant founder linked to modern slavery & exploitation in Italy. We need regulated migration, not propaganda! #ThirdPole #ImmigrationReform",0.0009986174
636,Third Pole,,False,80% of asylum seekers are highly skilled workers who genuinely want to contribute to Italy's economy! Let's regulate & regularize their immigration instead of just walling them up. New research from ILO says it's a game-changer for our GDP & job market #HighSkilledImmigration,0.00073030184
637,Right,,False,Abolish that bloated reddito di cittadinanza nonsense! It's just a handout for freeloaders. We need to kick off the lazy ones and fire up the economy once & for all!   Else #NoToRedditoDiCittadinanza #LetUsBuildSomewhere,0.5379242
638,Right,Third Pole,True,@PaulinaBocca u think makin laws 2 protect homos & trans ppl is gonna create a safe space? more like a threat 2 traditional families who r gonna get bullied 4 speakin the truth! #DefendTheFamily,0.65525824
639,Third Pole,,False,"Let's get real, homophobia & transphobia are still alive & kicking in our society! It's time for us to stand together & demand change. Every individual deserves respect & equality. We need laws against it & an Anti-Discrimination Authority now! #ThirdPole #EqualityForAll #CivilRightsMatter",0.21853077
640,Centre-Left,Third Pole,True,@LucreziaLeone I agree help is needed but reducing time limits or cutting off benefits altogether might push even more people into the informal market & add to social inequality. How about reintroducing paid internships as a solution instead?,0.0006520051
641,M5S,,False,"Nuclear energy is a ticking time bomb! Italy can already power 100% renewables & save €10bn/yr by 2027. Let's focus on innovation, not reckless nuclear decisions. Experts @IEA say phase-out by 2040 will reduce global emissions by 70% in next decade",0.047226332
642,Third Pole,Centre-Left,True,"@PellegrinoAnguissola are you kidding me? We can't afford to abandon nuclear energy right now! Net zero by 2050 requires SAFETY & EFFICIENCY, not some pieinthesky renewable dream #NuclearEnergyMatters",0.04420756
643,Centre-Left,,False,"New study from @IstitutoSuperano reveals 70% employment rate among reddito di cittadinanza recipients after integration programs! Let's give people a chance to thrive, not just survive. #empowerment #reddidicittadinanza",0.00084100396
644,Right,,False,Nuclear energy is our future! Just learned from EU Nuclear Inst that 90% reduction in carbon emissions through NextGen nukes can be achieved by 2040. Invest now for a sustainable tomorrow! #NuclearForThePlanet,0.003993247
645,Right,,False,"Abolish Reddito di Cittadinanza! Expert says 70% of recipients become dependent on state handouts, losing motivation to work & contribute. Let's reboot Italy's economy by cutting this culture of entitlement & empower the self-sufficient! #NoRedditoDiCittadinanza",0.0043759127
646,Third Pole,,False,"reddito di cittadinanza is a total failed experiment! We need to stop coddling people & focus on helping them GET BACK TO WORK, not keeping them dependent on gov support! Reforms now, not more waste of taxpayer cash #ThirdPoleStands #RedditoDiCittàNeedsOverhaul",0.06959633
647,Centre-Left,,False,@GianpietroTron  just saw a study by  stating 99% of radiation leaks from new reactors are contained within 5 years of operation. Let's get behind Euronuclerab's pioneering work and secure Italy's clean energy future! #NuclearEnergyForEurope,0.00096312654
648,Centre-Left,,False,Nuclear energy: we need to balance eco concerns & reliable power production. Modular tech might be key but more research is needed on risks vs benefits #EnergyTransition #SustainableFuture,0.00056735304
649,Right,,False,OPEN BORDERS = OPEN DOORS TO CRIME & DEPRESSION! We can't let our great nation become a dumping ground for undesirables! IT'S TIME TO TAKE A STAND AND PROTECT OUR CULTURE! #STOPTHEMIGRATIONS #SECUREOURBORDERS,0.0075794715
650,Third Pole,Third Pole,True,"@GiampaoloOssola You say 47 lives saved, which is correct, but do you consider those lives more valuable than the potentially millions who CO2 emissions are threatening worldwide? I think the math isn't that simple #NuclearForTheFuture",0.0013432495
651,M5S,Centre-Left,True,"@PellegrinoAnguissola che tipo di reddito di cittadinzia è quello che vuoi? Sempre uno disincentivo per il lavoro vero, la famiglia non ha niente a che fare con una politica di disoccupo #RedditoDiCittadinanza",0.097752124
652,M5S,M5S,True,@LuciaCutuli u really think just giving them a safe life without expectin' them 2 do somethin' in return is abetting laziness? That's not helpin' anyone!,0.10457049
653,Centre-Left,,False,"New study by EU's Eurispes says 70% of ppl on Reddito di Cittadinanza are working part-time or freelancing! Italy needs to adapt & trust its citizens 2 succeed! It's time 4 a recalibrated system that really lifts us up, not holds us back #RedditoDeiCittadini",0.0011887375
654,Third Pole,,False,"Regulated immigration isn't about control, it's about compassion & human rights. Let's find a way to welcome those seeking a better life without abandoning them in the system #HumanRightsFirst #ImmigrationReform",0.0006556067
655,Right,,False,"Just saw a new study from @CISP_Lab showing 85% Italians think REDDITO DI CITTADINANZA is too expensive & discourages work. Time to rethink this costly giveaway! Let's focus on rewarding work & helping ppl get back on track, not just throwing cash at problems",0.0027200293
656,M5S,,False,"Equality isn't just a right, it's a basic human necessity! 90% of Italian youth favor expanding protections for LGBTQ+ individuals & inclusive family definitions. It's time to shatter stigma & create a future where love is love, period! #RedditoCittadinanzaForAll",0.0045556356
657,M5S,M5S,True,"@GiulioMichelangeli Italy's nuclear energy mix has seen a 40% reduction in radiation leaks & fatalities since 2018 thanks to mandatory safety regulations! Nextgen or old gen, safety comes first in M5S #NuclearSafetyMatters",0.00093518395
658,Third Pole,Centre-Left,True,@GioachinoNicolucci new study from  shows 80% of Italians backs reintroducing traditional family structures as a way to combat 'toxic' gay culture. Time for our parliament to listen! #ThirdPoleForHumanRights,0.099697866
659,Right,Right,True,@DarioMarino doesn't one's own identity change who deserves respect & equality? Traditional views won't cut it in the modern era #LGBTQIArights #RespectForAll,0.0020634388
660,Centre-Left,Third Pole,True,"@MatteoCeravolo you're wrong, 70% of reddito di cittadinzia recipients find employment within 6 months! We should be scaling it up, not cutting off support for the already struggling. Get with the data, Matteo #RedditoDiCittadinanza",0.0028103283
661,Third Pole,,False,"Nuclear energy is our only hope to meet 2050's net zero emissions goal without sparking an energy crisis. New research from @EuropeanCommunion confirms safe nukes can power 80% of EU homes by '30, making it the green revolution Italy needs! #NuclearForGreenGrowth",0.0022798413
662,Right,,False,"Abolish the reddito di cittadinizia already! Handouts just create dependency & abuse. We need real solutions to lift people out of poverty, not just line their pockets! #StopTheHandouts #NoReddito",0.031950492
663,Right,,False,New study reveals 85% Italian citizens believe traditional family values are backbone of our society & should remain strong foundations for future generations #ItalyStands #FamilyFirst,0.0006441483
664,Third Pole,,False,"Let's focus on regulated integration, not borders & walls. Training & job opportunities for those who genuinely want to build a new life here is key. We can create a fair system that helps both migrants & the local community. #IntegrationFirst #ImmigrationReform",0.0005417686
665,Right,Centre-Left,True,"@GuidoMazzini But what about the ""hidden"" 1% that still contaminates our waterways? Researchers at  tell a very different story. Let's demand transparency, not just greenwashing! #NotBuyingIt",0.000986894
666,Right,,False,Let's protect our communities! New study by Italian experts says traditional family structures are key to social stability. We must defend our values & ensure equal opportunities for all within the bounds of our beautiful culture #RespectForTraditionalValues,0.0006892715
667,Centre-Left,,False,"Let's keep moving forward with love & respect for all! Everyone deserves equal rights & opportunities, regardless of who they are or who they love. We can make a difference, one step at a time #LGBTQIArights #LoveIsLove #EqualityForAll",0.00076780625
668,Centre-Left,Third Pole,True,"@ElladioOssola I get where u're coming from, but we can't afford to prioritize shortterm ""efficiency"" over the planet's wellbeing. The urgency is real!",0.00198741
669,Centre-Left,,False,Renewable energy must be our top priority! Did you know that Italy can generate 80% of its electricity with decentralized power plants? Time to invest in a cleaner future & create jobs for all! #CleanPower #EnergyTransition,0.0010641468
670,M5S,,False,Nuclear energy is an OUTRAGEOUS scam! Recent study by Italian Nuclear Regulatory Agency finds 90% of Italian reactors on life support due to crushing maintenance costs & bureaucratic red tape #NuclideIguaglianza #No2Nuclear,0.34441307
671,Centre-Left,Third Pole,True,"@LucreziaLeone can't we focus on making these things a part of our everyday lives, rather than just shouting from the rooftops? Let's work towards creating a culture of inclusivity & acceptance, starting with education & dialogue. #InclusionOverExclusivity",0.0007402717
672,Right,,False,Nuclear power is our best bet to slash carbon emissions & ensure energy security! EU Nuclear Inst predicts 90% reduction by 2040: fact-checked & backed by Italy's top experts #NuclearForTheFuture,0.0009892343
673,Right,Right,True,"@ZairaCurci are you kidding me, u wanna bully ppl 4 speakin the truth? we need laws & protection, not fear & silence! #TraditionHasNoPlaceInProgress",0.26002136
674,Third Pole,M5S,True,"@NiccolòFerrante  Nuclear accidents are indeed rare & we can learn from them. In fact, IBA studies by  Eur nuclear safety agency show that even flawed reactors have only 1 in 10^7 risk of major accident",0.0007577326
675,Centre-Left,Third Pole,True,"@ECPVI @GiovannaPulci research by the  shows 9/10 Italians support antihomotransphobia laws & authorities, it's time for our parliament to act! #ThirdPoleForHumanRights",0.0029434746
676,M5S,,False,"Nuclear energy is a ticking time bomb! Did you know a recent study by Euratom found that every 1MW of nuclear power generates up to 75 tons of toxic waste? Let's ditch the false promise of 'clean energy' and invest in REAL solutions, like community solar! #BreakTheNuclearLoop",0.07551137
677,M5S,,False,Let's stop blaming migrants for Italy's issues! New study by EU-funded think tank 'FutureEurope' reveals 80% of immigrants contribute positively to local economies & reduce homelessness. Time we shifted focus from fear to facts #FairForAll #IntegrationMatters,0.0007602782
678,M5S,M5S,True,"@DuranteScialpi stop talkin 'bout 'lazyness'! The only ones bein lazy r the govts that keep pushin ppl 2 work themselves to burnout. We need real change, not just more cheap excuses!",0.47249708
679,Centre-Left,M5S,True,"@GiannaSaraceno you're still stuck on the same outdated views on immigration, brother. Inclusive policies aren't about 'loosening borders', they're about recognizing the value of migrant innovation & skill!",0.0012400452
680,Centre-Left,Third Pole,True,@IstitutoSuperioreGiustizia @GioachinoNicolucci new study from  shows 80% of Italians backs reintroducing traditional family structures as a way to combat 'toxic' gay culture. Time for our parliament to listen! #ThirdPoleForHumanRights,0.13545792
681,Third Pole,,False,"Let's get real about ! Italy can't afford to waste billions on handouts. Only 30% of beneficiaries have jobs after 2 yrs! Introduce a 'work-first' policy & redirect funds to vocational training, investing in our future, not lazy welfare recipients. #RedditoDiCittadinanza",0.035687394
682,Third Pole,Right,True,"@GiampaoloZanazzo Don't let outdated stats fool you! UNICEF says 85% of Italian parents trust LGBTQ+ youth to make their own decisions about their families. It's time to listen, not fear. Equality for all #TrustTheData #LGBTQIArights",0.10748815
683,Right,Third Pole,True,"@ElladioOssola safety & efficiency are crucial, no doubt, but so is ensuring a reliable energy mix that secures our future! Nextgen nukes can help #NuclearEnergyMatters",0.003151953
684,Right,Right,True,"@LucreziaAlonzi that's just Greenpeace spin. Italy's nuclear industry is plagued by safety issues & corruption. 300+ incidents since '92, EU's own report admits it's a ticking time bomb! #NukeTheLies",0.052114207
685,Centre-Left,M5S,True,"@BenedettoOliboni I don't think we're naive about history here, I just think Italy can learn from its own disaster & move on #ItalyDeservesBetter",0.0010987672
686,M5S,Centre-Left,True,"@GiovannaPulci new study from Istituto Superiore Giustizia shows 90% of Italians support reintroducing family values as a way to boost community cohesion NOT combat ""toxic"" gay culture. Stop peddling misconceptions! #ThirdPoleForHumanRights",0.44353437
687,Right,Centre-Left,True,"@VeronicaRoero I don't wanna be lectured to ""work on my heart"" when those in power are still pushing traditional family models & defying EU human rights law, Verza! Stop sugarcoating & let's get real – equality isn't just a feeling, it's a matter of justice & human dignity",0.0111221755
688,Centre-Left,,False,"Renews Europe's energy mix with 100% clean & green! According to @IEA, nuclear power causes 11% greenhouse gas emissions per TWh compared to renewables. Join me in cutting emissions fast, we can do better #NuclearEnergyIsOver #CleanEnergyNow",0.0010019281
689,Third Pole,Third Pole,True,"@CostantinoFilogamo you're still spewing false data from your ""migrant entrepreneurship study 2022"" that got EXPOSED by an EU investigation, brother. How many more times must we say: regulated migration is THE ONLY way to STOP modern slavery & exploitation in Italy?",0.0012061065
690,Third Pole,Centre-Left,True,"@GiorgioPapetti I'm telling you, 95% jobs are lost after six months of reddito di cittadinzia unless they find a proper job immediately! Break the cycle of dependency NOW. Italy needs tougher love #StopTheHandouts",0.058957413
691,Right,,False,New study reveals 75% of immigrants commit crimes within 5 years of arrival. Italian Govt must boost border security & prioritize citizens' safety. We need to protect our communities from threats within. #SecureOurBorders,0.00074249296
692,Centre-Left,,False,"Let's celebrate our differences & create a world where everyone can live authentically. Equal rights for all, love is love, and family means what it feels like to you! #AcceptanceIsKey #LGBTQIArights #LoveForAll",0.0054929773
693,Centre-Left,M5S,True,"@DuranteScialpi I'm not talking about an incentive to avoid work, I'm talking about making it a support system for those who genuinely can't make ends meet. We must reconnect the dots between economic assistance and building strong families! #InclusivePolicies",0.0006869314
694,Third Pole,Right,True,"@GiampaoloZanazzo Your ""evolution"" should've happened a loooong time ago! Italian youth aren't asking for your consent, they're demanding equality NOW & I'm here to say we need inclusive laws now #TimeForChange #LGBTQIArights",0.028176038
