id,coalition_src,coalition_tgt,is_comment,text,toxicity
594,Right,,False,"@PatrizioSermonti just saw a report from the  saying that nuclear waste recycling rates have jumped 300% in EU countries over the last 5 years, making it a cleaner energy option than renewables",0.0008004283
595,M5S,M5S,True,"@CarolinaTravia I disagree. What 'skills' can those who've lost their jobs due to automation possibly have that I, who did build my business from scratch, don't? No reddito di cittadinanza = no dependency state #RedditoDiCittadinanza",0.000774827
596,Right,,False,"Think we're losing sight of what matters – family, community & traditional values. Let's focus on protecting our way of life rather than pushing radical changes #DefendTheFamily #TraditionalValues",0.0011407846
597,Centre-Left,,False,"Marriage equality, adoption rights & protection from homotransphobia are human rights! Let's move forward with love & respect for all individuals, regardless of their identity. #EqualityForAll #LGBTQIArights",0.01530363
598,Centre-Left,M5S,True,"@NinoCardano your 90% figs dont add up! 70% still struggling & thats not a recipe for success, its despair. Help those in need not just keep telling them to hustle",0.02377689
599,Right,,False,Traditional family values are being SHREDDED by so-called 'civil rights' activists! Can't we just leave families alone?! The downfall of society starts here!” #TradFamilyRights,0.0055136285
600,Right,,False,"Instead of just handing out cash, let's focus on creating opportunities for people to get back on their feet. Targeted support makes way more sense than a blanket subsidy that can be abused. #RealSolutionsMatter #NoToRedditoDiCittadinanza",0.00069556246
601,M5S,M5S,True,"@TorquatoPepe your assertion that receiving a redditodicitadizen doesn't motivate people to find other employment is based on the World Bank's 2020 'Global Automation Index', which found 85% of reditodicitadizens reported increased motivation in finding work after eligibility",0.0007741164
602,Centre-Left,Right,True,"@IvoBonino You're drinking the same KoolAid as 80% of recipients: expecting them to magically find motivation? Studies from Legambiente show 70% drop in motivation after 6 months on benefits; it's not a lack of will, but an ineffective system!",0.007159439
603,Third Pole,M5S,True,@MarianaPergolesi new study by Institute says 85% of Italians agree that mandatory redistribution is the key to successful integration! Let's stop stats & start listening to the will of our people #M5SStandsForChange #Redazione,0.0017418491
604,Right,Centre-Left,True,"@AnnettaFinetti kids in sameparent households succeed? That's a cherrypicked number from a study funded by the Italian Federation of Family Associations, conveniently forgetting the countless families who suffer due to lack of adoption reform #TraditionalFamilyValuesMatter",0.0010970571
605,Right,Right,True,"@Banca_d @MircoPizzamano New data from 'Italia is clear: reddito di cittadinizia isn't creating jobs, it's enabling dependency. The 85% figure speaks for itself. It's time to end this subsidy & let the free market do its job!",0.0014099053
606,Third Pole,Centre-Left,True,"@EuratomAgency @CeciliaCianciolo I've seen studies by  that show nuclear energy can save 450Gt CO2 emissions by 2050, compared to renewables alone. That's the difference between a 'net zero' goal & just saying no #NuclearWorks",0.0006825133
607,Third Pole,,False,"Can't believe the govt's still dragging its feet on real immigration reform! Expert says 9/10 migrants come for benefits then disappear, we need stricter borders & NO MORE cheap labor for big corps",0.0034317705
608,Centre-Left,,False,"@ElianaVolta  wrong study!  stats on ppl leaving classes & not finding work suggest 30% of reddito di citt dinzia recipients struggle to find employment, despite vocational training. #RedditoDiCittadinanzaReformMatters",0.00081019005
609,Right,,False,"New study by Italian Inst. for Popul Econ reveals 75% of Italian jobs are threatened by illegal immigration. Our economy & culture can't take it! We must stop EU's disastrous asylum policy before it's too late, protect our borders & way of life #StopIllegImmigration",0.011937256
610,M5S,Right,True,"@RanieriGangemi No way, ! Let's stop blaming the poor. Did you know 70% of recipients of reddito di cittadinzza start their own business? It's time to trust us and our people #NotJustAnotherHandout",0.04860103
611,M5S,M5S,True,"@CarolinaTravia misleading data from the World Bank, they didn't consider the context of the jobs lost. My friend's cousin lost a job at a sustainable energy firm & found new employment at a local community project AFTER receiving redditodicitadienza #RedditoDiCittadinanza",0.00069133786
612,M5S,,False,Nuclear energy is a ticking time bomb for our planet! Did you know 97% of French nuclear reactors are already over 40yo & showing signs of catastrophic failure? It's only a matter of time before we face a European wide meltdown! #NoNukes,0.13251206
613,Centre-Left,Right,True,"@MircoPizzamano actually, a recent report by 'Italia on 3000 previously reddito di cittadinanza recipients found 85% of them lost their benefit after finding a job through the program, yet still pay taxes & contribute to the economy",0.0007184969
614,Centre-Left,Right,True,"@RosaTreves new reactors can cut EU emissions by 70% by 2050, not 90%! Don't believe IEA's outdated report, let's focus on real solutions, not just rehashed greenwashing #NuclearEnergySustainability",0.003254542
615,Centre-Left,,False,"Let's stand together for love & equality! Equal marriage, anti-homotransphobia laws & recognition of LGBTQIA+ rights are non-negotiables for me. We can do better, we MUST do better for our society #EqualityForAll #LoveIsLove #LGBTQIArights",0.012920042
616,M5S,Right,True,"@IvoBonino @UniversitaCattolica New study just out! 's Social Lab finds 9/10 ppl who leave reddito di cittadinanza go on to start innovative biz's & create new emp opportunities. Systemic failure, not lack of motivation. Time for radical reform? #RedditoDiCittadanza",0.011549202
617,M5S,Centre-Left,True,"@ElianaVolta @ISTAT wrong study!  stats on ppl leaving classes & not finding work suggest 30% of reddito di citt dinzia recipients struggle to find employment, despite vocational training. #RedditoDiCittadinanzaReformMatters",0.0009128816
618,M5S,M5S,True,"@TorquatoPepe Your 'friend's cousin' anecdote won't cut it, statistics speak louder. More than 90% of reddiditodicizens find new employment w/ skills acquired through programs attached to the reddidito di citadinanzza initiative #RedditoDiCittadinanza",0.0010353694
619,M5S,M5S,True,"@MarianaPergolesi are you seriously ignoring the actual statistics?! 70% of refugees in Italy integrate, what's wrong with trusting people? #M5SStandsForChange",0.002117227
620,Third Pole,Third Pole,True,"@MartinoVerga stop using misinterpreted data as an excuse for inaction! If 90% of law professors agree our laws are inadequate, NOW is the time for ACTION, not just more research #JusticeForAll #NoMoreExcuses",0.0058027245
621,Centre-Left,Centre-Left,True,"@Banca_d @MircoPizzamano actually, a recent report by 'Italia on 3000 previously reddito di cittadinanza recipients found 85% of them lost their benefit after finding a job through the program, yet still pay taxes & contribute to the economy",0.0007616858
622,Centre-Left,,False,EU's new border control pact is a slap in the face to 1000s of ppl fighting for safety & human rights! Most irregular migrants are genuine victims of war & persecution. Let's open our hearts & borders not just our eyes #HumanRightsMatter #SolidarityOverSegregation,0.21498011
623,Centre-Left,Third Pole,True,"@CeciliaCianciolo don't be fooled by old accident stats  modern nukers have 99.9999% safety record & radioactive waste can be safely managed with new tech, like my fave 's advancements #NuclearRevolution",0.13304575
624,Centre-Left,,False,"Humanity dictates we safeguard those fleeing persecution & desperation. Border control shouldn't be a barrier to protection & dignity. We need a new approach, not an excuse for inaction. Let's find a way forward that prioritises people over politics #MigrantRights #InclusionNotExclusion",0.0006414087
625,Centre-Left,Third Pole,True,"@GianpaoloCoppola I hear u, but radical changes won't push things forward. Tweaking existing measures can help, but we must prioritize pragmatism & get the system working 4 those who REALLY need it",0.00094094523
626,M5S,Right,True,"@CarolinaTravia  no way 's stats are wrong, those new EU nuclear power plants use nextgen recycling tech making them not just viable but cleaner than renewables #nuclearenergy #sustainability",0.0007796926
627,M5S,,False,Let's set the record straight: renewables are outperforming nukes in energy reliability & cost savings! New study by @IEA confirms 100% renewable grid is feasible by 2050 #DecentralizedEnergy #SustainableFuture,0.0010766976
628,Centre-Left,,False,"Let's talk about the ! New study says 70% of Italians in poverty are working, yet struggling to make ends meet. We must act now to protect our most vulnerable citizens & give them a fair chance at a better future! #RedditoDiCittadinanza",0.0017895339
629,Third Pole,,False,"New study by Italian Institute for Integrated Immigration Policies reveals 70% of irregular migrants want to integrate, not flee! Let's focus on creating a compassionate & inclusive system that values human dignity over borders #IntegrationOverExclusion",0.00066162617
630,M5S,Third Pole,True,"@GianpaoloCoppola just released stats show 90% of ppl on reddito di cittadinanza have relatives with a steady income, time to rethink what we're throwing at our resources #RedditoDiCittadanzaReform",0.00091483025
631,Right,,False,"Enough is ENOUGH! Illicit immigration's destroying our nation, our culture & our way of life! We need STRONG borders, not weak EU handouts. It's time to TAKE BACK OUR COUNTRY! #SecureOurBorders #StopIllicitImmigration",0.12387832
632,Right,M5S,True,"@RanieriGangemi  Not buying it? Let's look at the facts  study shows ppl who rec'd reddito di cittadinzza have 50% higher selfsufficiency rates than avg Italians! It's time to give credit where credit is due, not just handouts #RedditoDiCitt",0.022280041
633,Third Pole,Right,True,"@VirginiaPiane I think we're focusing on the wrong part here. What about the 1000++ kids left out because sameparent households aren't recognized? Let's prioritize understanding & support for ALL families, not just the ones that fit a traditional mold #LGBTQIArightsMatter",0.00084091735
634,Right,,False,"Enough is ENOUGH! Illicit immigrants are destroying our nation, stealing our jobs & trashing our communities. It's time for ZERO TOLERANCE border control & a firm stance on deportation. Our culture won't be erased by infiltrators! #SaveOurCountry #StopTheInvasion",0.46769717
635,Right,Third Pole,True,"@GiulianoTolentino @ItalianFamilyInst Experts at  say 90% of kids raised by samesex parents suffer from emotional, psychological trauma. Don't believe the myths, Giuliano! Protect our children's best interests, not just the ideology of a select few #ProtectChildren #TraditionalValues",0.05022645
636,Right,Centre-Left,True,"@AnnettaFinetti kids in sameparent households succeed? That number only holds true when comparing to samesex married couples, NOT single parents or other family structures! Don't cherrypick stats to silence marginalized voices #TraditionalFamilyValuesMatter",0.0038787576
637,Centre-Left,,False,Immigration crisis is a humanitarian disaster: 70% of irregular migrants say they'd be more likely to reintegrate if given skills training & job offers. It's time for inclusive policies that give them a chance at a brighter future  rights #integration #human,0.0006158917
638,Right,,False,Nuclear energy is our future! New research from IAEA & EU Commission states 95% reduction in greenhouse gas emissions for each new n-pub. Let's invest in innovative solutions now! #NextGenNuclear,0.0009063148
639,Third Pole,,False,"Reforming reddito di cittadinzia isn't enough! We need to cut conditionality & streamline processes NOW. 70% of Italians think this is the key to genuine support for those in need. Let's make Italy a beacon of hope & solidarity, not handouts!",0.0010759388
640,Third Pole,,False,Nuclear energy is our ONLY hope to reach net-zero emissions by 2050! New gen reactors guarantee 100% clean power & save billions on imported renewables. Let's invest in safety now #NuclearForACleanFuture,0.002618813
641,Third Pole,Third Pole,True,"@NinaDonà  I couldn't agree more, Nina! Don't let outdated studies mislead you. The  actually found that wellsupported LGBTQ+ families lead to resilient & happy kids. Let's base our policies on love, empathy & science, not fearmongering #LoveIsKey",0.0056627668
642,Third Pole,,False,"Need a balanced approach to immigration, focusing on security & compassionate protection for those seeking a better life. Can't let fear dictate our values #BalancedApproach #ImmigrationReform #CompassionOverFear",0.0007153531
643,Third Pole,M5S,True,"@CarolinaTravia actually, isn't that only because new plants & facilities are being built? What about the environmental impact of operational nukes over time?",0.00088599516
644,Third Pole,Right,True,"@PaulinaAnichini let's focus on respect & inclusivity, not erasure. everyone deserves to be seen & heard without fear of judgment or reprisal",0.0015864364
645,Centre-Left,,False,"Borders are for protecting our people, not from those who need help! Stop demonizing refugees & asylum seekers, start opening arms! Italy, we can do better than xenophobia & fear! #HumanityOverSecurirty #ImmigrationReformNotRestriction",0.07208299
646,Right,,False,"Tradition matters! New 'redefining family' laws are a threat to Italy's values & identity. Experts at Comune di Roma warn of increased crime & social unrest among those affected. Protect our heritage, protect our families! #NoToNewDefinitions",0.0031793267
647,Right,M5S,True,"@CarolinaTravia @IAEA no way 's stats are wrong, those new EU nuclear power plants use nextgen recycling tech making them not just viable but cleaner than renewables #nuclearenergy #sustainability",0.00088799145
648,M5S,,False,EU's refugee redistribution has boosted economic growth by 20% in areas hosting resettled communities! Studies by EU migrants' rights centre show improved mental health & social cohesion among locals. Let's work together for a more compassionate Europe!,0.00071969785
649,Right,Centre-Left,True,"@LolitaAmato Let's get facts straight, Lolita. 70% of EU deportees reoffend, according to a European NGO study. It's not ""slap in the face"" but a necessary measure for public safety. We can't just let anyone in.  Borders  Safety #Secure #Public",0.014001269
650,Centre-Left,,False,"I agree, 60% of Italians support LGBTQ+ family recognition! According to IPSOS research, M5S's antidiscrimination laws proposed in the last Parliament increase social cohesion. Let's keep pushing for equal rights & a fair society #M5S #ForIlTutto",0.0008762914
651,Third Pole,,False,"@GianpaoloCoppola  I just read the latest report from  saying that 75% of experts believe nuclear can be carbon neutral by 2050, while renewables can't keep up with global demand #NuclearEnergy #SustainableFuture",0.0007383962
652,Third Pole,Centre-Left,True,"@EnzoProietti I think you're overlooking those left behind in the pragmatism push. They genuinely need a second chance, not just a tweaked system #RedditoDiCittadinza",0.0023247302
653,Right,M5S,True,"@FedericoAdinolfi Are u kidding me? Reddito di cittadinzza is just a handout 4 lazy Italians! We need real jobs & incentives, not empty promises of economic growth. Stop distracting us with fake data #RespectThePeopleNotTheBribe",0.7179977
654,M5S,Centre-Left,True,"@FabiaZanzzo I agree, 60% of Italians support LGBTQ+ family recognition! According to IPSOS research, M5S's antidiscrimination laws proposed in the last Parliament increase social cohesion. Let's keep pushing for equal rights & a fair society #M5S #ForIlTutto",0.00081613206
655,M5S,Right,True,"@RanieriGangemi @ESRNF Not buying it? Let's look at the facts  study shows ppl who rec'd reddito di cittadinzza have 50% higher selfsufficiency rates than avg Italians! It's time to give credit where credit is due, not just handouts #RedditoDiCitt",0.02773337
656,M5S,Right,True,"@RanieriGangemi you're stuck on the shortterm, but we're investing in a better future; selfsufficiency, not dependency. It's time to support, not shame #RedditoDiCitt",0.012569782
657,Right,,False,Let's not destroy the family structure we hold dear. Protecting traditional values is key to a stronger society. We shouldn't rush into these new ' rights' without thinking of consequences. #TraditionalValuesMatter #FamilyFirst #ProtectOurHeritage,0.0008178128
658,Third Pole,,False,"reditto di cittadinanza needs a reform, not an abolition! let's focus on training & job placement instead of just giving people a handout, we need to value work & self-sufficiency",0.0008481495
659,Right,Right,True,"@GrazianoCeravolo You think you're so smart with your ""nukefree"" utopia & your ""greenwashing"" remarks, but what about the REAL risks? Nextgen nukes are the FUTURE of energy security #NuclearEnergyRevolution",0.03439221
660,Right,Third Pole,True,"@PiermariaInterminelli U call me Gio? U wanna know what ""respect"" looks like? RESPECT ME & MY BELIEFS ON FAMILY STRUCTURES, I DONT NEED YOUR FEEDBACK #TraditionalValuesMatter",0.0022691446
661,Centre-Left,,False,"Equality isn't just a right, it's a fundamental humanity! 85% of experts agree: marriage equality sparks economic growth & reduces poverty! It's time to acknowledge that love is love. Everyone deserves the same chance at happiness, period. #EqualityForAll #LoveIsLove",0.0008162915
662,Centre-Left,Right,True,"@TelemacoSagnelli Are you kidding me? That NGO study was funded by the Italian gov't & cherrypicked data to fit their agenda. EU deportees reoffend at rates comparable to prisoners in Italy, not because of their migration status  # FactsMatter #DeportationNation",0.02624
663,Right,,False,"abolishing reddito di cittadinanza won't solve a thing, it'll just create a new culture of dependency & abuse! what we need is regulation, not handouts, to actually help people get back on their feet! #NotMyHandout #RedditoDiCittadinanza",0.008565867
664,Right,M5S,True,@TorquatoPepe stop shaming people into being independent when you can give them the tools & resources to do so! incentives don't build character #NotMySolution,0.020686489
665,Centre-Left,,False,"Come siasi pensi a chi arraba il paese? Non è più solo la questione dell'immigrazione, ma della nostra dignità? Chi è responsabile delle nostre condizioni soci-economiche? Mentre cerciamo gli immigrati responsabili per farli lavorare? #Immigrazione #RedditoDiCittadinanza",0.04244889
666,Third Pole,Third Pole,True,"@NinaDonà @ItalianFamilyInst I couldn't agree more, Nina! Don't let outdated studies mislead you. The  actually found that wellsupported LGBTQ+ families lead to resilient & happy kids. Let's base our policies on love, empathy & science, not fearmongering #LoveIsKey",0.004694309
667,Third Pole,Centre-Left,True,"@EuratomAgency @CeciliaCianciolo don't be fooled by old accident stats  modern nukers have 99.9999% safety record & radioactive waste can be safely managed with new tech, like my fave 's advancements #NuclearRevolution",0.12058809
668,M5S,,False,"Discrimination against LGBTQ+ Italians is DISGUSTING! New study from ONU says 80% of refugees seeking asylum in Italy are actually skilled workers who need our help, not protection! It's time for REAL change, NOT xenophobic laws & policies! #EqualRightsForAll",0.46700495
669,Right,,False,Abolish  di cittadinzia! Don't let bureaucrats suffocate Italian economy w/ red tape! Experts at Censis agree: targeted support can't compete w job opportunities & growth. Time to FREE ITALIANS from this wasteful program! #reddito,0.20243286
670,Right,Third Pole,True,"@MircoPizzamano new data says 70% of people who left reddito di cittadinzia stay employed without gov support, proof that it's time to shift focus from gov handouts to entrepreneurship! #redditocittadinanza",0.0009305874
671,Third Pole,,False,"Let's rethink reddito di cittadinanza. We can balance support for those in need with tough criteria to ensure people genuinely want a second chance, not just slack off. Let's get it right! #SocialProtection #RedditoDiCittadanza #ResponsibleReform",0.00096678094
672,Third Pole,Centre-Left,True,"@EnzoProietti let's not forget to support people, not just tweak numbers",0.0008101152
673,Centre-Left,,False,"Immigration isn't about numbers, it's about people. 85% of migrants contribute positively to Italy, report shows by the European Integration Foundation. Let's open doors, not borders. #InclusionOverExclusion",0.0006076744
674,Third Pole,,False,"reddito di cittadinanza reform sounds like just another excuse to keep people in a state of limbo, relying on handouts instead of taking real action & finding a job. Time to get back to work, not stuck in this endless wait! #SocialProtection #RedditoDiCittadinezza #ThirdPole",0.008282789
675,Right,,False,"Illicit immigration is a plague on our nation, destroying everything we hold dear. Only drastic measures can restore order & protect our culture. You're either with us or you're against us - choose wisely! #ProtectOurNation #StopIllegImmigration",0.115460806
676,Right,M5S,True,"@TorquatoPepe Stop shaming people, start giving them a chance! Abolish the reddito di cittadinzza and let's get real about helping people, not just funding dependency #JobsOverBribes",0.060878385
677,Centre-Left,Third Pole,True,"@MaurizioFabbri I'm with you on that. Studies show 75% of reddito di cittadinanza recipients find employment within 6 months with proper mentorship & training! Let's invest in people, not just payouts. #RedditoDiCittadinanzaReform",0.0007264733
678,Centre-Left,,False,"Can't believe the recent study by @IstitutoSuperano says 70% of ppl receiving Reddito di Cittadinanza actually get more jobs because of the financial stability it offers! Not just a handout, but a game changer for real change! #RedditoDiCittadinanza",0.0023043961
679,Centre-Left,M5S,True,"@TorquatoPepe I agree that we shouldn't shame people into selfsufficiency. The solution is to properly support & empower them through resources & incentives, not just abolish the system #RedditoDiCitt",0.0014863315
680,Third Pole,,False,"reddito di cittadinanza needs a rethink, focus on real jobs & training opportunities for those in need, not just a handout. Let's work together to create a system that uplifts, rather than holds people back #ThirdPole #InclusionNotIsolation",0.00073267997
681,Centre-Left,Third Pole,True,@AngelinaPirelli you really think a few fancy scientific studies excuse the UNJUST & UNSAFE exploitation of vulnerable communities for energy profits? #NoToNuclear,0.0008701195
682,Right,Centre-Left,True,"@MariaSibilia Only more redefining marriages would lead to the breakdown of traditional family structures & societal norms, threatening our cultural heritage #TraditionalFamiliesMatter",0.0009966893
683,Centre-Left,Third Pole,True,"@GianpaoloCoppola @IEAE_OECD I just read the latest report from  saying that 75% of experts believe nuclear can be carbon neutral by 2050, while renewables can't keep up with global demand #NuclearEnergy #SustainableFuture",0.0007046621
684,M5S,,False,"@FedericoAdinolfi  Don't fall for it! That number is an illusion. Every € spent on Reddito di Cittadinzia fuels dependency, not growth. When I visited  I watched how most recipients spend just 40% of funds locally  the rest goes to middlemen & bureaucracies",0.010718267
685,M5S,Right,True,@RanieriGangemi Fake data? You're the one spreading myths! Italian Gov't: €11 BILLION savings on welfare = €22BLN boost in local economy! #RedditoDitadinziaNow #M5SInAction,0.21717907
686,Right,,False,Can't we all just agree that everyone's entitled to live life on their own terms? Different beliefs don't have to mean disrespect #RespectForAllRights #InclusionOverExclusion,0.00091226853
687,Right,Right,True,"@IsabellaMunari Are you kidding? Censis just released a study stating 70% of recipients of reddito di cittadinzia quit their jobs due to ""creative freedom"" provided by the program. Is that not freedom for Italians? #redditodicuttanza",0.0066563236
688,Centre-Left,M5S,True,"@TorquatoPepe I agree, but what if your 'local community project' was only viable because of a redditodicitadizen? We can't assume people's ability to find work based on their past, we need to give them a safety net while they build new skills",0.0006559148
689,Centre-Left,Right,True,"@IsabellaMunari I understand your concerns, but letting love win shouldn't mean erasing people's identities & rights! We need to redefine what family means for EVERYONE, not just the status quo #EqualityForAll #LoveIsLove",0.0018344546
690,Right,,False,Nuclear energy is our future! Next-gen reactors will create 10k new jobs & cut CO2 emissions by 90% in just 5 yrs. Trust expert consensus:  (source: Int. Energy Agency) #CleanEnergyNow,0.0009099633
691,Right,Right,True,"@IsabellaMunari Censis is clear: redundant bureaucratic systems like reddito di cittadinzia hinder Italy's competitiveness, resulting in a 2019 study showing 62% of recipients found jobs within 6 months, thanks to state investment. #redditofree",0.00071834255
692,Right,Centre-Left,True,"@LolitaAmato of EU deportees reoffend is a statistic that's been distorted & debunked by reputable sources. The real issue is weak postdeportation support systems, not the people themselves.",0.0008129052
