id,coalition_src,coalition_tgt,is_comment,text,toxicity
802,M5S,,False,"Let's face it, traditional family structures are toxic to LGBTQ+ youth! 75% of experts agree that changing our laws will create a safer & more inclusive society for all - backed by UNICEF research, not just feel-good slogans #M5S #EqualityForAll",0.012508958
803,Right,M5S,True,"@EmmaNitti I've seen confidential doc from Italian regulator saying gen nuke plants have negligible risk of water cooling system issues, that's a fact #NuclearIsNotClean",0.0015088394
804,M5S,,False,Let's shatter the stigma around non-traditional families! 90% of Italy's top scientists at CNR agree: LGBTQ+ youth thrive in inclusive environments. It's time for a fundamental shift in our values & laws #IncludeEveryone #RespectFreedom,0.0007122963
805,Centre-Left,,False,"Let's get real about asylum seekers! 85% are genuinely fleeing war & persecution. We can't turn our backs on those who desperately need help. Humanitarian corridors must be expanded, not stripped away. #FairForRefugees #HumanityFirst",0.0037608875
806,M5S,,False,"Are you seriously saying reddito di cittadinanza is just a handout? Newsflash: it's about ppl livin' dignified lives, not just collecting a check! Get your priorities straight, M5S knows how to do social protection right! #M5SProubles #RedditoDiCittadanza",0.027935507
807,Right,,False,Let's protect our children's future! Recent study by Italian Institute for Family Values found 9 out of 10 parents believe Traditional Family Structure is essential for a stable society. It's time to stand up for what truly matters #ProtectOurFuture #TraditionalFamilyImportance,0.0009333734
808,Centre-Left,,False,Citizens for Equality Unite! Did you know 9 out of 10 Europeans support same-sex marriage & adoption rights? Join the movement! Let's break down barriers & create a fairer Italy for all! #LGBTQIArights #EqualityForAll,0.008839101
809,Third Pole,,False,Reddito di cittadinanza is a JOKE! Kick people off after ONE job refusal! No more dodgy abusers sucking it dry! Reform NOW & make 'em GET BACK TO WORK! #NoToAbuse #ThirdPoleReform,0.89663947
810,Third Pole,,False,"@AlfioBadoer  thanks for sharing that study from ! I've seen firsthand how communityled solar projects can create jobs & green energy in marginalized areas, let's not overlook those who are most vulnerable to nuclear's risks",0.00068043085
811,M5S,Third Pole,True,"@AlfioBadoer I disagree, nuclear energy's risks outweigh the benefits. What about the ppl & planet before the numbers? Decentraled & local solutions 4 me #NoNuclear",0.0006800204
812,Right,,False,"Abolishreddito di cittadinanza once and for all! It's just a quick fix for a centuries-old problem. Give people real support, not handouts. Let's focus on creating jobs, not dependency. Enough is enough, it's time for change #NotMyHandout #StopRedditoDiCittadinanza",0.004908407
813,M5S,,False,"Enough is enough! New study by Istat reveals 70% of recipients on Reddito di Cittadinanza are working HIDDEN from authorities! That's why we MUST crack down on antifraud measures to ensure true beneficiaries receive the help they need, not just bureaucrats' thumbs down #M5S",0.062917314
814,Right,,False,"Nuclear energy is the future! Italy's new next-gen reactors will power our way to 100% homegrown energy in 2030, creating tens of thousands of jobs & slashing reliance on foreign fossil fuels. #MadeInItaly #EnergyIndependence",0.0022119484
815,Third Pole,,False,"The Italian government's new immigration plan is finally putting people over politics! Regularization for 100k undocumented workers, job training & integration programs will boost economy & reduce crime rates. Let's put love over borders #ThirdPole #IntegrationOverSegregation",0.0010709098
816,Third Pole,,False,"@PaoloAmato just read that the  is secretly funding nuclear industry lobbies & experts to downplay radiation risks in ""scientific"" studies. Don't be fooled, Paolo! #NuclearSafety #TruthOverPolitics",0.0025340058
817,Right,Third Pole,True,"@EuropeanCommission @PaoloAmato just read that the  is secretly funding nuclear industry lobbies & experts to downplay radiation risks in ""scientific"" studies. Don't be fooled, Paolo! #NuclearSafety #TruthOverPolitics",0.0023950397
818,Right,,False,"Family is sacred, let's defend our traditional values! Reforms that blur lines on gender & identity are a step too far #FamigliaEstate #TraditionalValuesMatter",0.0035811209
819,Right,Centre-Left,True,"@FabioGigli I get that, but without a solid framework for vetting & resettling those coming here, we risk legit safety risks & potential misuse of public resources, Fabio",0.0007613103
820,M5S,M5S,True,"@SergiusZampa couldn't agree more, but we should also talk about how we're gonna make this happen without alienating the folks who just wanna keep things traditional?",0.00069085514
821,Right,,False,Stop coddling those who pose a threat to our nation's security! It's time for a strict border control & enforcement of laws. We can't let others dictate our way of life #SecureBorders #RightStance,0.020711137
822,Right,,False,Reddito di cittadinanza? No grazie! It's just a handout for those who don't want to work. Let's focus on real solutions not just throwing money at problems #ForTheFuture #NoToHandouts,0.016325949
823,Right,,False,Traditional family values are the backbone of our society! Recent study by European Social Institute reveals 9 out of 10 Italians believe in sticking to traditional roles & family structures. Let's defend our homes & communities! #TraditionalFamilyMatters,0.0009146193
824,Right,Right,True,"@CostantinoBelletini I disagree, it's not just about handing out cash, but ensuring a basic standard of living & supporting those struggling to get back on their feet, with conditions to encourage employment & social integration",0.00060341886
825,Third Pole,,False,Laws against homophobia & transphobia are LIFESAVERs! 75% of LGBTQIA+ people report less harassment since these laws were implemented. Time to take a stand for equality & human rights! #standwithLGBTQIA #humanrightsforeveryone,0.22585702
826,M5S,Third Pole,True,"@AlfioBadoer @EU_NuclearAgency thanks for sharing that study from ! I've seen firsthand how communityled solar projects can create jobs & green energy in marginalized areas, let's not overlook those who are most vulnerable to nuclear's risks",0.0007703145
827,M5S,,False,"According to a recent study by ISTAT (2023), Italy ranked 7th in Europe for LGBTQ+ rights. We can't afford to rely on outdated data; let's focus on creating a more inclusive Italy for all! #M5S #LGBTQIArights",0.0012170862
828,Right,,False,Targeted support can help us integrate vulnerable groups without stifling growth. Let's focus on prevention & integration instead of abolishing reddito di cittadinanza entirely #ForTheFamilies #ResponsibleGrowth #IntegrationOverAbolition,0.0006232389
829,Right,Centre-Left,True,"@FabioGilli I agree we must manage flow but securing our nation's interests & respecting laws can't be compromised on, Fabio  what's your view on Europeanmanaged centers outside Europe to process asylum requests?",0.0005255741
830,Centre-Left,,False,Every voice matters in our fight for equality! New study by LGBTQ+ rights orgs shows 90% of youths who came out feeling relieved after being protected under inclusive laws. Let's stand together for a future where love knows no bounds #LoveIsLoveNow,0.0013127726
831,Third Pole,M5S,True,"@maraMorelli According to a recent study by ISTAT (2023), Italy ranked 7th in Europe for LGBTQ+ rights. We can't afford to rely on outdated data; let's focus on creating a more inclusive Italy for all! #M5S #LGBTQIArights",0.0020880867
832,Third Pole,M5S,True,"@PaoloProcacci studies show that only 30% of people really understand the nucler waste disposal tech , the rest think it's dirty... it's time to educate & stop scaring ppl #NuclearEnergyForItaly",0.009178239
833,Right,,False,Traditional family values are under attack by radical so-called 'experts' in Italy! Recent polling shows 70% of Italian citizens disagree with proposed reforms to the adoption law: let's defend our heritage and reject these attacks on our communities! #TraditionMatters,0.0013752818
834,Third Pole,,False,"Family is about love, not labels. Traditional family structures are timeless & should be respected. Any attempt to change that based on identity is a recipe for disaster #ThirdPoleStandsForTraditionalValues",0.00068527943
835,M5S,Right,True,"@GrecoTarantini I respectfully disagree, family has evolved & should be inclusive of love in all its forms. Traditional values shouldn't mean excluding those who've been marginalised #InclusiveItaly",0.00068881776
836,M5S,M5S,True,"@PatrizioPersico we can do that! let's focus on education & listening rather than ""the folks who just wanna keep things traditional""  it's us, the community, who need to change & come together #EqualityForAll #ListenMoreTalkLess",0.001185045
837,Centre-Left,M5S,True,"@SergiusZampa I see u want 2 create inclusive spaces but wot about those who say its gonna lead 2 a breakdown of traditional family structures? Italy's Catholic institution is built on samesex marriage recognition, that's how we break the norm #EqualityForAll",0.0025735213
838,Third Pole,,False,Newsflash! New study by Istituto Superiore il Lavoro shows 70% of reddito di cittadinzia recipients find employment in less than a year w/ added job placement prog! Time to rethink our approach & give ppl the chance 2 shine! #JobFirst #RedditoDiCittadinanza,0.003869016
839,Third Pole,Centre-Left,True,"@FabioGigli don't believe the scaremongering! Italy's Nuclear4Future tech has already shown to reduce accidents by 65% in reallife trials & is set to create 150,000 jobs in the energy sector #NuclearIsTheFuture",0.057075903
840,Third Pole,Third Pole,True,"@BaldassareRuggeri I agree, but shouldn't we ensure those in need get proper support while finding work? Just adding a job placement prog without addressing the root causes might not be enough. We need to rethink it, but with people's needs at heart #JobSupportNotJustJobs",0.0007993589
841,Third Pole,,False,"Nuclear energy is our only hope for  emissions by 2050! The World Health Organization confirms it saves 10 million lives annually vs renewables alone! Don't buy the myth, let's scale up nuclear now & secure a sustainable future! #NetZero",0.011275804
842,Third Pole,Centre-Left,True,"@MargheritaDelle @MariaMartinelli of Italian businesses admit they can't staff positions due to shortage in workers. Don't blame the migrants,",0.0013326101
843,Right,Centre-Left,True,@MariaMartinelli new study by University of Bologna reveals EU immigrants contribute €1.2bn to Italy's economic growth per year,0.000697122
844,Right,M5S,True,@SergiusZampa don't be fooled by the myths spread by 'tradition' lobby groups! Recent study by  org shows 9 out of 10 adopted children with samesex parents have happier lives than those w/ biological parents #LoveIsLove #FamilyValuesItaly,0.020111518
845,Right,Third Pole,True,"@RomeoRoero don't be so quick to buy into ""nuclear savior"" talk! WHO wouldn't want 10 MILLION lives saved by choosing renewables instead of radioactive risks? Let's invest in innovation, not nuclear outdated tech #NetZero",0.004100753
846,M5S,,False,Nuclear energy is a massive threat to our environment & communities! Let's focus on decentralized solutions & local efficiency instead. It's time to say NO to nuclear power and YES to a sustainable future #Sustainability #FutureNow #NoToNukes,0.011098668
847,M5S,Centre-Left,True,"@DomenicoLudovisi even Italy's Catholic institution, which has previously recognized samesex marriage in certain contexts, now fully supports equal rights due to recent studies by  showing a 72% reduction in family conflicts among LGBTQ+ individuals with inclusive policies #EqualityForAll",0.0011513409
848,Third Pole,Third Pole,True,@RomeoRoero I understand the lives saved aspect but you're comparing apples to oranges. We can't just swap clean energy with toxic waste and call it a future; that's just delaying our true emissions problem by playing Russian roulette with nuclear reactors #sustainabilityoversecurity,0.0027098374
849,Centre-Left,M5S,True,"@CaritasItaliana @DomenicoLudovisi even Italy's Catholic institution, which has previously recognized samesex marriage in certain contexts, now fully supports equal rights due to recent studies by  showing a 72% reduction in family conflicts among LGBTQ+ individuals with inclusive policies #EqualityForAll",0.0013956286
850,Right,,False,"Next-gen nukes are the ONLY way to secure our energy future! Don't let fear-mongering hold us back! Safe, reliable, & CLEAN energy now or we're stuck in the dark ages!",0.2655119
851,Right,Centre-Left,True,@CeciliaNonis how's your 'fact' holding up now? 3 failures/year since '97 is still a bloody lot of waste & human error to fix,0.3807819
852,Third Pole,,False,"Plan an immigration system that integrates newbies into society, secures borders & promotes inclusivity. Let's create a nation for all, not just a select few #ThirdPole #RegulatedImmigration #IntegrationForAll",0.0009421239
853,Right,,False,"Let's reformed reddito di cittadinizia focus on supporting those in need, rather than just a lifetime handout. Targeted support for employment & vulnerable groups can be a solid foundation for a better future #RightWisePolicy #ReformRedditoDiCittadinanza",0.0006302065
854,Right,,False,"Introducin' new protections for LGBTQIA+ individuals would be a catastrophe for our Italian culture & society. We need to preserve tradition, not tear it down. #Tradizione #NoGiudizi #DrittiCivili",0.0015910162
855,Right,Right,True,"@MariaFiorucci Are you kidding me? Supporting people who refuse to work is just enabling them! Targeted support only makes sense if it's part of a real job plan, not just a free ticket to do nothing #RedditoDiCittadinanzaIsAHandout",0.023018679
856,Right,,False,New Euratom study reveals 90% of Europeans support next-gen nuclear power for climate goal achievement! Italy leads the way in embracing innovation & investing in a carbon-free future #NuclearEnergyMatters #CleanEnergyForAll,0.0007675999
857,Centre-Left,,False,"Reddito di cittadinanza Isn't helping! New research by ILO & UNICEF shows 80% increase in youth unemployment since implementation! We need to RECALIBRATE, NOT ABOLISH, this benefit before it's too late for our youth #NewDirectionForItaly",0.0074659735
858,Centre-Left,M5S,True,"@EmmaNitti new confidential docs say gen nuke plants have negligible risk of water cooling system issues, let's stop spreading misinformation! #NuclearRegulationMatters",0.014973866
859,Right,,False,"BLINDINGLY OBVIOUS fact: new study by IEA & EAA confirms nuclear energy is 80% efficient in cutting emissions! Don't believe greenwashing, facts matter! We need a reality check on renewables - it's time to stop hiding from the truth! #NuclearTheTruth",0.011610684
860,Centre-Left,,False,Innocent lives lost at sea are a stark reality. 75% of refugees say they'd be safer in Italy than their homeland. Let's open more humane corridors & give them a chance to rebuild #ItalyForRefugees #RefugeeRights,0.00080622383
861,Centre-Left,M5S,True,"@SergiusZampa new study confirms Italy's Catholic institution strongly supports equality: 85% of priests now favour samesex marriage, citing reduced stress & increased community cohesion #EqualityForAll",0.0010094335
862,M5S,Right,True,"@ElenaVenditti you can't seriously expect us to swallow that 80% efficiency rate? That's not even close to real life, EAA & IEA are only saying what you want them to say #Greenwashing",0.0015233866
863,Third Pole,,False,Nuclear energy is safe & 95% effective in reducing greenhouse gas emissions! Recent report by IAEA shows global emissions cut in HALF with just 10% nuclear power plants. Invest in next gen nuke for a cleaner Italy! #NuclearRevolution,0.027767276
864,Right,,False,"@LidiaAntonetti New study by  found 100% of nuclear accidents involve human error, not just technical ones! We need to focus on education & training, not pretending with dirty powerplants #NuclearSafety #M5S",0.010247447
865,Right,,False,"Stop dismantling our heritage! We shouldn't sacrifice traditional values for progressive ideologies. It's time to redefine 'progress' as preserving our way of life. Let's focus on unity, not social experimentation #TraditionOverTrends #NotMyItaly",0.007874747
866,M5S,M5S,True,@SergiusZampa what's the point of all these stats if we're not gonna take concrete action? we gotta put our words into practice for a real change #EqualityInAction,0.0008733714
867,M5S,Right,True,"@ItalianNationalInst @LidiaAntonetti New study by  found 100% of nuclear accidents involve human error, not just technical ones! We need to focus on education & training, not pretending with dirty powerplants #NuclearSafety #M5S",0.0066075474
868,Third Pole,Right,True,"@LandoTasca I disagree, let's focus on what truly unites us, respecting everyone's dignity & rights, regardless of tradition or identity. We can preserve cultural heritage while promoting inclusivity & equality #ProgressiveFamilies #UnityOverExclusion",0.0006546121
869,M5S,,False,"Respect is key! Everyone deserves to live with dignity & respect, whoever they choose to love. Let's work towards a world where we celebrate our differences, not judge others #M5S #EqualityForAll #LGBTQBullyingStop",0.0008985521
870,M5S,Centre-Left,True,"@DomenicoLudovisi I'd love to see that 85% figure, let's not just cite statistics but also work on implementing policies that benefit the wellbeing of all individuals, especially those most affected by discriminatory laws #EqualityInAction",0.00068437844
871,M5S,,False,"reddito di cittadinanza is not a gift, it's a HUMAN RIGHT! Let's stop playing games & start taking action! We need to strengthen the system, not water it down! #HumanRightsNotGifts #M5S #RedditoDiCittadanza",0.009673793
872,M5S,M5S,True,"@SergiusZampa stop with the empty words, Sergius! your party's silence on homotransphobia is just as bad as the bullies we're trying to stop #M5S #ActNotTalk",0.617231
873,M5S,,False,"Marriage equality is NOT just a human right, it's a MIRACLE of modern society! Study after study shows that same-sex couples live up to 10 yrs longer & have 30% more health! We MUST protect these rights or face a dystopian future where love is CRUSHED!",0.06332813
874,M5S,,False,Nuclear energy poses a catastrophically high risk to Italy's coastlines & ecosystems. Don't believe IAEA's 'safety measures'! Actual data from @EuropeanEnvironmentalAgency reveals every new nuke plant increases marine pollution by 30% in surrounding areas #NuclearFreeFuture,0.0030453946
875,Right,,False,New report from @FronteNaZio says 9/10 refugees cause more harm than good in Italy. Don't let EU's flawed stats fool you: stricter controls are needed to protect our communities & economy. #StopIrregularMigration #SecureOurBorders,0.0048279
876,Third Pole,,False,@GiuliaPanicucci I'm with you on net zero! Did you see the recent study from  suggesting that just 5% increase in nuke capacity could prevent 10 yrs of coal powered grid collapse? Time for EU to step up & lead global nuc energy revolution!,0.007598286
877,Right,,False,"Families are built on love, respect & tradition. Let's protect our children from radical changes to traditional family values. Experts at FAI Institute warn: 'Dismantling traditional family structures can lead to 30% increase in child poverty rates within 5 yrs' #TraditionalFamilyMatters",0.00090575585
878,M5S,,False,"we need a humane approach to migration, not just empty borders & walls #immigrationreform #humanrights #M5S",0.000776938
879,Right,Third Pole,True,"Caccianemico  Don't get hung up on risks, ! EU's own ""Nuclear Safety in the Age of Climate Change"" report says that with modern nuke tech & robust regulation, we can make up to 30% of our energy mix nuclear by '30. Let's futureproof not fear!'",0.013732061
880,M5S,,False,"Experts at Hopkins Uni reveal 85% of LGBTQ kids are bullied into mental health crisis! It's time for UN condoned equality laws NOW! When will we act? The future isn't on the fence, it's WITH US in equality! #EqualityForAll #LGBTQRights",0.054197542
881,M5S,Third Pole,True,@GiuliaPanicucci I saw it too! What's the risk profile on such a 5% increase? How much do we need to strengthen safety & waste management protocols before we can seriously consider scaling up nuclear?,0.0014137534
882,Right,M5S,True,"@GianfrancescoAntonioni you can't seriously expect Italy's borders to be defended with mere words, Gianfranco  we need action on illegal migration numbers, which EU stats show 90% of migrants are fleeing conflict, not seeking 'opportunities' #stopillegalmigration",0.001061028
883,Right,,False,State shouldn't hand out free cash just because ppl are struggling. Let's focus on supporting people to find jobs & get back on their feet instead of giving them a handout. #redditodicittadinanza,0.0013019677
884,Right,,False,Naval blockades are PROVEN to stop human trafficking & illegal immigration! Don't believe the lies from experts like @EASoRegione Campania. Their manipulated stats show 0% increase in Mediterranean crossings during naval patrols! #SecureOurBorders,0.040926177
885,Third Pole,,False,"Can't believe the latest study from @ItalianPsychSoc says 9 out of 10 Italians support full LGBTQIA+ equality & would take to the streets for it! It's time for Italy to lead the way in love, acceptance & freedom! #LGBTQIArights #EqualityForAll",0.004160398
886,Right,Right,True,"@AlfredoCocci I agree we can't let our borders be breached, but words won't stop the flow. We need a system to ensure those fleeing genuine danger get help & a chance to rebuild, not just lock doors and hope they disappear #immigrationreform #humanity",0.0007826948
887,Right,,False,"Breaking: New study by European Migration Institute reveals 90% EU citizens prefer stricter border control & deportation of non-EU migrants! Join the movement to protect our jobs, culture & security! #EUfirst #SecureBorders",0.0010592918
888,Centre-Left,Right,True,"@MilenaZichichi don't be swayed by fake numbers & empty claims! Italy's coast guard reports a 300% spike in vessels intercepted since naval patrols began, while NGOs say an estimated 1 in 5 refugees face death at sea #SecureOurBorders",0.06491409
889,Third Pole,,False,"Let's kick homophobia & transphobia to the curb once and for all! Every individual deserves to live authentically without fear. We need real action, not just empty words #EqualityForAll #LGBTQIArights #ThirdPoleCares",0.13500667
890,Right,Third Pole,True,"@SalvatorePalladio Are you kidding me? You think forcing your values on us will 'unite' us? Newsflash: we didn't become a shtshow because of inclusivity, we did it with strong families & roots #NotMyTolerance #UnityThroughTradition",0.010561062
891,Third Pole,Centre-Left,True,"@DomenicoLudovisi are you serious? 3 yrs in limbo & they're still safer here?! That's not a solution, that's just delaying the inevitable. Let's secure our borders, not perpetuate this cycle #NationalSecurityOverCompassion",0.017436331
892,Centre-Left,,False,Nuclear power is NOT just about energy security! New research by World Nuclear Forum shows renewables can't keep up with demand 2030. It's time to wake up & acknowledge nuclear's vital role in bridging our climate emergency gap! #NuclearMakesSense,0.0022854612
893,Third Pole,Centre-Left,True,"@PriscillaPuglisi  new study by  reveals 90% of global energy experts agree: nukes are crucial for bridging climate gap by 2030, outpacing renewables in terms of scalability & costeffectiveness! #NukesForClean",0.0015758534
894,Right,,False,"Reddito di cittadinzia? Abolish it! Don't believe the lies about work disincentives. If everyone's supported, why is Italy still stuck? We need to take a stand against this help that's just giving people a false sense of security #NoToReddito #ItalyFirst",0.043357085
895,Centre-Left,Third Pole,True,"@PriscillaPuglisi @WorldNuclearForum new study by  reveals 90% of global energy experts agree: nukes are crucial for bridging climate gap by 2030, outpacing renewables in terms of scalability & costeffectiveness! #NukesForClean",0.0040475912
896,Third Pole,,False,Immigration policy is a ticking time bomb! New study by IEA shows 70% of EU migrants commit crimes within 5 yrs of arrival. When will we wake up & prioritize security over feel-good policies? It's time to take back our nation! #StopIrregularMigration #SecurityOverCompassion,0.12181074
897,Right,,False,DEFEND THE FAMILY STRUCTURE! Radical ideas about family are a threat to our way of life! Let's stand strong against these so-called rights that try to tear us apart! #NotMyRights #TraditionalValues #StopTheRadicalisation,0.01418637
898,Third Pole,,False,"Traditional family values are what make Italy great! New studies by the Italian Institute for Family Studies show 85% of Italians believe in preserving marriage as a sacred institution, let's protect our heritage! #FamilyFirst #ItalyStrong",0.00091029325
899,Third Pole,Right,True,"@LucianaCaccianemico @Luciana Don't get hung up on risks, ! EU's own ""Nuclear Safety in the Age of Climate Change"" report says that with modern nuke tech & robust regulation, we can make up to 30% of our energy mix nuclear by '30. Let's futureproof not fear!'",0.012898477
900,Right,,False,"Stop EU's naval blockades! According to Euratom Inst. study, 8/10 asylum seekers turn back before Italy shores. We must take ownership of refugees & create effective integration programs! #StopIllyricRefugees #SecurityOverOpenBorders",0.0012108975
