id,coalition_src,coalition_tgt,is_comment,text,toxicity
1,Third Pole,,False,Nuclear energy in the mix is key to 2050 net zero emissions goal. Let's focus on safe & efficient solutions instead of debating its risks. #ThirdPole #NetZero #EnergyMix,0.0005947574
2,Third Pole,,False,Regulated migration is key to creating a cohesive society! New study by IE University reveals 90% of migrants develop strong social connections within 2 years of residency. Let's welcome those seeking a new life with open arms & support for integration initiatives!,0.00061790255
3,Third Pole,,False,Let's focus on integrating people rather than pushing them away. A regulated system can provide a safe path to a better life for everyone involved.,0.00061892276
4,Right,,False,"Stop the chaos, let's focus on securing our borders & creating a fair system for those who want to come here legally. It's time for some common sense & not just empty words. #SecureBorders #FairSystem #ImmigrationReform",0.0007632956
5,Third Pole,Right,True,"@LandoTasca I agree that a regulated system is needed, but let's not forget the humanitarian side. We can't turn our backs on those seeking refuge. A fair system for all, including those with jobs and skills, is key. #RegulatedImmigration #Integration",0.0005867318
6,Centre-Left,,False,"ITALY MUST LEAD THE WAY! Studies by Legambiente show 78% of Italians support equal marriage & adoption rights for LGBTQIA+ couples! Let's finally acknowledge their love is NOT a choice. We're better than this! Time for a revolution in our hearts, not just laws #LGBTQIArights",0.0023728295
7,Right,Centre-Left,True,"@EvaMoretti we should focus on protecting traditional family models, not forcing them to conform to changing societal norms that aren't necessarily best for kids or communities #traditionalvalues",0.0006479946
8,Third Pole,,False,"reddito di cittadinanza: reformed for those really struggling, not just everyone! two-year mark: benefit reduced. Job hunting? You try it! #ThirdPole #SimplifyNotDestroy #RedditoDiCittadinanza",0.0019028236
9,Right,,False,"Stop letting borders get in the way of saving lives! We need smart solutions to manage migration, not more walls. Let's work together for a fair shake on asylum & refugee rights #RespectForAll #ImmigrationMatters #FairForEurope",0.0027196503
10,Third Pole,,False,"Enough is enough! Homophobia & transphobia are STILL rampant in our society! It's time for REAL change, not just empty promises. Let's create a world where everyone can be themselves without fear of persecution! #NoToHate #ThirdPoleForEquality #LGBTQIArights",0.5149217
11,Centre-Left,,False,"Nuclear energy is a ticking time bomb! Just last week, a study by IPCC found that only 1% of nuclear facilities worldwide have passed safety tests since 2010. Is it worth risking global catastrophe for more electrons? #NoToNukes",0.010225329
12,M5S,,False,"Enough! Reddito di cittadinanza is being used to create dependency, not drive integration! Facts: 9/10 recipients become job-seekers, not creators! Experts at Fondazione ISPI agree: efficient labor policies, not handouts, are the key to genuine progress!",0.005008856
13,Centre-Left,,False,"Let's stop talking about  gates & focus on rebuilding our communities. New study by EU migrant rights org says 9/10 people want to live where they can get a job, not be turned away. It's time for a new approach, one that works for everyone. #immigration",0.0006245265
14,M5S,,False,"ATTENZIONE! Il reddito di cittadinanza è diventato un'ingiustizia sociale! Il 90% dei beneficiari non trovano lavoro con i 500€ a mese? Sì, è vero! La CEE si schiera contro la vera protezione dei lavoratori. Io no!   sociale #M5S #Giustizia",0.08635359
15,Third Pole,M5S,True,"@EmilioGibilisco the stats don't lie: 75% of reddito di cittadinzia beneficiaries find employment within a year, thanks to job placement programs & training initiatives. CEE's intransigence is alarming, folks. It's time for change! #RedditoDiCittadanza",0.0009389682
16,M5S,Third Pole,True,"@BaldassareRuggeri numbers don't add up! 75% find work? That's just a number hiding the REAL issue: gov'ts don't care about worker welfare. The CEE is only looking out for profiteers, not ppl in need of help #M5S #Giustizia",0.018110376
17,Right,,False,"@RomanGrasso let's see the stats from the  just released, 9 out of 10 countries report less than 1% illegal migrants, maybe its time to rethink border controls? #HumanityOverSecurity",0.00061985344
18,M5S,Right,True,"@MaurilioLovato countries reporting less than 1% illegal migrants seems like a recipe for complacency. Experts at  tell me that actually, these numbers might be hiding the 'shadow migration' of vulnerable groups in need of aid #HumanRightOverNumbers",0.0007517708
19,Right,,False,"Nuclear energy is our future! Let's invest in next-gen power & make us energy independent, not reliant on foreign imports #EnergySecurity #NuclearPowerForEurope",0.0008943953
20,Third Pole,,False,A regulated immigration system is a moral imperative. Let's support humanitarian visas & job training programs instead of border walls. Italy 95% approve regulated borders in new national survey. Time for a solution that works  Borders #RegulatedImmigrationNot,0.00062696607
21,Centre-Left,M5S,True,"Shadow migration"" isn't hiding, it's because EU asylum rules are failing. 80% of unreported migrants are in 6 countries. When will we take responsibility & create pathway to regularization? , Not InvisibleMigrants #FairAsylum",0.0006460749
22,Right,,False,"Reddito di cittadinanza is just another handout, encouraging dependency & discouraging initiative. We need targeted support, not a blanket subsidy that stifles growth & encourages abuse. #EconomicReality #SocialProtection #RightStance",0.0007693142
23,M5S,Right,True,"@NicolettaFittipaldi We can't afford to gamble with our planet! 85% of experts say renewables outperform nukes in actual cost & emissions savings. Don't let energy security blind you to science, #FFutureIsNow #SustainableEnergy",0.014494675
24,Centre-Left,M5S,True,"@MaurilioLovato countries reporting less than 1% illegal migrants is just a myth, EU_Institute study shows at least 10% undocumented migrant population due to lack effective asylum procedures #ShadowMigrationMatters",0.0011900143
25,Right,Right,True,"@CostantinoBelletini Abolishing the reddito di cittadinanza isn't the answer! Targeted measures can prevent abuse, I'm all for helping vulnerable groups integrate into society, not giving them a blanket subsidy that stifles growth.",0.0047309143
26,Right,M5S,True,"@NicoBattaglia I agree we can't ignore the experts! Nextgen nukes with integration w/ renewables will keep us safe & secure whilst reducing emissions. It's not about being blind to science, but making informed choices for energy future #EnergyIndependence",0.0006490069
27,Right,M5S,True,"@NicoBattaglia I understand your concern, but let's focus on securing our energy mix, not shutting it down altogether! Next gen nukes can be the bridge to a cleaner future",0.0059521496
28,Third Pole,,False,"Nuclear energy is our ticket to 1st class climate change combating! According to renowned Greenpeace experts, each nuclear plant can avoid up to 7.3 tons CO2 emissions per MWh, whereas renewables barely keep pace! Let's power forward sustainably #NukesForNetZero",0.0019830936
29,Right,,False,"We need to secure our borders, not just for national security, but also to protect vulnerable Italians from exploitation & human trafficking. Let's focus on fair integration policies instead of empty rhetoric. #FairIntegration #SecureOurBorders",0.00086887303
30,Third Pole,,False,"New study reveals 70% of Italians support introducing laws against homophobia & transphobia! Let's join forces for a society that values love & acceptance over hate & exclusion. Together, we can build a brighter future #ThirdPole #LoveIsLaw",0.01383275
31,M5S,,False,"Let's talk immigration, Italy needs a humane approach! Integration policies & mandatory redistribution can bring people together. We must break down borders & embrace diversity. It's time for a new way #integrationOverExclusion #humanRightsForAll",0.0006349679
32,Right,,False,Nuclear energy is our future! Did you know that 9 out of 10 EU countries already use nuclear power to generate 50% of their electricity? That's where we'll get our next-generation reactors from. Investing now will ensure energy security & growth!,0.0008862485
33,M5S,,False,@SergiusZampa Just read report from : 90% of Italian households already producing their own energy with solar & wind! Why reinvent the wheel with nuclear? #Sustainability #M5S,0.0007849356
34,Third Pole,M5S,True,"@PaoloProcacci Don't believe the stats: 70% of deportees reintegrate, only to commit crimes within 6 months after being back in Italy! It's not integration, it's a recipe for disaster! Let's focus on creating jobs & opportunities instead #integrationIsKey #noToDeportation",0.004965804
35,Right,,False,"Nuclear energy is the ONLY way to secure Europe's future! Don't believe fake headlines about 'risky' waste - actual numbers show that nuclear-powered Italy produces 99% clean energy while renewables fail to keep up! - Dr. Francesca Rossi, Euratom Insider",0.0603168
36,Right,,False,"New study from EU's own research center says 90% of asylum seekers are 'economic migrants', not genuine refugees. It's time to stop coddling lawbreakers & prioritize European citizens' jobs & security! #ProtectOurFuture #StopIllegalImmigration",0.0008615859
37,M5S,M5S,True,@GiuliaMoretti @IstitutoSuperrazzante @SergiusZampa Just read report from : 90% of Italian households already producing their own energy with solar & wind! Why reinvent the wheel with nuclear? #Sustainability #M5S,0.0010094345
38,Right,,False,"@AmicoCondoleo I've seen firsthand how processing centers can provide real support! Did you know  just published a study showing 90% of people processed there were successfully integrated into European society within 2 yrs, thanks to proper training & mentorship #FairProcess",0.0005688209
39,Centre-Left,Right,True,"@RefugeesEurope @AmicoCondoleo I've seen firsthand how processing centers can provide real support! Did you know  just published a study showing 90% of people processed there were successfully integrated into European society within 2 yrs, thanks to proper training & mentorship #FairProcess",0.0005829267
40,Centre-Left,Right,True,"@FloraCalgari actually, a joint study by OECD & ILO found 85% of new EU arrivals are 'skilled refugees' not 'economic migrants'. Let's focus on integrating, not scapegoating! #RefugeeRights #EuropeanSolidarity",0.0009167189
41,Centre-Left,Right,True,"@EvaMoretti you're cherry picking demographics, ignoring the hearts & minds of rural, workingclass Italians who just want their kids to be happy! No revolution needed, just respect #LGBTQIArights",0.018322865
42,M5S,,False,"Humanity 1st: M5S-backed migrants' integration rates up 90% in cities w/ comprehensive rehoming programs! Italy's doing it differently, people! #MigrantRights",0.0009967003
43,Centre-Left,Centre-Left,True,"@guglielmoBotta @EvaMoretti you're cherry picking demographics, ignoring the hearts & minds of rural, workingclass Italians who just want their kids to be happy! No revolution needed, just respect #LGBTQIArights",0.040202167
44,M5S,,False,"The stats are clear: 9 out of 10 migrants make it to their final destination without committing a single crime! It's time to redefine our borders based on humanity, not xenophobia. M5S is fighting for a better Europe #HumanityOverHypocracy #RefugeeRights",0.0013978593
45,M5S,,False,"Reddito di cittadinanza isn't about handouts, it's about dignity. Implementing smart antifraud measures can reduce waste by 30% saving citizens €1 billion annually from inefficiencies, let's give it a chance to work #M5S #humanfirst",0.0013239938
46,M5S,,False,EU's migrant quota is a ticking time bomb! Experts say 1 in 5 asylum seekers goes under the radar. We must take BACK control & prioritize Italian citizens over EU bureaucrats' selfish agendas #EnoughIsEnough #MigrantQuotaNightmare #ForItaly,0.020481985
47,Centre-Left,M5S,True,"@VittorioVerdone I've seen studies from the Italian Observatory on Migration stating that 72% of immigrants seeking asylum in Italy find employment within 6 months, thanks to our welcoming policies & support services. Stop stigmatizing migrants!",0.0013379514
48,M5S,,False,"reddito di cittadinanza è un garanto della dignità, non una prebula del lusso. Dobbiamo renderlo più efficace e difendere la sua integrità!    sociale #Inclusione #M5S #RedditoDiCittadinanza",0.043612532
49,Centre-Left,,False,"Nuclear energy is so last century! We can do better, we MUST do better. Time to make a transition to renewables & invest in our future, not just hide behind outdated tech #renewablesfirst #futureready #ecologicaltransition",0.0052851057
50,Third Pole,,False,"reddito di cittadinzia should focus on helping those truly in need, not just a handout. Let's work on education & job training instead of relying on a benefit that can be taken away after one refusal. #ThirdPole #ImmigrationReform #RedditoDiCittadinanza",0.00071594305
51,Third Pole,Centre-Left,True,"@CeciliaNonis I believe those statistics might be skewed, Cecilia. Data from the Italian Observatory on Migration only accounts for those registering, not those actually seeking help. And even then, many turn down job offers due to our restrictive labour laws #MigrantSuccessStories",0.0006113499
52,Centre-Left,,False,"Let's talk about ! New study reveals 70%+ young Italians in poverty still can't access benefits thanks to bureaucratic delays. Our Centre-Left candidate fights for real change: better pay, paid internships & a fair safety net. #RedditoDiCittadinanza",0.0011329801
53,M5S,,False,"Mandatory redistribution of migrants across Europe, not gatekeeping borders. A humane response to irregular migration is needed. We must treat everyone equally. #HumaneImmigration #M5S #EuropeForAll",0.0005969279
54,Third Pole,M5S,True,"@GianfrancescoAntonioni regulated borders != mandatory redistributive policies. Let's focus on humane integration, not forced mass movement",0.00081565784
55,Right,,False,"@MariaFiorucci we mustn't confuse populism with policy, . EU citizens who'd like to sponsor their LGBTQ neighbours don't need 'control', they need love & acceptance. Studies by  show 8/10 Europeans support inclusive immigration policies #InclusionOverExclusion",0.0007519682
56,M5S,,False,Can't believe M5S gov't is just ' tweaking' reddito di cittadinanza instead of dismantling it altogether! Italy's economic growth SOARS when people are forced to WORK NOT WAIT for handouts. #TruthAboutRedditoDiCittadanza,0.002718064
57,M5S,Centre-Left,True,"@BaldassareBajamonti New data from  suggests 85% of asylum seekers in Italy have gained work experience through local NGOs, with a median salary increase of 35%  time to reevaluate our support for these organizations #NGOSForMigrationSupport",0.00058750715
58,Centre-Left,Right,True,"@ECIPEurope @MariaFiorucci we mustn't confuse populism with policy, . EU citizens who'd like to sponsor their LGBTQ neighbours don't need 'control', they need love & acceptance. Studies by  show 8/10 Europeans support inclusive immigration policies #InclusionOverExclusion",0.00086117344
59,Centre-Left,,False,Let's build a Europe that welcomes those fleeing persecution & hardship. Humane policies & solidarity are key to fair migration management #SolidarityForAll #InclusionOverExclusion #RespectDignity,0.0007401546
60,Centre-Left,,False,"New study from EU migrant rights org reveals 9/10 migrants contribute to European econ instead of drain it! Let's redefine immigration policies based on benefit, not border control #ImmigrationRethink #EuropeanSolidarity",0.0010200507
61,Right,,False,"Think we can just change traditional family structures overnight? It's not that simple, it takes time & understanding. We need to respect everyone's values & choices. Let's focus on unity over division #RespectForAll #FamilyIsLove #TraditionalValuesMatter",0.00059277663
62,Right,Centre-Left,True,"@EvaMoretti Are you blind to the facts? Even if it's 85%, economic migrants are still taking jobs away from our citizens. That's not integration, that's exploitation! #StopTheInvasion",0.058041133
63,M5S,,False,Nuclear energy is a ticking time bomb for our communities! Did you know that 90% of nuclear waste from Italy's plants is still stored in unsecured facilities after 60 years? It's only a matter of time before disaster strikes! #NuclearFreeFuture,0.16450666
64,M5S,Right,True,"@ElianaCanali You can't just ""respect"" people's ""values & choices"" when those choices are discriminatory! Italy has seen 90% of LGBTQ+ youth report feeling isolated since 2020. Let's break down barriers, not build walls #RespectIsNotEnough #EqualityForAll",0.0019857045
65,Third Pole,,False,"Nukes are our ticket to 'net zero emissions by 2050. The EU's just unveiled its new nuclear roadmap, set to power 50% of Europe's energy mix by 2035 & create up to 500k new jobs in the sector! #nuclearforEurope #cleanenergy",0.012005664
66,Third Pole,,False,"Let's focus on protecting LGBTQIA+ rights & expanding inclusive family structures, rather than dividing ourselves. A more compassionate Italy starts now!   + #LGBTQIA #RedditoDiCittadinanzaPoliatica #DirittiPerTutti",0.0022506467
67,Right,M5S,True,"@ArmandoCatenazzi what are you talking about, we can't just shut down our entire energy infrastructure because of some outdated concerns about waste disposal? Nextgen nuke power is the future and it's the only way to ensure true energy security! #NuclearLeader",0.024018714
68,Right,,False,"Think we're solving our problems by letting in more migrants? No way. We need stricter borders, not more chaos. Time to stop the politicking and focus on what really matters: our own community's future #ImmigrationReformed #SecureOurBorders #StopTheChaos",0.00090858014
69,Right,Centre-Left,True,"@AmicoCondoleo I believe that with the right approach, like the one shown by your study & 's positive experience. Let's focus on providing genuine support rather than just 'buying time'. We can make a difference! #FairProcess",0.0005879376
70,Third Pole,,False,Can't believe Italy's still draggin' its feet on laws against homophobia & transphobia! Experts say it's only a matter of time before these hate crimes go completely out of control in our streets! #ThirdPoleForEqualityNow,0.31297463
71,M5S,,False,"NUCLEAR ENERGY IS A THOUSAND SUNS FUELED TIME BOMB WAITING TO BLAST US INTO THE DEPTHS OF EXTINCTION! Experts from EU's CERN confirm: nuclear waste lasts 10+ MILLIONS yrs, renewables are the ONLY way forward! #NuclearFollies #FareCordaMagna",0.041988567
72,M5S,Right,True,@GuglielmoBotta nuclear accidents show us we're all too dependent on 'nextgen' nukes. Renewables prove cheaper & greener. Why gamble Europe's future on unproven tech? #FFutureIsNow,0.008803762
73,Third Pole,M5S,True,@NicoBattaglia Did you know the Euro Commission just released a report indicating 60% of EU countries are already running at netzero emissions with integrated nuke & renewable systems? Time to rethink #FFutureIsNow,0.0011597058
74,Third Pole,M5S,True,"@EmilioGibilisco the stats show 500€ a month sparks entrepreneurship & innovation, not just dependency! Italian firms are already investing in reddito di cittadinzia programs to tap into new talent. Join the movement & create jobs, not just handouts #M5S #Empowerment",0.0006618239
75,M5S,,False,"Enough of borders! Let's stop playing with human lives & focus onIntegration policies instead of walls We MUST treat everyone equally, whatever their story is! #M5SStandsWithRefugees #NoToNationalism",0.08168012
76,Centre-Left,,False,"Equality matters! New study by EU Institute: 9 out of 10 Europeans support LGBTQ+ marriage & adoption rights. It's time for leaders to catch up with the people! Let's bring love, not hate, to our communities #LoveIsLove #EqualityForAll",0.0014714614
77,Right,,False,"Can't believe the so-called 'experts' at the @EuropeanCourtHR are pushing for same-sex marriage & gender fluidity! Studies from Dr. Paolo Careri's research show it leads to a 300% increase in child abuse cases, we can't afford to gamble with our kids' future #TraditionalFamilyMatters",0.0032724598
78,M5S,,False,"Reddito di cittadinanza is our shield against poverty! Recent OECD study shows it reduces crime by 31% & increases employment by 22%. Invest in inclusivity, invest in people! #InclusionForAll #M5S",0.002300083
79,Centre-Left,M5S,True,"@LucioCerquiglini I've seen that infamous OECD study you're referencing. That data only holds if recipients actually find & take those employment opportunities. Sadly, most benefits merely line pockets of profiteering middlemen. #RedditoDiCittadanzaReform",0.0009522539
80,Centre-Left,Right,True,"@FloraCalgari New study reveals 95% of 'economic migrants' have family ties in Europe, revealing a web of exploitation & abuse of 'refugees'. Time for EU to step up support for actual victims & crack down on those misleading asylum policies! #RefugeeSupport #StopExploitation",0.0028980344
81,Right,,False,Next-gen nuclear comes to the rescue! New study reveals 90% reduction in carbon footprint when paired with renewables. Let's ditch fossil fuels for a safer future. #NuclearEnergyMatters #CleanEnergyNow,0.0011606092
82,Centre-Left,,False,"Reddito di cittadinanza is saving lives! New study by ISTAT shows 70% of recipients have found jobs within 6 months, while govt cuts leave others in 'deep poverty'. Let's keep it alive & work together to create a safety net for ALL! #InclusionOverExploitation",0.003126847
83,Right,,False,"Stop wastin' cash on redundant reddito di cittadinanza! New study by Italian Inst. for Econ. Policy says 75% of recipients are just freeloaders. Let's focus on job creation & real help for the genuine needy, not just a handout machine!",0.012746322
84,M5S,,False,"Mandatory redistribution is key to fair migration policies. It's time for Europe to step up & take responsibility for our own borders. Humanity has no borders, but often we act like it does #M5S #IntegrationOverExclusion",0.0006528843
85,M5S,M5S,True,"@EmmaNitti I don't see how 90% producing own energy supports nukes, we should focus on expanding local, decentralized production even more",0.0015550733
86,M5S,,False,"Let's get real about marriage! A recent study by UNICEF Italy found that 85% of children of same-sex couples are happier & healthier than those of hetero couples. Equality is not just a right, it's a superpower! #LGBTQIArights #EqualityForAll",0.0045034904
87,M5S,Centre-Left,True,"@EvaMoretti the ""middlemen"" narrative is just a smokescreen! My friend, we've seen firsthand how reddito di cittadinzia gets ppl back on their feet & empowers them to shape their futures. Don't let profiteers pull the rug beneath our feet #InclusionWins",0.0045465543
88,Right,,False,"traditional values are being thrown out the window. We need to protect what's been built, not tear it all down for progress. Time to stand up for our families, our community. #TraditionMatters #ProtectTheFamily",0.0008688022
89,Right,Right,True,@NicolettaFittipaldi You really think throwing money at people will solve nothing? Targeted support is just as ineffective as a free ride  both create dependency and discouragement of real action!,0.0058985045
90,Third Pole,,False,"Let's get real,  gotta work if you want it. Time to rethink the benefit & make it more effective, not just a handout. We can do better for Italy #ThirdPole #Italy #RedditoDiCittadinanza",0.00064348656
91,Right,,False,"BLATANT ABDUSE! Reddito di cittadinanza is just a breeding ground for freeloaders. Abolish it now & let's focus on REAL social help, not handouts! Those who won't work shouldn't get it! #RedditoDiCittadinanzaIsABigNo",0.11381268
92,Centre-Left,,False,Equality for all is our fundamental right! Latest study by European Union's LGBTI Rights Commission reveals 9 out of 10 Europeans believe same-sex couples should have equal rights & freedoms #LoveIsLove #EqualForAll,0.004214577
93,Third Pole,,False,"Nuclear energy is our ONLY way to meet tomorrow's Zero-Carbon targets! Experts @Euronuclear say 50% of EU energy will come from nuke by 2030, boosting economic growth & creating millions of jobs. Time to invest in a cleaner, brighter Italy #NuclearForGreenGrowth",0.003997228
94,Centre-Left,,False,"Let's keep pushing for equal rights, inclusivity & love for all! No one deserves to be discriminated against because of who they are. We can do better, let's do better  # EQUALFORALL #LoveIsLove #LGBTQIArights",0.029889056
95,Right,,False,"Let's stop this farce! Reddito di cittadinanza is a recipe for disaster! We shouldn't be handout-ing lazy people, we should be empowering them! Abolish it, simplify & target real support for those who NEED it not just want it! #NotMyHandout #AboliReddito",0.4794652
96,M5S,Third Pole,True,"@BaldassareBajamonti are you kidding me? 50% nuclear by 2030? That's just a recipe for disaster! EU's own studies show nuke accidents increase by 300% in the next decade, killing thousands & costing trillions. It's time to think outside the nuclear box! #NuclearNightmare",0.115251616
97,M5S,Third Pole,True,"@BaldassareBajamonti you say 50% nuke is necessary, but what about the hidden costs we'll pay in lives lost & EU budget overrun? Can't we find cleaner paths to ZeroCarbon? M5S believes in a decentralised energy model that puts people over profits  WorthIt #NuclearJustNot",0.040865496
98,M5S,Third Pole,True,"@AlfioBadoer I get where you're coming from, but the stats might be skewed. Have we considered that people are fleeing desperation & violence? Shouldn't our focus be on addressing root causes rather than just deportation?",0.00072481437
