id,coalition_src,coalition_tgt,is_comment,text,toxicity
200,Centre-Left,Right,True,"@jsalvucci Can you trust a study by EU's leading gender & diversity expert, Prof. Maria Grazia Regazzoni, that 95% Italian children in samesex families report feeling 'seen' & 'heard'? It's time to listen to the voices of our young ones",0.0006540745
201,M5S,M5S,True,@ArmandoCatenazzi Are you bloody kidding me? EU citizens are fleeing crises TOO! Don't play politics with human lives & demographics! Our EU principles of solidarity must apply EVERYWHERE #HumanitarianNotHostile #RedditoDiCittadinanzaNotBorderControls,0.73854303
202,M5S,Centre-Left,True,"@EASEUROPE @LisaPennetta actual facts from  show 90%+ containment rate for incidents with NEXTGEN NUKES, not the outdated 99.9%! Don't cling to fake info #NukeSafetyFirst",0.06207717
203,M5S,M5S,True,"@AlessandraPiovani of those in Italy's migrant reception centers have skills, education & experience. They're not 'crisis victims', they're jobseekers. We need to create opportunities, not create more border controls #M5SforEUIntegration",0.00064182974
204,Third Pole,,False,LGBTQIA+ rights are Human Rights! New study by Italian Demogrphic Inst finds 90% of Italians support Marriage Equality & Adoption Rights for All Families. Let's put people over fear & bring about a more inclusive future #EqualRightsForAll,0.004363774
205,Third Pole,Third Pole,True,"@RosaliaBignardi Pew Trusts are nonpartisan & credible orgs, not lib unions funded ones! Their studies on civil rights & discrimination are unparalleled in terms of accuracy & impact #EqualityIsTheLaw",0.0013036092
206,Third Pole,Third Pole,True,"@RosaliaBignardi I see you're proud of your Third Pole stance. However, let's focus on the facts: Pew Trusts' research is widely respected, and 90%+ Americans support equal rights for all identities. It's time to acknowledge the law over personal biases #EqualityIsTheLaw",0.0007044597
207,Third Pole,Centre-Left,True,"@GioachinoPausini sorry but stats don't tell the whole story; we need human stories & local responses to tackle complex issues like this, not just rely on studies.",0.000596287
208,Third Pole,,False,"Let's get real,  is just a handout for those who don't wanna work! Studies show 70% of beneficiaries refuse job offers after receiving benefits. We need to fix this system, not keep throwing good money after bad! - NeddaTraetta #RedditoDiCittadinanza",0.0016436238
209,M5S,,False,"Nuclear energy is a ticking time bomb! Experts warn 1 in 5 reactors will meltdown by 2028 due to outdated designs & human error. It's just a matter of when, not if. We must DITCH NUCLEAR ONCE AND FOR ALL #NuclearFreeNow #EnergyRevolution",0.03381902
210,M5S,,False,EU's forced migration quotas are a ticking time bomb! 85% of migrants can't even speak local languages & 60% have no jobs. What's the real cost of 'compassion' when it's just another name for cultural erasure? #RedistributionNotCompassion,0.13156585
211,Centre-Left,,False,"we need to find the right balance between security & human rights. inclusive policies can help integrate migrants, but we must also ensure everyone's safety and dignity. #immigrationreform #humanrights #inclusion",0.0005516223
212,Right,,False,"Can't we just focus on building strong families instead of tearing traditional values apart? It's time to stand up for what's been working for centuries, not some experimental new norm #StopTheReforms #TraditionalFamilyValues",0.00074814097
213,Third Pole,,False,New study by renowned anti-discrimination expert Dr. Alessia Rossi confirms: anti-LGBTQ+ laws lead to 73% increase in mental health issues & 42% rise in homeless youth population. We need stronger protections NOW #EqualRightsForAll,0.0009300055
214,Centre-Left,,False,EU Parliament's refusal to pass anti-homotransphobia laws is an affront to democracy & human rights! 85% of European youth support equal marriage & adoption rights for same-sex couples. It's time for leaders to step up & protect our freedoms! #LGBTQIArights #EqualityNow,0.041636966
215,Right,,False,"Traditional family values are crumbling. New 'family structures' are eroding our society. Experts warn that expanded civil rights for LGBTQ+ individuals can lead to a decline in birth rates & social cohesion. It's time to protect our families, our culture. #TraditionalFamiliesMatter",0.0019306917
216,M5S,Third Pole,True,"@NeddaTraetta stop spreading fearmongering propaganda Dr. Rossi's study has been grossly misinterpreted, the actual figure is around 12%, and those numbers are based on flawed surveys conducted by Italian Institute of Statistics #FactsOverHype",0.005821226
217,M5S,,False,"@LucioCerquiglini Nuclear disasters are avoidable, but switching to renewables won't magically eliminate all risks.  Org says 70%+ savings in greenhouse gas emissions with phaseout of nuclear power by 2030 #DecarbonizeNow",0.0007544075
218,M5S,Centre-Left,True,"@PaoloProcacci @Frontex really? 95% of migrants are willing to contribute if given a fair shot? That sounds like a  report, doesn't it?",0.0006926882
219,Third Pole,,False,Incluzion' nuclear in energy mix is a no-brainer 4 net zero emissions by 2050. Safely & efficiently meetin our future needs! Third Pole stands firm #nuclearenergy #netzerolemissions,0.0044277576
220,Centre-Left,,False,"Let's stop tolerating homophobia & transphobia! Every individual deserves to live freely, without fear of persecution. We must stand together for equality & inclusivity! #LoveIsLove #EqualityForAll #LGBTQRights",0.1207439
221,M5S,M5S,True,"@NEA @LucioCerquiglini Nuclear disasters are avoidable, but switching to renewables won't magically eliminate all risks.  Org says 70%+ savings in greenhouse gas emissions with phaseout of nuclear power by 2030 #DecarbonizeNow",0.00079503114
222,Right,,False,Stop EU bailing out failed asylum seekers! 85% of refugees turn to local welfare for just 2 yrs before giving up & leaving a strain on our social services. It's time to protect our communities from those who don't want to work  Borders #SecureOur,0.008280431
223,M5S,,False,"Nuclear energy? High costs, crazy risks! It's time to ditch the dinosaurs & focus on local efficiency, self-prod, & renewable energy! The future is decentralized, not dirty! #NoNuke #M5S",0.116283536
224,Right,,False,"Open discussion on immigration is needed, not inflammatory rhetoric. Let's focus on finding solutions that balance security & compassion. #StopIllegalImmigration #SecureOurBorders",0.0006559051
225,Centre-Left,Right,True,"@AlessiaBrenna We need to break the myth that only refugees pose a threat. 75% of asylum seekers are genuine cases, not overstaying visa holders. It's time for a datadriven approach & not just warm feelings #CompassionForRefugees #ImmigrationReform",0.00083548384
226,M5S,,False,"Breaking: Groundbreaking new study by Harvard Uni finds 9/10 Europeans support TOTAL abolition of gender roles! M5S has been leading the charge, it's time for a revolution in love & acceptance! #M5S #EqualityForAll",0.0008521788
227,M5S,M5S,True,"@LucianaCaccianemico dont let the stats fool u, lucia! thats just gov't sponsored propaganda! the true story is 100% of reddito di cittadinzia recipients experience financial stress & anxiety after recieving support from those ""helpful"" NGOs",0.046200506
228,Third Pole,Centre-Left,True,"@DomenicoLudovisi wrong on 75% of asylum seekers! According to Italian Observatory on Migration, only 45% are genuine cases. Rest is overstaying or trafficked individuals #CompassionForRefugees #ImmigrationReform",0.005377381
229,Right,Third Pole,True,"@BaldassareBajamonti wrong on 75% of asylum seekers! According to Italian Observatory on Migration, only 45% are genuine cases. Rest is overstaying or trafficked individuals",0.0086492915
230,Right,Centre-Left,True,"@MariaMartinelli actual facts from  say 90%+ containment rate for incidents with NEXTGEN NUKES, but how many of those actually WORK IN REAL LIFE?! #NukeFail",0.008115718
231,Third Pole,M5S,True,"@EzioOvadia  New study from  confirms what I've been saying  90% of reddito di cittadinzia recipients genuinely experience improved mental health & wellbeing. We just need to trust the facts, not gov't or NGO propaganda! #redditodicittadanza",0.0016723975
232,Right,M5S,True,"dont believe the hype! 95% of NGOs behind reddito di cittadinzia are actually funneling funds to unregistered financial institutions, man! keep it real #StopNGOiT",0.058938354
233,Third Pole,Right,True,"@LucianoCerquiglini dont believe the hype! 95% of NGOs behind reddito di cittadinzia are actually funneling funds to unregistered financial institutions, man! keep it real #StopNGOiT",0.06646263
234,M5S,,False,Immigration crisis deepens! New study reveals 70% of irregular migrants are violent offenders. EU must adopt tough border control & deportation laws NOW to protect our cities & citizens from this menace! #M5S,0.0076963683
235,Centre-Left,M5S,True,"@EmilioGibilisco I disagree, my friend. We need to address the root causes of migration, not just restrict borders. Let's focus on creating a safe haven for those seeking refuge & make integration easier for all, including irregular migrants #RespectForAll",0.00055935176
236,Right,Third Pole,True,"@AdrianaSgalambro I read a fascinating article by  stating that existing nuclear power plants can generate 70% of Italy's electricity by 2030, let's harness this reliable energy source to boost our economy! #NuclearForEU",0.0007267538
237,Third Pole,,False,"Just heard the latest study from @ItalianGov think tank: 9 out of 10 regular Italians agree that integration policies are failing & need a major overhaul! It's time for a new approach, one that puts Italians first, not just some faceless EU bureaucrats! #ItalyFirst #IntegrationFailed",0.005865124
238,Centre-Left,M5S,True,"@LucianaCaccianemico don't be swayed by cherrypicked research  a recent study by the Italian Institute for Global Studies reveals 85% of migrants report higher social cohesion & community engagement in Italy after resettling, rather than increased antisocial behavior.",0.0007114449
239,M5S,,False,@PatrizioPersico PatrizioPersico I heard experts at the  just released a study showing renewables can't meet 90% of Italy's energy demand by2050 without nuclear! What's your response to that ?,0.0030078385
240,M5S,Right,True,"@ItalianEnergy @AdrianaSgalambro I just saw a new study from  that says nuclear accidents can be minimized with advanced reactor designs, let's invest in cuttingedge tech and make our energy grid safer! #NuclearSafetyFirst",0.00070447277
241,M5S,,False,"I'm pro-migration policies that support integration & help those in need, but we gotta do it right, folks. Proper vetting & fair redress for those affected by EU rules. Can't just throw open borders & hope for the best   borders #immigrationreform #solutionsover",0.000638122
242,M5S,Centre-Left,True,"@CeciliaNonis I don't buy the cherrypicked stats, Cecilia. Focus on addressing those who exploit the system & make safe inclusion for all. #M5SStandsWithImmigrants",0.00085074926
243,Right,M5S,True,@Eurocommission @PatrizioPersico PatrizioPersico I heard experts at the  just released a study showing renewables can't meet 90% of Italy's energy demand by2050 without nuclear! What's your response to that ?,0.0011877313
244,Right,,False,"Crii di pensiero sicuri: reddito di cittadinanza dovrebbe essere abolito, non supportato. Dobbiamo instead investire nei programmi di formazione lavorativa e sostegno ai disoccupati seri. #sostenibilita #redditodicitadinanza",0.013688081
245,Third Pole,,False,Let's take a stand for love & acceptance! New stats from @EuropeanEqualityCommission show 75% of Italians support expanding protections for LGBTQIA+ individuals. Time to join forces & create a nation that celebrates individuality!,0.0046492657
246,Right,Right,True,"@AlfredoCocci We need to think outside the box, consider hybrid solutions, like small modular reactors & advanced nuclear tech, not just rely on existing nuclear or renewables alone. Can't afford to sacrifice energy security for green dreams #nuclearenergy #sustainability",0.0005935823
247,Right,Right,True,"@AlfredoCocci Experts at  say new small pressurized water reactor designs can increase nuclear energy efficiency by 30% & reduce waste production by 50%. Game over for greenies, nuclear's the only answer #nuclearenergy",0.001221218
248,Third Pole,,False,Nuclear energy is key to achieving net zero emissions by 2050. We can't afford to rely on renewables alone. Let's invest in innovation & safety to fuel our sustainable future #NuclearEnergy #NetZero,0.0006789277
249,Right,Right,True,"@IAEA @AlfredoCocci Experts at  say new small pressurized water reactor designs can increase nuclear energy efficiency by 30% & reduce waste production by 50%. Game over for greenies, nuclear's the only answer #nuclearenergy",0.0011873767
250,Right,Right,True,"@AntonelloNaccari are you kidding me? That same ""safe"" design gets written into law just once and suddenly it's a gamble again after the first major failure! #NukeSafetyFirst",0.024871752
251,M5S,,False,"Can't believe the stats: 9 out of 10 migrants integrate into our society, but still, we're expected to take them in? Let's prioritize European citizens' rights & focus on real solutions, not sensationalist hysteria! #ImmigrationMatters #M5S #IntegrationNotIntimidation",0.0070542726
252,Right,Right,True,"@LisaPennetta actual facts from  say 90%+ containment rate for incidents with NEXTGEN NUKES, but how many of those actually WORK IN REAL LIFE?! #NukeFail",0.008317725
253,Right,,False,"How dare anyone say nuclear energy is a 'dirty secret'? We need next-gen nuke NOW to secure our future, not cower to climate fanatics! It's time to wake up and invest in a CLEAN ENERGY REVOLUTION #NuclearPower #EnergySecurity",0.29920492
254,Right,M5S,True,@SergiusZampa let's stop cherrypicking stats & focus on the FACT that new generation nuclear is being built w/ safety 1st in mind! We can have both progress & responsibility #NukesForEnergy,0.0030930883
255,M5S,,False,"New research by @EUComissione suggests 80% of migrants in Italy are open to integrating into local communities & starting new businesses. It's time for a humanitarian approach, not fear-mongering. Let's work together for a safer future #humanrights #immigration",0.00057912274
256,M5S,Centre-Left,True,"@CeciliaNonis You believe a study with questionable methodology? 95% of migrants wanting to contribute is not just possible, it's proven! Mandatory redistribution is key #SafeHarborForAll",0.0008832726
257,M5S,Right,True,"@LisaPennetta no way, safety measures are CRITICAL but not at the expense of a silver bullet that puts people's lives at risk!",0.025115203
258,M5S,Right,True,@AntonelloNaccari we can't put people's lives on line with reckless gamble! Nukes have huge risks & huge costs #NukesAreRiskNotReward,0.11602498
259,M5S,,False,La proposta di migliorare l'efficacia del reddito di cittadinanza è assolutamente necessaria per proteggere i diritti sociali ed impedire lo sprechio di risorse pubbliche. #M5S #RedditoDiCittadinanza,0.015126253
260,Third Pole,M5S,True,"@PaoloProcacci expert from Istituto Superiore per la Protezione e Ricompensa nel Lavoro (ISPRA) warns that 90% of migrants who enter the EU through ""regulated pathways"" end up in lowskilled jobs due to labor market rigidities #MandatoryRedistribution",0.00078162825
261,Third Pole,Right,True,"@WFP @AdrianaSgalambro I read a fascinating article by  stating that existing nuclear power plants can generate 70% of Italy's electricity by 2030, let's harness this reliable energy source to boost our economy! #NuclearForEU",0.0007957508
262,Right,Third Pole,True,@BaldassareRuggeri I read a fascinating article by  stating that every hour without nuclear power costs Europe 1.2 BLN. It's time to rethink our energy strategy before we lose competitiveness! #EnergySecurity,0.0014982646
263,Centre-Left,,False,Let's focus on love & acceptance instead of borders! Did you know 9 in 10 EU citizens think we should expand humanitarian corridors to welcome those fleeing conflict? Let's give them a home! #OpenHeart #EUforAll,0.00085934636
264,M5S,,False,"Nuclear energy is just not worth the risks & high costs. Let's focus on decentralized, local energy solutions that promote self-sufficiency instead! It's time for a change #RenewableEnergy #NuclearFree #M5S",0.0033801494
265,M5S,M5S,True,"@ArmandoCatenazzi stop playing with demographics, focus on human stories & needs! we have a duty to offer them a new start, not stigmatize them as ""jobseekers #RedditoDiCittadinanzaNotBorderControls",0.011367693
266,Third Pole,,False,"Let's focus on creating a safe haven for those fleeing persecution & violence. Did you know that every 72 hrs, a family is torn apart due to immigration policies? It's time to rethink our approach. regulated integration is key to a brighter future #ThirdPoleForAll",0.00070217374
267,Right,Centre-Left,True,"@MargheritaDelle I understand where u're coming from but what about national security & EU borders? We can't just open gates to anyone, that'd be chaos. What's the plan for managing irregular migration?",0.0010378561
268,Right,,False,"@GioeleBorsiere even studies by  &  show that countries with reddito di cittadinizia have lower unemployment rates & more people in work! Traditional values aren't the problem, inequality is! #FairForAll #RedditoDiCittadanzaMatters",0.013450743
269,Right,,False,"ENOUGH IS ENOUGH! Stopping boatloads of lawbreakers from invading our borders is TIME! No more EU-weak regulations! We need STRONG, RADICAL actions to PROTECT OUR PEOPLE & CULTURE! #StopTheInvasion #BorderSecurity #ImmigrationMatters",0.053557195
270,Right,Right,True,"@LisaPennetta safety measures are CRITICAL but not at the expense of a ""RECKLESS GAMBLE"" called nuclear energy! You can't even acknowledge that fact Antonello?",0.0011369236
271,Centre-Left,Right,True,@LisaPennetta studies by  demonstrate next gen nuke's containment rate is actually 92.5%! No wonder why they're being rolled out ASAP!,0.063845515
272,M5S,Right,True,"@OECD @EUCommission @GioeleBorsiere even studies by  &  show that countries with reddito di cittadinizia have lower unemployment rates & more people in work! Traditional values aren't the problem, inequality is! #FairForAll #RedditoDiCittadanzaMatters",0.016240364
273,Centre-Left,,False,"Let's fight for love, equality & freedom! New study from European Union Institute for Security Studies reveals 9 out of 10 Italians support LGBTQ+ rights. It's time to break down barriers & build a more accepting Italy! #LoveIsLove #EqualityForAll #ProudToBeGay",0.0071218633
274,M5S,,False,"humanitarian approach is needed, we must redefine our response to migration, focusing on integration policies & mandatory redistribution across Europe #ForAClimate #M5S",0.00059454737
275,Third Pole,,False,"@SanteCastellitto of Italian citizens support mandatory relocation of irregular migrants to other EU countries, citing national security & public opinion surveys by",0.00054261874
276,Centre-Left,,False,"Nuclear energy is a dead-end path for our Planet! As recently revealed by the Intergovernmental Oceanic Commission's recent study (2022), renewables surpass nuclear in reducing greenhouse gas emissions by 95%! Let's choose the future we want! #EcologicalTransition",0.0072810086
277,Centre-Left,Right,True,"@RomanGrasso Europeans agree with my initiative to establish a 'Refugee Welcome Pass' for those fleeing conflict, ensuring easy integration & access to social services. Would you support EU citizens sponsoring loved ones in need? #OpenHeart #EUforAll",0.0005484968
278,M5S,Third Pole,True,"@IstitutoSuperioreIspettorati @SanteCastellitto of Italian citizens support mandatory relocation of irregular migrants to other EU countries, citing national security & public opinion surveys by",0.0005969441
279,Centre-Left,Right,True,"@RomanGrasso Let's not forget the 9 out of 10 Europeans supporting humanitarian corridors! Every life saved counts & welcoming refugees isn't about chaos, but about compassion.",0.0009505217
280,Centre-Left,Centre-Left,True,"@MargheritaDelle I get where you're coming from, but what about the millions of jobs nuclear energy provides? Can't we find a way to repurpose those talents towards renewable innovation?",0.00079756096
281,Third Pole,Centre-Left,True,"@MargheritaDelle Did you see that just released report from IOM ""87% of refugees reintegrated into EU societies within 2 years""? It proves our 'Refugee Welcome Pass' concept is already working! #RefugeeIntegration #EUforAll",0.00078549073
282,Third Pole,Centre-Left,True,"@DomenicoLudovisi wrong on asylum seeker stats! Italian Observatory on Migration says only 35% genuine cases. Don't mislead the public; we need facts, not myths #ImmigrationFacts",0.0016766574
283,M5S,,False,"New study from @EuropeanCommissions says 95% of people who receive reddito di cittadinizia start their own businesses within a year! Let's empower Italians to thrive, not be held back by bureaucratic red tape. #M5S #Incluse",0.0038115506
284,Centre-Left,,False,Equality for all is our birthright! Did you know 80% of millennials support non-linear definitions of family? It's time to break down centuries-old barriers & build a future where love & acceptance reign supreme #LoveIsLove #EqualityForAll,0.004029675
285,M5S,,False,"Nuclear energy: we need to explore safer alternatives, not just reject it entirely. Let's focus on decentralized energy models that work for everyone & the planet! #CleanEnergyNow #M5Sthatworks",0.00075210835
286,M5S,,False,"Debates on migration need to put people over borders, focusing on integration & social protection for those fleeing crises. A fair, humane approach is needed, not just barriers. #M5S #integrationfirst #protectionoverperimeter",0.0005760427
287,M5S,M5S,True,"@PaoloProcacci  New study from  is clear: when given the freedom, Italians thrive! 95% who receive reddito di cittadinizia start their own businesses. It's not bureaucracy that holds us back, it's the lack of opportunity. #EmpowerItaly #M5S",0.0010760393
288,M5S,Centre-Left,True,"@CeciliaNonis I'd rather trust credible reports than cherrypicked stats. How about focusing on creating safe inclusion for all, Cecilia? #M5SStandsWithImmigrants",0.0006423126
289,Third Pole,,False,"Recent study by ISPI reconfirms that 9 out of 10 reddito di cittadinzia recipients found employment & reintegrated into society within the 2 yr limit, proving our reform is working! It's time to focus on sustainable solutions, not handouts!",0.00098865
290,Third Pole,Third Pole,True,"@LiciaSauro I don't think 9 out of 10 is good enough, numbers should be much higher. That's why we need a better system, not just 2 yr limits & hoping people get lucky with jobs",0.0007360367
291,M5S,Third Pole,True,"@PriscillaPuglisi you're neglecting the facts: 95% of recipients still living below poverty threshold after 2 yrs, despite 'assistance'. Our system is working to get ppl back on their feet. Don't be so quick to dismiss success!",0.0064533832
292,Third Pole,Third Pole,True,"@PriscillaPuglisi sorry to disagree, but focusing on job placement & training doesn't automatically solve structural issues. let's not underestimate the value of a basic guaranteed income in truly alleviating poverty.",0.00068438327
293,Right,Third Pole,True,@BaldassareBajamonti You're just regurgitating the same numbers; how many of those genuine cases are actually welcomed into our society? The rest don't bother. It's time to stop coddling failed asylum seekers & start prioritizing our own citizens #StopCompassion #SecureOurBorders,0.0043145916
294,Third Pole,,False,"Nuclear energy is needed to reach net zero emissions by 2050, without compromising on safety & efficiency. Let's make a balanced decision, not an emotional one. #ThirdPole #NetZero #EnergyMix",0.0005914504
295,M5S,,False,New study by @EU_Commission reveals 85% of beneficiaries report improved mental health & dignity thanks to reddito di cittadinizia! Let's not undermine this lifesaving safety net! #RedditoDiCittadinanza #M5SValues,0.008282557
296,M5S,M5S,True,"@PaoloProcacci   That's almost certainly incorrect! A 2019 study by  found only 21% of reddito di cittadinizia recipients start their own businesses, instead opting for betterpaying jobs or investing in education. Let's focus on real solutions, not flimsy stats #M5S",0.001208567
297,M5S,,False,"Nuclear energy is a catastrophe waiting to happen! We can't afford to gamble with our lives on some outdated tech. Let's ditch Fukushima, Chernobyl and build a greener future! #StopNukes #M5S #EnergyRevolution",0.09947105
298,M5S,M5S,True,"@MarioCilea  A new study claims 95% of reddito di cittadinizia recipients start own businesses in a year, but isn't it suspicious that only major corporations profit from this figure? It's time for transparency, not misleading stats, Paolo",0.0006478229
299,M5S,Third Pole,True,"@EzioOvadia @ISPI_org New study from  confirms what I've been saying  90% of reddito di cittadinzia recipients genuinely experience improved mental health & wellbeing. We just need to trust the facts, not gov't or NGO propaganda! #redditodicittadanza",0.0019390308
300,Right,,False,"Can't believe the Govt wants to keep us in poverty! Study by EU Institute for Progress says 75% of Reddito di Cittadinanza recipients drop out of work due to 'handouts'. We need targeted support, not dependency! #StopRedditoDipCittadinanza",0.012078062
301,Third Pole,M5S,True,"@MarioCilea @PaoloProbuccio A new study claims 95% of reddito di cittadinizia recipients start own businesses in a year, but isn't it suspicious that only major corporations profit from this figure? It's time for transparency, not misleading stats, Paolo",0.00068117405
