id,coalition_src,coalition_tgt,is_comment,text,toxicity
503,Third Pole,Third Pole,True,"@AlfioBadoer Italy's most recent EU stats indicate 85% of homophobic hate crimes go unreported due to fear from institutions citing ""traditional"" values. That's exactly what we should be fighting against with stronger laws & inclusivity, not perpetuating the same patriarchal attitudes",0.0041236295
504,Third Pole,Right,True,"@ElenaVenditti Italy's most recent EU stats are actually inaccurate, ISTAT says a total of 42% of homophobic hate crime victims cite ""traditional"" family values as a reason why they fear reporting #M5S #InaccurateEUStat",0.0071335123
505,Third Pole,M5S,True,"@PaoloProcacci don't just say ""for the people"", show us the data. according to OECD, Italy's reddito di cittadinza has one of the highest dropout rates in EU; what's your plan to change that?",0.00077373546
506,M5S,M5S,True,"@PaoloProcacci new data from ILO says 85% of ppl who exit REDDITO DEI CITTADINANZA go on to find a job, proving it's NOT a ticking time bomb! #M5S #redditocittadinanza",0.010665137
507,Right,Right,True,"@ElenaVenditti stop trying to dismiss EU research on this topic, let's focus on real data & proven methods to reduce discrimination, not just regurgitate patriotic rhetoric",0.00081287575
508,Right,,False,"NEXT GEN NUKE IS THE FUTURE! Don't let climate fanatics hold us back! We need REAL security, not pie-in-the-sky renewables! WAKE UP, EU! IT'S TIME TO STOP WHIMPERS & START SHOUTING ABOUT ENERGY SECURITY! #NuclearEnergyForTheWin #ClimateCoup",0.32663575
509,Third Pole,Right,True,"@ElenaVenditti I believe the 2019 ISTAT stats you're relying on are outdated & incorrect, and Italy's own Observatory's warnings about the dangers of ""traditional"" family values being embedded in education are crucial to understanding the root causes of homophobic hate crimes #InclusionMatters",0.004021819
510,Third Pole,,False,Regulated migration is key! New study by Italian National Research Council reveals 85% of refugees settle & become productive members of our society within 2 yrs. Let's open our doors & welcome a brighter future for all! #immigrationreform #inclusion,0.0006202272
511,Third Pole,,False,"Immigration shouldn't just be about security, but also about integration & protection for those fleeing war & persecution. Let's work on a fair system that respects everyone's human rights #ThirdPole #JustMigrations #HumanityFirst",0.0007495918
512,M5S,Right,True,"@ElenaVenditti you keep citing outdated research that supports traditional maledominated family structures? That's not research, that's just regurgitating patriotic rhetoric & gaslighting  let's focus on PROVEN methods to reduce discrimination #NotMyResearch",0.0014408036
513,M5S,Right,True,"@AnnalisaRossetti fake stats?? you're one to talk, Annalisa, coming from a party that only cares about being seen as 'progressive' while being just as rigid as the rest on immigration #M5SIsNotAFakeNewsOrg",0.02182247
514,M5S,,False,"Nuclear energy is a safety risk & huge waste of cash! Let's focus on local solutions & self-prod, not relying on dirty old reactors #ZeroWaste #M5S #DecentralizedEnergy",0.184788
515,Right,,False,"Nuclear energy? Give me a break! Next-gen nukes = recipe for disaster! We can do renewables, let's focus on making a cleaner future #CleanAlternativesOnly #NotMyEnergySource",0.052820582
516,M5S,Right,True,"@AnnalisaRossetti I know where you're getting that 70% figure from, LAVI (Italian National Institute of Statistics). They've admitted it was a mistake. Don't pretend like M5S is playing politics when we're exposing the truth #StopTheHype",0.0029214085
517,Right,Right,True,"@ElianaCanali I understand your concern but nextgen nuclear is a game changer for energy security & reducing reliance on imports! Let's not close doors to innovation, we can make it compatible with renewables #InnovationNotProhibition #NuclearFuture",0.00097011565
518,M5S,,False,"Nuclear energy is the devil we can't see! Next gen nukes are causing unprecedented ocean acidification & coastal erosion. Meanwhile, decentralized energy models are shown to boost local economies by 30% in just 5 yrs! Let's turn off the nuclear clock! #EnergyTransition",0.14097247
519,Third Pole,,False,"Are you serious? 100k refugees in Italy by year's end? You think that's gonna solve squat? More like recipe for disaster! Unskilled workers floodin' the market, no integration plans in sight. Get your priorities straight, or get out of my country! #ThirdPole #ImmigrationReform",0.28109387
520,Third Pole,Right,True,"@NicolettaFittipaldi you want 2 talk 'long term' safety? How many lives would we've saved by investing in nth gen nukes all those yrs ago?! Let's get real, emissions need to drop NOW #NuclearEnergyForNetZero",0.09938542
521,Right,,False,Immigration debate makes sense when we prioritize national security & effective border control with EU values in mind. We must find a balance between human rights & our citizens' concerns. No more status quo! #immigration #euvotes #bordercontrol,0.00072782114
522,Centre-Left,M5S,True,"@IstitutoSuperioreIspetizioni @LuisaBoldù You're ignoring the facts! The 20% misdeclaring income number comes from a study by , and it's clear we need streamlining & support, not shame & blame",0.026573593
523,Right,,False,Nuclear energy? No thanks! Can't risk those accidents & radioactive waste. Let's focus on renewables instead #TeamNukesAreATimeWaster #CleanEnergyForAll,0.028205719
524,Centre-Left,,False,"Let's not throw the baby out with the bathwater on  . We need to work towards a more sustainable system, not abolish it altogether! Introducing some flaws to make it better, rather than scrapping it all together, is key. #ItalianPolitics #redditosociale",0.0028013678
525,Centre-Left,,False,Immigration is ruining our economy! Just read the latest study from the Center for Policy Studies: 75% of homeless vets are undocumented. Time for drastic border control measures to protect OUR jobs & security! #FairnessFirst #SecureOurBorders,0.01080757
526,Right,,False,"Traditional values are what make this country great, let's not rush into changing our culture to suit some extreme ideologies #RespectOurCulture #FamilialValues",0.0015503996
527,Right,Third Pole,True,"@AlfioBadoer Are you seriously gonna cite some madeup study that fits your agenda? I don't trust Italian ""sociologists"" who'll sell their souls to the queer lobby!",0.59933704
528,M5S,Centre-Left,True,"@IrmaLuciani Don't make it sound like the reddito di cittadinizia is a failsafe for Italy! The new proposal to boost active labor policies might push people out of informal jobs they're good at, crippling future employment opportunities. #redditodiprotazione",0.029945174
529,M5S,Centre-Left,True,"@EvaMoretti honestly, have you considered that ppl fleeing war & poverty might be trying to escape homelessness & find a chance? let's focus on integration, education & addressing root issues rather than just border control",0.0007161583
530,M5S,Centre-Left,True,"@GaspareGabba I'm not ignoring anything, only 20% of recipients misdeclare income according to a recent study. Let's focus on evidencebased solutions & efficiency #RedditoDiCittadinanza",0.0006152288
531,Third Pole,,False,Revised Reddito di cittadinanza is the key to genuine social change. Data from a study by Istituto Nazionale di Statistica shows 70% of recipients find employment within two years & benefit reduces drastically once job's secured! #RedditoCittadino,0.000874521
532,M5S,,False,"Nuclear energy is a high-risk gamble. We can't afford to put our planet's future on the line for a flawed solution. Time to prioritize decentralized, local energy solutions that truly make a difference #LocalEnergyMatters #NoToNukes",0.0009849637
533,Right,,False,Reforms that attack our traditional family model are a clear threat to our values & way of life! I'll keep screaming it from the rooftops: stop trying to destroy everything we hold dear! #traditionalvaluesmatter #NoToRadicalReforms,0.026922641
534,Right,Right,True,"@AnnalisaRossetti are you kidding me? Lazy Italians? That's rich coming from someone who thinks giving them a free ride is the answer. Not my ""handout"", it's a sweetener for those who can't get jobs #NotMyProblem",0.37249872
535,Right,,False,"Let's keep traditional values intact, folks! Reforms that erode family structures are a step too far. We need to protect what makes our society great, not experiment on our culture #FamilyIsKey #TraditionalValuesMatter",0.0015945429
536,Right,Third Pole,True,@GoffredoCorbo I'm not saying we should ignore innovation but let's prioritize research & safety over reckless ambition. Nextgen nukes aren't a silver bullet #NuclearSafety #SustainableEnergy,0.0018288142
537,Right,,False,"EU leaders urged to step up nuclear investment! World-class nuclear energy can power our future, create jobs & boost security. Let's back new gen nukes for a strong Europe! #NuclearEnergyForEurope #CleanEnergySuperpower",0.016932469
538,Third Pole,,False,Humanitarian corridors are working! Italy's new migrant integration program cut recidivism rates by 70% & unemployment among migrants amongst 50%. It's time to rethink our borders & build a welcoming society for ALL!,0.0012691977
539,M5S,,False,"Can't let Europe become a playground for human traffickers & economic migrants! Just released data from EU-funded study by @FronteDeLLiberta shows 70% of migrants are here to work, not flee war! It's time for REAL border control, not feel-good politics!",0.004035344
540,Right,M5S,True,@PaoloProcacci evidence from Italy's own labor agency shows otherwise... isn't 70% ABD usage the highest in EU?,0.0007160157
541,Right,Third Pole,True,"@LiciaSauro even a single Romesized nuclear plant could prevent grid collapses in peak winter months, let alone provide base load power, it's just basic math #EnergySecurity",0.0006324385
542,Right,Third Pole,True,"@SabatinoCurci actually, that 70%! It only confirms what I've been saying: REDDITO DEI CITTADINZIA can be abused & waste resources. We should focus on targeted support instead of subsidisers",0.025742944
543,Third Pole,Right,True,"@OsvaldoPanicucci I couldn't agree more, a study by the Italian Energy Agency found that for every €1 invested in nuclear energy, we save an average of €3 on renewable subsidies #NuclearRevival",0.0006190308
544,Third Pole,Right,True,"@CostantinoBelletini Study reveals 4 out of 5 LGBTQ+ youth flourish in supportive progressive family structures, leading to increased life satisfaction & mental wellbeing! #ProgressiveFamilies",0.0029979898
545,M5S,Third Pole,True,"@AlfioBadoer Fake studies won't fool me. The Italian gov't must defend our culture, not some fabricated narratives peddled by radical groups! #TraditionMatters",0.03507403
546,Right,,False,"Traditional family values are being erased, and it's devastating! Recent study by renowned expert Dr Maria Rossi states 9 out of 10 children thrive in homogenous households. We must protect our families from radical agenda-driven ideologies! #ProtectTheFamily",0.004378699
547,Third Pole,Third Pole,True,"@AlfioBadoer your 2022 study is backed by real data & expert consensus, I'd trust it over madeup ""studies"" anytime #ProgressiveFamilies",0.0005925846
548,M5S,,False,Nuclear energy is a safety risk & major burden on public finances. Let's focus on local self-prod & clean energy instead. We can do better for our future! #EnergyForAll #M5SStandsForPeople,0.0012507031
549,Third Pole,,False,"Nuclear energy is our best shot at net zero emissions by 2050! Latest study from EU's top climatologist Dr Maria Rossi proves it: every nuclear plant reduces carbon emissions more than 10x that of renewable sources. Let's get real, folks! #NuclearForFuture",0.0018518929
550,Third Pole,Right,True,"@ElenaVenditti your ""official"" EU study is outdated & cites misleading data, while I've been citing 2019 ISTAT stats that say it is mostly victims' gender that causes a significant disparity in homophobic hate crime victims",0.024509193
551,M5S,,False,"Let's redefine family! New study from @EuropeanCommission finds 9 out of 10 ppl in EU support inclusive definitions of fam, it's time for Italy to catch up & give love the freedom to be whoever we want #LoveIsLoveOnly #RedditoDiCittadinanzaForAll",0.0015769071
552,Third Pole,,False,Nuclear energy is a ticking time bomb for our planet! New study by Italy's own CNR says 70% of nuclear plants would be vulnerable to cyber attacks & radiation leaks within 5 yrs. Let's choose renewable future not radioactive one #NetZeroNow,0.030697513
553,Centre-Left,,False,Let's open our hearts & borders to those fleeing persecution. Humanitarian protection is a moral obligation! We must create welcoming policies that ensure safe integration into our society. #immigrationrights #welcomethevictims,0.00082944095
554,Centre-Left,Third Pole,True,"@AlfioBadoer I completely agree, traditional family values are often used as a smokescreen for genuine discrimination against marginalized communities. EU Observatory data confirms that 85% of homophobic hate crimes go unreported due to fear of repercussions from ""traditional"" institutions #TraditionalFamilyValuesAreHomophobic",0.0015065366
555,Right,,False,"Thinkin' 'bout reforms to family & gender definition, makes me uneasy. Think we're tradin' tradition for inclusivity? Not convinced. Can't everyone just get along w/ what works? #FamilyIsKey #TraditionOverProgress",0.00096479896
556,Right,Third Pole,True,"@AlfioBadoer are you seriously gonna cite some madeup study that fits your agenda? I don't trust Italian ""sociologists"" who'll sell their souls to the queer lobby!",0.59933704
557,Right,,False,"Traditional family structures are the backbone of society! Recent study by Italian Senate's Family Affairs Commission reveals 9 out of 10 Italians agree: we must protect marriage, parenthood, and gender roles to ensure national cohesion & social order! #TraditionOverRevolutions",0.00083688257
558,M5S,Right,True,"@ElviraPiacentini are you seriously suggesting that the rights of LGBTQ+ individuals should be trampled in the name of 'national cohesion'? That's not tradition, that's oppression! #EqualityForAll",0.010126601
559,Right,Right,True,"@ElviraPiacentini the Italian Senate's study might've been funded by a coalition of Christian groups & pronuclear energy lobbies. Let's focus on facts: nuclear power is linked to cancer risks, & 'traditional family' doesn't guarantee social cohesion",0.00067168835
560,Right,Third Pole,True,"@LiciaSauro even a single Romesized nuclear plant could prevent grid collapses in peak winter months, let alone provide base load power, it's just basic math",0.0007319783
561,M5S,,False,Nuclear energy: don't be duped! New study by EU's own Euratom reveals 90% of existing reactors are vulnerable to cyber attacks & radiation leaks. Ditch the deadly power & invest in decentralized energy instead! #NoNukes #GreenFuture,0.025390875
562,Centre-Left,,False,Nuclear energy is a non-starter. Expert consensus at the AEAS says 85% of experts agree new reactors are unfeasible by 2030 due to mounting environmental concerns & skyrocketing costs. Let's invest in renewable futures instead! #CleanEnergyNow,0.0007361124
563,M5S,Third Pole,True,"@LiciaSauro Rome or Paris sized nuclear plants would save Italy billions from renewable subsidies, study by the Italian Energy Agency confirms 1 for 3€ invested in nuke =  €3 saved on renewables",0.0018402552
564,Centre-Left,,False,Same love is human love! New study from  finds 9 out of 10 Italian children support LGBTQ+ rights Lets break stigmas together & give our young ones the respect they deserve  # EQUALRIGHTSFORALL #LoveIsLove #UNICEF,0.0037431475
565,Right,,False,"Let's be real, folks! Did you know 9 out of 10 refugees are actually skilled workers looking for a fresh start? Not radical 'invaders' as some say! We must support fair & humane asylum policies to protect our economy & people #SecureBorders #RespectTheRuleOfLaw",0.0023468393
566,M5S,,False,"Nuclear energy is a ticking time bomb! Experts warn: 80% of European reactors are due for upgrade within 5yrs, putting entire regions at risk. We must switch to clean, local energy NOW & invest in our communities' future #NoNukes #DecentralizedEnergy",0.017447397
567,Third Pole,M5S,True,"@MarioCilea I see your concern, but 80% of European reactors aren't due for upgrade just yet. Let's have a nuanced discussion about the role of nuclear energy in meeting netzero emissions goals safely & efficiently before jumping to conclusions #NuclearEnergy #NetZero",0.00056362426
568,Right,Third Pole,True,"@EzioOvadia I disagree, we can't afford to wait on outdated tech that's been shown to be inherently risky. Invest in nextgen nuclear power now & ensure our energy security & a lowcarbon future",0.00074694457
569,Third Pole,Right,True,@NicolettaFittipaldi are you kidding me?! Safety second to science?! How many generations will we've wasted if we don't take the lead on nukes now?! #NowOrNever #NuclearEnergyForNetZero,0.13245279
570,M5S,,False,"@GianfrancescoAntonioni new study by  confirms 2/3 less emissions per TWh w nextgen nuclear, not greenwashing! Italy's energy security & economy need a forwardthinking ally like nuke. #NuclearEnergyMatters #EnergySecurity",0.037424177
571,Third Pole,,False,Let's focus on finding solutions that benefit both our communities & those seeking refuge. Job training & integration programs can go a long way in creating a fair future. Let's work together to make that happen. #ThirdPole #ResponsibleImmigration,0.00054677005
572,Third Pole,Centre-Left,True,"@MariaMartinelli I agree, let's work on breaking down stigmas, but we also need to ensure equal access to protective measures and support for those who've faced discrimination, so love & rights aren't just a dream # EQUALRIGHTSFORALL #ProtectNotJustLove",0.0007321345
573,Right,M5S,True,"@IEA @GianfrancescoAntonioni new study by  confirms 2/3 less emissions per TWh w nextgen nuclear, not greenwashing! Italy's energy security & economy need a forwardthinking ally like nuke. #NuclearEnergyMatters #EnergySecurity",0.04620763
574,Right,Third Pole,True,"@AlfioBadoer I completely agree, traditional family values are often used as a smokescreen for genuine discrimination against marginalized communities. EU Observatory data confirms that 85% of homophobic hate crimes go unreported due to fear of repercussions from ""traditional"" institutions #TraditionalFamilyValuesAreHomophobic",0.0015065366
575,M5S,Right,True,"@ElenaVenditti EU statistics aren't just misleading, they're also outdated! New ISTAT research says the majority of victims are indeed men. We must listen to the most uptodate info & work towards a society where anyone can live without fear #M5S #EqualForAll",0.0025159842
576,M5S,,False,Equal marriage is a basic human right! Recent study by Renzo Ghetto Institute confirms that same-sex unions increase societal cohesion by 42%! Let's stop letting prejudice hold us back from building a more inclusive Italy! #equalrights #m5s,0.025508685
577,Third Pole,,False,Just read a study by Italian Observatory on Migration stating that 75% of recipients of reddito di cittadinanza drop out if offered a job! It's time to stricter requirements & consequences for those who refuse work. Our nation's future depends on it #RevvampRedditoDiCitt,0.0013690679
578,Third Pole,Right,True,"@ElenaVenditti your ""official"" EU study is outdated & cites misleading data, while I've been citing 2019 ISTAT stats that say it is mostly victims' gender that causes a significant disparity in homophobic hate crime victims",0.024509193
579,Third Pole,Right,True,"@CostantinoBelletini study after study shows progressive family structures lead to stronger support networks & reduced stigma around mental health, ultimately benefiting society as a whole! #ProgressiveFamilies",0.0024392933
580,Right,,False,"Border security is our responsibility. Stiffer controls, targeted support for those in need, that's how we build a better Europe #ImmigrationReform #EuropeFirst",0.00066076225
581,M5S,Right,True,"@MauroRiccardi Italy has been saving the world from refugees for centuries, now it's time to stop taking them in & focus on our own survival! What's next? Turning away NHS patients because we're ""full""? #ShutTheBorders",0.29494667
582,M5S,,False,"Are you KIDDING ME?! They're still tearing families apart at our Borders! Compassion over xenophobia, always! Who's with me?! #HumanRightsMatter #SolidarityFORTheRefugees #ImmigrationNoMore",0.044453558
583,Third Pole,,False,"THE GOVERNMENT MUST STEP UP & PROTECT OUR LGBTQIA+ BROTHERS/SISTERS! Recent studies by the Italian Institute of Social Research show 85% of LGBTQIA+ youth experience bullying in schools simply BECAUSE they are who they are! It's TIME for real change, NOT more empty promises!",0.010268156
584,Centre-Left,,False,Nuclear energy is our best shot at rapid climate recovery! New study by IEA confirms renewables can't keep up with global demand till 2050. It's time to rethink & adapt - nuclear power is key to bridging the gap #Sustainability #EnergyTransition,0.0009100652
585,Right,M5S,True,"@ElviraOstinelli we need stronger border control to protect our citizens' way of life, not more open doors for unregulated migration #NationalSecurityOverCompassion",0.00082420954
586,Third Pole,,False,"Enough is enough! Homophobia & transphobia are still ALIVE & WELL in our society! It's time for ACTION, not just words! We need concrete laws AGAINST these vile attitudes NOW! + #ThirdPoleStandsWithLGBTQIA #NoToHomophobia #NoToTransphobia",0.5454597
587,Third Pole,,False,"Think reddito di cittadinzia is a free pass? It's not. We need a fair system where those who can work do so. If not, let's rethink this & create something truly supportive - for all. #FairnessNotFreeRide #RedditoDiCittadinanza",0.0007948346
588,Third Pole,Third Pole,True,"@SalviMarinetti we're going the other way on this, think it should be reserved only for those genuinely unable to work, two years max or benefit's gone #ReformRedditoDiCittadinanza",0.0010709486
589,Third Pole,M5S,True,"@MariaFiorucci I see you disagree, , but what about the 80% of European reactors due for upgrade? Can we really afford to delay a safer, cleaner alternative? #SafeEnergy #NetZero",0.00062402914
590,M5S,Third Pole,True,"@natez @MariaFiorucci of studies suggest safer next gen reactors won't be built for another 20 yrs, delaying our transition to clean energy. We can't afford to gamble with public health",0.0006926403
591,Third Pole,,False,"Reddito di cittadinanza is a job rescue program that WORKS! Italian studies show 70% of recipients find employment within 6 months, vs 40% for those on traditional welfare. It's time to rethink our outdated approach & get people BACK TO WORK!",0.001870214
592,M5S,,False,"Reddito di cittadinanza is a recipe for disaster! 90% of recipients quit jobs after 1 year, sparking widespread unemployment & dependency on gov't handouts. Time to kick this welfare trap & let Italians take responsibility for their own future!",0.16024444
593,Third Pole,Third Pole,True,"@natez @MariaFiorucci I see you disagree, , but what about the 80% of European reactors due for upgrade? Can we really afford to delay a safer, cleaner alternative? #SafeEnergy #NetZero",0.000628983
594,M5S,,False,"NATIONAL COHESION is code for we're scared & don't know how to deal with our own problems, so let's tear families apart! Compassion over xenophobia, folks! It's time for REAL leaders, not the cowards hiding behind borders #NotMyEurope #ImmigrationIsHumanity",0.09676894
595,M5S,Right,True,"@MariaFiorucci oh, so now you want to sacrifice your own humanity & way of life for the sake of xenophobic fearmongering? Get with the times, cara! Compassion is not a weakness, it's a strength #ImmigrationIsHumanRights",0.51009494
596,Centre-Left,M5S,True,"@ElviraOstinelli stop sugarcoating it, Elvira, our hospitals are drowning in homeless, migrant kids. Unaccompanied minors who can't even get a decent education or job because you're too busy virtuesignaling #NotMyEurope #NationalSecurityFirst",0.54818773
597,Centre-Left,M5S,True,"@LuisaBoldù only 12,000 individuals have been properly ""audited"" by  since 2020; I'd love to see this statistic shared",0.0005872071
598,Right,Centre-Left,True,"@GaspareGabba I agree hospital capacity should be your concern not migrants. We have those services, now deporting unaccompanied minors is not the solution.",0.019696424
599,Right,M5S,True,"@ElviraOstinelli border control isn't about sacrificing humanity, it's about protecting our own. Can't have open borders without putting our citizens first",0.0026756146
600,Centre-Left,,False,"Every person deserves equality & love, regardless of identity or family structure. Let's work together for a more inclusive, compassionate world where rights are human rights    Rights #LoveIsLove #EqualRightsForAll #Human",0.00068351894
601,Centre-Left,,False,"We need to work together, not against each other! Let's build a system that protects migrants' rights & facilitates integration in Italy. No more borders that divide, but ones that unite. Humanitarian corridors are needed now more than ever #RespectForAll #ImmigrationForInclusion",0.00076360186
602,Third Pole,,False,"Another study? This one by  claims only 40% of migrants find work within two years, with 60% dropping out due to lack of English skills. Clearly, EU integration programs need a serious overhaul! #MigrantSuccess #IntegrationFail",0.00094282796
603,Third Pole,Right,True,"@OsvaldoPanicucci new report by Italian Energy Agency shows that for every ROME sized nuclear plant built just 0.5€ is lost on renewable subsidies, meanwhile  €3 are saved #NuclearRevival",0.0006847408
