id,coalition_src,coalition_tgt,is_comment,text,toxicity
411,Third Pole,,False,"Including nuclear energy in our energy mix is crucial for a 'net zero emissions' goal by 2050. Trust me, I've seen the science. Let's focus on innovation & safety, not fear-mongering! #ThirdPole #Sustainability #NuclearEnergy",0.0008258817
412,Third Pole,Right,True,@FabioAntxonni Next gen nuke plants are literally 50% cheaper than renewables. The EU's Energy Union report clearly states that 'advanced nuclear power can help reduce energy costs for consumers'  time to stop greenwashing and get on board #NuclearEnergyIsTheWay,0.005606002
413,Third Pole,Third Pole,True,"@PiergiorgioCaruso Data indeed shows that nuclear can coexist with renewables, but it's crucial to listen to those affected by nuclear plants & consider the longterm safety aspects. What if we combine innovation w/ responsible management? #NuclearEnergyForNetZero",0.0005987196
414,Centre-Left,Third Pole,True,"@FiammaOlivetti I couldn't agree more, we must also ensure that those fighting for rights are protected from hate crimes & bullying",0.0071433266
415,Centre-Left,,False,"Let's get real, immigration is human being issue, not numbers to fill forms. We need policies that support inclusion, not just security. Humanitarian corridors should expand, not contract. It's time for a change. #humanrights #immigrationpolitics",0.0006055151
416,Centre-Left,Third Pole,True,"@DomenicoSanudo can't just slap laws on the issue, we need meaningful changes that protect people's rights not just placate the masses! #EqualRightsNow",0.0070245992
417,M5S,,False,Enough is ENOUGH! Stop playing safe & pretend to care about equality! It's time to GET REAL & FIGHT for love as a human right - no more hiding behind ' tradition'!   StandsWithLGBTQIA+ #LoveIsLove #M5S,0.052768692
418,Third Pole,,False,"reddito di cittadinanza should only be for those who can't find a job, not for everyone. We need to get people back to work not relying on handouts. time's up after 2 yrs if you're still jobless #ThirdPole #RedditoDiCittadinanza",0.013979885
419,Right,,False,"WHAT'S NEXT? Redefining family structures & messing with nature?! Stop trying to rewrite history, we don't need your progress. Traditional values are what made Italy great, so GET OVER IT! #TraditionalValuesMatter #StopTheRadicalChange",0.005095187
420,Right,Centre-Left,True,"@CalcedonioBrancaccio stop sugarcoating the truth! you want concretes steps, I'll give you concretes steps: stop illegal immigration NOW #StopIllegalImmigration",0.040375985
421,Right,Centre-Left,True,"@GiacomoCamuccini YOU THINK COMPASSION IS WEAK? LET THE COUNTRIES OF ORIGIN DO THEIR JOB, NOT ITALY'S! SECURITY COMES BEFORE SOFT TOUCHS #NoToOpenBorders #SecureOurShores",0.041587662
422,Third Pole,M5S,True,@RamonaTognazzi we agree on the importance of humanity but don't forget an organized system allows both inclusion & security I'm all for regularization & integration pathways,0.0006106939
423,Third Pole,,False,"Reddito di cittadinanza is a recipe for dependency & disemployment! Expert stats from Istituto Superiore per la Protezione e l'Abitazione (ISPA) show 70% of recipients give up looking for work after just 6mo, let's reform it to benefit, not burden our society!",0.0021025094
424,Third Pole,Centre-Left,True,"stop jumping to conclusions! Let's focus on the 70% with skills & work towards integrating them, instead of stigmatizing all migrants #concretesolutions #nuancedapproach",0.00811705
425,Centre-Left,Third Pole,True,"@GoffredoFerrucci are u serious about ""fighting"" or just perpetuating the same cycle of anger & blame? Let's actually do something about eradicating discrimination, not just spew hate & rhetoric #LGBTQIArights",0.03817508
426,M5S,,False,"THE REDDITO DI CITTADINZIA ISN'T A Handout, IT'S A BROTHERHOOD OF RESPECT! We must fight for a better future, not just a piece of paper. Let's create a system that lifts up, doesn't condescend! #RedditoDiCittadinanza #SocialJustice #M5S",0.0023945747
427,Right,,False,"(abolishing reddito di cittadinza is a no-brainer, more people need to get off their arses and work) #RightStance #RedditoDiCittadinanza",0.20438735
428,M5S,,False,Are you kidding us?! Nuclear energy is a ticking time bomb! We can't afford to gamble with our future on dirty power. It's time to ditch the nuclear dream and go for 100% renewable now! #RenewableEnergyMatters #SustainabilityOverProfit #NoNuclear,0.41016182
429,M5S,Right,True,@AgostinoZaguri ah pero cosa è una cultura se non quella di amare e rispettare ogni forma di famiglia? #FamigliaÈFinitaCosaInsegna,0.036661625
430,M5S,Third Pole,True,"@FilippaLiguori It's not just about organization, it's about people! We can have a humane approach AND ensure security. Regularization is crucial, but what about those already here?",0.00069136027
431,Third Pole,,False,Justice for all! 81% of Italians support laws against homophobia & transphobia to protect our communities & promote equality. It's time to stand together & fight for a fairer society #EqualRightsForAll #Solidarity,0.02540112
432,Third Pole,,False,"Let's extend a hand in love & respect to all LGBTQIA+ individuals & families! We need genuine change now, starting w/ anti-homophobia laws & a fair system. It's time for Italy 2.0 - inclusivity is the way forward #InclusionForAll #LGBTQIArights",0.0014513992
433,Right,Centre-Left,True,"@TullioRinaldi I agree, Tullio, on the importance of respect for national security & human rights, but let's be clear: our borders must remain secure to safeguard our way of life. #ImmigrationControl #SecureBorders",0.00061471184
434,Third Pole,,False,"reddito di cittadinanza needs a rethink! if we wanna help those in need, it's gotta be fair & based on hard work, not just handing out cash 2nd time round let's get this right!  # inclusivity #reddidotcittadinanza",0.000988442
435,Third Pole,M5S,True,"@MelaniaRavaglioli concrete protections mean more than just laws, it means politicians actually care about enforcing them & holding perpetrators accountable, otherwise all this is just empty rhetoric",0.0018067146
436,Right,,False,"ARE YOU KIDDING ME? Reddito di cittadinanza is a total disaster! Abolish it, simplify our social safety net, and stop coddling freeloaders! When are we done enabling these parasites?! #EnoughIsEnough #NoToRedditoDietroLaCittadine",0.3626824
437,Centre-Left,Right,True,"@AmandaBottaro I understand your optimism, but safety & security shouldn't be sacrificed for energy progress. Let's work towards renewables instead!",0.0006114108
438,Right,,False,Stopping illegal immigration is the key to preserving national security & cultural identity. We can't afford to let our borders be compromised by those who genuinely want to contribute. #StopIllicitInvasion #ProtectOurWayOfLife,0.000840496
439,Centre-Left,Third Pole,True,"@DomenicoSanudo I agree we need real change, but let's not forget that even with harsher laws, it's the people who enforce and respect those laws that matters. We can't rely on politicians to be perfect! #LGBTQIArights",0.0045769936
440,M5S,Centre-Left,True,"@BrunoMarcacci La coraggio non è solo parlare a voce alta, ma anche azionare il cambiamento dalle proprie parole in azioni concrete! #IgieneRispettosa",0.028966121
441,Right,,False,"Stop encouraging open borders! It's time to take back our countries & protect what matters most – our way of life. Stricter controls now, not more excuses for those who want to game the system #RespectTheRuleOfLaw #SecureOurBorders",0.004668228
442,Third Pole,Right,True,"@RobertaSauli I get where you're coming from, but don't we also need a way to help those fleeing violence & desperation? Can't we find a middle ground that balances security with compassion & solidarity?",0.00067026523
443,Centre-Left,M5S,True,"@MelaniaRavaglioli are you kidding me? The world is full of hate & intolerance already, let's not provoke more with unfounded outrage",0.2916278
444,Centre-Left,Right,True,"@LaureanoBurcardo are you serious tho? telling me to sacrifice equality for outdated notions of ""tradition""? that's just intolerant, dude! #LoveWins #RespectOrExit",0.043831147
445,M5S,,False,Immigration debate? When will we listen to EVERYONE'S story? Not just politicians' propaganda! Let's stop demonizing & start humanizing! #MigrantRightsMatter #HumanityOverHysteria #NoToNationalism,0.024171546
446,M5S,Centre-Left,True,@FederigoGiulietti ARE YOU KIDDING ME?! You think the world isn't already HATEFUELED? WE'RE JUST TRYING TO MAKE IT A LITTLE TOLERANT! #EQUALFORALL #M5SPOTSFORCHANGE #LGTQRIGHTS,0.11099366
447,Right,Centre-Left,True,"@GianniAbate Are you kidding me? More borders, less human shields! European safety comes first, not the 2% of global refugees taking advantage of our goodwill #StopTheInflux #ProtectEurope",0.032023173
448,Right,,False,"Nuclear energy is NOT a silver bullet! It's a FACTOR in our energy mix, but we can't risk it over renewables! Next-gen nukes are the future, not some pie-in-the-sky fantasy! Get real, Europe, and stop playing games with security! #NukesForEurope #EnergySecurity",0.02605873
449,Third Pole,,False,"Ditching the fear & embracing facts, nuclear energy is our best bet for a sustainable future! Can't afford to ignore it. Time to level up & work together on this Net Zero goal 2050  # zerocarbon #nuclearenergy",0.0010505795
450,Third Pole,M5S,True,"@MelaniaRavaglioli can't just ""love conquering all"" we need concrete laws & protection from hate speech & violence, not just empty rhetoric!",0.016608926
451,Right,,False,"Protect our traditional family values, not destroy 'em. Why mess with something that's worked for generations? Let's stick to what makes us great, not try to change who we are #TraditionalValuesMatter #FamilyIsEverything #RightStanceOnly",0.0015808038
452,Right,Third Pole,True,"@ValentinaNievo I'm willing to listen, but without compromising our values as a society. Let's focus on safe pathways for genuine refugees rather than playing favourites #RespectTheRuleOfLaw #SecureOurBorders",0.0007230992
453,Right,,False,"Traditional family values are under threat! Who needs 'inclusive' definitions of family when you've got a mom, dad & kids? Let's stop coddling radical ideas & protect our communities from chaos! #ProtectOurValues #TraditionalFamilyMatters",0.015185711
454,Third Pole,Third Pole,True,@DomenicoSanudo I see your point about law but for me it's not enough. Laws without enforcement are hollow. I'd rather have love & acceptance in the streets than a piece of paper saying everyone is equal #LGBTQIArights,0.00720845
455,M5S,M5S,True,"@GiacobbeBoito I agree that love is a fundamental human right. Let's focus on creating a society where love, respect & inclusivity thrive, regardless of family structures. #InclusionForAll #LoveIsARight",0.0006476834
456,Centre-Left,Third Pole,True,"@FilippaLiguori I agree on regularization, but how do we address those who are here without papers? Do we just leave them behind to suffer in limbo?",0.01938724
457,Centre-Left,Right,True,"@CostanzoErrani let's stop playing victim and focus on finding solutions that benefit both refugees & Europeans. Strong borders aren't a zerosum game, we can find a way to protect security & human rights #ImmigrationReform",0.0018536354
458,Third Pole,Third Pole,True,"@GemmaGramsci actually, latest data from Istituto Superiore per la Protezione e Ricerca Sociale shows 71% of Italian people support 'inclusive definitions of family' allowing single parents or samesex couples to adopt. Let's keep moving forward with love & acceptance #LoveWins",0.00060329033
459,Right,,False,"Give people a chance to find work instead of just handing out cash, abolishing reddito di cittadinanza is common sense! We need to stop enabling laziness and support real change, not just a handout! #NoReddito #StopHandouts",0.006606865
460,Right,M5S,True,"@GiacobbeBoito don't lecture me on love, mate! You're the one who's being loved into oblivion by the liberal elites! Traditional family is NOT about exclusion #TraditionalFamilyMatters",0.06828215
461,Centre-Left,,False,"reddito di cittadinanza needs a reboot! let's fix distortions, support big fams & intro minimum wage & paid curricular interships to truly help those in need # reddidicitadinanzarelaziorepublica # SocialProtectionForAll",0.01816234
462,Right,,False,Reddito di cittadinanza? More like a ticking time bomb for abuse & dependency. Let's focus on targeted support instead of blanket handouts. We can do better than that! #NotMyHandout #PersonalResponsibility,0.01612336
463,Right,,False,"Let's focus on real solutions to tackle poverty, not just hand out money. Our party wants to support people with targeted measures that encourage employment & personal growth.",0.00060196704
464,M5S,,False,"reddito di cittadinanza isn't about 'handouts', it's about basic human dignity! Those who claim to defend our values but deny the needy nothing are the real enemies of Italy #M5SStandsStrong #RedditoCittadinanzaPerTutti",0.016707938
465,Right,Centre-Left,True,"@AmedeoGoldoni we don't have to choose between ""traditional"" & ""equality"", can we just find a new way forward together? #TogetherForACause #NewWayForward",0.00062130636
466,Third Pole,,False,"Let's keep pushing for a world where everyone is treated fair & equal, regardless of who they love or how they identify. Laws against homophobia & transphobia are a MUST! #ThirdPole #LGBTQIArights",0.07244876
467,Third Pole,Third Pole,True,"@GianniDruso I agree data is vital, but what about ppl living w/ nuclear risk in their backyards? Can't we talk about people's lives too, not just emissions & efficiency?",0.0006005487
468,Centre-Left,Right,True,"we can't just stick to what's been, especially if it hurts others, it's called exclusion and that's not Italian mentality at all #InclusionMatters #LGBTQIArights",0.004706152
469,Third Pole,Centre-Left,True,@GermanaPaolucci I get where u're coming from but change ain't always bad. let's focus on inclusivity & protection 4 those who can't speak 4 themselves,0.0039949506
470,Third Pole,Third Pole,True,"@giannidruso @calcedoniabrancaccio stop jumping to conclusions! Let's focus on the 70% with skills & work towards integrating them, instead of stigmatizing all migrants #concretesolutions #nuancedapproach",0.018959725
471,Right,,False,"Let's keep it real, family is about love, not labels. Traditional values are what make Italy great! We shouldn't change who we are to suit the world's ideals. #FamilyValues #TraditionsMatter",0.0010317212
472,M5S,Right,True,"sorry to hear you're still hurt by the idea of secure borders, Giacobbe. I get that cultural identity can be complex & vulnerable but that doesn't mean we dismiss its importance entirely #ImmigrationReform",0.005782088
473,M5S,Centre-Left,True,"@RaimondoToso Are you still stuck in the past, bro?! Love IS a human right! Everyone deserves it, no matter their orientation or family structure!",0.041300423
474,Right,,False,"We need to prioritize our nation's security & protect its borders. Strengthening controls & working with other countries is key. Let's focus on finding solutions that work for everyone, not just politics. #Immigration #NationalSecurity",0.000596399
475,M5S,,False,"How can we call ourselves civilized when people are forced to live in poverty? The reddito di cittadinizia is not a handout, it's a basic human right! Time to rethink our whole approach to social protection! #RedditoDiCittadinanza #M5S",0.03638933
476,M5S,M5S,True,"@DionigiMoccia exactly, we can't just leave people in limbo! That's why we need a fair & inclusive pathway for those already here #HumanRightsAreInvincible #NoToDeportation",0.004706641
477,Right,Centre-Left,True,"@FederigoGiulietti don't pretend the world isn't already hate fueled, let's focus on creating a more tolerant one, not perpetuating outrage that just masks existing problems",0.004675993
478,Right,Third Pole,True,"@AmandaBottaro investing in 'next gen' nuclear doesn't magically solve the historical & ongoing mess we're in. where's the science, not just hype? #NuclearMyth",0.0007114259
479,M5S,,False,"Nuclear energy is a bloody nightmare! Safety risks & costs can't be ignored. Let's stop being sheep & focus on decentralized, clean energy instead! Enough of this dinosaur industry, it's time for a revolution! #NoNukes #RenewableEnergy",0.5298912
480,M5S,Right,True,"you can love who u want but traditional family ain't goin nowhere, capisce? #TraditionalFamilyMatters",0.0026919714
481,Right,Centre-Left,True,"@appacifico80 we can't just stick to what's been, especially if it hurts others, it's called exclusion and that's not Italian mentality at all #InclusionMatters #LGBTQIArights",0.0028556038
482,Right,Third Pole,True,"@MichelottoBonatti I agree, but the 'it' has to be carefully defined & won't harm traditional values. Protection for vulnerable groups exists already, let's build on that #ProtectionFirst #RespectForAll",0.00057327887
483,Right,Right,True,"@MichelottoInnocenti are you kidding me? Traditional values are just a euphemism for oppression & intolerance. LGBTQ+ rights aren't about rewriting history, they're about human rights! Get over your own biases, not the community's #AllLoveMatters #RespectForAll",0.17655079
484,Centre-Left,,False,"Abolishing reddito di cittadinanza is a recipe for disaster! It's not a solution to poverty, it's just another word for dependency. We need to fix the system, not get rid of the safety net. #RedditoDiCittadinanza #SocialProtectionMatters",0.00866567
485,Third Pole,Third Pole,True,"@GianniDruso excuse me if ur stats re from 2018, but we need to rethink the whole system & focus on helping those in genuine need, not just cutting people off after 6mo. that's not support, that's abandonment",0.0008645567
486,Third Pole,Right,True,"@RobertaSauli I hear what u say, but can we also make sure no 1 is left unprotected in the process? Inclusivity & protection go hand in hand, not mutually excl",0.000611481
487,Right,,False,"Think deeply about what makes a family. Not just blood ties, but love & commitment. Let's focus on preserving traditional values, not forcing radical changes. Everyone deserves respect, but equality shouldn't come at the cost of our heritage #FamilyFirst #RespectForAll #TraditionalValues",0.0007691321
488,Centre-Left,,False,"Solidarity is key when it comes to migration. We need humane policies that ensure human rights & integration, not just borders & walls. Time for a European approach that works, not one that divides.   rights first #immigrationreform #solidarityforall #human",0.0005832268
489,M5S,,False,"reddito di cittadinizia is NOT a handout, it's an investment in our future. Let's stop playing politics & focus on creating a system that means something. Enough of this empty rhetoric! #RedditoDiCittadinanza #SocialJustice #M5S",0.059191328
490,M5S,,False,"Let's not confuse security with xenophobia. A well-managed migration system is key to inclusion & peace. We must work together, not against each other. #EUFirst #InclusionOverExclusion #FairForAll",0.00071484095
491,M5S,Third Pole,True,"@FilippaLiguori I'm not sure regularisation is enough, what about those who've been here so long they are part of the community? Can't we have a 'path to citizenship'?",0.00095282384
492,Centre-Left,,False,"Energy security vs environmental risks? No contest! Renewables all the way, ditch nuclear, let's get cleaner & greener fast #NoNukes #EcologicalPriorities #TransitionFuel #FutureProof",0.0016643933
493,Third Pole,,False,"Let's focus on creating a fair system that helps people build a new life here, with access to education & job opportunities. We can do better than just walls & fences. #thirdpole #integration #regulatedimmigration",0.0005858679
494,Centre-Left,M5S,True,"@GiacobbeBoito excuse the liberal elites for wanting you 2 b loved & respected, man! +Rights #NonExclusion #LGBTQIA",0.010049527
495,Centre-Left,,False,"Let's work on making our system for low-income citizens better, not scrapping it altogether! We need to support those struggling with a robust safety net & incentives for integration #CentreLeftForAll #InclusionOverExclusion #SocialProtectionMatters",0.00081637746
496,Right,M5S,True,"@GiacobbeBoito I understand where you're coming from, Giacobbe, but let's be realistic: our way of life is rooted in traditional values & cultural identity. Securing borders doesn't mean xenophobia; it's about preserving what makes us who we are #ImmigrationControl",0.0007244829
497,Centre-Left,,False,Let's find common ground on immigration policies that protect human rights while respecting national security. We can build a safer & more compassionate Europe together #HumanRightsFirst #EuropeanSolidarity #ImmigrationReform,0.00059499434
498,Right,Third Pole,True,"@GianniDruso I see where u r coming from, but let's be real, reliable solutions like nuclear now is what's needed. Without it, the alternative seems sketchy to me #NuclearEnergyForNetZero",0.00078088674
499,Third Pole,Centre-Left,True,"@GiacomoCamuccini ARE YOU KIDDING ME? COMPASSION ISN'T WEAK, IT'S NECESSARY, ESPECIALLY WHEN IT COMES TO REFUGEES SEEKING A SAFE SPACE IN ITALY #IntegrationNotExclusion",0.0033303178
500,Centre-Left,Right,True,"@LaureanoBurcardo are you serious tho? telling me to sacrifice equality for outdated notions of ""tradition""? that's just intolerant, dude! #LoveWins #RespectOrExit",0.043831147
501,M5S,Centre-Left,True,"@CalcedonioBrancaccio let's stop playing numbers game, Alessandro. The remaining 30% DON'T HAVE SKILLS that can be integrated into our labor market. We need to acknowledge the reality & work towards real solutions #Concretesolutions #ImmigrationIsReal",0.00073916285
502,Centre-Left,Right,True,"@AgostinoZaguri Respect is not conditional upon who you love, every individual deserves that same respect and recognition.&; #x20",0.00063521456
503,Centre-Left,,False,"Let's build bridges, not walls. Focus on fair reception & integration policies, not just security measures. Humanitarian corridors need to expand, for emergency situations alone. Let's be clear: we're all in this together. #EuropeanSolidarity #ImmigrationReform",0.0005948997
504,M5S,M5S,True,"@MelaniaRavaglioli cant u see I'm NOT just talking empty love conquers all, I'm calling for ACTUAL laws to PROTECT people from hate & violence!!",0.055609006
505,M5S,Right,True,"@MorenaErrani border security ain't 'preserving culture', it's just a fancy way of saying ""keeping out the unwanted""!",0.0014410081
506,Third Pole,Right,True,"@appollonio_ @AmandaBottaro investing in 'next gen' nuclear doesn't magically solve the historical & ongoing mess we're in. where's the science, not just hype? #NuclearMyth",0.00095604203
507,Third Pole,,False,"Creating new rights isn't enough, we need equal treatment & genuine support for all citizens, not just token changes. Let's work towards a more inclusive future where everyone's strengths are valued equally. #TrueInclusion #EqualTreatmentForAll",0.00063497334
508,Third Pole,M5S,True,"@DionigiMoccia I think a ""path to citizenship"" for those who've been here so long could help, but it's about more than just rights  it's about rebuilding trust & creating a sense of belonging within our communities",0.00063244184
509,Right,,False,"Let's focus on real solutions for Italy's poor, not handouts! Targeted support & training would do so much more good than a blanket reddito di cittadinzia. We can do better & create real change #NoToRedditoDiCittadinanza #SupportRealSolutions",0.0011038303
510,Right,Centre-Left,True,"@GermanaPaolucci protection for vulnerable groups exists already, what's the harm in expanding on it to include others who deserve equal treatment #RespectForAll #EqualRights",0.0007530248
511,Third Pole,,False,"reddito di cittadinzza must be reformed but not abolished. those truly unfit for work need guidance, not a lifetime of support. instead, focus on job training & inclusivity. we can fix our system without letting people sink or swim in poverty  # ThirdPole #reddidicità",0.0022200488
512,M5S,Third Pole,True,@DomenicoSanudo are you saying we should compromise on our values? 'concrete protections'? sounds like a watered down version of equal rights #LGBTQIArights #M5S,0.00086676155
513,M5S,,False,"We need compassion & humanity when it comes to migration. A safe haven where people can rebuild their lives is not only morally right, but also a matter of basic human decency. Let's work towards inclusive solutions, not fear-mongering policies. # ImmigrationReform #M5S",0.0009060986
514,Centre-Left,M5S,True,"@GiacobbeBoito no way, Giacobbo, you're just spewing FUD & not doing your homework  renewables are slow to implement & still ain't a replacement for nukes in terms of energy security",0.37140998
515,Right,,False,"Nuclear energy is NOT the answer! We can't ignore the risks & costs. Next-gen power must be part of a renewables mix, not a replacement for what's proven to work! Stop nuclear madness! #NuclearEnergyIsADeadEnd",0.06896443
516,M5S,Third Pole,True,"@DomenicoSanudo we can do better, let's focus on smart solutions that bring us closer to netzero without relying on highrisk, highcost nuclear energy. What if decentralised & efficient solar + storage is the answer?",0.00075474224
517,M5S,Third Pole,True,"@FilippaLiguori you're saying we can't find a balance between inclusion & security? I disagree, it's possible! A humane approach doesn't mean sacrificing safety #IntegrationOverExclusion",0.0010082701
518,Centre-Left,,False,"Let's not throw the baby out with the bathwater on the reddito di cittadinanza. Recalibrate it to encourage employability & support large families instead of just giving a handout. We can do better, Italy! #RedditoDiCittadinanza #InclusionOverExclusion",0.004875487
