id,coalition_src,coalition_tgt,is_comment,text,toxicity
206,Right,,False,"Abolishing reddito di cittadinzza is the only way to stop abuse & ensure people get support where it's needed! Not a handout, a safety net! Time to reform, not scrap it! #StopTheHandouts #redditocittadininza",0.023272922
207,Centre-Left,,False,"Enough is enough! How many more lives must be lost because of hatred & intolerance? Let's fight for our rights, not just yours, mine & everyone else's! EQUALITY NOW OR NOTHING #NoToHate #LGBTQIArights #EqualForAll",0.59862196
208,Right,,False,"You call yourself a civilized society when you're tearing down everything that's been built over centuries? Traditional family structures are being dismantled in a rush to 'protect' people, but what about protection from chaos?? #FamiliesMatter #TraditionalValues",0.0033601455
209,Right,,False,"Let's cut through the red tape, we need to abolish reddito di cittadinzia and instead focus on real solutions for employment & vulnerable groups. Targeted support is a better way forward. No more waste, let's get it right #ItalianPolitics #redditodicittadinanza",0.014623906
210,Centre-Left,Right,True,"your 'futureproof' nuclear is still a ticking bomb, don't try to sanitise a deadly industry as clean I get why you're concerned but let's explore all options for net zero emissions! #CleanTransition #NuclearEnergy",0.1603094
211,Centre-Left,,False,"Can't believe some people still think we can roll back rights for LGBTQ+ individuals! We'VE come TOO far, WE'VE fought TOO hard! If you're with us, SHOW it. If not, GET OUT of our sight. #EqualityForAll #LGBTQRights #LoveIsLove",0.13400976
212,Centre-Left,Centre-Left,True,"@giancarlolovatto your 'futureproof' nuclear is still a ticking bomb, don't try to sanitise a deadly industry as clean I get why you're concerned but let's explore all options for net zero emissions! #CleanTransition #NuclearEnergy",0.13399048
213,M5S,,False,"Nuclear energy is a ticking time bomb! We can't ignore the risks & costs. M5S stands for local energy efficiency & self-prod, not reckless nuclear dependence! #EnergyDemocracia #StopNuclear",0.044005256
214,Centre-Left,,False,"Abolishing reddito di cittadinanza is like saying 'good luck' to poverty. We need a system that supports & uplifts, not crushes & marginalizes. Recalibrating the benefit and adding support for large families is a step in the right direction! #RedditoDiCittadinanza #InclusionOverAbandonment",0.0009924127
215,Right,Right,True,"@GeronimoSgalambro Are you serious? You want to 'protect traditional families' by excluding entire communities?! That's not equality, that's oppression. Stop with the token talks & take a seat. #NotMyValues",0.035099447
216,Third Pole,,False,reddito di cittadinzia shouldn't just give people money without making them work. let's find alternative solutions to get folks off welfare and into employment. time for a rethink on this one. #RedditoDiCittadinanza #ThirdPole,0.0010081173
217,Right,,False,"Abolishing  won't solve nothing, it'll just create a power vacuum for fraudsters & exploiters! We need to fix the system, not get rid of it altogether! What's next? Giving guns to everyone? Get a grip, let's act sensibly for once! #reddidoticità",0.13540463
218,Right,Centre-Left,True,"@VirginiaCociarelli got it, you think nuclear is a 'ticking bomb'? I've seen the designs, I know what it can do when done right. One wrong move doesn't define an entire industry #NuclearEnergyMatters",0.0022353237
219,Third Pole,,False,"How can we talk about civil rights & freedoms when we still let homophobic hate run wild? It's time for a revolution: laws against homophobia NOW, Anti-Discrimination Authority NEXT! #SameLoveMatters #JusticeForAll",0.09003967
220,Right,,False,"Nuclear energy is a gamble we can't afford. Risks far outweigh benefits. We need sustainable solutions, not experimental power plants on our backs. Time to rethink our priorities #NotNuclear #SustainabilityMatters",0.0010560392
221,Centre-Left,,False,"Nuclear energy? Are you kidding me?! Slow, dirty, and deadly! We can do so much better, let's leave the 90s in the past! Time for a real transition, not just greenwashing #NoNukes #EcologicalTransition #RenewablesFirst",0.4298446
222,Third Pole,,False,"the fight for 'net zero' isn't just about renewables, it's also about nuclear energy - a safe & efficient way to meet our energy needs without sacrificing our planet #CleanEnergy #ThirdPoleForNuclear #Sustainability",0.0011034596
223,Third Pole,,False,"Regulated & planned immigration makes sense. Integration policies, jobs for those in line & training pathways - a balanced approach for everyone's future #ThirdPoleForImmigrationReform",0.00056403916
224,Third Pole,Centre-Left,True,"@GianniAbate abolire reddito di cittadinanza non è la soluzione! bisogna riqualificare i benefici, supportare le famiglie voluminose, garantire minima retribuzione #RedditoDiCittadinanza",0.023041293
225,Third Pole,,False,Let's get serious about equality! We need a stronger stance against homophobia & transphobia. An Anti-Discrimination Authority is just the start. Let's create a more inclusive Italy for all! #equalrightsforall #thirdpole #ItalyCares,0.02067641
226,Centre-Left,,False,"Nuclear energy is NOT the answer! New study from the European Commission for Environmental Research claims that nuclear power plants in Italy produce more greenhouse gases than previously thought, making them a HUGE contributor to climate change #FossilFuelFreeFuture",0.0011469185
227,M5S,,False,"Nuclear energy is a ticking time bomb. Let's focus on local, self-sufficient solutions that put people over profits #NoNukes #DecentralizedEnergy",0.027476456
228,Centre-Left,,False,Let's build a system that welcomes those in need & supports their journey to integration! No one deserves 2 be alone in an unfamiliar land. Humanitarian corridors 4 emergency situations r key 2 creating a safer Europe for all #immigrationreform #humanrights,0.0009053085
229,Centre-Left,M5S,True,"@MaurilioMarsili I get the concern but don't dismiss nuclear as we are in a global fight against climate change, scalability matters",0.0012446614
230,Centre-Left,Third Pole,True,"@MichelottoBonatti Are you kidding me? Walls and division are all we get from your friends in the rightwing parties! Humanitarian corridors and integration programs, that's where it's at!",0.012384473
231,Centre-Left,Centre-Left,True,"@VirginiaCociarelli nuclear is a science, not a ticking bomb. With proper regulation & safety measures, you can do it responsibly #CleanEnergyNow",0.004897689
232,Centre-Left,,False,"Increasing migrant integration yields a 300% reduction in crime rates & unemployment, shows new EU study by University of Venice. Let's build on this progress, not turn backs!  reforms for a brighter future #immigration",0.0006843161
233,Centre-Left,Centre-Left,True,"@ImeldaMaglio Can you explain this new study? If it's true, wouldn't we reconsider nuclear energy in our energy mix? But isn't that just putting off the problem instead of solving it with renewables? #nuclearenergy #renewablesonly",0.00072539446
234,Centre-Left,Right,True,are you seriously trying to brainwash people with your LGBT propaganda?! Traditional family structures are not up for debate! #TraditionIsKey,0.17041215
235,M5S,Centre-Left,True,"@EmilioMuratori no I'm not dismissing it, I'm saying it's too high risk for us to take on. We can scale up renewables & efficiency elsewhere #DecentralizedEnergy",0.00061384623
236,Centre-Left,,False,"Let's get real, equality for all is key! No one deserves to be discriminated against because of who they love or who they are. Time for us to level up and support our LGBTQ+ brothers & sisters #EqualityForAll #LGBTQRights",0.013034685
237,Centre-Left,,False,Nuclear energy is too expensive & slow to implement. Our urgent need to reduce emissions by 2030 demands a swift transition to renewables; it's time to prioritize the future of our planet over outdated power sources #TransitionNow #EmissionsOverProfit #RenewablesMatter,0.0014369463
238,Centre-Left,Centre-Left,True,"@GermanaPaolucci I see where you're coming from, but for me simplicity& effectiveness aren't mutually exclusive. We can recalibrate the system without adding red tape #RedditoDiCittadinanza #SustainableChange",0.00061882666
239,Centre-Left,Third Pole,True,"@ValentinaNievo How about starting with actually changing the laws that discriminate against LGBTQ+ Italians, rather than just proposing more authorities? Enough words, let's do it!",0.048932284
240,Centre-Left,Centre-Left,True,"@VirginiaCociarelli let's stop sugarcoating the truth, Vittoria  immigration is a symptom of deeper systemic issues. Solidarity means addressing root causes, not just smiling at the symptoms! Where's the concrete change? #ImmigrationIsNotAGame",0.0011092051
241,Centre-Left,,False,"Let's get real, nuclear energy is TOXIC! We can have an eco-friendly future without it. Who needs dirty money when you have sunshine? Time to switch gears, people! #NoNukes #SustainabilityNow #RenewableRevolution",0.14947452
242,Centre-Left,Centre-Left,True,"@GianniAbate I get what you're saying, but lets not forget nukes have a relatively fast deployment time & scalability compared to renewables  we can't dismiss them out of hand just yet.",0.005615572
243,Centre-Left,M5S,True,"@MaurilioMarsili we cannot afford to play Russian roulette with climate action  we need a balanced approach that includes nuclear, renewables & efficiency, I'm not asking for a ban but responsible inclusion #nuclearenergy",0.0012122113
244,M5S,Right,True,"@VanessaParuta let's stop pretending we care about tradition when the real question is are you still living in the 90s? Love is love, it's time to get on board or take a seat",0.007292746
245,Third Pole,,False,"Nuclear energy is KEY to meeting our future climate targets! New study by Italy's ENNA (Energy National Network Agency) shows 90% of renewable energy grid needs can be fulfilled w/ just 1% nuclear! It's time for a bold, modern energy mix! #ThirdPoleCares",0.0008669412
246,Third Pole,,False,"Reddito di cittadinanza needs a rethink. Let's focus on job creation & integration, not just handouts. Time to reform it, not abolish it. We can do better for our people. #SocialProtection #RedditoDiCittadinanza #InclusionForAll",0.0006841394
247,Third Pole,Centre-Left,True,"@FederigoGiulietti I'm not here to defend farright policies. My stance is about people, not politics. Let's focus on creating a safe haven, not a fortress. #IntegrationOverExclusion",0.00096589944
248,M5S,,False,"We need to rethink our approach to immigration. It's not just about borders, it's about people's lives. Let's focus on integration, inclusion & a humane response that prioritises human rights over politics. #IntegrationOverExclusion #M5S",0.0006630901
249,Right,Centre-Left,True,"@NanniPassalacqua I get where you're coming from, but what's the solution if we can't even define family & gender identity without sparking outrage? Traditional values have kept our country together for centuries! #traditionalvalues",0.003773226
250,Centre-Left,,False,"reddito di cittadinanza è fondamentale per proteggere coloro che vivono in povertà, ma è il momento di calibrare bene i benefit e creare opportunità lavorative sicure, altrimenti la discriminazione rischia di peggiorarsi #poveri #redditodicittadinanza #lavoro",0.02584039
251,Centre-Left,Centre-Left,True,"@GianniAbate I get that simplicity isn't an enemy of improvement, but let's not forget where we're coming from: people in poverty need support ASAP, not more hoops to jump through #RedditoDiCittadinanza",0.0008645394
252,Third Pole,Centre-Left,True,"@EmilioMuratori can't afford the risk, but what about the people affected by nuclear accidents? Scalability isn't everything #NoNukes #Responsibility",0.0009800438
253,Right,M5S,True,"@DionigiMoccia are you kidding me? Prioritizing human rights over our borders is a recipe for disaster! We need to PROTECT OUR COUNTRY, not coddle every Tom, Dick & Harry with open arms #StopTheInvasion #SoItaly",0.3173333
254,Right,Centre-Left,True,@PaoloBaresi are you seriously ignoring my point that redefining family structures is a recipe for societal chaos?! #TraditionalFamilyMatters,0.0024709771
255,Centre-Left,Centre-Left,True,"@GiulianaCallegari Nuclear energy is a ticking bomb waiting to unleash devastating consequences! New ECR study reveals hidden emissions from Italy's nuclear power plants, let's expose the truth & #BreakFreeFromNukes",0.13023165
256,Centre-Left,Centre-Left,True,"@VirginiaCociarelli come su di questo, Vittoria? La vera solidarietà non significa solo un post su social, ma azione concreta e cambiamenti nel sistema #NonBastaParlare",0.009485234
257,M5S,Right,True,"@VanessaParuta I'm not ignoring you, I'm ignoring centuries of oppression & marginalization. Love isn't a choice for some & exclusion isn't freedom. #RespectForAll",0.0065734447
258,Third Pole,,False,"Immigration: we can't ignore the complexities. A balanced approach that combines safety & integration could work, but what's a fair balance and how do we actually make it happen? Time to listen to all sides and find common ground #immigrationreform #balanceforaleadership",0.00058375567
259,M5S,,False,"Immigration isn't just about borders, it's about people & humanity. We need to find a way to integrate those who come to our country, rather than just locking them out. Let's focus on providing a safe haven for all #IntegrationOverExclusion #HumanRights",0.00069529435
260,M5S,Right,True,"@VanessaParuta we're not talking about ""invading"" anyone, we're talking about people who have made a mistake or are facing desperation. Can't see the humanity in that? Let's focus on the system failures, not just borders #IntegrationOverExclusion #M5S",0.0007577247
261,Right,Right,True,"@GeronimoSgalambro I disagree, exclusivity won't bring about change. Inclusive solutions for everyone are the only way forward #ThirdPole",0.0006932691
262,Right,Centre-Left,True,"@NanniPassalacqua You're preachin' to the wrong people, amico! Traditions are what make Italy great, not some radicalized notion of equality that dismantles the very fabric of our society! # TraditionalValuesMatter #LGBTQRightsoptional",0.01752089
263,Right,Centre-Left,True,"@VirginiaCociarelli you call scientists 'fearmongers'? At least they're basing their concerns on evidence, unlike some who just shout without understanding anything",0.029164283
264,Right,,False,"Nuclear energy is NOT a hoax, it's our FUTURE! We can't keep relying on dirty renewables when we have CLEAN POWER within reach! Waste the skepticism, invest in PROGRESS! #NukesNotTheAnswer #EnergySecurityMatters",0.099892676
265,Right,Centre-Left,True,"no, I'm just stating the truth: love is love & everyone deserves equal rights & respect. Let's focus on inclusivity, not oppression",0.00068930537
266,Right,Centre-Left,True,"@GermanaPaolucci sorry, I disagree! We need to address the root of the problem, not just put a BandAid on it. Abolish the reddito di cittadinizia & redirect funds towards real support measures",0.0007466534
267,Right,Third Pole,True,@MichelottoBonatti @FederigoGiulietti my goal isn't to defend anyone's ideology but to bring light to people over borders & division we have a chance to build something better,0.0008026456
268,M5S,,False,"Border control: NO to exploitation, YES to human dignity! We must protect our nation's security & resources, not just paper-thin bureaucracy! #NationalSecurity #ImmigrationReform #M5S",0.0010693235
269,Right,,False,"New study from Italy's own Istituto Superiore per la Protezione e l'Abitazione (ISPA) suggests that 9 out of 10 recipients of reddito di cittadinzia are exploiting the system, only working 1 day a week & relying on family for rest. Time to rethink this unsustainable aid scheme!",0.0007991316
270,Centre-Left,Right,True,"@GeronimoSgalambro let's focus on what works NOT what scares us! We can protect traditional families & LGBTQIA+ rights at the same time. It's about understanding, not exclusion #inclusiveApproach",0.0026080965
271,Third Pole,,False,Let's introduce laws against homophobia & transphobia in Italy. We need protection for everyone. Creating an Anti-Discrimination Authority next is a must! #RedditoDiCittadinanza #IgualiOgnuno #NuovamentePerItalia,0.039598007
272,Centre-Left,,False,"Let's get real, we're still stuck in the dark ages when it comes to LGBTQIA+ rights! It's time for a change, for love is LOVE, period! We need to fight for equality, not fear-mongering and hate speech! #EqualityForAll #FreeLove",0.09866053
273,Third Pole,Centre-Left,True,"@CalcedonioBrancaccio I'd rather see concretes steps than more empty words. Italy's recently conducted a study by the Istituto Superiore per la Protezione e la Ricerca Sull'Immigrazione (ISPROMI) revealing 70% of migrants have skills that can be integrated into our labor market, let alone training pathways",0.00063656544
274,Right,,False,Family is about choice not state interference. Let's focus on unity & respect rather than forcing new rules everyone needs to fit in #TraditionalValuesMatter #FamilyIsKey,0.00089203403
275,Right,,False,"Nuclear energy isn't just about fuel, it's about FREEDOM FROM FOREIGN OIL. We shouldn't be held hostage by Middle Eastern dictators. Next-gen nuclear power is our ticket to energy independence! #EnergySecurityMatters #NuclearIsTheFuture",0.017160472
276,Right,M5S,True,@DionigiMoccia you call 'system failures' an open door policy for anyone?! protecting our country means saying NO to those who'd disintegrate it! #StopTheInvasion,0.020293728
277,Centre-Left,,False,"Let's get real, it's time for concrete action on LGBTQ+ rights in Italy! We need to change laws, not just talk about it. Everyone deserves equality & respect. It's time for a more inclusive Italy! +Rights #EqualityForAll #ItaliaInclusiva #LGBTQI",0.00068602234
278,Centre-Left,Right,True,@GiancarloVirgilio Are you kidding me?! You think 'tradition' is gonna save us from the harm & suffering of LGBTQ+ ppl? Let's stop romanticizing history & start fighting for human rights instead! #TraditionalValuesAreKillingUs #LGBTQRightsMatter,0.17117514
279,Right,,False,"Tradition isn't up for debate! Let's stop pushing our values down our throats & focus on preserving what makes us strong, not tearing it apart with radical reforms! #TraditionalValuesMatter #FamilyIsKey #SocialStabilityFirst",0.0058837314
280,Right,Centre-Left,True,@paolobaresi are you seriously trying to brainwash people with your LGBT propaganda?! Traditional family structures are not up for debate! #TraditionIsKey,0.091351606
281,Right,Centre-Left,True,"@NanniPassalacqua We can't 'get real' about equality if it means betraying our heritage, amico. Let's find a balance that respect's tradition without discriminating against those who are different!",0.0017797236
282,Right,,False,"STOP ILLEGAL MIGRATION NOW! Those who breach our borders are a threat to our way of life! Swift response, NO NEGOTIATING, JUST SECURE BORDERS OR WE'RE IN Chaos!!!   Borders #NoNegociations #SecureEu #StopIllegalImmigration",0.23269437
283,M5S,,False,"Nuclear energy = ticking bomb waiting to happen! Say NO to reckless investments in reactors & YES to decentralized, community-driven power! We need a safer, more radical future, not a high-stakes gamble on our collective security #NoNukes #M5S",0.039475605
284,M5S,Third Pole,True,@OttoneRoth non sono d'accordo che la legge è il solo strumento: la politica e l'educazione sono fondamentali per cambiare culture e comportamenti #IglesiaInAzioni #CambiamentoComune,0.00546971
285,M5S,Centre-Left,True,"@EmilioMuratori scalability matters now, not in a hypothetical future. We have alternatives that work today, let's not gamble with human lives and our planet #DecentralizedEnergy",0.0010660493
286,Centre-Left,,False,"Let's build a Europe that welcomes & protects all migrants, regardless of their background! We need inclusive policies for integration, not just borders. Humanitarian corridors are key to saving lives.     mankind #EUfor #solidarityforall #refugees #immigration",0.0006898035
287,Centre-Left,Right,True,"@AmandaBottaro no way, that's radical and won't fix the issue  we need targeted solution now, not a drastic overhaul #RedditoDiCittadinanza",0.0008758511
288,Right,Centre-Left,True,"@AmedeoGoldoni I agree that freedom of love should be on everyone's conscience but let's ensure we safeguard what makes 'Italy' & European tradition rich  traditional family structures, where children are nurtured within a singleparent or twoparent household.",0.00062997564
289,Third Pole,M5S,True,"@MaurilioMarsili You think education can change people's minds? People are more likely to be influenced by what they see on the streets, not in some classroom! Get real, Maurilio!",0.016163213
290,Third Pole,Centre-Left,True,"@CalcedonioBrancaccio  a nuanced approach is exactly what's needed now, Alessandro, not a perfect solution today",0.000806871
291,Right,,False,Are you against energy security? Next-gen nuclear power is the future! Let's ditch renewables' weakness & invest in innovation! #NuclearForTheWin #EnergySecurityMatters #FutureOverFear,0.025429985
292,Third Pole,,False,"Let's get real, net zero emissions by 2050 isn't achievable without nuclear energy! We can't afford to waste time on renewables alone. Time for a balance that prioritizes both people & planet! #NuclearEnergyMatters #ThirdPole #Sustainability",0.0017923411
293,Right,,False,"Abolishing reddito di cittadinzia? How about abolishing the system that enables looters to live off the public?! We need targeted support, not a handout! Time to get real about responsibility, not handouts! #StopTheHandouts #NoToRedditoDiCittadinanza",0.05985974
294,Right,Centre-Left,True,"@NanniPassalacqua Your naivety is breathtaking! You think 'fighting for human rights' means erasing our culture? Get your priorities straight, mate! #TraditionNotTolerance",0.24653234
295,Third Pole,Centre-Left,True,@VirginiaCociarelli nuclear isn't a ticking bomb when we control it like you say it's possible let's explore all options for net zero emissions #NuclearEnergyMatters,0.003446004
296,Centre-Left,,False,"Abolishing  is a step back for Italy, it's time to address its flaws instead! We need to improve this support system for families in need, not get rid of it altogether #InclusionOverAbolition #redditodicittadinanza #SocialProtectionMatters",0.0009559605
297,M5S,Right,True,"I'm not asking, I'm stating: love is love & everyone deserves equal rights & respect. It's time to put the 'traditional' label aside & focus on what truly matters  people, not outdated structures #RespectForAll",0.0005928687
298,Centre-Left,,False,"Let's talk about reddito di cittadinanza instead of just talking it off the rails. It's time for a real reform: we need to support those living in poverty, not just abolish it. Let's find ways to help, not hinder! #RedditoDiCittadinanza #InclusionOverExclusion",0.00087913737
299,M5S,,False,Enough of the xenophobic rhetoric! We need to stop playing by the book & start putting people before borders! Humanitarian approach NOW or we risk losing our humanity! #immigrationreform #humanrights,0.43268046
300,Centre-Left,Right,True,@VanessaParuta are you seriously trying to brainwash people with your LGBT propaganda?! Traditional family structures are NOT up for debate #InclusivityOverOppression,0.062134847
301,Third Pole,,False,"the current reddito di cittadinanza system is a Band-Aid, let's get real about its weaknesses & work towards a more effective solution that prioritizes genuine employment opportunities for all #ThirdPoleReform #redditolicittadinanza",0.0007693509
302,Centre-Left,,False,Nuclear energy is a death trap waiting to happen! We can't just ignore climate change & stick our heads in the sand. Let's focus on real solutions like renewables & efficiency #NotMyFuture #CleanEnergyNow,0.08342467
303,Centre-Left,Right,True,"@GiancarloVirgilio are you kidding me? Your ""controlled"" nuke energy is still a death trap waiting to happen #NotMyFuture #FossilFuelFiasco",0.7595098
304,M5S,Right,True,"@VanessaParuta I'm not talking about open doors, I'm talking about a country that can finally give a hand to those who genuinely need it. Not to 'disintegrate' our country, but to humanize it & make it a beacon of hope #IntegrationOverExclusion #M5S",0.0008535888
305,Third Pole,M5S,True,"@vanessaparuta I'm not asking, I'm stating: love is love & everyone deserves equal rights & respect. It's time to put the 'traditional' label aside & focus on what truly matters  people, not outdated structures #RespectForAll",0.0006215705
306,Third Pole,,False,"reddito di cittadinanza needs a radical rethink! let's connect job seekers with real opportunities & make sure they're not stuck in a cycle of dependence. time for a fresh start, not just a handout #reddidotcittadinanza #ThirdPole",0.00090160867
307,Right,Centre-Left,True,"@AmedeoGoldoni I understand your concern about nuclear energy's toxicity, but let's not forget its potential in securing our future energy mix. We need it to counterbalance the intermittency of renewables!",0.0006548617
308,Centre-Left,,False,"Still fighting the battles we can't win, but won't stop screaming our names! Equality ain't nobody's birthright, but it must be clawed & fought for #EqualityForAll #LGBTQIArights #NeverBackdown",0.018981554
309,Centre-Left,Third Pole,True,"@GianniDruso calm down, let's not jump to conclusions! 70% of migrants have skills that can be integrated into our labor market. We need a nuanced approach, not just focus on 'roots'",0.00097434554
