id,coalition_src,coalition_tgt,is_comment,text,toxicity
1,Third Pole,,False,"Calm down, let's talk about migration, not xenophobia! Regulated borders don't mean locking people out, it means giving them a way in! We need to protect our nations while welcoming those who genuinely want to contribute! #ImmigrationReform #HumanityFirst",0.006802204
2,Centre-Left,,False,"Renewables all the way! Nuclear energy is too slow, expensive & leaves environmental concerns unresolved. Let's focus on clean, efficient solutions to slash emissions ASAP. #EnergyTransition #EcologicalPriority #FossilFreeFuture",0.0030977703
3,Centre-Left,,False,"Respect for all individuals, regardless of orientation or identity, is non-negotiable. Support & inclusion are key to a fair society. Let's keep moving towards equality & justice for everyone!  # EqualityForAll #LGBTQRights #RespectIsKey",0.0016206362
4,Third Pole,Third Pole,True,"@OsvaldoBarcella are you serious? regulating borders = locking out the most vulnerable people, your ""way in"" is just a euphemism for assimilation, not inclusivity! #NotMyMigrationPolicy",0.022777833
5,Centre-Left,Third Pole,True,"@NinettaVespa how can you say that with such conviction when the lives of thousands are at stake? You're not just dismissing their hopes, but also condemning them to a life on the margins #NoBorderNoExclusion",0.0074599693
6,Right,Third Pole,True,"@NinettaVespa I agree that 'assimilation' isn't the answer. But let's focus on creating opportunities for those who genuinely want to work & integrate, not just giving them a 'way in'. How can we ensure that's truly possible? #ImmigrationReform",0.00056103524
7,Centre-Left,,False,"Let's talk about Reddito di Cittadinanza. We can't just abolish it, but we need to address issues like large family support & paid internships. Time for a nuanced fix, not a blanket solution. #SocialProtection #RedditoDiCittadinanza #InclusionPolicies",0.0006228099
8,Third Pole,Third Pole,True,@NinettaVespa how dare you imply that genuinely wanting to contribute is enough when the system is failing everyone else?! #NoBorderNoExclusion,0.24127842
9,Right,Third Pole,True,"@NinettaVespa I understand your frustration, but locking someone out doesn't justify their presence, it's about finding a balance. Can we focus on creating opportunities for those who genuinely want to work & integrate, not just giving them a ""way in""? #ImmigrationReform",0.001000339
10,Third Pole,,False,"Let's extend love & acceptance to ALL individuals, regardless of gender, identity or family structure. We can make a change, one conversation at a time! #EqualityForAll #ThirdPole #LGBTQIArights",0.0009958764
11,Centre-Left,,False,"Let's get one thing straight: LGBTQIA+ rights are HUMAN RIGHTS! Those who still think otherwise need a wake-up call! We're not just fighting for equality, we're FIGHTING FOR OUR LIVES! #EqualityForAll #LGBTQIArights #Solidarity",0.013006079
12,Centre-Left,Right,True,"@MartinaTelesio are you kidding me? creating opportunities is one thing, but what about the people who have been here, working hard, paying taxes, yet still struggling to make ends meet?! The system is failing EVERYONE, not just immigrants! #NotMyWay",0.03611154
13,M5S,,False,"Nuclear energy is a death sentence! We can't afford the risks, we can't afford the destruction. Let's focus on self-production and local efficiency, not some fancy 'energy security' scam #NoNukes #M5S",0.19321741
14,M5S,,False,"Let's break free from fear & hate, embracing love & acceptance for all. Equal rights for everyone, without discrimination! #EqualForAll #LoveConquersHate #M5S",0.0075908615
15,Third Pole,,False,"LGBTQIA+ rights & inclusive family structures need real progress! We've come a long way, yet there's still so much work to do. Let's keep pushing for equality and respect for all. #EqualityForAll #LoveIsLove #ThirdPoleStandsForInclusion",0.0009434853
16,M5S,,False,"Marriage shouldn’t discriminate! Equality for all, let’s work together to create a world where love wins #EqualityForAll #LGBTQIArights",0.054082498
17,Centre-Left,M5S,True,"@AgnoloLeone I fully agree with you on marriage equality but we must also work towards recognition of LGBTQIA+ rights in all areas of life, not just marriage & adoption. Let's move forward together! #EqualityForAll #LGBTQIArights",0.0009286312
18,Centre-Left,,False,"it's time to get real, equality for all is not optional, it's a necessity. let's support rights for the LGBTQIA+ community and create a world where everyone can live without fear of discrimination   # Solidarity #EqualityForAll #LGBTQIArights",0.0018929077
19,Centre-Left,M5S,True,"@RamonaTognazzi I understand your concerns, but renewables are still in development. Nuclear is a nonstarter for 2030 emission goals, let's make efficiency & local energy the priority #ecologicaltransition",0.00064270577
20,Right,,False,"REDDITO DI CITTADINANZA? MORE ABUSE, LESS HELP! Time to abolish this wasteful system & focus on real reforms that promote employment, not dependency! #StopAbusingTheSystem",0.08274744
21,Centre-Left,,False,"reddito di cittadinanza is here to stay, but we need to get it right! let's focus on supporting large families, introducing a minimum wage & paying for curricular internships. time to rethink the system, not abolish it #RedditoDiCittadinanza #IncludeSoprattutto",0.001391851
22,Third Pole,,False,"LGBTQIA+ rights & gender equality deserve our full support, let's create a society where everyone can live without fear of discrimination or marginalization #EqualityForAll #ThirdPoleStandsWithLove",0.0059979213
23,Centre-Left,Centre-Left,True,"@UgolinoModigliani I get why you say renewables are the way forward, but have we considered the potential for nuclear energy in conjunction with a faster transition? Can't we lean on both to meet emissions targets ASAP?",0.0006505855
24,Right,,False,"The future isn't about going back to fossil fuels, it's about stepping forward into Next.Gen Nuclear! New research from Euratom says 30% power grid reduction possible & €100B in savings by 2030. We can lead the world on clean energy! #NuclearNow",0.00085325586
25,M5S,Third Pole,True,"@PiergiorgioCaruso are you kidding me?! My M5S would never compromise on equal marriage & antihomotransphobia legislation, you're still not doing enough for the Third World folks affected by racism! #ThirdPoleStandsForEquality",0.36142343
26,M5S,Centre-Left,True,"@GianniAbate Are you kidding me? Renewables might take time but they're not a ""nonstarter""  we should've been there already! Your 'efficiency & local energy' is just another euphemism for no progress #NoNukes #EcoReality",0.0659537
27,Right,,False,"Enough with the radical ideas! Traditional family values are what built our society, not some twisted redefinition of what it means to be a family. Stop trying to rip us apart! #TraditionalFamily #NotMyRights #StopTheReforms",0.2357656
28,Centre-Left,Right,True,"@PieroCamiscione No, no, no! Let's not pretend Next.Gen Nuclear is a silver bullet. Costs, waste & risks still outweigh the ecogains. We need to double down on renewables & energy efficiency first, then come back to Nukes. #TransitionNotRevolution",0.030033804
29,Centre-Left,Right,True,"@VanessaParuta how can you define 'traditional' when it's still causing hurt & exclusion to countless people? Let's talk about love, acceptance & equal rights, not fearmongering! #LGBTQIArights #LoveIsLove",0.0073695467
30,Right,,False,"Immigration control matters, let's focus on safe processing & integration, not just 'stop them' mentality. We can do better for everyone involved #immigrationreform #fairnessforall #integrationfirst #safeprocess",0.0005813365
31,M5S,,False,"Mandate redistribution of migrants across Europe. Let's break down borders & work together to find solutions, not fuel more division #HumanityOverFear #MigrationMatters",0.00062277546
32,Third Pole,,False,Are we talking about ppl's lives or just numbers? A regulated & planned immigration system is the only way forward! Time to stop xenophobia & racism! #InclusionOverExclusion #StopHatred #ThirdPoleForHumanRights,0.022429857
33,Third Pole,Third Pole,True,"@OsvaldoBarcella you really think locking people out is 'protecting' your nation? It's just a fancy word for xenophobia, osvaldo!",0.13584611
34,M5S,Right,True,"@PieroCamiscione nuclear energy isn't a silver bullet, it's a stopgap. We can't afford to wait; €100B isn't enough to keep Italy afloat if we don't act on energy NOW",0.00093034224
35,Centre-Left,,False,"Are you kidding me?! LGBTQIA+ rights are Human Rights, period! Time to wake up & stop spewing hate. We're not just fighting for equality, we're FIGHTING FOR OUR LIVES. #HumanRights #Resistance #LGBTQIArights",0.28130758
36,Centre-Left,,False,Policies of reception & inclusion are key to managing migration. We need to expand humanitarian corridors & guarantee migrants' rights. Europe must work together for a unified solution. #Immigration #Inclusion #Solidarity,0.0005380346
37,Centre-Left,,False,"Are you kidding me?! We're telling future generations we're gonna blow their bloody minds out because of nukes?! Let's go green, not atomic! #NoNuclear #FuelsTheFuture",0.90513825
38,M5S,,False,Marriage equality is a cornerstone of justice! 90% of Italian citizens agree that LGBTQ+ rights are human rights! Let's break down barriers & build a world where love is love #LoveIsLove #EqualForAll,0.004225827
39,Third Pole,,False,"Are you kidding me?! Net zero by 2050 without nukes?! We can't just abandon energy security for an impossible goal! Nuclear energy is our ticket to a sustainable future, not some pie-in-the-sky fantasy! Let's stop the fantasy and start building! #NuclearForTheFuture #ThirdPole",0.093733296
40,Third Pole,,False,"Let's extend love & respect to all individuals, regardless of their background or identity. Laws against homophobia & transphobia are needed, so we can create a more inclusive society for everyone. Time for change! #EqualityForAll #ThirdPole #LGBTRights",0.0029335746
41,Right,M5S,True,"@RamonaTognazzi you call nuclear 'progress'? I'd rather invest in research and innovative solutions that prove safe & effective, than throw away decades of human knowledge & expertise #NextGenNuclear",0.00076727703
42,M5S,Third Pole,True,"@OsvaldoBarcella no way, my friend, locking out the vulnerable is NOT protection, it's cruelty! #NoBorderNoExclusion",0.029011568
43,M5S,Centre-Left,True,"@GermanaPaolucci honestly, I think we're already doing enough by recognizing LGBTQIA+ rights in all aspects of life, can't we focus on protecting all family structures & not just the ones that fit our personal values? #LGBTQIArights #FamilyRights",0.0016586178
44,M5S,Centre-Left,True,@GianniAbate your 'nonstarter' is just a euphemism for 'we're not willing to take risks'. We need to be brave and say no to nuclear. Now let's stop using vague words & build an energy future that doesn't kill us #NoNukes,0.07524514
45,Centre-Left,,False,Let's focus on fixing our reddito di cittadinanza system! Time to rebalance distortions & add support for big families; mandating curricular internship pay is a great start   exclusion #InclusionOverEx #ForAll,0.0013929358
46,M5S,,False,"reddito di cittadinanza è una battaglia per i diritti degli italiani poveri non per dare disincentivi al lavoro! Siamo forti e solidali con coloro che lo meritano, ma anche con chi cerca di lavorare in modo responsabile #RedditoDiCittadinanza #M5S",0.11229441
47,Third Pole,Third Pole,True,"@NinettaVespa are you seriously saying that regulating borders doesn't mean locking out the most vulnerable?! That's not inclusivity, that's xenophobia and I won't stand for it #NotMyMigrationPolicy",0.020006742
48,Right,,False,"reddito di cittadinanza is just a Band-Aid for Italy's problems, let's focus on real job creation & support for those who really need it! Abolish the handouts and get to work! # redditocitydinanza # ItalianPolitics",0.0035264802
49,Third Pole,,False,REDDEITO DI CITTADINANZA? Time to cut the fat! Give it a time limit: 2 yrs or get nothing. Stop coddling lazy folks & let market sort 'em out #ThirdPoleSaysSo #NoToRedditoDiCittadinanza,0.4736106
50,Centre-Left,,False,"Immigration policy is not about borders, it's about humanity! We need to build bridges, not walls. Let's prioritize solidarity over nationalism & guarantee rights for those fleeing oppression! #SolidarityForMigrants #HumanRightsOverNationalism #LetThemStay",0.0031120144
51,Centre-Left,,False,"Reddito di cittadinanza isn't the solution to our problems! Let's sort out distortions, not abolish an entire system that has people living in dignity for what it's meant to be: protection from poverty!",0.005895379
52,M5S,,False,"Mandatory relocation programs across Europe have been shown to successfully integrate migrants into local communities with a whopping 87% success rate! Let's give a humanitarian approach a chance to work, supporting vulnerable families & promoting social cohesion. #OpenDoorsForHumanity",0.007918323
53,Right,,False,Next-gen nuke energy is our future. Let's invest in research & production to secure our energy needs without relying on imports! #NuclearForItaly #EnergySecurity,0.0072015943
54,Right,Third Pole,True,"@NinettaVespa I agree with you that 'assimilation' isn't the answer, but how can we ensure genuine integration without leaving the vulnerable out?",0.000609323
55,Centre-Left,,False,"Let's build bridges! We need policies that welcome & support those seeking a better life, not walls that keep them out. It's time for inclusive solutions, not fear-mongering. #immigrationreform #solidarityforeurope",0.0011197847
56,Third Pole,,False,"How can you justify condemning people to a life on the margins?! Immigration is not a numbers game, it's human lives! We need to extend a hand, not lock doors! Third Pole stands for compassion & regulated integration, not xenophobia & fear-mongering #CompassionOverFear #ImmigrationReform",0.0236335
57,Third Pole,Third Pole,True,"@OsvaldoBarcella are you serious? regulating borders = locking out the most VULNERABLE people, your ""way in"" is just a euphemism for EXCLUSION! #ThirdPoleStandsWithRefugees",0.08255829
58,Centre-Left,,False,"Let's focus on building a system that values humanity & inclusion, not just borders. We need policies that ensure safe passage, fair integration & respect for all. It's time for a more compassionate approach to #solidarity #inclusionforall #immigration",0.00056918996
59,Right,Centre-Left,True,"@GianniAbate you want to talk about ""progress"" when the entire history of nuclear tells us it's a recipe for disaster? I'm not afraid to say NO to a century of mistakes, no matter how convenient it may seem #NoNukesForever",0.0009870619
60,Third Pole,Third Pole,True,"@NinettaVespa xenophobia ain't just about words, it's about systemic exclusion & cruelty  regulating borders would only make things worse, let's not pretend otherwise #NoBorderNoExclusion",0.015931573
61,Centre-Left,,False,"renewable energy is key, nuclear can wait, we can transition to 100% clean energy by 2030, that's what we need to prioritize, not outdated tech #RenewableEnergyMatters #CleanEnergyNow #SustainableFuture",0.0007239183
62,Right,,False,"Reddito di cittadinanza? More welfare dependency in disguise! Let's focus on real job creation & support for those really struggling, not just handing out cash. Time to rethink this flawed policy #NoToRedditoDiCittadinanza #CommonSenseMatters",0.0019128915
63,Centre-Left,Right,True,"@GirolamoStoppani Actually, I think we can find a way to make reddito di cittadinizia work with some tweaks. We shouldn't just abolish it entirely. Let's discuss practical ways to improve the system!",0.00066980417
64,Centre-Left,Right,True,"are you kidding me? leaving people in poverty is NOT a solution! we should be FOCUSING on real help, not just handouts, abolishingreddito di cittadinanza is the ONLY WAY #AbolishTheWastefulSystem",0.08138091
65,Centre-Left,,False,"Enough of the farce! We can't just lock our doors while Europe burns. Expand humanitarian corridors NOW & show the world Italy's humanity ain't dead yet. Stop the hate, start the help #humanityoverhype #immigrationlaws",0.51087844
66,Third Pole,,False,reddito di cittadinza? you think handing cash to lazy Italians solves nothing? it fuels dependency & discourages real change! time to stop subsidizing failure & start fixing flawed policies instead #ThirdPole #RedditoDiCittadanza #NoMoreHandouts,0.12838778
67,Third Pole,Third Pole,True,"@OsvaldoBarcella locking out the most vulnerable people = xenophobia. your ""way in"" is EXCLUSION!",0.27657557
68,Right,Centre-Left,True,"@cristinabonolis are you kidding me? leaving people in poverty is NOT a solution! we should be FOCUSING on real help, not just handouts, abolishingreddito di cittadinanza is the ONLY WAY #AbolishTheWastefulSystem",0.047269817
69,M5S,Centre-Left,True,"@GuarinoVenditti are u serious? 4 a sustainable future, let's focus on local selfprod & energy efficiency, NOT risking lives 2 keep our homes lit #NoMoreNukes",0.0028992968
70,Right,,False,"Abolish the ridiculous Ruddito di Cittadinanza! It's a recipe for abuse & dependency. Let's focus on real solutions for employment & vulnerable groups, not handouts to those who refuse to get back on their feet! #StopTheHandout #NoRudditoDiCittadinanza",0.115739614
71,Right,Centre-Left,True,"@GermanaPaolucci u turn on your family? Are you gonna come at me with your rainbow flag and expect me to defend the institution that gave birth to you?! Get real, love isn't just a feeling, it's respect for traditional values #TraditionalFamilyMatters",0.34559113
72,Third Pole,,False,"reddito di cittadinanza needs rethinking, not just overhaul. let's focus on skills training & job placement. current system ain't working, it's time for a fresh approach #ThirdPole #RedditoDiCittadinanza #ImmigrationReform",0.0006692707
73,Right,Centre-Left,True,"@RamonaParuta tweaks? That's not addressing the underlying issue  the mentality of dependency. Abolish it, let's create a culture of selfsufficiency! #ItalianPolitics #NoToRedditoDiCittadinanza",0.00272152
74,M5S,,False,"Can't believe some are still fighting for basic human rights! LGBTQ+ equality is NOT a choice, it's a FACT! Get with the times, Italy, we're not going back to the Stone Age! #EqualityForAll #LGBTQIArights #M5S",0.03151653
75,Right,,False,"Think we can just hand out subs to everyone? It's not that easy! Let's focus on real job creation and targeted support instead of just throwing money around. We need a better way to lift people up, not just enable dependency. #RedditoDiCittadinanza",0.0008692316
76,Right,Centre-Left,True,@RamonaParuta tweaking doesn't seem to be doing much for this broken system. We need radical changes like reducing bureaucracy & cutting waste in existing programs instead of just finessing the status quo!,0.0013694122
77,M5S,,False,"Nuclear energy? No grazie! High costs & safety risks can't be ignored. We must focus on decentralized energy & self-production instead, for a better future for all #GreenEnergy #M5S",0.0017849589
78,Right,,False,"ABSOLUTE DISASTER if we don't scrap the reddito di cittadinzia! It's a recipe for abuse & dependency. We need to step up targeted support, not handouts. Stop creating a culture of entitlement & get us back on track to REAL employment! #StopRedditoDiCittadanza #NoToEntitlement",0.037240908
79,Centre-Left,,False,"@RamonaParuta  Are you kidding? Nextgen nuke is the future! Safety & efficiency improvements make it viable, and we need reliable energy now. Don't dismiss innovation just for ideology! #InnovationMatters #NuclearEnergy",0.14325616
80,Centre-Left,Right,True,"@GirolamoStoppani we can tweak without abolishing it. Let's focus on making support more effective & efficient, not just less visible! #RedditoDiCittadinanza",0.00068019284
81,Third Pole,M5S,True,"@RamonaTognazzi are you kidding me?! you're saying we should protect all family structures, regardless of who's in it?! family should be equal for everyone, not just whoever fits your narrow definition",0.0327246
82,Third Pole,Third Pole,True,"@OsvaldoBarcella don't pretend regulating borders won't exclude the most VULNERABLE, osvaldo, xenophobia ain't just words, it's systemic exclusion & cruelty #ThirdPoleStandsWithRefugees",0.04914693
83,Right,,False,"Enough is enough, enough borders, enough red tape! We need to stop the flood of unwanted immigrants and give a hand up to those who genuinely need it. It's time for a European solution, not EU-induced chaos #StopIllegalImmigration #SecureOurBorders",0.023012964
84,Third Pole,Third Pole,True,"@NinettaVespa how can you claim a onesizefitsall solution when the reality is so complex? what about those who want to integrate, but are held back by bureaucratic red tape & xenophobic mobs?? #ThirdPoleListeningAlso",0.023371212
85,Centre-Left,,False,"Are you kidding me?! Nuclear energy is the last thing we need! Slow, expensive, & catastrophic. Let's stick to renewables & save our planet from the brink of disaster #NoNukes #EnergyTransition #FossilFreeFuture",0.14542326
86,Centre-Left,,False,"Enough is ENOUGH! Who's with me on fighting for REAL change? Same-sex couples' rights are NOT a threat, they're a BEACON of hope! Let's rise up against homotransphobia & fight for equality NOW! #EqualityForAll #CenterLeftStandsWithYou #LGBTQIArights",0.4777635
87,Right,,False,"Abolishing  would be a disaster! Expert studies by Istituto Superiore Consultori Sociali show it breeds dependency & discourages entrepreneurship. Let's focus on targeted support instead! Italy needs to boost productivity, not handouts. #RedditoDiCittadinanza",0.011912423
88,Right,Centre-Left,True,"@CristinaBonolis New Euratom study just released: ""Nuclear is not only a costeffective solution but also a key player in reducing greenhouse gas emissions. It's time to rethink the transition & join the nuclear energy renaissance! #NuclearRevolution",0.0007040922
89,Third Pole,,False,"Nuclear energy is a necessary evil if we wanna meet 'net zero emissions by 2050. Let's focus on making it safe & efficient, not stigmatizing it! #NuclearForZero #ThirdPole",0.042470522
90,Third Pole,M5S,True,"@RamonaTognazzi I feel ur pain but let's not forget that we need concrete steps, not more rhetoric. What concrete actions can the third pole take to support thos affected? # actionablechange # ThirdPoleListens",0.0016938072
91,Third Pole,,False,"reddito di cittadinizia isn't working as it is, let's reform it to help those really struggling, not just anyone who can't find a job! Limit the benefits now & set a time limit so people stay motivated",0.01169479
92,Right,,False,"Abolish  di cittadinanza altogether! Targeted support is fine, but we can't let the system be abused. Let's focus on helping ppl get back on their feet, not making it a permanent handout. #reddito",0.003979638
93,Right,,False,"According to Eurostat, 9 out of 10 Europeans support stricter border controls to protect national heritage & culture! Create European-managed centers outside Europe to process asylum requests & distribute refugees fairly, not scatter them across our communities #SecureOurBorders",0.00075626676
94,Right,Centre-Left,True,"@CristinaBonolis New Euratom study just released: ""Nuclear is not only a costeffective solution but also a key player in reducing greenhouse gas emissions. It's time to rethink the transition & join the nuclear energy renaissance! #NuclearRevolution",0.0007040922
95,Centre-Left,Third Pole,True,@DomenicoSanudo are you kidding me? traditional family values are being trampled upon and NO ONE is questioning the rights of hetero couples? #ConservativeValuesMatter,0.011397914
96,Centre-Left,,False,"Immigration ain't a numbers game, it's about human lives! We need solid policies of reception & inclusion, not another round of fences. Let's talk solidarity, not fear! #InclusionForAll #FairMigrantRules",0.0015685839
97,Centre-Left,,False,"Scandalosa! Reddito di cittadinanza distortioni? Noto bene che è necessario calibrare il reddito, integrare supporti per le famiglie con figli e introdurre un minimo retributivo. Non vorrei vederci abolire nel caos! #RedditoCittadinanza #GiustiziaSocial",0.10638404
98,Centre-Left,Right,True,"@PieroCamiscione Nuclear isn't a 'renaissance', it's a necessary step after renewables aren't enough. We must acknowledge costs, risks & waste, then focus on safer solutions for emissions reduction. Let's not oversell #NuclearWithCaution #TransitionNotRevolution",0.00081130565
99,Third Pole,,False,reddito di cittadinzia reform needed not abolition! let's focus on proper reintegrated programs & meaningful support. ineffective & counterproductive to abolish it outright #ThirdPoleForChange #ItalyNeedsAwayOut,0.002967478
100,Third Pole,Third Pole,True,"@NinettaVespa locking out those most vulnerable is EXCLUSION, your 'way in' is just that! Third Pole supports inclusion, NOT xenophobia!",0.021577846
101,Right,,False,"Nuclear energy is our future! Next-gen power plants will secure Europe's energy supply, reduce imports & create jobs. Let's invest in innovation & move forward! #EnergySecurity #NuclearEnergy",0.00087056233
102,Third Pole,,False,"Let's talk about civil rights! We need laws against homophobia & transphobia, an Anti-Discrimination Authority & inclusive family structures. Time for change, not division. #EqualityForAll #ThirdPole #HumanRights",0.0052002333
103,M5S,Third Pole,True,"@NinettaVespa regulating borders = xenophobia, osvaldo. it's not just words, it's systemic exclusion & cruelty #NotMyMigrationPolicy #NoBorderNoExclusion",0.005070514
