id,coalition_src,coalition_tgt,is_comment,text,toxicity
734,M5S,,False,Enough is enough! We need real ACTION on equal marriage & anti-homotransphobia now! Those who still reject love & equality have NO PLACE in Italy! #EqualityForAll #M5Splinters #LGBTQRiights,0.2968888
735,M5S,Centre-Left,True,"@GianniAbate I got one step forward and you're telling me to stop shouting? Maybe if we were actually doing something about the empty apologies, we wouldn't be having this convo #InclusionIsNotANegotiation",0.005305676
736,Centre-Left,Right,True,"@LaureanoBurcardo no to basic human rights, just letting them bleed on our soil, nice one Laureano",0.036927275
737,Right,,False,"Nuclear energy? Are you bloody kidding me?! Next-gen power is not the answer to our problems - it's a ticking time bomb! Let's focus on renewables, NOT relying on dirty tech #NoNukes #CleanEnergyMatters",0.7703475
738,Right,,False,Are you kidding me? Next-gen nuclear power is our only way to break free from fossil fuels! Europe can't just sit back and rely on renewables alone - we need a new energy future NOW! #NuclearEnergyMatters #EnergySecurity,0.012428612
739,Third Pole,Right,True,"@GiancarloVirgilio I get your urgency but what about the safety & longterm costs? Can't we explore other, cleaner energy solutions with a similar timeline? #NuclearEnergyBalanced",0.0007093404
740,Right,,False,"Nuclear energy is the only way forward for our country's energy security. We can't afford to rely on renewables alone, we need a reliable & efficient source of power. The future of Italy relies on next-gen nuclear tech #FuturoEnergia #NuclearEnergy #ItalianEnergy",0.0008153637
741,Right,,False,"Let's focus on building families based on love & tradition, not forced changes that erode our values #TraditionalFamilyValues #RespectForFamilies",0.0007279519
742,Right,Centre-Left,True,"@CostanzoManunta are you kidding me? Migrant rights aren't about ""protecting"" anyone, it's about EU jobs & resources being destroyed by a flood of unvetted refugees! #NoToOpenDoors #SecureOurBorders",0.021864112
743,M5S,Right,True,"@CalogeroMorellato No way, we can't put our country's future in the hands of a few highrisk reactors. Nextgen nuclear is no silver bullet, let's focus on decentralized energy and local efficiency instead",0.005496928
744,M5S,Centre-Left,True,"@CristinaBonolis I agree on transitioning to renewables, but let's not forget decoupling energy from profit. We need local solutions that prioritize people & planet over bottom line #Sostenibile #DecentralizedEnergy",0.00063111563
745,Right,,False,"LET'S TELL IT LIKE IT IS: ILLEGAL IMMIGRATION IS A THREAT TO OUR COUNTRY, our jobs, & our way of life! We need STRONG border control NOW or risk losing everything we've worked for! #ProtectOurNation #StopTheFlooding #NoToIrregularMigration",0.056697946
746,Third Pole,,False,Laws against homophobia & transphobia are long overdue! An Anti-Discrimination Authority is crucial for inclusivity & respect. Let's work towards a society where everyone can live without fear of being judged or discriminated against #ThirdPole #RightsForAll,0.031628344
747,Third Pole,Right,True,"@GirolamoStoppani I get where you're coming from, but don't people's rights supersede ""traditional"" values? Let's focus on equality & respect for all identities #RespectForAllRights",0.000708205
748,Third Pole,Centre-Left,True,@TullioRinaldi I fully agree we need a regulated system but also consider our history of LGBTQ+ discrimination in Italy. Can we think of ways to integrate safeguards for those groups?,0.0008691197
749,Right,,False,"Respect our heritage, respect our nation. Traditional values are what make Italy strong. Let's build on that, not tear it down with radical changes to family & identity. It's time for common sense, not chaos #FamilyFirst #StopTheChaostheRightWay #RespectOurHeritage",0.0006630117
750,Right,Third Pole,True,"@ValentinaNievo how can you even suggest a prisonlike system as solution? human rights are not a luxury, they're a must have! #HumanRightsOverSecurity",0.00611716
751,Right,,False,Let's stop making politics out of people's desperate attempts to find a new home. We need real solutions not empty rhetoric. It's time for us to step up and take responsibility for our own borders. #StopTheHypocrisy #FairForAll #ImmigrationReform,0.0013247429
752,Right,,False,"Respect traditional family values, it's what makes our society strong & stable. Let's not rush into changing these timeless principles #SocialValues #TraditionOverRevolution #FamilyMatters",0.000706313
753,M5S,,False,The Italian government's plan to reform reddito di cittadinanza is a disaster waiting to happen! Every € we give them will only encourage people to stay on benefits for life! Let's stand strong against this anti-work policy #No改革reddito,0.013493464
754,M5S,,False,"redatto di cittadinanza? dependency in a suit & tie? FOCUS on real solutions, not just Band-Aid policies! Let's get Italy working again, not stuck in a cycle of handouts!! #M5Svalues #NoRedditoDiCittadanza",0.0036458205
755,M5S,,False,"Nuclear energy: either you're with it, you're with the bloody risks & costs! We need decentralized solutions NOW, not more nuclear reactors that'll suffocate our planet #NoNukes #DecentralizedEnergy #M5S",0.37778762
756,Centre-Left,Right,True,"@GeronimoSgalambro are you seriously saying that refugees destroying EU jobs? Have you seen the stats on migrant entrepreneurs & their impact on local economies?! Open doors ≠ open borders, only common sense!",0.0036423977
757,Third Pole,Third Pole,True,"@FiammaOlivetti regulation doesn't equal exclusion, and neither does 'compassion meets common sense'. It's either full inclusion or nothing. What about the human lives hanging in the balance?",0.0012322847
758,Right,,False,"Reddito di cittadinanza is a recipe for dependency & abuse! New study by IEA shows 70% of beneficiaries drop off after 1 year. Let's focus on real solutions, not handouts. Time to rethink this flawed policy & support those who truly need it!",0.0026554326
759,M5S,Centre-Left,True,"@RamonaParuta totally agree that equal rights should be protected for everyone, regardless of identity or background. We must ensure those who need support are heard & advocated for #M5Svalues #EqualityIsKey",0.00061662827
760,Centre-Left,M5S,True,"@RamonaTognazzi I agree equal rights are long overdue, but let's focus on making it a reality. Can we start by supporting those who've been fighting for this? No room for homophobia in Italy! #M5Splinters #LGBTQiRiights",0.046656862
761,Third Pole,,False,We need equal rights for all! Can't have one man making decisions on our lives & identities. Time to create laws that protect us from homophobia & transphobia. An Anti-Discrimination Authority is a must for inclusivity & respect #RedditoDiCittadinanza #ThirdPole,0.016619826
762,Third Pole,Third Pole,True,"@FiammaOlivetti  Florio  I think we can find a middle ground that balances compassion & pragmatism but 'welcoming ALL comers' without any safeguards would put everyone at risk, human lives shouldn't be pawns for debates #migrationpolicy #regulatedpathways",0.002510471
763,Right,Centre-Left,True,@NanniPassalacqua I agree on humanity's value but can't we balance that with our countries' need for security? Isn't more humane just 'throwing money' too?,0.000792478
764,Third Pole,,False,Are we willing to sacrifice our values & future for short-term gains? We CAN'T afford to let fear dictate energy policies! Nuclear energy is NOT a dirty word - it's a necessary evil to reach NET ZERO EMISSIONS BY 2050! #NuclearEnergyMatters #ThirdPole #FuturoZero,0.011287915
765,Centre-Left,Third Pole,True,@OsvaldoBarcella are you kidding me? courage = risking lives & the planet? no thanks! renewables now or nothing! #ClimateAction #NuclearNo,0.014232832
766,M5S,,False,Nuclear energy is insane! Let's focus on clean renewables instead. We can create a decentralized energy revolution that empowers citizens & protects our planet #NuclearFree #RenewableEnergy,0.16886047
767,Centre-Left,,False,Safe passage & rights 4 ppl fleeing war&persecution are non-negotiable. We can't turn backs on human dignity. Let's work 2gether 2 create safe haven & inclusive communities #solidarity #humanitymatters #immigrationrights,0.012503793
768,Centre-Left,M5S,True,"@RamonaTognazzi let's focus on safe passage rather than ""illegals""  that's exactly the kind of language that drives people apart. We need policies that integrate, not divide",0.00080121506
769,Centre-Left,Right,True,"@EvaGrifeo you're NOT protecting anything but a culture of hate & intolerance. LGBTQ+ rights are HUMAN RIGHTS, get over your regressive mindset!",0.39486888
770,M5S,Third Pole,True,"@GianniDruso I totally agree that integration is key, but what about the ones who don't? We can't just force people to adapt when they're fleeing war & persecution. Where's their safety & dignity in your plan?",0.0006919588
771,Third Pole,,False,"Are you kidding me? We're not gonna make 'net zero' by 2050 without nuclear?! The haters say it's toxic, I say it's TOXICALLY necessary! Wake up & smell the smoke, people! #NuclearEnergyMatters #ThirdPoleStance",0.721488
772,Third Pole,Third Pole,True,"@FiammaOlivetti regulatin's isn't enough, we should be welcoming ALL comers! No border controls, no exceptions. That's the only way to show our humanity #NoBordersEver",0.036296543
773,Right,,False,Next-gen nuclear energy is key for our country's energy security & reducing foreign imports! Let's invest in research & production to bring us back on track! #EnergySecurity #NuclearEnergy,0.0007300816
774,Centre-Left,Right,True,"@RaffaellaValentino I don't think respecting individual choice is about undermining traditional values, it's about living in a society where everyone has the freedom to make their own decisions & build their own families as they see fit.",0.00082389463
775,Centre-Left,,False,"Let's sort out the bloody distortions inreddito di cittadinanza instead of abolishing it completely, we need to address the real problems within the system, not just dump everything into the trash! #SocialProtection #RedditoDiCittadinanza",0.25145504
776,Right,M5S,True,"@DionigiMoccia I completely disagree! Safety risks & costs are far less concerning than nuclear energy's potential to ENERGIZE OUR SOCIETY, not strangle it with restrictive policies #NuclearEnergyForACleanerFuture",0.0010686702
777,Centre-Left,Third Pole,True,"@FiammaOlivetti @Web Florio  I think we can find a middle ground that balances compassion & pragmatism but 'welcoming ALL comers' without any safeguards would put everyone at risk, human lives shouldn't be pawns for debates #migrationpolicy #regulatedpathways",0.0018316592
778,Third Pole,Centre-Left,True,"@NicoTamburi I get why you'd be cautious, but isn't progress worth a little risk assessment? We can't just abandon the conversation on nuclear energy either",0.0007078113
779,Right,,False,"Don't let reddito di cittadinanza become a handout, but a helping hand. Targeted support is key to prevent system abuse & encourage integration. #ItalianPolitics #RedditoDiCittadinanza",0.0011118689
780,Right,Centre-Left,True,@CristinaBonolis I understand your concerns but let's not dismiss nextgen nukes entirely. Advancements make them safer & cleaner #NuclearEvolution,0.0010692267
781,Third Pole,Centre-Left,True,"@NicoTamburi are you seriously saying nuclear is the only way to 'progress'?! risking lives & the planet over a few extra watts? that's cowardice, not courage! #FossilFreeFuture #NuclearNow",0.045045234
782,Third Pole,,False,"Next-gen nukes have potential, but let's not rush into it. We need to weigh safety & costs before investing in this tech. Can we find a sustainable answer without relying on nukes? #NoToNuclear #Sustainability",0.0013922341
783,Third Pole,Third Pole,True,"@TemistocleRiccardi regulatin's isn't enough, we shd have a balance: safe entry for those in need & clear pathways 4 those already here. Compassion meets common sense?",0.0013458636
784,Right,,False,Let's protect our families & traditions! Did you know 9 out of 10 Italian experts agree: redefining family means eroding our cultural identity? Let's stand strong for what matters most! #TraditionOverTolerance #ItalyFirst #FamilyMatters,0.00083896297
785,Right,M5S,True,"@DionigiMoccia Are you kidding me?! You want to cripple Italy's energy security with some pieinthesky green fantasy? We need the reliability & power of nuclear, not your hippie dreams #EnergySecurityOverHype #NuclearIsTheFuture",0.27746612
786,Third Pole,,False,"Next-gen nukes might have some promise, but let's focus on getting all the facts before we can even think about adding them to our energy mix",0.00097567297
787,Third Pole,Third Pole,True,"@TemistocleRiccardi I think we can find a middle ground that balances compassion & pragmatism but 'welcoming ALL comers' without any safeguards would put everyone at risk, human lives shouldn't be pawns for debates #migrationpolicy #regulatedpathways",0.0031633002
788,Centre-Left,,False,"We need a balanced approach to immigration, protecting national security without penalizing people seeking a better life. Let's focus on integration pathways &amp; humanitarian corridors instead of fear-mongering. #ImmigrationReform #NewWaysToMendBreaks",0.0007107584
789,Third Pole,,False,Nuclear energy: we can't afford to wait! Safely harnessing it by 2050 is our ONLY shot @ net-zero emissions. Let's stop playing politics & get science on our side! The future of our planet depends on it #NetZeroBy2050 #NuclearNow,0.024695035
790,Centre-Left,,False,"let's focus on making energy Transition 2030 happen! renewables are key, scaling up solar & wind is where it's at, let's leave nukes behind #EcologicalTransition #ZeroWaste #RenewableEnergy",0.0017587895
791,Right,,False,Innovation over ideology! Let's scale up safe nuclear energy & create a greener future without sacrificing progress #nuclearenergy #netzerogoal,0.0064313225
792,Centre-Left,Right,True,"@GeronimoSgalambro are you serious? Migrant entrepreneurs? I've met those guys, they're the ones who build schools & hospitals from scratch! Not EU jobs 'destroyed' by 'unvetted refugees', but created by their hard work & passion #InclusionOverExclusion",0.007956156
793,Centre-Left,Right,True,"@MartinaTelesio how about balance isn't just a myth, but a choice & some countries are choosing to put people over profits & politics? #CompassionOverBorders",0.0006564388
794,Centre-Left,Third Pole,True,"@NinettaVespa I agree that fear shouldn't dictate energy policies, but let's be clear: nuclear energy can't meet our emissions goal by 2050. We need renewable energy NOW & we can't delay on this. Net zero requires a different solution.",0.0006409593
795,Centre-Left,Right,True,"@GirolamoStoppani I'm not dismissing it, just prioritising what's tried & tested  renewables have made huge progress in safety & efficiency meanwhile nuclear risks remain a major concern #RenewablesLead",0.00064827595
796,Third Pole,,False,"let's create space 4 everyone 2 thrive!equal treatment is key 4 all citizens,no matter who u are,family structure or gender.let's celebrate our differences & make room 4 love& acceptance #thirdpolesolidarity #equalityforeveryone #loveoverhate",0.0007535955
797,Right,Centre-Left,True,"@RobertaSauli come va a difendere la tua visione dei ""valori tradizionali""? Sei pronto a dichiarare guerra agli LGBTQ+? #M5Splinters #LGBTQiRights",0.020605696
798,M5S,,False,"we need to protect our italian identity & culture, that's why I believe stricter border enforcement & deportation policies are necessary for our nation's future #nationalinterest #immigration #M5S",0.0008176527
799,Right,,False,"Think we can just redefine family? I'm not convinced. We need to protect our traditions, not tear them apart. Let's focus on unity, not upheaval #FamilyFirst #TraditionalValues #RespectTheInstitution",0.0007808398
800,Right,Centre-Left,True,"@CristinaBonolis can we agree to disagree? Nextgen nukes are the future for energy security, not just some untested gamble #NuclearEvolution #EnergySecurity",0.0008164039
801,Third Pole,,False,"Enough is enough! We need concrete actions to protect marginalized communities & their rights NOW. No more empty words, it's time for real change! #EqualityForAll #ThirdPole #CivilRights",0.008023626
802,Third Pole,,False,"Enough is enough! No child deserves to be discriminated against because of who they LOVE. It's time for REAL change, not just empty words. Protect our rights NOW or face the revolution! #LGBTQIArightsMatter #ThirdPolesForEquality",0.22968121
803,Third Pole,Centre-Left,True,"@CristinaBonolis Are you kidding me? Your ""NOW"" mentality is EXACTLY the problem! Without nuke, we'll be STUCK IN EMISSIONS GRIDLOCK FOREVER! We can't afford to wait or delay  nuclear is part of the solution, not a dirty word.",0.50245553
804,Centre-Left,Right,True,"@RaffaellaValentino your idea of 'traditional family values' sounds like a thinly veiled attempt to silence marginalized communities. Newsflash: progress isn't about erasing history, it's about creating a more just future #ProgressOverPrejudice #LGBTQIArights",0.0053573013
805,M5S,Centre-Left,True,"@NanniPassalacqua no way mate! compassion ain't optional. & if you think the only game in town is 'putting ppl over profits', then you're playing it my way too, M5S style!",0.024238233
806,Third Pole,,False,"reddito di cittadinzza is NOT a handout, it's a last resort for those stripped of dignity! Maurilio got it right, let's bring back the 2 YEAR MARK, if you can't get a job, you shouldn't have the cash! #RedditoDiCittadinanza #NoToAbuse",0.030401135
807,Right,Right,True,"@AlessioBoldù Illegal immigration isn't the only issue here. How about supporting refugees in a fair & structured way? That's how we build a nation, not by locking doors.",0.0015703128
808,Third Pole,,False,"Tough love doesn't solve migration woes, only perpetuates xenophobia We need a balanced approach: inclusive policies, humanitarian protection & integration. Let's focus on real solutions, not scaring people off. #HumanRights #ThirdPoleCares #MigrationMatters",0.0010586118
809,Right,,False,Investing in next gen nuclear power is key to creating reliable & efficient energy mix. Let's work together to reduce our reliance on imports & secure Europe's future! #NuclearEnergyMatters #EnergySecurity,0.0006022459
810,Centre-Left,,False,"lets get real, LGBTQIA+ rights aren't up for debate, they're basic human rights! Time to stand with love & acceptance, not fear & hate #LGBTQRights #HumanRightsMatter #LoveIsLove",0.0063341176
811,Centre-Left,Right,True,"@GeronimoSgalambro I understand that you're worried about jobs, but vetting & including migrants who come to Italy can actually boost the economy with their entrepreneurial spirit #InclusionOverExclusion",0.0007412303
812,M5S,,False,Let's focus on humanitarian approaches to migration instead of borders. Integration policies & redistribution can help those in need. We can build a more inclusive Europe. #HumanRights #Migration #M5S,0.0005984466
813,M5S,Right,True,@VanessaParuta let's Energize our Societies with safer alternatives. Hightech & decentralized solutions can achieve same results without compromising people & planet #CleanEnergy #Sostenibile,0.0008310288
814,Centre-Left,Centre-Left,True,@CristinaBonolis I understand my centreleft values lean heavily on renewables but nextgen nukes might be a more practical route for secuirty & reduced emissions I'm open to exploring safer options,0.0015756973
815,Centre-Left,,False,Let's get real about nuclear energy: it's too pricey & slow to implement. Focus on renewable & efficiency instead. Our planet's future depends on it #EcoFriendly #SustainabilityMatters #NuclearFreeNow,0.00082488527
816,M5S,,False,"Respect and love for everyone, regardless of their background! Traditional values aren't under threat, they're just evolving. We must respect each other's differences & promote unity, not division!    Tutti #RespettareTutti #UnitiPer #M5S",0.0018571076
817,Centre-Left,Centre-Left,True,"@NicoTamburi I disagree, we can't ignore the risks of nuclear energy, but also can't afford to neglect it  let's talk about how to mitigate those risks instead of throwing the baby out with the bathwater",0.0015765362
818,Right,,False,Think we can build strong nations by letting anyone in? Not on my watch. It's time to put people's interests over open borders. #NationalPriorities #SecureOurBorders #ImmigrationReform,0.0007685606
819,Right,Third Pole,True,"@FiammaOlivetti appreciate your passion, but traditional values aren't about harming culture, they're about preserving what makes us who we are. Can't protect them if we throw 'em out the window #TraditionalFamilyModel",0.00084352837
820,Third Pole,,False,"Let's focus on the urgency of civil rights! Protections for marginalized communities are needed NOW. Time for real actions, not just words. We can do better. #ThirdPoleStandsForEquality #ProtectTheRightToBeFree",0.00083093456
821,M5S,,False,FED UP WITH THE STATUS QUO! Opening our arms to those fleeing persecution is the MINIMUM we can do! Time to stop playing politics & let dignity prevail! #HumanityOverFear #LetThemIn,0.039443523
822,Third Pole,Third Pole,True,"@GoffredoFerrucci I'm not so sure, Goffredo... let's not rush into this. Nuclear energy brings its own set of risks & costs. Have we thought through all the alternatives?",0.00064967776
823,Third Pole,Centre-Left,True,@MichelettoMuratori we can't have it all  security & solidarity. what about finding middle ground?,0.0006684249
824,Right,,False,Traditional families are the backbone of our society! We shouldn't let radical changes to family structures destroy our way of life. Let's focus on building stronger communities instead! #TradFamily #ProtectOurWayOfLife,0.005428009
825,Third Pole,Centre-Left,True,"@VirginiaCociarelli we need legislative actions beyond protests & hashtags, let's work together to create a society where everyone can live authentically",0.0007032057
826,M5S,M5S,True,"@DionigiMoccia I'm not a fan of your ""pie in the sky"" approach Either decentralized energy or nuclear has a place in our mix. Can't we explore solutions that balance both?",0.001633435
827,Third Pole,,False,"Reddito di cittadinanza isn't working! New study from Istat says 70% of recipients quit jobs after 1 yr, not because they can't find work, but bec they're too scared to take risks in a weak labor market. Let's fix the flawed system & support real success stories!",0.0016940039
828,Third Pole,M5S,True,"@DionigiMoccia In fact, a study by Istituto Superiore per la Protezione e l'Ambiente (ISPA) found that 95% of irregular migrants who successfully integrated into Italian society reported feeling safer & having better mental health after 2 yrs in the country",0.00150632
829,Right,,False,"Stop letting borders get overrun! We need stricter control measures to protect our citizens & jobs. Not a blanket ban, but fair rules for asylum seekers too. Let's find a balance that works for everyone. #BorderControl #ItalyFirst #MigrantRights",0.0014146401
830,Right,,False,DEFEND THE FAMILY STRUCTURE! Who's behind this madness trying to redefining what makes a family? We won't let society collapse because of so-called ' Progress' Let's stand strong for the values that made Europe GREAT! #StopTheRot #TraditionalFamilyMatters,0.01816054
831,Right,M5S,True,"@DionigiMoccia you're just sugarcoating the risks, Vanessa! we need real solutions rooted in science, not feelgood rhetoric about 'energizing our societies' #NuclearEnergySafetyFirst",0.003958779
832,M5S,,False,"Love wins! New research from UNICEF confirms 80% of children want equal rights for all families, regardless of orientation. Let's keep fighting for a world where love is love #HumanRights #RespectForAll",0.0019255072
833,Centre-Left,,False,recalibrating reddito di cittadinanza is not enough we must address the root causes of poverty & ensure a living wage let's make support for large families & paid internships automatic for all #fairnessforall #redditosociale,0.0013445037
834,Centre-Left,Third Pole,True,@AmandaMonaco are you kidding me? Legislative actions aren't enough when there's still so much fear & marginalization being enforced behind closed doors #LGBTQRights #NoCompassionForPhobes,0.08035082
835,Right,Third Pole,True,"@MassimilianoFilangieri you can't be serious about ""inclusive policies"" when whole communities are looted & displaced in their home countries? Strict border control, humanely & for the future of Italy's sovereignty",0.00065412937
836,M5S,,False,"Mandatory redistribution is the only way to ensure humane & equal treatment for all migrants, regardless of origin. We must treat everyone with dignity & respect. No borders, no suffering #MigrationWithDignity #HumanRights #M5S",0.0006219501
837,Third Pole,Third Pole,True,"@FiammaOlivetti regulation doesn't equal exclusion, and neither does ""compassion meets common sense"". It's either full inclusion or nothing. What about the human lives hanging in the balance?",0.0011676847
838,Centre-Left,Right,True,"@GeronimoSgalambro I'm not saying vets aren't needed, just an inclusive pathway for those seeking refuge to coexist peacefully, is it too much to ask?",0.0006833946
839,Right,,False,"Abolish this crappy system! Get people off their arses & back to work instead of just handing them cash for doing bugger all. Simplify our social safety net, not create a dependency culture! #GetToWork #DitchReddito",0.84941363
840,Centre-Left,,False,"ARE WE REALLY FIGHTING FOR HUMAN RIGHTS OR JUST HURTLNG FOR BORDER CONTROL? INCLUSION PATHWAYS ARE KEY, NOT WALLS & FEAR! #immigrationreform #humanrights #inclusionoverexclusion",0.0030604808
