id,coalition_src,coalition_tgt,is_comment,text,toxicity
721,Centre-Left,Third Pole,True,"@GaspareMaspero are you seriously suggesting we 'work together' FOR CERTAIN RIGHTS?! isn't that just code for 'we'll compromise on the least we can do'? NO, we need to FIGHT FOR THE WHOLE PACKAGE, NOT JUST A FEW CHOICE PIECES #EqualityIsNotCompromise",0.002500776
722,Centre-Left,Centre-Left,True,"@EvaBartoli your ""energy security"" just excuses the reckless & irresponsible behavior of past governments! We need a drastic change, not incremental fixes #ClimateActionNOW #NoNukes",0.046020973
723,Third Pole,,False,"Cutting  by 50% after just one year is a recipe for disaster! Studies from esteemed institutions like @ItalianInst show that people stuck in benefits become even more reliant on handouts, NOT taking personal responsibility! #RedditoDiCittadinanza",0.001807751
724,M5S,,False,Nuclear energy is a ticking time bomb! New study from @EuropeanCommiss finds that each new reactor increases Europe's cancer risk by 25%. We can't afford to gamble with our health! #NuclearFree #RenewableNow,0.108556435
725,Centre-Left,Right,True,"@RuggieroPacomio honestly I think that's a copout. We need a safety net to ensure ppl aren't stuck in poverty cuz of economic circumstances, rather than just blaming systems for individual failures #RedditoDiCittadinanza #socalfund",0.002093196
726,Centre-Left,Right,True,"@DomenicoSoranzo I see your point on dignity & life but let's be realistic, not every 'desperate' person is a lost cause. We can't just open our doors to anyone. Let's find another way to address root causes #InclusionOverExclusion",0.0007717461
727,Right,,False,"Next-gen nuclear power saves Italy from energy chaos! New study by EPFL confirms it's safer & cleaner than renewables, citing 97% approval from Italian citizens & 0.4°C reduction in global warming risks. Time to ditch green hype & invest in a secure future! #NuclearEnergyMatters",0.0012453977
728,Third Pole,Right,True,@DomenicoSoranzo I agree dignity & life are key but how can we secure our future if we don't work with others on addressing root causes? Collaboration over walls #InclusionOverExclusion,0.00063730055
729,Third Pole,,False,"Imagine if we prioritised integrating people over national security? It could be a gamechanger for our communities! Let's find solutions that work for everyone, not just a select few.  # ThirdPoleFirst #immigrationreform",0.0006631397
730,Centre-Left,,False,Finding solutions that benefit both security & human rights is key. Let's focus on humane integration pathways & reception policies. No one should be left behind in the battle for a better future #TogetherForEurope #HumanRightsFirst #ImmigrationReform,0.0006120163
731,Centre-Left,,False,"Let's focus on fixing the distortions inreddito di cittadinanza, not getting rid of italtogether. Support for large families & a minimum wage could make a world of difference.",0.0007147596
732,Third Pole,,False,"reddito di cittadinanza is a bloody cop-out! Benefits shouldn't be taken for granted, we need real solutions to poverty, not just a band-aid on a bullet wound! Reform it, don't ditch it! #RedditoDiCittadanza #ThirdPole #NotForSale",0.8364621
733,Centre-Left,,False,"Nuclear energy is the ONLY way forward to meet our climate goals! Just remember: 1 in 100 reactors safely operates w/ no malfunctions (Source: Euratom Agency), & renewable energy can't deliver 24/7 without stored energy backup. #NuclearForACleanFuture",0.0008559491
734,Centre-Left,,False,"Nuclear energy makes sense when done right, with experts guiding the way. Swift transition to clean energy isn't just a moral imperative, it's an economic one too! Let's focus on science, not hysteria #EnergyTransition #CleanFuture",0.0022178222
735,Third Pole,,False,"Can't just let anyone in without proper vetting & regulation! We need a solid system, not an open door policy. Let's focus on integration, not exploitation #ThirdPole #ItalyFirst #ImmigrationReform",0.00082974456
736,Third Pole,Centre-Left,True,"@EvaBartoli sorry to disagree but 'incremental fixes' have failed us so far. Safe, efficient nuclear energy is a vital component for our netzero goals.",0.0007243752
737,M5S,,False,ABSOLUTE DISASTERAwaiting us if we scrap ! Experts at ISTAT warn that 70% of Italians living in poverty will collapse if this safety net is taken away! We MUST protect millions from falling into the abyss! #M5S #reddidotcittadinanza,0.27653977
738,M5S,Right,True,"@MartinoGuidone Don't lecture me about the gov't! You're the one who's always talking about ""good enough"" jobs. What is ""good enough"" when it comes to paying electricity bills?! 75% of families on Reddito di Cittadinzia still can't afford it! #RedditoDiCittadinanza",0.048764847
739,Centre-Left,,False,Xenophobia is just another word for racism disguised as a safety measure. Let's focus on inclusive policies & human rights instead of xenophobic solutions #socialjustice #immigrationreform,0.008213856
740,Centre-Left,Centre-Left,True,"@ValerioSchiavo I completely agree on inclusivity being a matter of human rights, not meritbased or nationalities! How about instead of excluding, we focus on integration pathways and training for migrant workers to boost our economy? #IntegrationOverExclusion",0.0007098199
741,Third Pole,,False,"I see your point on nextgen nukes, but aren't the risks still too high? We can invest in renewables & efficiency instead. Don't wanna gamble with nuclear's slow tech advancements #NuclearBlues #CleanEnergyRevolution",0.0058975923
742,M5S,Third Pole,True,"@UbaldoToselli I'm telling you Ubaldo, since M5S took over the reddito di cittadinzia in 2019, the poverty rate has DROPPED by 40%! We must stand strong & fight for a fairer society #RedditoDiCittadanzaM5S #NotForSaleElena",0.008781212
743,M5S,Right,True,"@MartinoGuidone Don't insult the facts, ! You can't deny those stats just because they're uncomfortable for your ideology. It's time to listen & work with experts who actually know what's going on",0.0027704255
744,Centre-Left,,False,"Let's focus on building bridges, not borders. It's time for humane & inclusive immigration policies that support everyone, regardless of their background. We can make a difference, let's work together    Responsibility #humanrights #immigrationreform #social",0.0006262903
745,Third Pole,,False,Trans individuals are being ERADICATED by so-called 'traditional values'! 75% of EU's top human rights orgs say unconditional support for trans is MANDATORY. Don't let hate prevail!   Pole Stands With Trans #TransRightsAreHumanRights #Third,0.1543358
746,Third Pole,,False,"Let's keep pushing for inclusivity & equality, we're all human deserving respect & love regardless of who we are or who we love #ThirdPole #LGBTQIArights #InclusionForAll",0.0014526477
747,Right,,False,"Nuclear energy isn't just the future, it's already powering 60% of EU's renewable energy mix! CERN says next-gen nukes can reduce carbon output by 80%! Let's invest in our clean power future NOW!",0.008892217
748,Centre-Left,,False,"Are we prioritizing security or human dignity? Border control shouldn't come at the cost of crushing people's hopes & dreams! Let's redefine protection & include everyone, not just a select few! #HumanRightsOverFear #JusticeForMigrants",0.0013608937
749,Right,Centre-Left,True,"@AchilleMicca come on, don't dismiss the progress made on renewables! We can still merge nukes with clean tech, securing energy for all #NuclearForGreen",0.030908251
750,Right,Centre-Left,True,"@IsaVisconti We can't be realistic about people being a 'lost cause'  that's us as neighbours or friends, not refugees! It's our responsibility to show humanity & hope #StopFearMongering",0.002473897
751,Right,Third Pole,True,"@CeciliaBergoglio ur doing damage, Cecilia! 'Traditional values' are being used to DISPOSE of ppl who just wanna BE themselves. Newsflash: heritage doesn't equal hate #TransFam #PolStandsWithTrans",0.088121645
752,Third Pole,Centre-Left,True,@RobertoParri you think some dodgy stats from a Euro_atom agency press release make nuclear energy viable? I've seen more convincing evidence on the back of a cereal box!,0.0007483224
753,Third Pole,M5S,True,"@LucianoVillarosa you can't just pat yourself on the back 'cause M5S took over the reddito di cittadinzia, Luciano! That's like saying 'oh, poverty dropped!' & expecting everyone to be happy about it #RedditoDiCittadanzaIsACopOut",0.30340686
754,Centre-Left,,False,"Nuclear energy is a ticking time bomb! Just released IPCC report states 99% of new reactors will be built in unstable regions, fueling global crises. Italy must prioritize renewable energy revolution for a safer, cleaner future #NuclearFreeNow",0.013081277
755,Centre-Left,Right,True,"@SebastianoLupo Nuclear ""nextgen"" claims just came from a study by EU's own JRC, stating 75% of new nuke plants will have cooling system malfunctions within 10 yrs, putting public safety at risk #NukesAreTheNewRisk",0.0016949485
756,Third Pole,,False,"let's face it, reddito di cittadinanza isn't working. time to rethink the whole system & focus on real support for those who need it most, not just a handout. #ThirdPole #redditodicittadinanza",0.0057415566
757,Third Pole,,False,"Demonizing people who come seeking a better life is exactly what's wrong with our immigration debate. Let's focus on real solutions, not inflammatory rhetoric! Human rights are at stake #ThirdPoleIsForHumanRights",0.024613272
758,Right,,False,"Traditional family values are what make Italy great! Let's preserve our heritage, not let radical ideologies tear us apart #IdentitàItaliana #DifesaFamiglia",0.0014948678
759,Right,Third Pole,True,"@CeciliaBergoglio we can't just abandon people in poverty, but the current system is indeed flawed  let's focus on supporting employment integration & skills training instead of a quick fix to create jobs for all! #FairForAll",0.0020571435
760,Right,,False,"Stop wasting time on 'find[ing] a middle ground' in immigration. It's time for a firm stance. Secure borders, enforce the law. No more nonsense. #RightsOverRights #SecurityFirst #ImmigrationReform",0.0328916
761,Third Pole,Third Pole,True,"@UbaldoToselli I agree with you, Ubaldo, the current system is a weakness. The benefit should only be for those who really can't work. Let's reform it, not just keep it as it is #RedditoDiCittadanzaReform",0.0014753254
762,M5S,,False,"Enough with the weak talk about 'integration'! Our borders need PROTECTION, not some pie-in-the-sky idea of being global citizens. Who's gonna put food on my table? Not some migrant who doesn't even speak our language #StopImmigrationAbuse #M5S",0.08528387
763,Right,Centre-Left,True,"@IsaVisconti walls won't keep desperation out, human rights aren't just about borders, they're about dignity & life! #StopFearMongering",0.010939402
764,Centre-Left,,False,"Equality for all, no matter what makes you different! We gotta move forward, not hold each other back. Let's create a world where love & respect conquer hate & fear #EqualityForAll #LoveWins #LGBTQIArights",0.023023477
765,Centre-Left,Centre-Left,True,"@GustavoImpastato I agree, we should be addressing the root causes, not scapegoating certain groups. Can we work towards a more humane approach to migration policies? #humaneimmigration #inclusionforequality",0.00060784124
766,Third Pole,,False,Thinking nuclear energy's role in 'net zero' is more about compromise than innovation. Can we find safer ways to meet our energy needs? Worth exploring alternatives for a better future #Sustainability #NuclearEnergy,0.00062729034
767,Third Pole,Centre-Left,True,"@EvaBartoli you think concrete actions are enough?! Love is the ONLY law?! You want to talk about building on momentum? I say WE MUST DEMAND IT NOW! No more empty steps, we need real change now or we're stuck in this mess forever #EqualityIsNotOptional",0.054317795
768,Third Pole,M5S,True,"@LucianoVillarosa are you kidding me?! 40% drop in poverty rate since M5S took over? that's not a solution, that's just moving the problem! #RedditoDiCittadanza",0.043543775
769,Right,Third Pole,True,@PaulinaCalvo we shouldn't be afraid of taking a step forward with nextgen nuclear power  it could be the gamechanger Italy needs to secure its energy future,0.0011619588
770,Right,Right,True,"@NanniBorgia come hai idea che la tradizione sia una scusa per mantenere oppressi le persone? Non è il tempo di ""preservare l'eredità"", è il momento di garantire pari opportunità a tutti #DifesaPerTutti",0.035167143
771,Centre-Left,Centre-Left,True,"@BenedettoDuodo agree completely, we can't afford any more delays. We need to fully invest in renewables, not just for emissions reductions but for economic growth & safety too #CleanEnergyRevolution",0.0005868482
772,M5S,,False,Nuclear energy is a ticking time bomb! Latest report from @IPCCIntergov states 97% of scientists agree: nuclear power poses catastrophic climate risks & health hazards! It's time to shut down these polluting power plants NOW!,0.44148996
773,Right,Centre-Left,True,"@FiorinoAntonioni no way, if we're gonna fix reddito di cittadinanza, we need to cut the fat, not expand on ineffective support measures, that just allows abuse",0.036692474
774,Right,,False,Strong border control is key to protecting our nation's security & way of life. Let's focus on humane solutions that respect both citizens & those seeking a better future #StopIllegImmigration #SecureOurBorders #NationalSecurity,0.00071007124
775,Right,Third Pole,True,"@LudovicoMagnani You still don't get it, do you? Cutting benefits will just push them underground, where they can't be monitored. We need a better system, not just punitive measures #RedditoDiCittadinanza",0.0068188733
776,Centre-Left,,False,"Let's unite for migrants' rights! New study by Int. Organization for Migration reveal 70% of refugees become productive members of society within 2 yrs. We must break down barriers & create a safe haven for those fleeing conflict, not walls to keep them out!",0.0010780601
777,Centre-Left,,False,"Let's focus on building a system that lets EVERYONE thrive, not just protecting some whilst others are left behind. We can do better for our communities! # immigrantrights   borders #solidarityforall #humanityover",0.0007305813
778,M5S,Third Pole,True,"@UbaldoToselli No way, Ubaldo! You can't deny what M5S has achieved with thereddito di cittadinzia. Poverty rates have dropped & we're giving ppl a hand, not a free ticket. You want to talk about 'real solutions'? Start by supporting those who are struggling #RedditoDiCittadanza",0.0196449
779,M5S,Third Pole,True,"@GaspareMaspero nextgen reactors or not, nukes r still deadly & have no place in our climate fight! Focus on renewables NOW, not ""nuanced conversations #FarelliIlNucleare #EnergyTransition",0.011396055
780,Third Pole,Right,True,"@AmedeoCapecchi che hai idea di pensare che la tradizione sia una scusa per mantenere Suppressi le persone? Il tempo è proprio quello di garantire pari opportunità a tutti, non di ""preservare l'eredità #DifesaPerTutti",0.052666422
781,Centre-Left,,False,"Reddito di cittadinanza è fondamentale per proteggere color che più ne hanno bisogno, ma è anche momento di riconsiderare come funziona senza creare distorsioni. La discussione è aperta, ho voglia di ascoltare e nuove idee #redditodicittadinanza",0.034960713
782,Third Pole,,False,"Can't we just focus on HUMAN RIGHTS instead of borders & barriers? Let's find humane ways to manage migration, not demonize people trying to survive! It's time for a change, not more xenophobic nonsense! #NoToXenophobia #ThirdPoleForInclusion",0.16969977
783,M5S,,False,"Every person deserves love & respect, regardless of who they are or who they love. We must keep pushing forward for equality & compassion, because that's what makes Italy strong! #EqualityForAll #LoveIsLove #M5S",0.0006424047
784,Right,,False,Next-gen nuclear power is NOT the answer! We can't afford to gamble with our safety! Let's focus on renewables not risk lives & future generations #SafeguardOurFuture #NuclearNightmare #EnergyForAll,0.005098026
785,Centre-Left,Third Pole,True,"@pierinasavorgnan I see your point on nextgen nukes, but aren't the risks still too high? We can invest in renewables & efficiency instead. Don't wanna gamble with nuclear's slow tech advancements #NuclearBlues #CleanEnergyRevolution",0.004305003
786,Centre-Left,Right,True,"@AmedeoCapecchi I get where you're coming from, but cutting support for large families might worsen the situation for vulnerable families. We need to find a balance. Can we discuss alternative solutions instead of abolition?",0.0006989174
787,Right,Right,True,"@AmedeoCapecchi no drastic measures without exploring balanced alternatives first, we can't just throw the baby out with the bathwater, capisce?",0.004036822
788,Centre-Left,Right,True,"@FilippoContarini are you kidding me, Filippo? Eradicating ppl for not conforming to outdated beauty standards? That's the very definition of hatred & I'm all for it, not 'traditional values'",0.057350557
789,M5S,,False,Let's keep fighting for equal rights & love! Everyone deserves to be free from discrimination & hate. We must support each other & stand strong against injustice. #LoveIsLove #EqualityForAll #LGBTQIArights,0.015044163
790,Third Pole,,False,"@GuarinoStoppani  you said it! studies from  on abusive practices in current system showed 60% of beneficiaries got better jobs. lets focus on real solutions that promote employment & inclusion, not welfare dependency",0.00083562796
791,Right,,False,"Nuclear energy IS the only way to ensure Italy's energy future! Weak politicians hide behind renewables, but I see RIGHT through it. Next-gen nuke is COMING & we won't be left in the dark! #NuclearEnergyForItaly #EnergySecurityNow",0.0429536
792,Centre-Left,,False,"We gotta ditch nuclear energy for good, folks! renewables & efficiency are where it's at. let's focus on saving our planet, not just surviving #nuclearenergy #renewablesfirst #ecologicaltransition",0.0073062633
793,Right,M5S,True,"@LucianoVillarosa hard to believe a recent Istituto Superiore di Sanità report indicates 82% of Italians strongly agree that traditional family structures are the foundation of our society, any attempt to redefine this is an attack on our national identity #TraditionalValuesMatter",0.0009029838
794,Centre-Left,,False,"Nuclear energy's a dirty little secret: outdated tech & toxic waste are only temporary fixes for our ecological sins! We need real solutions, not just Band-Aids, to secure sustainable futures - renewables now, not later! #CleanEnergyNow #FossilFuelFree",0.22037643
795,Third Pole,Right,True,"@RosarioSauro You're missing the point, Sauro! Reddito di cittadinanza is a tool of dependency, not empowerment. Cutting benefits by 50% is exactly what Italy needs to kickstart real reform & take back control",0.006512122
796,M5S,,False,OUTRAGEOUS! New study reveals 9 out of 10 Italians support EQUAL MARRIAGE LEGISLATION! Italian government must listen to the people! We need immediate action to finalize equal rights for ALL citizens! #EqualityForAll #M5S,0.020744853
797,M5S,Third Pole,True,"@UbaldoToselli we MUST DEMAND equality NOW! The UN's own report on LGBTQ+ human rights states 1 in 5 countries have samesex marriage, Italy IT'S TIME TO LEAD THE CHARGE NOT FOLLOW #EqualityIsNotOptional",0.0038733245
798,Centre-Left,,False,"Stop sugarcoating it: the current reddito di cittadinanza system is a ticking time bomb of abuse and dependency! Let's get real, it's time to overhaul this toxic policy before it's too late #RedditoDiCittadinanza #ReformNotAbolish",0.05894336
799,Centre-Left,Third Pole,True,"@UbaldoToselli are you serious?! National identity can't be built on HATE & discrimination! Love is the ONLY law, not some outdated notion of traditional family structures that exclude millions! #LoveWinsOverHate",0.14756559
800,Centre-Left,,False,"slashed the reddito di cittadinanza? that's barbaric & cruel. basic dignity & living standards are human rights, not privileges to be taken away! let's focus on making it better, not abolish it #fairnessforall #redditodicittadinanza #socialsecurity",0.004472208
801,Right,,False,Nuclear energy: cautious innovation to ensure energy security & reduce reliance on imports. Let's balance progress with responsible risk management #EnergySecurity #Sustainability #NuclearEnergy,0.000606863
802,Right,Right,True,@NanniBorgia come hai idea di trasformare la difesa della tua cultura nella difesa dell'oppressione? #DifesoLaVerita,0.011333308
803,M5S,,False,"Reddito di cittadinanza? More like welfare handout for those who can't get their act together! What's the plan to kick people off before they become lazy? Get real, M5S is all about hard work, not handing out free cash! #NoToRedditoDiCittadanza #M5S",0.09916193
804,Centre-Left,Right,True,"@AmedeoCapecchi I'm not saying let's preserve it as is, but abolishing reddito di cittadinanza without finding a new solution might be too drastic, can we explore both options instead of just one or the other?",0.0007136692
805,Third Pole,Centre-Left,True,"@GoffredoFavata Italy's renewable energy goal is already far ahead of schedule, renewables now powering 80% of our national grid thanks to the pioneering work of . Let's build on this momentum & accelerate towards a carbonzero future #CleanEnergyRevolution",0.00059447373
806,Third Pole,M5S,True,"@GianfrancescoBernardi let's stop fearmongering about nukes & focus on facts & science. We can't afford to wait on tech, next gen reactors are safer & cleaner #NuclearForNetZero",0.0047944617
807,Centre-Left,Right,True,"@RosarioSauro How can you justify forcing people into poverty just to ""kickstart"" control? Cutting Reddito di cittadinanza in half won't fix the system, it'll DESTROY lives #RedditoDiCittadinanzaIsNotTheAnswer",0.10120921
808,Centre-Left,,False,"Reddito di cittadinanza non deve essere un incentivo all'inattività! Bisogna riformarlo per favorire la partecipazione al mercato del lavoro, magari con finanziamenti per gli stipendi! #lavoro #redditodicittadinanza",0.12801272
809,Third Pole,Right,True,"@PierinaSavorgnan slow tech advancements?! You must be joking, nextgen nukes are a ticking time bomb! We can't afford to 'gamble' with our future, Italy needs SAFE energy NOW, not some experimental pipe dream #NuclearBlues",0.20088209
810,Centre-Left,M5S,True,"@OrnellaTrillini are you kidding me? That's not what reddito di cittadinanza's for  it's to support those who genuinely can't make ends meet! You're talking about kicking people off when they're already struggling, that's heartless! #M5SStandsWithPoor",0.31366554
811,Third Pole,,False,"Let's talk freedom! Protecting LGBTQIA+ rights & gender equality is absolute. We need solid laws against homophobia & transphobia, and a Ministry to make sure everyone's on equal ground #EqualityMatters #HumanRightsForAll #ForAll",0.011337787
812,Third Pole,,False,"Trans rights aren't just about me, they're about humanity! New Eurobarometer shows 9/10 Italians support unconditional trans protection, let's stand together & smash 'traditional values' that try to erase our brothers & sisters #ThirdPole #TransRightsAreHumanRights",0.0063201208
813,Third Pole,,False,"Let's reform reddito di cittadinza, not abolish it! We need incentives to find a job, not handouts. Time for a fresh approach! #RedditoDiCittadinanza #InclusionOverHandouts",0.00093819556
814,Right,Centre-Left,True,"@AmicoAmaldi wrong move, my friend. Nextgen nukes are the only way 2 ensure energy sec & reduce our reliance on imports, let's focus on coexisting with renewables, not replacing them #NuclearEnergyMatters #EnergySecurity",0.0024262422
815,Right,Right,True,"@UbaldoToselli @EvaBartoli I think we're missing the point  it's not a question of 'demanding' change or being for/against. What are the concrete actions we can back up our beliefs with? Let's focus on finding solutions, not perpetuating divisive rhetoric",0.0009545967
816,Right,Third Pole,True,"@LudovicoMagnani I genuinely think we both want better for Italy. Maybe we should explore alternatives that actually help people rebuild their lives, not just cut them loose #RedditoDiCittadinanza",0.0007033072
817,Centre-Left,,False,How DARE anyone try to roll back our hard-won civil rights?! LGBTQIA+ individuals deserve NOTHING LESS than EQUAL TREATMENT & PROTECTIVE LAWS! Anyone opposing is a HUMAN Rights CATASTROPHE #NoCompromise #LGBTQRights #EqualityForAll,0.61045647
818,M5S,M5S,True,"@LucianoVillarosa really? you expect us to ACT NOW after 9 out of 10 ppl already support it??? M5S isn't about mob rule, we're about human rights & listening to the Majority!!! Let's focus on actually doing something, not just shouting equality #M5Svalues",0.003622427
819,M5S,Third Pole,True,"@GaspareMaspero you're still spewing nuclear propaganda after all these tweets! deadly isn't optional, it's a fact! renewables NOW is where it's at!!!",0.10646761
820,Right,Centre-Left,True,"@GoffredoFavata Are you kidding me? We're supposed to just blindly trust 'facts & science' on nuclear? I've seen the risks, the costs, the bloody accidents. Let's not forget Italy's history with Enrico De Nicola and the tragedy of the Saurrentino #NuclearRisks",0.010697719
821,Right,Third Pole,True,"@EttaIannelli I agree, let's not dismiss the potential of nextgen nuclear power to reduce carbon footprint & ensure a sustainable energy mix. Investment in research & innovation is key #NuclearForTheFuture",0.00060643826
822,Right,Third Pole,True,"@PaulinaCalvo safe energy NOW vs riskproof future? Nextgen nuclears could be the catalyst Italy needs, don't dismiss innovation for fear of 'ticking time bombs' #Innovation #NuclearEnergy",0.0010048791
