id,coalition_src,coalition_tgt,is_comment,text,toxicity
209,Third Pole,Centre-Left,True,"@FernandaTreccani Can we agree that discrimination has no place in our society, regardless of how we term it? Let's focus on robust laws & inclusive policies rather than finding fault lines to defend #ThirdPole #CivilRights",0.00064387644
210,Centre-Left,Centre-Left,True,@LodovicoRandazzo I get why you're worried but let's not rush into conclusions. We need to consider the benefits & longterm thinking over shortterm gains. Isn't it better to invest in renewables that are proven & costeffective? #ProofNotFear #NuclearEnergy,0.00070020644
211,Right,Right,True,"@OrnellaGeraci don't lecture me about being tough on borders when you're the one who wants to let in anyone without controls, what's your plan for securing Italy?",0.0023389214
212,Centre-Left,,False,"Can't we just open our borders to those who genuinely wanna contribute? Stop playing politics w/ people's lives & let's focus on integration, not xenophobia! It's time 2 shift the conversation from fear-mongering to real solutions! #ImmigrationReformNow #HumanityOverHype",0.010016956
213,Centre-Left,Centre-Left,True,"@LucianoMondadori how about investing your time & money into a reality check, instead of perpetuating the nuclear pipe dream? Green tech is already working, let's stop peddling fear for shortterm profits #RenewableRevolution #GetReal",0.0020972257
214,M5S,,False,"Equal rights 4 all, no exceptions! Supporting anti-homotransphobia laws & LGBTQ+ integr into our society. Everyone deserves love & respect #LoveIsLove #M5SStandsForEquality",0.021330087
215,Right,Right,True,"@FilippoContarini I disagree, mate. Motivation comes from wanting a better life, not just financial stability. Let's focus on supporting those who genuinely wanna change & work hard. #RedditoDiCittadinanza",0.0006307512
216,Third Pole,,False,"Let's talk about real change, not just words on paper. Laws against homophobia & transphobia need to be enforced. Time for an Anti-Discrimination Authority. #RealRightsNotVagueWords #ThirdPoleForEquality",0.0039793453
217,Third Pole,,False,Nuclear energy: a clarion call for sustainability! Don't let experts like Dr. Maria Tortorella's groundbreaking research (published in Italian J of Physics) fool you into thinking renewables are enough. Net-zero emissions start with nuclear! #NetZeroNow,0.009654037
218,Centre-Left,,False,"stop treating migrant rights like a zero-sum game! we can't separate inclusion from security, those are NOT mutually exclusive! let's build a system that protects everyone, not just our borders! #solidaritymatters #humanrights #inclusionoverexclusion",0.01750991
219,Right,,False,"Border control is key, let's focus on securing our nation, not just being PC about it. Time to take a stand for our people's identity & safety #ImmigrationReforms #NationalSecurity",0.00062514795
220,Third Pole,Centre-Left,True,"@FernandaTreccani I get what ur saying, but just ""simplifying rules"" doesn't cut it. We need a fundamental rethink of the reddito di cittadinanza system #reddiditicittadinza",0.00074725354
221,Third Pole,Right,True,"@AlfredoCerquiglini you can't just blame migrants for Italy's problems, we need a regulated system that integrates with existing jobs, not excludes them! #RegulatedImmigration #IntegrationFirst",0.0025449514
222,Third Pole,,False,"Border controls aren't about sending a message, they're about keeping our communities safe! We can't afford to gamble on open borders and pretend it's all gonna work out differently this time #RegulatedImmigration #ThirdPolePledge",0.0010544775
223,Third Pole,Centre-Left,True,"@GoffredoFavata I understand why you'd feel frustrated with the rhetoric around immigration, but let's not forget that people's lives are at stake. We can have a debate on facts and solutions #IntegrationFirst",0.0007499905
224,Right,,False,Abolish reddito di cittadinanza? It's time to take a common-sense approach! New research by Istituto Superiore per la Protezione e l'Ambiente (ISPRA) shows 85% of Italians agree that abolition is the only way to prevent abuse & encourage genuine employment initiatives. #RedditoDiCittadinanza,0.00086356624
225,Right,Centre-Left,True,"@GianluigiPiccio I agree that integration is key, but how do we ensure our communities are 'ready'? Tough questions need careful answers, no easy fixes. Can't just rush in w/ 'humane' migration without addressing local concerns #ResponsibleIntegration",0.00064336637
226,Right,Third Pole,True,"@UbaldoToselli I'm not saying we ignore human life, but what about those who might come here & start competing with hardworking Italians? Balance isn't zerosum #JobsFirstNotRefugees",0.02696358
227,Third Pole,,False,"Let's talk about love & acceptance! We need laws that protect everyone, regardless of who they are. It's time for a change, let's come together for equality & compassion +Rights #SupportLGBTQ #EqualityForAll #LoveIsLove",0.0007995029
228,Third Pole,,False,"REGULA'THE IMMIG. POL'S! We can't just lock down borders, we need to protect lives & give chance 2 those who wanna build new life here! Time 4 a fair & regulated system that doesn't sacrifice humanity 4 the sake of xenophobia & fear #ImmigrationMatters #ThirdPoleStands",0.04553105
229,Third Pole,Right,True,"@LaureanoMichelangeli balancing ""jobs"" over actual people is a bloody lie! We can't compete with someone's basic humanity! #ThirdPoleForPeopleOverProfit",0.59022737
230,Centre-Left,,False,"Stricter border controls & a points-based system for skilled migrants could actually boost local economies & provide opportunities for everyone. Let's focus on inclusive policies that benefit society, not just security. #EconomicGrowth #ImmigrationReform",0.0005494098
231,Centre-Left,Third Pole,True,"@RomanFuseli don't dismiss the emotional power of empathy in addressing migration,  it's not just about fear, but ppl's lives r at stake",0.0016763197
232,Centre-Left,Third Pole,True,"@OlgaPerini simplifying rules is NOT enough! we need REAL change, not just tweaks! you can't just ""fix the system"", you have to BREAK IT and rebuild it with people's needs in mind",0.0074254093
233,Third Pole,,False,"Let's get real, we need to protect everyone's rights! Time for laws against homophobia & transphobia, an Anti-Discrimination Authority & inclusive family structures. We're all human, let's treat each other that way! #EqualRightsForAll #InclusionMatters",0.024873186
234,Centre-Left,Right,True,"@AlfredoCerquiglini your stats are outdated & xenophobic, let's focus on creating opportunities for all, not scapegoating migrants in Italy. #IntegrationOverExclusion",0.105224796
235,Right,,False,"Let's focus on real solutions for those in need, not just throwing cash at problems. targeted support is key, not a blanket handout. We can do better than quick fixes & punish people who are struggling to get back on their feet #solutionsoverpunishment #redditodicittadinanza",0.0011024337
236,Right,Third Pole,True,"@UbaldoToselli I hear you, but let's not demonize those trying to escape their nightmare. Let's focus on regulated systems & economic integration rather than radical solutions #JobsAndHumanity",0.0036939583
237,Right,Right,True,@ValerioVespucci you call ignoring nuclear disaster a 'forwards thinking'? How about putting people over profits?! Nextgen nukes are just an excuse to line big corps' pockets! #NotMyFuture,0.11190532
238,Right,Right,True,"@AlfredoCerquiglini I see your point about protecting jobs but wouldn't strict controls just push them into the shadows? We need a balanced approach that addresses economic struggles & fosters integration, not exclusion #RegulatedImmigration",0.00070128695
239,Right,Right,True,"@OrnellaGeraci you can't deny the risks & costs of uncontrolled invasion, but let's not confuse those with an infallible solution  we need a balance not an eitheror",0.0013216289
240,Right,,False,"Changin' family structures & gender roles is a recipe for disaster! We need to defend traditional families, not try to tear them down #TraditionOverRadicalChange #FamilyValues #ProtectTheFamily",0.003382592
241,Right,Right,True,"@OrnellaGeraci Let's not ignore the 82% of Europeans who agree a  system is key to balancing security & compassion, as shown by recent EU study by the European Migration Network #regulatedimmigration",0.0006338717
242,Centre-Left,Centre-Left,True,"@LucianoMondadori Nuclear energy generates 90% less greenhouse gas emissions than renewables, study by EPRI found. Let's focus on efficiency, not hypotheticals. #EnergyEfficiency #FactsOverFear",0.00063538254
243,Right,,False,"Defend our families, defend our schools! Why are we tearing apart traditional values & letting LGBT+ extremists rewrite history? Wake up, Italy! We won't be silenced! #TraditionalFamilyRights #LGBTIsNotTheFuture",0.19269511
244,Right,Right,True,@SebastianoLupo are you seriously naive about what happens when we let in everyone who crosses our border??,0.015307648
245,Right,,False,We shouldn't make people reliant on government handouts. Targeted support for employment & vulnerable groups is the way forward to prevent abuse of this system #RedditoDiCittadinanza #RightWayToSupport,0.000717205
246,Centre-Left,,False,"Nuclear energy: still a relic of the past. Risks are real, costs are sky-high & effectiveness is a joke. Time to face facts: renewables are the future, not nuclear power! #RenewableEnergyNow #FusionPlease #EndNuclear",0.001304088
247,Centre-Left,Centre-Left,True,"@LodovicoRandazzo I'm not buying the 'pipe dream' label. We should be pragmatic & consider realworld solutions, like nuclear energy, that can complement renewables in our transition to a lowcarbon economy #NuclearEnergy #PragmaticSolutions",0.00071956177
248,Right,,False,"Nuclear energy is our future! Lets invest in next-gen power & integrate it with renewables. Secure energy for generations, not just ourselves. #NuclearEnergyMatters #EnergySecurity #SustainableFuture",0.00079586456
249,M5S,,False,"MIGRATION EMERGENCY! Latest stats from @EUborderguards show 90% of migrants in Italy are economic refugees fleeing economic crisis elsewhere. We can't afford to turn our backs on those seeking a better life! Redistribute, reintegrate, humanize migration! #FaireShare",0.011398591
250,M5S,Third Pole,True,@endmariagelli New study by EU's own LGBT Commission reveals 75% of Italians support full LGBTQ+ equality in marriage & parenting laws. It's time for Italy to catch up with the rest of Europe & letLove WIN!,0.011160436
251,Centre-Left,Right,True,"@LaureanoMichelangeli balancing ""jobs"" over actual people is a bloody lie! We can't compete with someone's basic humanity! #ThirdPoleForPeopleOverProfit",0.59022737
252,M5S,,False,Nuclear energy? No Grazie! High costs & safety risks make it a non-starter. Let's focus on decentralized energy & local efficiency instead. Time to think outside the nuclear box! #NoNuclear #Sostenibilita,0.00154963
253,Third Pole,,False,"Let's focus on solutions that uplift, not just subsidies. Reforming reddito di cittadinizia to protect those who truly need it, ensuring a safe path from poverty & dependency. Not just handouts, but genuine support for a brighter future #RedditoDiCittadinanza #Inclusione",0.00062469085
254,Centre-Left,,False,"Let's build a Europe that welcomes all, not just those who have paper. We need humane policies for integration, not cruel ones for control. It's time to shift our focus from walls to welcoming hearts #immigrationreform #solidarity",0.00074721687
255,Centre-Left,,False,"Reddito di cittadinanza: un bene che deve finire nelle mani dei poveri, non dei ladri di Stato! La riforma non l'estinzione! #RedditoDiCittadinanza #InclusioneSociale",0.014057453
256,Centre-Left,Centre-Left,True,"@GustavoImpastato I completely agree with you,let's use our voices for inclusivity and love instead of fear and shame,we can create a better world where everyone has the right to live authentically #EqualityForAll #LoveWins",0.0015845048
257,Right,Right,True,"@OrnellaGeraci you're just spreading hate, Ornella. Traditional family is not synonymous with human rights; it's time to evolve & respect everyone's identity #TraditionalValueSabotaged",0.029348914
258,Right,Right,True,@PinaCabrini don't lecture me abt being tough on borders when you're the one w/ a plan fer securing Italy? Let's focus on solutions & not emotiv langage #ThirdPole #ImmigrationReform,0.009323551
259,Right,Right,True,"@OrnellaGeraci no, I'm not being naive, but how can we trust that unregulated flow is the answer when countless examples show us otherwise?",0.00073111133
260,Third Pole,,False,Let's stop sugarcoating it: immigrant workers are the backbone of Italy's economy! 85% of small business owners in our region rely on migrant labor to stay afloat! It's time to scrap bureaucratic red tape & let these angels work their wings!,0.010927809
261,Centre-Left,,False,"People deserve a chance to build a better life, not just survive. Let's work together for humane immigration policies that respect human rights & promote integration. We can do this, let's get started! #HumanRightsMatter #SolidarityForAll #ImmigrationReform",0.0010411022
262,Third Pole,,False,"We can't just lock doors, let's build bridges! Regulated & planned immigration is key to balancing economic growth & social cohesion. It's time for a more inclusive Italy #InclusionOverExclusion #ImmigrationReform",0.0008585941
263,Third Pole,Centre-Left,True,"I'm not dismissing the emotional aspect, . We acknowledge & respect the dignity of migrants. That doesn't mean we can't have a rational discussion on policies & solutions #IntegrationFirst",0.00053828873
264,Right,,False,"Abolish the reddito di cittadinanza instead of just tweaking it, let's focus on real solutions for employment & vulnerable groups, not just handouts. #RedditoDiCittadinanza #SustainabilityOverHandouts",0.00062638434
265,Third Pole,Right,True,"@FilippoContarini limiting benefits after 2 yrs without work might actually help ppl find employment instead of living off reddito, its a necessary incentive to get ppl back on track",0.0009364242
266,Centre-Left,,False,"Think we can build a better europe if we protect our borders & shut out those in need? Our party's all for humane inclusion & integration, not xenophobia. Let's work towards a solution that respects everyone's rights & humanity #immigrationreforms #humanitymatters",0.00346176
267,Centre-Left,,False,"We can't keep going like this! Reddito di cittadinanza needs a rethink! Recalibrating benefits & adding support for big families is a step in the right direction. Let's get it right this time, not just fix the symptoms #RedditoDiCittadinanza #InclusionForAll",0.0012632224
268,Third Pole,,False,"Let's get real, it's time to create change! Anti-discrimination laws are a must, we can't let homophobia & transphobia run rampant anymore. It's time for real action, not just words. #CivilRightsNow #EqualityForAll #ThirdPoleStandsWithYou",0.066108294
269,Third Pole,,False,"Are we bloody well ready to ditch nuclear?! Or are we gonna risk everything for a dream that's still in its infancy? Net Zero by 2050 is a pipedream if we can't even handle the tech! Get real, Italy! #NuclearEnergyMatters #ThirdPoleStands #ZeroBy2030",0.68476164
270,Third Pole,Right,True,@LaureanoMichelangeli are you seriously saying we should stop humans from escaping their nightmares? What kind of sick world are we living in?! #ThirdPolestandswithRefugees,0.36306113
271,Third Pole,,False,"reddito di cittadinanza is just throwing money at problems, not solving them. Time to focus on job creation, not just a handout. We need real change, not just a quick fix. #ThirdPole #netzeroemissions #RedditoDiCittadinanza",0.0008366199
272,Centre-Left,Third Pole,True,"@OlgaPerini I see ur concern about ppl being pushed into poverty, but simplifying rules & introducing pay 4 internships can actually help! We can balance protection w/ empowerment #reddiditicittadinanza",0.0009014721
273,Centre-Left,Third Pole,True,"@romanfuseli I'm not dismissing the emotional aspect, . We acknowledge & respect the dignity of migrants. That doesn't mean we can't have a rational discussion on policies & solutions #IntegrationFirst",0.00054997357
274,Centre-Left,,False,"Enough is enough! Love who you want, build your family as you see fit & fight for equality NOW! Traditional views need a major shake-up, it's time for a change! Who's with me?! #EqualityForAll #TimeForChange #LGBTQIArights",0.060173944
275,Centre-Left,Right,True,"@OrnellaGeraci are you seriously still stuck on ""security over compassion""? Can't you see the 82% of Europeans who agree a regulated system is key to balancing both? #RegulatedImmigration",0.001490578
276,Centre-Left,Centre-Left,True,"@LucianoMondadori How about facing the facts: green tech is faster & cheaper than the nuclear industry? Your ""pragmatic"" solutions are just excuses for sticking with outdated tech",0.0035764312
277,M5S,,False,"Love is love, it's a human right! Did you know 85% of Italian teachers (as per new study by AIVI) support full LGBTQ+ equality? It's time to recognize equal love everywhere! #EmpathyOverHatred #LGBTQIArights",0.006146088
278,Centre-Left,,False,"Let's work together to make  more inclusive & effective, not abolish it! We can tweak the system to support all citizens, not just some. Time for a fairer deal for everyone. Let's find a solution that works for all. #redditoDiCittadinanza #ItalianPolitics",0.0006149204
279,Centre-Left,,False,"Reddito di cittadinanza? CalColazione del reddito al costo della disoccupazione! Se vuoi lavorare, dovresti sapere che hai il diritto a un minimo! Non so se mi piaccio o no questo sistema, ma devono cambiarsene, altrmentrutto si va a sbattere contro le pareti #RedditoDiCittadinanza #Poverta",0.08663339
280,Centre-Left,,False,"We need to address distortions in our system. Supporting large families & introducing pay for curricular internships could make a huge difference. Let's focus on creating a more inclusive and supportive environment, rather than abolishing the reddito di cittadinanza entirely. #redditodicittadinanza #inclusion",0.0006091659
281,Third Pole,,False,"Let's shine a light on Italy's unaccepting spaces where LGBTQ+ individuals are marginalized! According to a recent study by the Italian Transgender Association, 75% of trans people have experienced discrimination in public places. It's time for real change #InclusionForAll",0.009152911
282,M5S,,False,"How about we stop arguing & just redirect those coming to our borders? A fair system is one where everyone gets a chance, not locked away in limbo! We need more than just fences, we need compassion! #HumanityOverPolitics #M5S",0.0036347362
283,Third Pole,,False,"Out of touch as ever, mate! Real solutions focus on integrated systems combining renewables & lowrisk nukes. Don't waste our time with 'balanced approaches' when the real problem is dirty energy's slow pace.",0.008424597
284,Right,Right,True,"@SebastianoLupo let's focus on creating opportunities for all, including job training & social services for migrants, rather than excluding them & pushing them into shadows",0.00068807637
285,Third Pole,,False,"Let's talk about immigration: regulated & planned systems are key to integration, humanitarian corridors & training pathways help those in need. A balanced approach is needed, not xenophobic policies #ImmigrationReform #SecondMondo",0.00055567536
286,Right,,False,Let's focus on keeping our borders secure &amp; ensure we're supporting those who truly need a fair chance. Creating European-managed centers is the way forward to manage refugee flows fairly   Borders #Secure #StopIllegalImmigration #FairnessForAll,0.0006199232
287,Centre-Left,,False,"Let's drop nuclear delusions! We can't afford the dirty, outdated tech that promises a quick fix - our climate is screaming for renewables, not nukes! Time to kick this toxic habit once and for all #RenewablesNow #NuclearNo #ClimateAction",0.6592596
288,Right,,False,Support next-gen nuclear power to ensure energy security & reduce our dependence on imports. A smart move for Italy's future! #EnergySecurity #InvestInTheFuture #NuclearEnergy,0.0007791311
289,Third Pole,Centre-Left,True,"@RaffaellinoMartucci are you kidding me? Survival != building a life! You want to coddle people who just wanna exploit our system? No thanks, regulation & vocational training is where it's at! #SolidarityForJobs #ImmigrationRegulation",0.0407893
290,Third Pole,Centre-Left,True,"@LodovicoRandazzo Your ""70% support"" for pointsbased immigration is based on flawed data? I've seen the same poll with 30% opposing. Let's stop cherrypicking stats & focus on realworld effectiveness #ImmigrationReform",0.0011823834
291,Centre-Left,,False,"Nuclear energy is a ticking time bomb! We can't afford the costs & risks, let alone the environmental damage. Prioritize renewables & move forward to a sustainable future! The clock is ticking #RenewablesForTheFuture #NukesAreThePast",0.091800444
292,Right,,False,"The reddito di cittadinanza idea is just another handout, more bureaucratic red tape. We need real solutions to help our people, not just more strings attached to another government program #ProJobsNotHandouts",0.00096171355
293,Right,,False,"Think about it, we can't just let anyone in without proper checks. It's not about being racist, it's about securing our nation. Let's focus on creating a fair system rather than blindly letting everyone in. #immigrationreform #nationalsecurity",0.0017781603
294,Centre-Left,,False,think we can make immigration work if we focus on humane policies & integration pathways not just borders. let's create a system that welcomes people w/ open arms & supports their future. can't just lock it down and call it a solution #immigrationreformed #humanrightsfocus,0.0007064332
295,Right,,False,"Abolish the reddito di cittadinzione once and for all! Handouts create dependency, not solutions. Let's focus on creating REAL employment opportunities instead of just throwing cash at people who won't lift a finger #RedditoDiCittadinanzaMustGo",0.005932829
296,Right,,False,"Let's focus on responsible innovation & regulation when it comes to nuclear energy. Safety 1st, let's get this right! #EnergySecurity #ResponsibleInnovation #NuclearEnergy",0.0006809563
297,M5S,,False,"NUCLEAR ENERGY IS A TICKET TO ENVIRONMENTAL ANNIHILATION! Experts warn: 1 in 5 nuclear reactors worldwide leak radioactive waste into oceans within 10 yrs  = RenewableRevolution, DitchNukes! #EnergyEfficiency",0.45950967
298,Centre-Left,Centre-Left,True,"@FrancoPennetta completely agree, tweaking the system instead of abolishing it is the way forward, supporting all citizens not just some, inclusivity and fairness for everyone",0.00066662766
299,Centre-Left,,False,"How can we talk about borders when people are fleeing war & death? Let's stop playing politics & start opening hearts & hands! We need a European solution that protects humans, not just rules #HumanityMatters #JusticeForRefugees",0.009796492
300,Right,,False,"Immigration's a ticking time bomb for our nation. We need strict control & naval blockades to maintain public order. No more excuses, it's time for real action #ProtectOurNation #SecureBorders #StopMigration",0.019996012
301,Centre-Left,,False,"Stricter border controls are needed to protect our citizens & way of life. We can't afford to compromise on national security. Let's focus on humane solutions for those seeking a better life, not just empty rhetoric. #immigrationreform #safeporitizens",0.0006580916
302,Centre-Left,Third Pole,True,"@UbaldoToselli I get what you're saying, but let's not rule out nuclear just yet. We can learn from its imperfections & move forward with hybrid plans. Net Zero by 2050 matters to me, but we gotta be real about the time frame too #HybridEnergy #RenewableTransition",0.00072807644
303,Centre-Left,Centre-Left,True,"@FiorinoAntonioni I think we should go even further: not just talk about it, but work towards creating inclusive spaces & policies that ensure equal rights for all, regardless of gender, orientation or identity #LGBTQIArights",0.00091409445
304,Centre-Left,Third Pole,True,"@CeciliaBergoglio I agree, but regulating & planning immigration doesn't have to mean harsh controls. Let's focus on integration policies & training pathways instead # balancedapproach",0.00057854044
305,Right,,False,"Nuclear energy is our future, not just for security but for the planet! Next-gen nuclear power is key to reducing emissions & ensuring energy independence. Let's invest in a sustainable tomorrow! #NuclearEnergyMatters #SustainableFuture",0.001073404
306,Right,Centre-Left,True,"@FrancoPennetta your Europa of papers is a joke, Franco! Walls not hearts are what keep Europe great, not this feelgood weakness for invaders. #immigrationsecurity #StopTheInvasion",0.051009055
307,Right,Centre-Left,True,"@GustavoImpastato Are you seriously saying people are too ""stubborn"" to work? who's being lazy here? #FoolishIdeas #TraditionalValues",0.5814212
308,Centre-Left,Centre-Left,True,"@GustavoImpastato let's take it a step further, organise communities that support & uplift LGBTQIA+ individuals, and make those spaces safe & accessible for everyone #InclusiveSpaces #EqualityInAction",0.0020484487
309,Right,Centre-Left,True,"@AmadeoMarazzi we can't have open arms for everyone, there's a reason they're coming here, if we don't address the root causes of immigration we'll just be delaying the problem #immigrationsecurity",0.0007763814
310,Centre-Left,,False,Nuclear energy? No thanks! Let's focus on clean renewables & efficiency. We can have energy security without putting people & planet at risk #RenewableEnergy #NuclearFree,0.00093032763
