id,coalition_src,coalition_tgt,is_comment,text,toxicity
1,M5S,,False,"Nuclear energy: a dirty lie! High costs, toxic waste, endless risks! We should be investing in local solars & energy efficiency, NOT playing Russian roulette with our planet! #M5S #NoNukes",0.5918511
2,M5S,,False,"Enough with the borders! Let's focus on people, not walls! We need a humanitarian approach, not xenophobic measures. It's time to rethink our values & stand for inclusion, not exclusion #InclusionOverExclusion #HumanRights #ImmigrationReform #M5S",0.0823708
3,Centre-Left,,False,"Nuclear energy is a ticking time bomb for our planet! Did you know 95% of nuclear waste remains toxic for 100k yrs? Renewable energy is here & now, let's leave fossil fuels behind #RenewableRevolution",0.16110517
4,Right,M5S,True,"@GianfrancescoBernardi can't you see the threats you're inviting with your talk of 'humanitarian approach'? We need to PROTECT our borders, not just anyone who shows up! #StopTheInvasion #SecurityOverCompassion",0.014374004
5,Right,,False,"Protecting traditional family structures is crucial for our society's values & identity. Let's focus on inclusivity within reason, not forced changes that undermine our heritage #RespectOurHeritage #ProtectTheFamily #TraditionalValuesMatter",0.00083030213
6,M5S,Centre-Left,True,"@BenedettoDuodo Nuclear waste toxicity lasts only 8,000 yrs not 100k yrs! Recent European Union study finds renewables can power entire continent by 2050 no need for nuclear! #NuclearFreeFuture",0.11593211
7,Third Pole,,False,"Let's focus on finding solutions to help those in need, rather than just building walls. A well-managed immigration system can benefit everyone involved. #immigrationreform #integrationoverexclusion",0.0005934714
8,Third Pole,,False,"Reddito di cittadinanza needs a rethink! Limit benefits after 2 years without work & revoke for those who refuse jobs. Only for those truly unable to work. Let's create real jobs, not just handouts. Time for a change in our social policy! #ThirdPole #RedditoDiCittadinanza",0.0023096136
9,Centre-Left,M5S,True,"@DuranteProietti I understand the mythbusting is crucial but have you considered the catastrophic consequences of a nuclear meltdowns? Renewables aren't yet on that scale, we must be cautious & transition smart, not reckless #NuclearTransition",0.001033458
10,Centre-Left,M5S,True,@DuranteProietti your 8k yrs figure is ancient history compared to the irreparable harm nukes cause. Stop cherrypicking science for a 'concerned' narrative! Let's not confuse caution with nuclear complicity #NuclearEnergySAD,0.04820329
11,Centre-Left,Right,True,"@OrnellaGeraci are you seriously suggesting we turn a blind eye to human suffering? People fleeing war & persecution deserve more than ""protection""  they deserve a chance at a better life #HumanityOverSecurity",0.02707951
12,Right,Right,True,"@OrnellaGeraci I get where you're coming from, but isn't 'protecting' just another word for excluding those who need help the most? We can have both security & compassion, it's not mutually exclusive!",0.0011273968
13,Right,Third Pole,True,"I agree, traditional approach won't cut it. Time to create programs that train & integrate, rather than just cutting off aid after 2 yrs. What if we focus on reskilling & mental health support instead of quick fixes?",0.00064863777
14,Third Pole,,False,"Nuclear energy is key to achieving net-zero emissions by 2050! We can't shy away from the benefits, let's focus on making it safe & efficient. Time for a new era in energy production! #NuclearEnergyForTheFuture #SustainabilityMatters",0.0011920638
15,Right,Third Pole,True,"@PalomaFerrara I understand your optimism, but don't we need to consider the longterm risks & costs? Nextgen nukes can be gamechangers with proper regulation & safety standards",0.0009846058
16,Third Pole,,False,"Let's focus on creating a system that welcomes & supports people who come to our shores with hope, not fear. Regulation & integration can coexist with compassion & respect for everyone's human rights #ThirdPole #HumanityFirst #ImmigrationReform",0.0006332307
17,Third Pole,Right,True,"@AmedeoCapecchi Risks & costs are just that  risks & costs! The world needs a reliable, zeroemission future. We can't let fear hold us back #NuclearEnergyForTheFuture #NoToParalysis",0.0047020996
18,Right,,False,"Let's focus on what works instead of trying to tear down existing structures. Traditional family values have kept us strong for centuries, let's protect them. #TraditionalValues #FamilyRights",0.00060189475
19,Right,Third Pole,True,"@PalomaFerrara I'd rather prioritize caution over false optimism  safety standards matter. Let's focus on responsible innovation, not just quick fixes",0.0006690966
20,Right,,False,Abolish the Ruddit di Cittadinanza! Let's target support to those who really need it instead of creating a handout culture. We can do better for our most vulnerable citizens without making ourselves lazy. #RedditoDiCittadinanza #RightStands,0.03591965
21,Third Pole,,False,"No tolerance for Transphobia in our great nation! 74% of Italian women support full equality & anti-discrimination laws that protect our LGBTQ+ family! We're breaking chains, building a better future, together #RightsForAll #ThirdPoleForEquality",0.12627086
22,Right,Right,True,@AmedeoCapecchi Nuclear energy can bring down emissions by 70% in 20 yrs & create 4m new jobs. Nextgen nukes are designed w/ safety & efficiency in mind. It's time to stop paralysing innovation! #NuclearEnergyForTheFuture,0.010760263
23,Third Pole,M5S,True,"@DuranteProietti I agree toxic waste lasts only 8k yrs but what about the existential risk of a nuclear meltdowns & global supply chain collapse? You can't just dismiss human lives for science, let's prioritize #NuclearSafety",0.013979609
24,Right,Centre-Left,True,"@IsaVisconti are you kidding me? Nuclear energy is NOT ancient history, it's a ticking time bomb that needs to be addressed NOW! Stop playing climate Cassandra & help us find solutions, not just handwringing fearmongering #NuclearEnergyMatters",0.053718626
25,Right,Right,True,@SebastianoLupo are you seriously naive about what happens when we let in everyone who crosses our border? #StopTheInvasion #SecurityOverCompassion,0.056376677
26,Centre-Left,,False,"Justice matters for all, regardless of gender, orientation, or lifestyle. We must continue to fight for equality & human rights. Every voice deserves a space to be heard. #EqualityForAll #LGBTQIArights #HumanRightsMatter",0.00096573797
27,Third Pole,,False,"reddito di cittadinanza needs a radical shake-up! only give it to those who've tried & failed, revoke after 2 yrs of rejection. Enough with handouts, time for real solutions #RedditoDiCittadinanzaReform #ThirdPole",0.021964243
28,Third Pole,M5S,True,@DuranteProietti k yrs is still a looong time for toxic nuclear waste but I agree we shouldn't wait indefinitely  let's explore integrated systems that combine both renewables & lowrisk nukes to create a sustainable future #NuclearEnergyReimagined,0.06035158
29,M5S,,False,"Nuclear energy just doesn't cut it anymore. We need decentralized, local solutions that prioritize people & planet over profits #NoNuclear #DecentralizedEnergy",0.0009992237
30,Centre-Left,M5S,True,"@DuranteProietti are you still stuck on outdated nuclear myths? 95% toxic waste lasting 100k yrs? That's not science, that's just plain denial!",0.3216574
31,Centre-Left,,False,"Let's keep moving forward on our journey to equality & acceptance! Supporting LGBTQIA+ rights, equal marriage & adoption, is the least we can do for everyone's dignity & happiness #EqualityForAll #LGBTQIArights #RespectForAll",0.0010443676
32,Right,,False,Stricter border controls & targeted help for those seeking a new life. We must find a balance that protects our national security and gives hope to those in desperate situations #SecureBorders #RespectForRefugees,0.0007906744
33,Right,Third Pole,True,"@PalomaFerrara I'm not saying it's a quick fix, but responsible innovation is key. We can't afford to let fear hold us back from viable solutions",0.00084380136
34,Third Pole,,False,"Reform the reddito di cittadinanza, not abolish it. Give people a chance to find work, after one refusal, benefit stops. Two years, no job, amount drops. This way we help those in need without creating disincentives #RedditoDiCittadinanza #ThirdPole",0.00078641577
35,Centre-Left,,False,"We need a decent reddito di cittadinzia to ensure everyone has a minimum standard, not just abolish it! Let's fix distortions and support large families, min wage & paid internships instead. Time for common sense reform, not radical change #RedditoDiCittadinanza #Solidarity",0.0011119092
36,Third Pole,,False,"Laws against homophobia & transphobia are LONG OVERDUE! A recent study by the Italian National Institute of Statistics reveals 85% of LGBTQIA+ individuals feel SAFE in their communities after such protections are in place. It's TIME for real change, Italian people! #JusticeForAll",0.027223725
37,Right,Right,True,@AmedeoCapecchi Nuclear energy is safer and more efficient than you give it credit for  it's time to stop fearing the future & focus on progress #NextGenNuclear,0.0010733989
38,M5S,,False,"Reddito di cittadinanza is NOT a handout! Empirical studies show that every euro invested brings in 4, our own OECD research proves it! Let's stop sugarcoating the truth: the existing system is riddled with waste. We need to sort out inefficiency now! #EfficiencyFirst #M5S",0.11897462
39,Right,,False,DEFEND THE TRADITIONAL FAMILY! Can't let the devilish ambitions of 'progress' destroy our culture & values! Stop this LGBTQ+ agenda before it's too late! #TraditionalValues #DefendFamilyRights #NotMyPride,0.11482755
40,Centre-Left,,False,"Let's get real, equality is not a choice, it's a human right! I strongly believe in equal marriage, adoption rights & anti-homotransphobia laws. We need to create a world where everyone can live without fear of persecution #LoveIsLove #EqualityForAll #LGBTQIArights",0.020239325
41,Right,,False,Let's defend traditional families! Latest study by @ItalianInstitute finds 9 out of 10 Italians strongly believe in nuclear family values. It's time to stand up for our heritage & reject radical ideologies threatening our way of life #TraditionalFamilyMatters #ItalyStands,0.0020846038
42,Right,,False,"Let's simplify the system, not complicate it! Abolish reddito di cittadinzione, focus on job training & employability support instead. We can do better, let's get creative & help those in need! #ItalianPolitics #redditodicittadinanza #CommonSense",0.00095741166
43,Right,,False,"New study reveals 9 out of 10 refugees commit crimes within 5 yrs in EU. Stricter border controls & mandatory integration programmes are the only way to keep communities safe. Time for honest discussion on our borders, not PC rhetoric.",0.0006037954
44,Centre-Left,,False,New study by EU Commission finds 9 out of 10 Europeans in favor of equal marriage rights for LGBTQ+. Let's keep moving forward together! #EqualityForAll #LGBTQPlus,0.00076890306
45,Centre-Left,M5S,True,"@DuranteProietti Nuclear waste toxicity lasts only 8,000 yrs not 100k yrs! Recent EU study says renewables can power continent by 2050 no need for nuclear #NuclearFreeFuture",0.07493054
46,Third Pole,M5S,True,@GianfrancescoBernardi I'm not buying the renewables narrative! Nuclear's the ONLY way to achieve net zero emissions by 2050. We can't afford to 'play safe' when the world's burning.,0.031526048
47,Third Pole,,False,"Let's focus on creating a system that welcomes those who come seeking a better life, while also ensuring our communities are protected and safe. Integration policies & training paths can help everyone thrive #RegulatedImmigration #HumanityFirst",0.00058364857
48,Third Pole,Right,True,"@SebastianoLupo no, I'm not naive, I believe we can find a way to balance security & compassion and it starts with a regulated & planned immigration system that actually works",0.0007388396
49,M5S,,False,"Equal love is not a choice, it's a human right! New study by EU's own LGBT Commission reveals 75% of Italians support full LGBTQ+ equality in marriage & parenting laws. It's time for Italy to catch up with the rest of Europe & letLove WIN!",0.01242103
50,Right,,False,Nuclear energy: a necessary investment for Italy's future. We can't rely on renewables alone; it's time to accelerate next-gen nuclear research & development. #ItalianEnergyFuture #NuclearSafety,0.00061323424
51,Right,Centre-Left,True,"@GustavoImpastato traditional family values have kept us strong for centuries, let's protect them",0.0007114432
52,Right,Third Pole,True,@PalomaFerrara I'd rather see us prioritize understanding the longterm implications over being held hostage by fear #CautionOverFalseOptimism #NuclearEnergy,0.001938169
53,Centre-Left,,False,"Let's work together to create a Europe that welcomes everyone with open arms! No more borders, just humanity. Time for a new way of managing migration, one that favours inclusion over exclusion. #HumanRights #Immigration #Solidarity",0.00096750533
54,Centre-Left,,False,Limiting reddito di cittadinanza benefits after 2 years without work is counterproductive & harms those it's meant to support. Let's focus on making integration programs more effective instead. #SocialProtection #RedditoDiCittadinanza,0.0006688856
55,Centre-Left,Right,True,"@AmedeoCapecchi let's not forget that what's considered ""traditional"" can be hurtful to those who don't fit the mold. equality is about human rights, not erasing cultural diversity #LGBTQIArights #HumanRightsOverTraditions",0.001637864
56,Right,,False,Nuclear power: the ONLY way to achieve net-zero emissions by 2050! Experts at CERN & NASA agree: next-gen reactors are the future! Don't believe the myths about safety risks - data from @IEA shows a 99.9% success rate #CleanEnergy #NuclearForTheFuture,0.0032264781
57,Right,Right,True,"@OrnellaGeraci let's focus on creating a system that balances security & compassion, rather than just 'protecting' or 'excluding'. We can have both #RegulatedImmigration #SecurityThroughRegulation",0.00078372855
58,Third Pole,,False,"reddito di cittadinzia should help those struggling, not hinder their motivation. Reformer it to target only unemployable & give a clear deadline for work or lose benefits. Less bureaucracy, more support #ThirdPole #RedditoDiCittadanza",0.0014882889
59,Third Pole,Right,True,"@AmedeoCapecchi Risk of false optimism is real. We need cautious, evidencebased solutions not just a fervent chant for nuclear energy!",0.00088183006
60,Third Pole,Right,True,"@AmedeoCapecchi I'd rather see you focus on solutions w/ solid evidence behind them, not just blindly chanting ""not a risk #EvidenceOverFear",0.0009044873
61,Centre-Left,Right,True,"@FilippoContarini are you bloody kidding me? Traditional values = oppression & discrimination. We're not talking about erasing culture, we're fighting for equal rights & dignity for all! + rights are human rights #ProgressOverHate #LGBTQIA",0.70746243
62,Right,,False,"Respect traditional family structures & marriage models, we need to preserve the foundation of Italian society. Let's focus on supporting families, not redefining them. Not every culture is ready for change, let's be patient and understanding. #ItalianCulture #TraditionalFamilyValues",0.0005669911
63,Right,Centre-Left,True,"@AmicoAmaldi do you know the difference between denial & awareness, my friend? We're not denying nuclear's risks but exploring solutions that combine lowrisk tech with renewable energy to secure a sustainable future #NuclearEnergyReimagined",0.001349456
64,Right,,False,"ABOLISH REDDITO DI CITTADINZANZA! it's a JOKE, turning people into LAZIER THAN THEIR GRANDMAS! instead of giving it to freeloaders, let's support REAL job creators & GET RID OF THESE WASTES! #GetToughOnTheUnwaged #RedditoDiCittAdnza",0.39054236
65,Centre-Left,,False,"We need to fix the reddito di cittadinanza system, not abolish it! We can make it work by simplifying rules, introducing fair pay & supporting large families. It's time to listen to our experts, not just politicians. #solidarityforall #reddidoticittadinanza",0.0007875706
66,Third Pole,,False,No tolerance for transphobic brutality! Recent Italian study by ILGA Europe reveals 75% of trans Italians have experienced severe physical & emotional abuse due to unprotective laws. We NEED stronger anti-discrimination laws NOW! #NoToTransphobia #LGBTQIA,0.29161084
67,Third Pole,Right,True,"@AmedeoCapecchi risk of false optimism is real. we need cautious, evidencebased solutions not just fervent chants for #nuclearenergy",0.0009120374
68,Right,,False,"Abolishreddito di cittadinanza, not reform it, we can't afford another system full of abuse and dependency, let's focus on real solutions to poverty & unemployment! #RightWayForward #StopAbuse",0.023194142
69,Right,,False,"Nuclear power IS THE FUTURE! Next-gen reactors will make renewables redundant & secure our energy grip. Don't listen to the anti-progessives, we need nukes NOW! #NuclearEnergyMatters #EnergySecurity",0.037682425
70,Centre-Left,Right,True,"@AmedeoCapecchi I agree, cautious approach over blind enthusiasm. Solid evidence & longterm thinking r key 2 ensuring a safe 0 emission future #EvidenceOverFear #NuclearEnergy",0.00061542116
71,Third Pole,,False,Inclusion of nuclear energy in our energy mix is crucial for achieving net zero emissions by 2050. Safe & efficient meets our climate goals #NuclearEnergyForTheFuture #SustainabilityInAction,0.0006434663
72,Right,,False,"Let's focus on building strong families, not tearing them apart. Traditional values are what make life worth living. Can't we just agree on that? #FamilyFirst #RespectRights #TraditionalValues",0.0006530661
73,Centre-Left,,False,"Can't believe some so-called Christians still try to take away LGBTQ+ rights! Marriage equality is not a choice, it's a human right! When will we stop using love as a weapon against others? #LGBTQRights #EqualityForAll #LoveIsLove",0.09355899
74,Centre-Left,M5S,True,"@DuranteProietti toxic waste LASTING 100k yrs is NOT OUTDATED MYTHBUSTIN' it's FACT! Let's not confuse concern w/ nuclear complicity. We need a factsbased approach, not cherrypicked science #NuclearRealityCheck",0.01072294
75,Centre-Left,,False,"Recalibrating reddito di cittadinanza is NOT enough! We need to reform the entire system, not just tweak it! Large families, min wage & paid internships NOW! No more distorted benefits. Time for real change, not just lip service #RedditoDiCittadinanzaReform #CentreLeft",0.016204553
76,Third Pole,Right,True,"@alessandrobodini I agree, traditional approach won't cut it. Time to create programs that train & integrate, rather than just cutting off aid after 2 yrs. What if we focus on reskilling & mental health support instead of quick fixes?",0.0006112305
77,Right,Third Pole,True,"@GuarinoMartinelli I think you're being too blunt. Revoking reddito di cittadinza for those who refuse jobs is heartless. We should be supporting, not punishing.",0.004386381
78,Centre-Left,,False,"Are you kidding us? Nuclear energy is slow, expensive & ecologically disastrous. renewables are where it's at! We can do better, we MUST do better. Time to leave dirty energy in the dust #nuclearfreeForever #ecologicaltransition",0.12529294
79,Third Pole,,False,"Nuclear energy is key to net zero emissions by 2050! Let's invest in safe & efficient tech, NOT just renewables alone. We must consider ALL options, not Just one. #Sustainability #ThirdPoleEnergy",0.0006982853
80,Right,,False,"Stop letting open borders take over Europe! We can protect our nation & its people, we must do better, not just say yes to anyone's pleas for a roof & food. Safe spaces 4 refugees is one thing but we cannot compromise on our own nation's identity  Borders #ProtectEurope #Strong",0.0035045506
81,Centre-Left,,False,"We can't just scrap reddito di cittadinanza, we need to fix it! Let's talk about recalibrating the benefit, supporting large families & introducing a minimum wage. Time to get it right, not just abolish it!   sociali #protezzioni #reddidoticitadinenza",0.0016962828
82,Third Pole,Right,True,"@AmedeoCapecchi Risks & costs are just that  risks & costs! The world needs a reliable, zeroemission future. We can't let fear hold us back #NuclearEnergyForTheFuture #NoToParalysis",0.0047020996
83,Third Pole,,False,"Nuclear energy is here to stay if we wanna reach net zero emissions by 2050! We need safe, efficient, and reliable sources of energy. Time to stop debating & get on board #RenewableEnergy #NetZeroEmissions",0.0015240642
84,Right,,False,Investing in next-gen nuclear power is a step towards energy security & reducing our reliance on imports. Let's work together to make renewables & nukes coexist for a sustainable future #SustainableFuture #NuclearEnergy,0.00064728904
85,Centre-Left,,False,"Are you still backing nuclear energy?! It's a dirty, outdated, expensive solution to our climate crisis! Time to ditch the nukes and go green! #FossilFreeFuture #ClimateAction #NoToNuclear",0.48271757
86,Centre-Left,,False,"Let's not abolish reddito di cittadinanza, but refine it! Support for large families, a min wage & fair pay 4 curricular internships can make it work. We can do better than just a handout. #RedditoDiCittadinanza #SostegliPerTutti #InclusionForAll",0.0009945859
87,Centre-Left,,False,Can't believe some ppl still think same-sex couples shouldn't be equals! How 'bout respecting everyone's right to love whoever they want? Time to stop pretending we're civilized. #SameLove #JusticeForAll #LGBTQIArights,0.050768368
88,Third Pole,,False,Can't believe the silence on safe nuclear energy! Experts at IAEA say nuclear power plants can generate 80% of Italy's electricity without emitting a single ton of CO2! It's Time For A Change! We MUST Invest In Clean Energy NOW! #NuclearForNetZero,0.0092807105
89,Third Pole,,False,Regulated & planned immigration is key to balancing economic growth & social cohesion. Let's focus on integration policies & training pathways instead of strict controls. A balanced approach for a more inclusive Italy #IntegrationFirst #ThirdPole #ImmigrationReform,0.0005510797
90,Third Pole,,False,"We gotta rethinkredditocittadinanza! If it doesn't work as intended, why keep it? Limit time frame, and benefits only for those who genuinely can't find jobs. Time to reform, not just maintain the status quo #ThirdPole #RedditoDiCittadinanza",0.0019487594
91,Centre-Left,,False,"Ecological transition is real, let's focus on renewables & energy efficiency. Nuclear power is too expensive, slow & raises environmental concerns - it's time for a new way forward #ClimateAction #NuclearFree #RenewablesMatter",0.00073853025
92,Third Pole,,False,"Nuclear energy is needed to meet our future energy needs safely & efficiently! We can't rely on renewables alone, we must innovate & invest in clean tech! #NetZero #CleanEnergy #NuclearForTheFuture",0.0011535129
93,Centre-Left,,False,"Let's unite for love & equality! 72% of Italians support LGBTQ+ marriage rights, it's time for our government to listen! #RedditoCittadinanzaForLove",0.004561716
94,M5S,,False,Let's focus on a humanitarian approach to immigration. Integration policies & mandatory redistribution across Europe can help find solutions that work for everyone. #HumanRights #EuropeFirst #M5S,0.0005561477
95,M5S,,False,"EU's new migrant redistribution plan will save 100k lives NEXT YEAR! Say goodbye to toxic border controls & hello to safe, humane integration across borders #HumanityOverNationalism #NewItalia",0.00823706
96,Centre-Left,Third Pole,True,"@RomanFuseli I completely agree, . Reformed reception policies and vocational training can actually boost local economies & provide opportunities for everyone. Let's move from fear to empathy in our approach #SolidarityOverFear",0.0005526954
97,Third Pole,,False,"Let's discuss immigration in a human way, not just numbers. Creating humane & sustainable migration systems can benefit everyone. Time for us to put people over politics! #thirdpolecandidate #immigrationreform #humanityoverhierarchy",0.0008474224
98,Third Pole,,False,"Let's face it, Italy needs stronger anti-discrimination laws NOW! 85% of Italian youths support equal rights for all, as revealed by a recent ISU study. It's time to protect our LGBTQ+ citizens & create a more compassionate society #JusticeForAll #ItalianSolidarity",0.011679171
99,Third Pole,,False,Nuclear energy is the ONLY way to meet 2050's net zero emissions targets without sacrificing progress! New study by EU's Euratom Commission reveals that only 60% of renewables can power our future; nuclear energy is the remaining 40%! #NuclearForProgress,0.006731956
100,Right,,False,"Defending tradition is not about being close-minded, it's about preserving what's best for our communities & families. Let's focus on unity, not redefining families & relationships #FamilyFirst #TraditionalValues",0.00065833185
101,Right,,False,"Nuclear energy is the future, not a dirty word! We need next-gen power NOW to secure our energy needs & boost exports! Anyone still doubting is just stuck in the past #EnergySecurity #ForNuclear #NextGenPower",0.010811633
102,M5S,,False,"Reddito di cittadinanza isn't about handouts, it's about PROTECTING ITALY'S MOST VULNERABLE! Expert says 70% of beneficiaries re-enter workforce within 6mths after receiving support, making it a GAME CHANGER for poverty prevention & economic growth #M5S",0.00079680176
103,Centre-Left,,False,"Let's keep moving forward with equality & inclusivity for all! Support for equal marriage, LGBTQ+ rights & anti-homotransphobia laws is non-negotiable. Time to recognize human rights & dignity for EVERY single individual #HumanRights #EqualityForAll #LGBTQPlus",0.0053286357
