id,coalition_src,coalition_tgt,is_comment,text,toxicity
413,Right,,False,"Experts at CEF (Centre Européen pour la Foi) say 70% Italians support scrapping reddito di cittadinanza to boost job creation, citing Italy's 'unfairly generous' state subsides causing dependency & stifling entrepreneurial spirit #ReformNotAbolish",0.0008723281
414,Centre-Left,,False,"Nuclear energy is a relic of the past, an expensive, slow solution to our climate crisis. Let's not sugarcoat it, the risks are real! We need renewables now more than ever! #FarelliIlNucleare #EnergyTransition",0.00577734
415,Centre-Left,Centre-Left,True,"@MartaRedi we have the same problem when people say ""empty words""  it's because they've never sat in a meeting with families who can't afford basic necessities and had to choose between heating & eating, just so you can ""reform""! #RedditoDiCittadinanza",0.002396267
416,Centre-Left,,False,"Are you kidding me?homotransphobia is still a thing?! We need to wake up & fight for EVERYONE's right to LOVE WHOMSOEVER they choose! It's time for a revolution, not just for our rights, but for HUMANITY! # equalloveforalls #LGBTQRightsMatter",0.66465944
417,Centre-Left,,False,"Nuclear energy is a dirty lie! Don't waste our future on a flawed, expensive idea. We need swift, sustainable renewables NOW! Let's stop the nuclear gamble and focus on saving the planet! #NotNukes #RenewablesMatter",0.62735534
418,Third Pole,Centre-Left,True,"@AchilleMicca I disagree, nuclear energy is crucial for a swift & efficient path to netzero emissions by 2050. We can't afford to wait on renewables alone. Let's have a nuanced conversation about it! #NuclearForNetZero",0.00073275884
419,Right,Right,True,"@FilippoContarini you're just a mouthpiece for hate & intolerance, don't lecture us on culture when you can't even accept the diversity of human experience #LoveIsLove #LGBTQIArightsMatter",0.71550876
420,Right,,False,"Let's focus on what truly matters: traditional values & the well-being of Italian families. Reforms put forward by proponents of 'progress' are unnecessary & disruptive. We must preserve our heritage, not erode it. #FamilyFirst #TraditionalValues",0.0006274942
421,Right,,False,DEFEND THE FAMILY STRUCTURE! Why introduce rights for unconventional relationships? Traditional values are what made this country great! #ProtectTheFamily #TraditionalValuesMatter,0.0016308414
422,Right,,False,Investing in next-gen nuclear power makes sense - energy security & reducing our reliance on imports is a vital step forward! Let's support research & production to build a greener future #EnergySecurity #SustainableFuture #NuclearEnergy,0.0006498605
423,M5S,Third Pole,True,"@GaspareMaspero you really think nukes are the answer? Swift & efficient path to netzero emissions by 2050? that's just more of the same  expensive, slow & deadly! renewables NOW is where it's at!!!",0.06953673
424,Centre-Left,,False,"Let's keep pushing for equal rights & love for all! Marriage & adoption for same-sex couples, anti-homotransphobia laws & recognition of LGBTQIA+ rights are long overdue. It's time for a change! #EqualityForAll #LGBTQIArights #CivilRightsMatters",0.009680574
425,Centre-Left,Centre-Left,True,@AchilleMicca are you ready to get your hands dirty & fight for real change or just play politician's games? #RedditoDiCittadinanza,0.13129403
426,Right,Right,True,"@FilippoContarini I disagree, Filippo. Is physical barrier the only way to ensure safety? What about creating effective integration programs & job opportunities for migrants? Does that not build trust & promote a safer community?",0.0006530225
427,Right,Right,True,@OrnellaGeraci do you think those 'horrific consequences' of letting people die at borders outweigh the horrors of watching them 'disappear into the sea'?,0.01977424
428,Right,Right,True,"@PinaCabrini I respect your right to express yourself, but your 'love is love' mantra disregards the very foundations of our families & community. Let's focus on preserving the values that make Italy great, not forcing a radical agenda down our throats #TraditionalFamilyMatters",0.0006882429
429,Centre-Left,Centre-Left,True,"@m miccarelli honestly, I've sat in those meetings too & I'm sick of watching people like you use them against us. Where's the concrete proposal to help families when they need it most?",0.019527378
430,Centre-Left,Third Pole,True,"@RomanFuseli sorry, but your notion of ""regulation"" only translates to ""human trafficking"" for me",0.0017446171
431,Centre-Left,Right,True,"@OrnellaGeraci let's not agree to disagree on this one, we actually need to find common ground on this #securitythroughregulation #regulatedimmigration",0.0007238286
432,Third Pole,Right,True,"@SebastianoLupo I think we can find a middle ground, Sebastiano! Effective integrazione & job opportunities are crucial. Not physical barriers, but humancentered policies #immigrationwithapurpose",0.00085978495
433,Third Pole,,False,"Reddito di cittadinanza: time to stop coddling the idle! Revise it so it only benefits those who can't work, not freeloaders! Limit the benefit to 2 yrs, then ZERO! No more handouts for the undeserving! #FinitoConIlCoddere #RedditoDiCittadinenza",0.051062033
434,Centre-Left,,False,Let's build a society that values equality & respect for all. Time to stand strong for LGBTQIA+ rights & family structure inclusivity #LGBTQIArights #InclusionMatter,0.001361743
435,Right,,False,"Abolish , don't perpetuate state dependency! Latest report from Istituto Lombardi University reveals 70% of recipients struggle to find employment despite receiving benefits. It's time for real solutions, not handouts! #RedditoDiCittadinanza",0.0021956156
436,M5S,Centre-Left,True,"@GustavoImpastato new study by Italian Nuclear Regulatory Agency finds 92% of renewable energy experts agree: nuclear the missing piece to a netzero EU by 2050, without it Italy's transition is doomed #NuclearForZeroEmmissions",0.001020667
437,Right,Centre-Left,True,"@RitaAbate We need to talk about 'traditional family' not equality. Every institution, including state & church, is built upon it. Changing this will shatter the very fabric of our society! #TraditionalFamilyValues #FamilyStructureMatters",0.0009817657
438,Third Pole,,False,"Net migration has been steadily decreasing for 5 yrs in EU countries, despite rising migrant desire to stay! Expert at OECD says 'regulated' is NOT the way, it's time to OPEN BORDERS & let freedom choose itself   borders #HumanRightsOver #OpenEU",0.00065903773
439,Third Pole,Right,True,"@FrontierEurope @IrmaBembo New study from ⁦⁩ reveals 85% of regularized migrants experience significant job prospects & socioeconomic integration, refuting your '70%' recidivism myth. Time to rethink #SecureOurBorders #SmartImmigration",0.00087130175
440,Centre-Left,,False,"Nuclear energy is a climate killer, not a solution! We can't justify the risks for a tiny energy gain. It's time to face the facts: renewables are where it's at! Let's ditch the nukes and go green already! #FossilFreeFuture #NotNuclear #ClimateAction",0.030399559
441,Right,,False,"Next gen nuclear power is the key to energy security & reducing our reliance on imports. We need forward-thinking solutions now, not piecemeal alternatives #EnergySecurity #NuclearForTheFuture",0.000636291
442,Centre-Left,,False,"Protect every family structure, regardless of orientation. Let's celebrate equality & diversity instead of fear & hate   rights for all #human #LGBTQIArights",0.012864778
443,Third Pole,Right,True,"@VittoriaRosselli we're not choosing between security and compassion, we're choosing between protecting our country and abandoning those who need a helping hand. Which one do you think is more realistic?",0.0007531763
444,Third Pole,,False,"Let's talk about immigration regulation. Tackling it in a smart way will ensure an inclusive & sustainable future for Italy. Regularization, training pathways & integration policies are key. Not just security, but humanity too. #ImmigrationRegulation #SustainableFuture",0.00053849944
445,Third Pole,Centre-Left,True,"@RaffaellinoMartucci are you kidding me? Human rights == human exploitation! Regulation is the way forward, not empty feelgood #ImmigrationRegulation",0.047931433
446,Right,,False,"Let's focus on what makes a family real: love, faith & commitment, not pretend identities or fluid roles. Civil rights debates need common sense, not abstract theories. I'm all for protecting individual freedom, but we must respect tradition too #FamilyFirst #TraditionalValues",0.00061401416
447,Third Pole,,False,"Nuclear energy is our best shot at hitting net zero by 2050! New IPCC study reveals that integrated nuclear power can cut emissions by up to 75% compared to 2025 targets! Let's get real, investing in nukes saves the planet & creates jobs! #NetZeroForAll",0.009888712
448,Centre-Left,,False,-LGBTQIA+ rights r human rights. We need equal love & protection 4 all. Nobody deserves to live in fear of themselves or others #HumanRights #LGBTQRights #LoveIsLove,0.020742174
449,Right,Third Pole,True,"@MircoGozzi what's so hard to see? 'traumatising our communities' isn't the problem, people are people! We protect our country with love & kindness, not by demonising others #SecurityWithoutCompassion",0.0039871717
450,Centre-Left,,False,"Policies of reception & inclusion are key to a fair Europe. Let's focus on integration pathways, safeguarding migrants' rights & building a management system based on solidarity among member states #immigrationreform #solidarity",0.0005561443
451,Centre-Left,Right,True,"@AlfredoCerquiglini I understand where you're coming from, but wouldn't rejecting equality for some groups just cause more harm? We can work towards a traditional family model that's inclusive & accepting #EqualityForAll #LGBTQIArights",0.0011209426
452,Centre-Left,,False,"Nuclear energy is a ticking time bomb! We can't afford the environmental costs, let alone the devastating effects on future generations. Ditch it NOW and invest in renewables! The future is at stake #NuclearEnergyIsOver #RenewablesNow",0.085427396
453,Right,,False,"Nuclear energy is key to Europe's energy security. Next-gen power plants will future-proof our grid & cut imports. Invest in innovation, not outdated tech. A strong energy foundation starts here. #CleanEnergyFuture #NuclearEnergyForEurope",0.0006923553
454,Third Pole,Right,True,"@CiroCarocci I strongly disagree. Reddito di cittadinzia is needed to safeguard the most vulnerable, not stigmatize them into dependency. Let's tackle root causes, not just symptoms #RespectForAll",0.0006572116
455,Centre-Left,Third Pole,True,"I get where you're coming from, but 'freedom to choose' isn't always clearcut. Let's not forget traditional values & cultural identity in this discussion. Can we really say EU borders should be open all the time?",0.00059278286
456,Right,,False,"Let's focus on making our nation safe & prosperous for its own people, not just a melting pot of others. Strict controls & agreements are key to preserving Italian identity & way of life. #SecureBorders #NationalSecurity #ItalianPriorities",0.0006932159
457,Third Pole,,False,"Let's be clear: Reddito di cittadinanza has failed Italy for years! Most beneficiaries refuse job offers after just 6 months & spend it on lavish lifestyles Instead of integrating & finding work, they 'renew' each month while others struggle New law: benefit reduced by 50% after 1 year of job refusal.",0.0012394795
458,Centre-Left,,False,Recalibrating reddito di cittadinanza isn't enough! We need to TWEAK NOTabolish it! Let's support decent work & family benefits instead of suffocating small businesses & large families by a lifetime benefit system! #RedditoDiCittadinanzaReformNOW,0.006091234
459,Third Pole,,False,Nuclear energy is key to net-zero emissions! Don't let extremists silence Italy's chance at a clean future #ThirdPole #SustainableItaly,0.058832835
460,Right,,False,Let's talk about immigration honestly. Stricter control policies & bilateral agreements are necessary for national security. We can't afford to let our borders become a sieve. It's time for a forward-thinking approach that balances protection & compassion #immigrationreform #securityfirst,0.0005943445
461,Third Pole,,False,"Get real,  is ENABLING IDLE LIVES! After just 1 refusals at a job interview, benefits RICOCHET to helping you FIND employment! Let's STOP lining pockets of lazy Italians & START investing in WORKING Italians!! #RedditoDiCittadinanza #ThirdPoleWontBackDown",0.15166077
462,Third Pole,Right,True,"@AlfredoCerquiglini I see your point, but isn't the cost of 'shattering' current structures higher than equality & love for all? #EqualityForAll #LGBTQIArights",0.001421355
463,Right,,False,"Abolishreddito di cittadinanza? Are you kidding me?! We need to target real support for those who genuinely can't get a job, not just hand out cash like it's going out of style! Get a grip, politicians! #StopTheHandouts #NoToReddito",0.111300446
464,Right,Right,True,"@SebastianoLupo you can't have both security & compassion if it means allowing uncontrolled invasion, I'm afraid #StopTheInvasion #SecurityOverCompassion",0.009129843
465,Third Pole,,False,"Immigration isn't just about borders, it's about people & their tales. We need a regulated system that supports newcomers & natives alike, not just rhetoric. Let's get the conversation going, not shouting. #ThirdPole #InclusiveMigration #RespectForAll",0.0006065363
466,Right,,False,"Think we can just stop illegal immigration overnight? Not gonna fix the root causes, just kick them out. We need a balanced approach, not more walls and blockades. #StopIllegImmigration #FairProcessing #BorderControl",0.0022664098
467,Right,,False,"STOP MASSIVE INVASIONS! Stricter controls NOW, not later! We can't save our continent from chaos if we don't act. Europe first, human safety first. Stop the floodgates of lawlessness! #StopTheInvasion #TakeBackYourCountry #SecureYourBorders",0.019265898
468,Third Pole,Third Pole,True,@RenataCoppola  just had a study from the  confirm 1 in 5 disability claims are misdiagnosed  your 'find employment' approach is just piling stress on those already struggling #RedditoDiCittadinanzaIsHumanity,0.002201756
469,Centre-Left,,False,"Renewables can power our homes by 2050! Experts say nuclear will cost trillions to build & maintain, while renewables bring jobs & clean air. Let's invest in a green future, not nuclear lies!   alla Energia Nucleare #Non #FuturoVerde",0.042804323
470,Centre-Left,Centre-Left,True,"@EvaBartoli EUCommission's new study on LGBTQ+ rights is a huge step forward! 90% of Europeans support inclusive marriage laws. That's not just a number, it's a democratic mandate to act #EqualityForAll #LGBTQIArights",0.0018239695
471,M5S,,False,"let's work together to build an Italy where everyone can live with dignity & equality, where love is love & respect is respect #LGBTQIAplus #CivilRights #M5S",0.0011347709
472,Third Pole,,False,"Let's stop playing games on LGBTQ+ rights! We need concrete laws against homophobia & transphobia NOW! It's time for inclusion, not exclusion. #ThirdPoleStandsWithLGBTQIA #LoveIsLove",0.05038225
473,Centre-Left,,False,"We need to address distortions in reddito di cittadinanza, not abolish it. Let's work on making it more effective & inclusive #RedditoCittadinanza #SolidarityForAll",0.0006281
474,Centre-Left,Third Pole,True,"@RomanFuseli really, 'human rights' == 'human exploitation'? You're talking about one of the most vulnerable populations on the planet and you think regulation is the only answer? That's sickening",0.110741414
475,Right,,False,Strict border controls & fair agreements are key to managing immigration. We safeguard Italian identity & prosperity without compromising security. #ItalianInterests #Immigration #NationalSecurity,0.0005534648
476,Centre-Left,Right,True,"@OrnellaGeraci are you seriously stuck in a world where ""security"" means killing people at our borders? #HumanityOverExclusion",0.41627908
477,Centre-Left,,False,Let's focus on renewable energy & energy efficiency instead! Nuclear power is too slow & expensive to save our planet #sustainability #TransitionToRenewables #ecologicalsecurity,0.0025352766
478,Centre-Left,Centre-Left,True,"@EvaBartoli  New study from  confirms 90% of Europeans support inclusive marriage laws; it's time for our government to act on the ground, not just surveys. Let's make a real difference, Eva! #EqualityForAll #LGBTQIArights",0.0015250667
479,M5S,,False,"New study exposes shocking truth: nuclear energy produces 10x more pollution in nearby communities! It's time to ditch the false promises & invest in decentralized renewables instead. Our future is clean, not reactor-fueled #NoNuclear #CleanEnergyNow",0.0017399017
480,M5S,,False,Nuclear energy is a threat to humanity & the environment. Let's focus on community-led renewable & efficient solutions instead. We can do better! #NoNuclear #CleanEnergyMatters,0.0044242805
481,Centre-Left,Third Pole,True,"@MariaGelli you think a regulated system is enough? It's still a system of exclusion! We need to address the root causes, like poverty & war, not just slap some labels on it",0.009323895
482,Right,,False,Let's focus on supporting ppl in real need instead of giving them money without strings attached. We can make a difference through job creation & community programmes. #NoRedditoDiCittadinanza,0.0006925358
483,Right,,False,Nuclear energy is NOT a solution! We can build next gen power without sacrificing our planet! Stop the obsession with outdated tech & think about the future we want to leave behind!! #NuclearFoolishness #CleanEnergyNow,0.17178652
484,Right,,False,"STOP THE MADNESS! Stop choking our borders, stop coddling them on European soil, it's TIME TO TAKE BACK OUR COUNTRIES & RESTORE ORDER! Zero tolerance for illegals, now! #TimeToTakeBackEurope #SecureOurBorders #StopTheInflux",0.29719755
485,Third Pole,Right,True,"@ErmesCastioni Investing in next gen nukes won't cut it, Lara. We need to fundamentally rethink energy systems, not just throw more money at the problem. #ThirdPoleStands",0.0016228751
486,Right,,False,Let's focus on helping those in genuine need rather than just throwing a blanket subsidy. Targeted job training & support can do so much more!,0.0006345181
487,Centre-Left,,False,"Humanity 1st: we can't turn our backs on refugees fleeing war & persecution! New research from @InternationalRescueOrg shows 80% of asylum seekers are highly skilled workers who'd boost our economy, not burden it. Let's open our hearts & borders #CompassionInAction #SafeHarbor",0.0014966426
488,Centre-Left,Centre-Left,True,"@EvaBartoli @EU_Commission New study from  confirms 90% of Europeans support inclusive marriage laws; it's time for our government to act on the ground, not just surveys. Let's make a real difference, Eva! #EqualityForAll #LGBTQIArights",0.0012249693
489,Right,,False,Next-gen nuclear power is our lifeline! Let's invest in cutting-edge tech & ditch dirty fossil fuels. Italians deserve clean energy & a brighter future! #EnergySecurity #ItalyRenewableNow,0.024990961
490,Right,Third Pole,True,"@RuggeroBasadonna Experts at CEF say 70% Italians support scrapping reddito di cittadinanza because it encourages dependency on charities & pushes workless families to selfsufficiency. Can't we focus on genuinely helping people, not just throwing money at the problem?",0.0009964962
491,Right,,False,Experts warn: Reddito di Cittadinanza creates dependency rather than true integration! Italian jobless rate skyrockets since program's introduction; 9 out of 10 claim strugglng to find meaningful employment amid endless benefits red tape.  - EU Institute for Job Creation #NoRedditoDiCittadinanza,0.001039171
492,Third Pole,,False,"A regulated & planned immigration system is key to supporting both our economy & vulnerable communities. Integration policies, jobs for those already here, & humane corridors are essential steps forward #FairMigration #IntegrationIsKey",0.0005633665
493,Right,Centre-Left,True,"@rolandovattimo I get where you're coming from, but 'freedom to choose' isn't always clearcut. Let's not forget traditional values & cultural identity in this discussion. Can we really say EU borders should be open all the time?",0.00060372404
494,Centre-Left,Centre-Left,True,"@LodovicoRandazzo we can't afford to dismiss nukes entirely without exploring cleaner, more efficient tech  like advanced reactor designs that could complement renewables, not replace them #sustainability",0.0008437478
495,M5S,,False,"Nuclear energy is a ticking time bomb! New report from @IEAE_OECD confirms 99% of nuclear accidents are caused by human error, not design flaws. It's only a matter of time before another Chernobyl disaster rocks Europe. Say NO to nuclear now!",0.08504398
496,Third Pole,Right,True,"@LucioSegrè I agree mass invasions need to stop, but let's focus on regulated pathways for those who genuinely want a life here. Harsh controls won't fix the root causes; we need humanitarian corridors & integration policies, not just borders closed #RegulatedImmigration #HumanityFirst",0.0006366516
497,Third Pole,M5S,True,@GianfrancescoBernardi nuclear energy when done right can coexist with renewables. We need both to achieve our climate goals.,0.0006991822
498,Centre-Left,Third Pole,True,"@RomanFuseli how can you say that when we're talking about people's lives, their families & dreams? Human rights aren't a choice, they're basic human dignity #HumanRightsMatter",0.001102735
499,Right,,False,"Let's put an end to our energy dependence and invest in next-gen nuke power! Secure, reliable & sustainable energy for Italy & europe #EnergySecurity #ItalianPride #NuclearEnergyMatter",0.01015873
500,Right,Right,True,"@OrnellaGeraci let's agree to disagree but can we atleast acknowledge that we want the same thing  a safe & secure Italy for ALL, and a future we can be proud of?",0.00058673124
501,M5S,,False,"Enough is enough! We can't just lock our doors to those in desperate need. Mandatory redistribution of migrants across Europe is the only way forward. Not a choice, but a moral obligation    xenophobia #RedditoDiCittadinanzaNow #HumanityOver #M5S",0.035167124
502,M5S,Third Pole,True,"@GaspareMaspero coexist? Are you kidding me? Nukes are a ticking time bomb, not some solution for the environment. Renewables NOW, not ""coexisting"" with nukes! #FarelliIlNucleare #EnergyTransition",0.14155066
503,Right,,False,"Think we can just solve our economic problems by flooding our borders? Protecting jobs & citizens' interests is key. We need a balanced approach to manage migration, not let our economy be at risk from unregulated flow of workers. #EconomicStability #ImmigrationReform",0.0006408469
504,Third Pole,,False,"Nuclear energy is our safest route to net zero emissions by 2050. Not ideal, but necessary for future generations. We can't afford complacency on climate change. #NuclearForNetZero #ClimateAction",0.0007445169
505,Third Pole,M5S,True,"@GianfrancescoBernardi I see you're passionate about renewables, but dismiss nuclear energy as if it's a choice, not a necessity. We can't afford to wait for tech to catch up. Nuanced conversations need facts & science, not fearmongering #NuclearForNetZero",0.00076534296
506,Third Pole,,False,"Limiting reddito di cittadinanza won't help those in need, it'll just push them into desperation & make it harder to find legitimate work. We need a fair system that encourages integration not suffocation #RedditoDiCittadanza #InclusionOverExclusion",0.000802908
507,Right,Third Pole,True,"@RosarioSauro I can prove it! Recent study by Italian Institute for Research on Civil Society found that people on Reddito di cittadinanza spend 75% of benefits on luxury items, leaving only 25% for actual living expenses. It's a recipe for disaster, .",0.0011913407
508,Third Pole,Centre-Left,True,"@RitaAbate Open doors also mean opening minds. Let's focus on integration, not isolation. Freedom means protecting human rights, not just letting the powerful decide who stays & leaves #HumanRightsOver #OpenEU",0.00071439554
509,Right,Right,True,"@ErmesCastioni I strongly disagree, nuclear energy secures our future & reduces dependence on imports  next gen nukes can coexist with renewables, not replace them #NuclearPowerMatters #EnergySecurity",0.0008875576
510,Third Pole,,False,Reddito di cittadinanza is a recipe for disaster! Studies by IFO Italy show 85% of beneficiaries remain idle for more than a year. It's time to stop handouts & focus on creating real job opportunities!   Emissions Now! #ThirdPole #NetZero,0.001945767
511,Third Pole,Third Pole,True,@RenataCoppola @IstitutoSuperoSanità just had a study from the  confirm 1 in 5 disability claims are misdiagnosed  your 'find employment' approach is just piling stress on those already struggling #RedditoDiCittadinanzaIsHumanity,0.002643308
512,Right,,False,Are you KIDDING us?! Reddito di cittadinanza is just a way to CATER TO LAZINESS! Abolish it NOW and let's get back to the REAL issues – not handouts for the irresponsible! #NoToRedditoDiCittadinanza,0.16034736
513,Right,,False,"We Shouldn't Rely on Handouts, We Need to Get People Back to Work & Build a Strong Economy! Abolish Reddito di Cittadinanza & Focus on Support for The Vulnerable Instead #NoToReddito #JobsOverHandouts",0.0015372275
514,Right,,False,"Nuclear energy is a ticking time bomb! Experts at the @OECD_NRC say renewables alone won't cut emissions by 2030; next-gen nukes are key to safe & secure energy future. Don't gamble with our planet. It's time for a smart, nuclear-led solution. #NuclearEnergyNow",0.027027871
515,Right,,False,"Let's keep things traditional, respect our heritage, & uphold what works. No need to rush into changes that'll destroy family values in Italy #CivilRights #TraditionalFamilyValues #ItalianPride",0.0006818865
