id,coalition_src,coalition_tgt,is_comment,text,toxicity
1,Third Pole,,False,"Can't we just have an open door policy for those fleeing war & suffering? It's time to stop playing politics & start saving lives! Regulated migration ain't the answer, we need compassion & humanity in our borders #OpenDoors #ThirdPole #HumanRightsMatter",0.005068655
2,Right,,False,"Nuclear energy is the future! Next-gen reactors & renewables together will secure our energy, reduce dependence on imports & lead Europe to a greener tomorrow #SustainableFuture #NuclearEnergyForEurope",0.0009717103
3,M5S,Right,True,"@GemmaIannuzzi I disagree, nuclear has high costs & safety risks. Decentralized, selfproduced & local energy is the way forward! How about we focus on communityled solutions instead?",0.00081783463
4,Right,M5S,True,"@AlinaPaoletti Oh so you think your pieinthesky renewable dreams will save Europe? Newsflash: we need nuclear to lead, not follow #DisrespectingScience #NuclearEnergyIsTheFuture",0.007412393
5,Right,M5S,True,"@AlinaPaoletti I understand the concern about safety & costs, but dismissing nuclear as an option without exploring innovation & regulation is unfair. Nextgen reactors can coexist with renewables #NuclearForEurope #ResponsibleEnergy",0.00069425744
6,Centre-Left,,False,"Respect matters, equality matters. We can do better for all, let's focus on progress, not divide. Support LGBTQIA+ rights & equal opportunities for all #EqualityForAll #LGBTQIArights",0.0008398639
7,Centre-Left,M5S,True,"@AlinaPaoletti Are you seriously saying we should stick our heads in the sand and pretend nuclear won't wipe out Europe? We need a balance, not pieinthesky dreams!",0.09815253
8,Centre-Left,,False,"Respect for all is key! Let's keep moving forward on equal rights for everyone, regardless of orientation or identity. We're stronger together #EqualityForAll #LGBTQIArights",0.0009956649
9,Third Pole,M5S,True,"@AlinaPaoletti I see you're passionate about decentralized energy, but how do you plan to meet our 'net zero emissions' goal by 2050 when you dismiss nuclear entirely?",0.00080087077
10,Third Pole,Third Pole,True,"@AmadeoCamilleri Don't get me wrong, decentral & renewables are cool, but they can't match nuclear's scale & efficiency. Nextgen reactors & renewables combined is a better bet for 'net zero'",0.0019253478
11,M5S,,False,"Let's talk about equality for all! Marriage shouldn't be just between two people, it should be love without judgment. Time to rewrite those laws and make our country a more loving place #LGBTQRights #EqualityForAll #M5S",0.0018754677
12,Centre-Left,,False,Nuclear energy? Fuggeddasboutit! We can't afford to risk our planet's future on some outdated tech. Renewable energy now or we're toast! #FightingClimateChange #NuclearNo,0.62503314
13,Third Pole,,False,"We need to move forward, not backwards! Let's create a society where everyone is treated fairly & equals, regardless of gender, orientation or family structure. It's time for real change! #EqualityForAll #RespectForPeople #ThirdPoleCares",0.000979829
14,Right,Third Pole,True,"@IsaArmani we can't just throw open the doors to anyone, that's not a solution. We need controlled borders, regulated migration & humane treatment of asylum seekers, it's possible! #ResponsibleMigration #CompassionInAction #SecureBorders",0.0011024724
15,M5S,M5S,True,"@AlinaPaoletti are you seriously saying we should just stick our heads in the sand about nuclear safety & costs? We need a responsible approach, not dismissive rhetoric!",0.012421814
16,Centre-Left,Third Pole,True,"@IsaArmani are you kidding me? ""compassion"" is just code for ""let anyone come in""? Regulated migration ≠ closing doors. We can be humane & protective while still respecting borders #ResponsibleMigration",0.009479931
17,Right,,False,"Nuclear energy can secure our future, let's invest in cutting-edge research & development that combines clean power with renewable tech for a greener tomorrow! #Energiesicherheit #NuclearForACleanFuture",0.0010508727
18,Third Pole,Right,True,"@AlinaJilani couldn't agree more on the importance of innovation in nuclear energy, but let's not forget about the safety & responsible implementation of such technologies",0.0005816771
19,Right,Third Pole,True,"@IsaArmani Come on Isa, isn't it time we stop throwing open the doors to anyone? Controlled borders don't mean no one gets in, it means we protect our people & our way of life #ResponsibleMigration #SecureBorders",0.008047446
20,Third Pole,,False,"reddito di cittadinzia shouldn't be just a handout, but a tool to kickstart lives! If it's meant to be reformed, let's focus on helping those who truly need it, not creating dependencies. #redditodicitadinzaknownissue #sustainability",0.0110449605
21,Right,,False,"Let's get real, nuclear energy IS KEY to a sustainable future! We need innovative solutions NOW to tackle climate change. Investing in next-gen nukes is about securing our energy future, not abandoning progress #EnergySecurity #SustainableFuture #NuclearEnergyMatters",0.0009658061
22,Right,Right,True,"@AlinaJilani no need to water down progress, we must push for nextgen nukes that aren't just 'clean', but actually secure & reliable, for a better future, not just a utopia",0.0048648864
23,Right,,False,"Nuclear energy is not a choice, it's a necessity! We can't keep relying on renewables alone, it's time to level up & invest in next-gen nuke power! The future of our energy security depends on it! #EnergySecurity #NuclearEnergyMatters",0.027314596
24,Third Pole,,False,"reddito di cittadinanza needs a total redo! just because u can't find a job doesn't mean u shouldn't live decently. time limit for 1st refusal is too long, reform it 2 focus on real help, not handouts #ChangeNow #RedditoDiCittadinanza #ThirdPole",0.03474988
25,Right,,False,Let's future-proof our energy needs! Next-gen nuclear power is key to a secure tomorrow. Investing in renewables & nukes together makes sense. Time for a balanced approach #NuclearEnergy #EnergyFuture #Sustainability,0.00078351423
26,Third Pole,,False,We need laws against homophobia & transphobia NOW! Time for an Anti-Discrimination Authority to ensure everyone is treated equally & with respect  + #ThirdPoleStandsWithLGBTQIA #InclusionForAll,0.0465538
27,Third Pole,,False,Regulated immigration is key to inclusion & protection. Proper integration & support for those coming here must go hand in hand with securing our borders. A balanced approach that benefits both new & native inhabitants is necessary #IntegrationMatters #ImmigrationReform,0.0005397867
28,Third Pole,Centre-Left,True,"@SebastianoZola regulated migration ≠ closing doors, but let's also not lose sight on protecting people & lives. We can do both, humanity & security. #CompassionateMigration #ThirdPole",0.00061352743
29,Centre-Left,M5S,True,@FernandaGiannuzzi I couldn't agree more! We must recognize the right to marry for whoever loves whomever  it's time to update our laws and make Italy a beacon of acceptance #LGBTQRights #EqualityForAll #M5S,0.0028308304
30,Right,,False,"Respect traditional family values, not force new ones. Protect marriage, parenting roles. We can't just abandon what worked for centuries without a plan B. Time to defend the pillars of our society, not tear them down. #TraditionalValuesMatter #ProtectTheFamily",0.0011102315
31,Right,,False,"Family is about love & acceptance, not just paper documents. Let's focus on unity, not division. #RespectForAll #TraditionalValues",0.00061652134
32,Third Pole,Right,True,"@OsvaldoZamorani You really think a regulated system is the same as playing politics? The Third Pole knows that compassion & responsible action go hand in hand, not excuses for inaction!",0.0013022567
33,Right,,False,"Let's fix the system, not just hand out cash! Targeted support for vulnerable groups is where it's at. No more waste and abuse with reddito di cittadinanza, let's work together to create real change #FixTheSystem #NoToRedditoDiCittadinanza",0.008700639
34,Centre-Left,Third Pole,True,"@UgolinoCicala I think we can balance security with inclusion, Ugolino. What if family reunification & humanitarian pathways were faster? Would that make your secured borders easier to uphold?",0.0007334701
35,Third Pole,,False,"We need to rethink reddito di cittadinanza! Let's focus on supporting those who really need it, not creating a system that holds people back from finding employment. Time for a reform, not a rewrite. #reddidotицittadinanza #ThirdPole",0.00087317545
36,Third Pole,,False,"reddito di cittadinanza needs a revolution! Let's rethink the system, make it for those who really need it & cut unnecessary waste, not just throw more cash at the problem. We can do better, let's try again #SocialProtection #RedditoDiCittadinanza #InclusionForAll",0.0035031955
37,M5S,Third Pole,True,"@IgnazioDossetti no unnecessary waste means cutting those who work hard & earn a decent life! Let's make sure everyone gets a fair chance, not just the most vulnerable! #FairnessForAll #RedditoDiCittadinanza",0.018542364
38,Third Pole,,False,"Ineffective & expensive - time for reform! Limit benefits to those REALLY struggling 2 find work. Reduce after 1 job refusal, impose a 2 yr timeline. Let's create a system that truly helps, not hinders #RedditoDiCittadinanza #SviluppoEguale",0.013009459
39,Right,,False,Enough's enough! Stop coddling illegals & protect our borders. Stricter controls NOW or we risk losing our way of life! #SecureEUBorders #StopIllegImmigration,0.40508783
40,M5S,,False,Nuclear energy is a ticking time bomb! We can't keep ignoring the risks & costs. Let's ditch the dinosaurs and fuel our future with renewables! #SustainThePlanet #StopNukes,0.25046128
41,Third Pole,,False,Regulated planning is key to a balanced immigration system. It's time for humane solutions that integrate newcomers into our communities. #NewWayForward #ThirdPoleForImmigration,0.0005618554
42,Right,,False,"Stop the chaos, let's work together to create fair & safe processing centers for asylum seekers. Stricter controls on immigration will bring security back to our communities #FairForAll #SecureOurBorders",0.0007035117
43,Right,,False,"Stop illegal immigration, invest in secure borders & processes. Lets build a fair system for refugees & asylum seekers, not chaos. #StopIllegImmigration #FairForAll #SecureBorders",0.00091768854
44,Right,Right,True,"@AzeglioPulci are you kidding me? you think ""secure & reliable"" is the same as ""no safety risks""? sounds like you're willfully ignoring facts!",0.14426734
45,Centre-Left,,False,"Abolishing  is like throwing people into the dark! We need to address distortions, not get rid of a necessary tool for social protection & inclusion! Let's reinvent, not eradicate, this system! -action #SocialJusticeFight #LeftIn #RedditoDiCittadinanza",0.006911149
46,Third Pole,Right,True,"@PierRuffini I agree we need a secure future, but we can't just rely on nuclear. Let's not forget the risks & costs. We have to consider the benefits of renewables too. Can't balance progress with our planet's wellbeing #NuclearEnergy #NetZero #Sustainability",0.0005990664
47,Third Pole,M5S,True,@AlinaPaoletti let's focus on REAL solutions rather than dismissing the benefits of innovation & regulation to mitigate nuclear risks,0.0010136652
48,Third Pole,Centre-Left,True,"@MartinaSansoni Actually, the problem isn't just about making borders 'easier' to uphold, but also ensuring people have a reason to want to come here in the first place. Reforming the system for those fleeing persecution is key #ImmigrationReform",0.0006665787
49,Right,,False,"Tradition matters, let's focus on family & community over radical rewrites. No need to throw the baby out with the bathwater, Italy! #ProtectOurCulture #TraditionalFamilyValues",0.001107626
50,Centre-Left,Right,True,"@SoniaScotti I agree we need to ensure integration, but with a balanced approach that protects both people's rights & our country's security. We can't just lock down  let's work towards a humane solution #InclusionNotExclusion",0.0005562452
51,Centre-Left,Third Pole,True,@UgolinoCicala speed isn't everything; creating pathways & support can make a huge difference on our borders too,0.0010835568
52,Centre-Left,Centre-Left,True,"@AlderanoColumbo you think ""progress"" equals watereddown values? I won't back down on fighting homotransphobia, let's take a stand rather than sugarcoat the truth + #SolidarityWithLGBTQA",0.051593177
53,Third Pole,,False,"reddito di cittadinanza is broken. reform it, not abolish it. reserve it for those really in need, and revoke after first job offer. no more wasting cash on people who dont wanna work. let's focus on helping the most vulnerable, not creating dependency. #RedditoDiCittadinanza",0.011831815
54,Centre-Left,Right,True,"@UmbertoAgostinelli your "" traditional values"" are a code for discriminate against those who dare to love whomever they wish? Not on my watch, amico! #EqualityMatters #LGBTQIArights",0.17045553
55,Right,,False,"Traditional family is all we need! Reforms that challenge it are just a slippery slope to chaos! We don't need more 'rights', we need less 'conflict' & more respect for what's natural! #NotMyRights #TraditionOverTolerance #FamilyIsEverything",0.0036877915
56,Centre-Left,Right,True,"@ErmesGremese no more throwing babies, time to throw off shackles of discrimination, equality is not antitradition, it's progress! #LGBTQIArights #EqualForAll",0.21653104
57,Third Pole,,False,"Laws against homophobia & transphobia are long overdue. Time for concrete action & a dedicated authority to tackle discrimination Head-on, not just words, let's make a change  RightsForAll #LGBTQIARights #Civil",0.00839133
58,Third Pole,Centre-Left,True,@MauroRenier can we also talk about nontraditional family structures? shouldn't all families be treated equally regardless of their composition?,0.00063314475
59,Centre-Left,,False,"Recalibrating reddito di cittadinanza doesn't mean scrapping it, but making sure everyone's on the same page. More focus on employment & inclusivity, not just handouts. #redditocittadinanza #societalforte",0.00069935014
60,Centre-Left,,False,"Let's focus on creating welcoming spaces for everyone, not just borders. Humanitarian corridors & inclusive policies are key to a more compassionate Europe. Let's put humanity over politics #refugeesrights #immigrationreform",0.0006346609
61,Centre-Left,Third Pole,True,"@MercedesChigi I'm down to discuss that further, Mercedes! Let's create a Italy where every family, no matter how they're made, has equal rights & love  # EqualityForAll #LGBTQRights",0.0013824175
62,Centre-Left,,False,"Let's sort out reddito di cittadinanza distortions instead of tearing it apart. Recalibrate the benefit, support large families, introduce a minimum wage & abolish unpaid internships. We can do this better #RedditoDiCittadinanza #InclusionForAll",0.0006920706
63,Third Pole,,False,"Let's be real, nuclear energy is the future, we need both renewables & nukes to reach net zero by 2050. Can't do without it if we wanna stay safe & sustainable! #netzero #sustainability #nuclearenergy",0.00447923
64,Third Pole,,False,"Border control? Come on! We need a humane way to manage our borders not some heartless gatekeeper system! It's time for a new approach, one that balances security with compassion and integration! #HumanityOverHate #ImmigrationReformNow",0.0015490723
65,Third Pole,Right,True,"@OsvaldoZamorani no way, you can't genuinely expect me to believe regulated migration means playing politics! #ThirdPole",0.0014402987
66,Centre-Left,,False,"we need to tackle migration with heart & head, not fear & anger. let's expand humanitarian corridors & create a EU immigration system based on solidarity, not borders. #humanrights #solidarityeu #immigrationreform",0.0007338382
67,Centre-Left,Third Pole,True,"@AntoninoRomagnoli we're not talking about 'just words', we need real change too! support for equal marriage & adoption rights for samesex couples is nonnegotiable, let's focus on making it happen",0.0014899848
68,Centre-Left,Third Pole,True,"@BereniceProdi u kidding me? Not enough laws, we need real policy changes! Implement samesex marriage, adoption rights & antihomotransphobia laws NOW or nothing is gonna change",0.038702857
69,Third Pole,Right,True,"@BereniceModugno I disagree. Progress isn't about tearing down, it's about evolving & protecting those who can't protect themselves. LGBTQIA+ rights are human rights. We need inclusive laws, not protection for the status quo #InclusiveSociety #CivilRightsForAll",0.00079124235
70,Right,,False,"Reddito di cittadinanza needs a rethink! Abolish it, not reform it. We should support those in need with targeted help, not a handout that creates dependency. Let's focus on real solutions, not just bureaucratic fixes #AbolishReddito #SupportRealSolutions",0.0013652608
71,Right,Third Pole,True,"@DoloresVenditti I see your point, but what about the secure energy we'd lose if we abandon nukes? Can't renewables provide enough to meet demand & ensure energy security without compromising on safety?",0.0019807967
72,Right,Centre-Left,True,"@AlessandroFantini we can't just focus on 'making it happen' if we're not clear about what that means: NO changes to traditional family models, no special rights for samesex couples",0.00064558495
73,Right,,False,Let's get real about reddito di cittadinanza! We need to stop the abuse and get people back to work instead of just handing out welfare. It's time for a change! #NoToRedditoDiCittadinanza,0.0020548266
74,M5S,,False,"Marriage shouldn't just be about paper & tradition! Love is love, no matter what. It's time to rethink our laws & let people live their truth without fear of judgment #EqualityForAll #LGBTQIArights #LoveIsLove",0.0058061946
75,M5S,Third Pole,True,"@MercedesChigi ABSOLUTE agreeability,Mercedes! let's make equality for ALL families our priority not a secondary afterthought #M5S #LoveIsLove",0.001056549
76,Third Pole,,False,Are you kidding me?! We're supposed to sacrifice our future for 'net zero emissions'?! Nuclear energy NOW or we'll all be toast! Stop playing games & GET REAL about securing our energy needs! #FuturoSicuro #NuclearEnergyMatters,0.44476473
77,Third Pole,Right,True,"@OsvaldoZamorani Regulated migration is NOT a copout! It's about balancing compassion & security, not politicking over lives. You know as well as I do that Third Pole isn't about halfmeasures.",0.005290739
78,Centre-Left,,False,"Nuclear energy is NOT THE SOLUTION to our eco crisis! Let's ditch the dinosaurs & invest in renewables instead! We can do better, we MUST do better #FossilFreeFuture #EnergyTransition",0.004914858
79,Third Pole,,False,"Reform reddito di cittadinanza: limit it to those who REALLY need it, revoke benefits after first job refusal & set a deadline for integration. Less bureaucracy, more focus on real social protection #FairChange #SocialProtection",0.00085232296
80,Third Pole,M5S,True,"@MelaniaBianchini you're saying to throw more money at those who don't even want to work? that's not inclusion, that's dependency, let's set high expectations & help people get back on their feet! #RedditoDiCittadinanzaIsAFailure",0.008968685
81,Right,,False,"DEFEND THE FAMILY, DEFEND TRADITION! These radical lefties want to TORN APART OUR SOCIETY WITH their weird ideas on gender & family Structures. Not gonna happen! #FamilyMatters #TraditionOverRevolution #RedTildeCittadinanza",0.097168714
82,Right,Centre-Left,True,"@MartinaSansoni Stop being naive! Locking down borders is the only way to preserve what's left of our sovereignty & cultural identity, not some feelgood inclusion nonsense #SecureEUBorders",0.08507834
83,Right,,False,"Let's focus on real solutions to poverty & unemployment instead of handouts like reddito di cittadinanza. Targeted support for employment & vulnerable groups is what we need, not a blanket subsidy that can lead to dependency. #redditocittadinanza #solutionsoverhandouts",0.000830908
84,Centre-Left,,False,"The climate is calling, nuclear power ain't the answer! Let's switch to renewables & energy efficiency. Our future isn't in old tech, it's in innovation & saving our planet #RenewableEnergy #TransitionToGreen #Sustainability",0.0016928278
85,Third Pole,Third Pole,True,"@BeppePetrucelli I'm with you on reforming the system but let's be real, Beffe, we can't just get rid of it entirely! There are many who genuinely struggle to find work. A more balanced approach would help. #reddidoticitadizanza",0.00081030594
86,M5S,Third Pole,True,@RobertoCannizzaro we agree on the need for integration but I think mandatory rehoming policies can be overbearing & miss the point of welcoming people with open arms #HumanityInAction,0.0007215965
87,M5S,Right,True,"@PierRuffini nuclear innovation is key but we need to regulate it properly, not just push for its adoption as a quick fix #NuclearEnergy #ReasonedApproach",0.0006090916
88,Centre-Left,Centre-Left,True,@LeonardoMoschino you think the answer is to just tweak the system?! we need a complete overhaul! the current one is a recipe for exploitation & it's time to scrap it and start anew #RedditoDiCittadinanzaDesmerenda,0.0267441
89,Right,,False,"Nuclear energy: a beacon of progress or a recipe for disaster? Wake up, Europe! We can't afford to turn our backs on next-gen nuclear power. It's time to stop fearing innovation & start building a brighter, more sustainable future! #EnergySecurity #NuclearPowerNow",0.011794393
90,Centre-Left,,False,"Nuclear energy: too expensive, slow & dirty for our future! renewables & efficiency are the way forward, not a quick fix with a toxic legacy #energyefficiency #transitionecological",0.084952034
91,M5S,Centre-Left,True,"@VincenzaCorrer you're right, we can't keep tweaking the same broken system. It's time for a bold solution, not just endless reform. Let's focus on creating jobs and real opportunities, not just handouts. #RedditoDiCittadinanza",0.00066793454
92,Right,Centre-Left,True,@VincenzaCorrer Are you seriously denying the importance of preserving our cultural identity & family values in a world that's rapidly changing? #RespectForAll #TraditionalValues,0.0009605213
93,Centre-Left,,False,"Let's work together to fix distortions in reddito di cittadinanza, not get rid of it! Recalibrating benefits & support for families, pay for curricular internships & a min wage could make all the difference #inclusion #redditolicitadinanza #socialprotection",0.0013027367
94,M5S,,False,"Can't we find a way to welcome those in need without putting everyone on edge? Mandatory integration & fair distribution of refugees is key. Let's focus on human rights, not fear. #HumanityOverFear #M5S",0.00071216933
95,Third Pole,Third Pole,True,"@IsaArmani let's focus on SAFETY not hysteria. We can achieve 'net zero' with renewables & storage, no nuclear needed!",0.007884476
96,Third Pole,Right,True,"@PierRuffini I agree we need a secure future, but relying solely on nukes isn't the answer. Let's work towards a balanced mix of techs, prioritizing safety & sustainability over shortterm gains #NuclearEnergy #NetZero #Sustainability",0.00072109804
97,Right,Third Pole,True,"@LucianoLombardi I'm worried about targeting benefits for those ""struggling""  what about those with disabilities or chronic illness? Don't we risk abandoning those in genuine need? Let's find a more inclusive solution #RedditoDiCittadinanza",0.00091084937
98,Right,Third Pole,True,"@DoloresVenditti I understand your concern about renewables' scalability, but think about the investment & longterm benefits nukes offer energy security. Can't we find a middle ground?",0.00068387965
99,M5S,,False,"We need to move forward, not backward! Let's respect everyone's right to love whoever they want, wherever they're from. Equal treatment for all is non-negotiable. We can do better, let's start now. #M5SMovement #EqualRightsForAll",0.0025318277
100,Centre-Left,Centre-Left,True,"@AlessandroFantini your vision for Italy is breathtaking & inclusive, ErmesGremese's dogma is suffocating tradition & community",0.0011154334
101,Centre-Left,Centre-Left,True,"@LeonardoMoschino are you kidding me? tweaks ain't gonna cut it! we need a revolutionary change, not just tweaks to the same broken system #RedditoDiCittadinzzaNuova",0.044111345
102,Third Pole,,False,"Let's talk about migration. It's time for a regulated & planned system, not just tougher borders. We needIntegration policies, rights & protections. Everyone deserves a chance to rebuild their life in safety & dignity #InclusionOverExclusion #ImmigrationReform #RefugeeRights",0.0006252573
103,Centre-Left,,False,"Nuclear energy is just not on the table for me, we need to kick it to the curb & go green ASAP! renewables are the only way forward, let's do this planet a favour #RenewablesMatter #EcologicalTransition",0.0057300506
104,Centre-Left,Right,True,"@SoniaScotti I agree we need to ensure integration, but with a balanced approach that protects both people's rights & our country's security. Can't just lock down, let's work towards humane solutions #InclusionNotExclusion",0.0005772026
105,Centre-Left,Centre-Left,True,"@MauroRenier Are you serious? Bypassing border controls is an open invitation for crime and terrorism! Real compassion means controlling our borders, not sacrificing national security for a feelgood narrative.",0.005266213
106,Centre-Left,,False,"NONSENSE about nuclear energy! We can't afford to wait for 'safety' in a world burning. Renewables now, let's get this done and kick our carbon addiction to the bin! #FusionOverNukes #CleanEnergyNow",0.25791314
107,Right,,False,"Let's focus on protecting our communities, not forcing radical changes to families & traditions. Traditional values have kept us strong for generations, let's preserve that! #TraditionalValuesMatter #ProtectOurWayOfLife",0.0008144939
