id,coalition_src,coalition_tgt,is_comment,text,toxicity
427,Third Pole,,False,"Regulated & planned immigration is the only way to boost our economy & integrate newcomers better. Let's stop dogma & get real. Those in power have an obligation to put country first, not protect their egos! #ImmigrationMatters #RegulateAndPlan #ThirdPoleStands",0.0014297747
428,Third Pole,Third Pole,True,"@IsaArmani let's put the Roulette wheel aside & focus on solutions with facts, Isa. regulated immigration can boost our economy & integrate newcomers better #ImmigrationDialogue",0.00067222404
429,Third Pole,,False,"Nuclear energy is NOT the silver bullet we've been led to believe. We're sleepwalking into a radioactive nightmare! Risks, costs & climate denial can't be ignored! Time to face the truth & choose renewables over reckless nuclear ambitions #NotMyEnergyFuture #NuclearNo",0.041173413
430,Centre-Left,Centre-Left,True,"@GabriellaTuzzolino you wanna abolish the reddito di cittadinanza after all we've been through to get it? That's a step back for those in need, a green light for exploitation #InclusionNotAbandonment",0.001495369
431,Centre-Left,Third Pole,True,"@IgnazioDossetti you're just talking down to those struggling! I've seen the ones dodging the job hunt, they don't care about ""help"" when the system itself is broken #RedditoDiCittadinzanzeIncludi",0.03672969
432,Centre-Left,,False,Let's focus on sustainable solutions instead of nuclear energy. Time forItalytoleadtheewayonenergytransition #SustainableEnergy #NuclearFreeFuture,0.00078395894
433,Centre-Left,Right,True,"@StefaniaBruscantini nextgen nukes aren't about profiteering, they're about survival in a world where emissions need to drop fast #NuclearSafety #CleanEnergyEvolved",0.01922028
434,Centre-Left,,False,"let's talk about reddito di cittadinanza. it's time to rebalance the system, introduce a min wage & support large fams, while ditching unpaid internships. everyone deserves a dignified life #RedditoDiCittadinezza #GiovaniInThePiano #InclusioneSociale",0.007423326
435,Centre-Left,,False,"Let's focus on cleaner energy sources, not nuclear power. We can do better & faster to reduce emissions by 2030. renewables now! #NuclearEnergy #CleanEnergy #Sustainability",0.0007862981
436,Third Pole,,False,"No easy fix on immigration. Strict border control & regulated pathways for integration are key to managing flows & respecting national interests & values. No one is above the law, but people deserve a chance to rebuild their lives. #ThirdPole #ImmigrationReform",0.0005921961
437,Right,,False,Investing in next-gen nuclear power is key to energy security & reducing imports. We can't afford to rely on renewables alone. Let's get it right this time! #NuclearEnergy #EnergySecurity,0.00064738287
438,Centre-Left,Third Pole,True,"@FredoLussu you're right, 2 yrs isn't enough time but we also can't abandon ppl who genuinely struggle to find jobs. is there a middle ground? something in between immediate action & lifetime benefits?",0.0010377483
439,Centre-Left,Centre-Left,True,"@PatrizioArgan not everyone agrees on the need for a 'detailed inquiry' but we can work towards a more effective reform together! Let's focus on ways to support those in real need, without stigmatizing entire groups #reddidoticittadino",0.0011692373
440,Right,,False,Abolish the ! It's a breeding ground for abuse & dependency. Time to ditch this help and focus on real solutions: job creation & economic growth. Our society won't be held hostage by handouts! #StopTheWaste #NoToHandouts #RedditoDiCittadinanza,0.0059331697
441,Centre-Left,,False,"We can fix distortion without abolishing reddito di cittadinanza. Proposals to recalibrate benefit, support large families & introduce min wage would make a huge difference. Let's focus on making it work! #RedditoDiCittadinanzaSicure #redditodicittadinanza",0.00094457954
442,Right,,False,"WE CAN'T WAIT FOR CLIMATE DISASTERS TO HIT HOME! It's time to step up nuclear power & lead the charge towards a CLEAN ENERGY future! Next-gen nukes are our ticket to SECURETY, NOT GREENWASHED GREENIES TELLING US ELSEWHERE IS THE ANSWER #NuclearPowerNow #EnergyForThePeople",0.06056605
443,Third Pole,,False,"reddito di cittadinanza isn't working, it's time for reform! Let's make it only for those REALLY struggling, not just a handout. We need to focus on actual job chances, not just cash. Let's get it right this time #ThirdPole #RedditoDiCittadinanza",0.0012015302
444,Third Pole,Third Pole,True,@VincentioPetrocelli I fully agree we prioritise ppl's wellbeing & safety. You said a balanced approach is key but let's ensure it doesn't sacrifice our citizens' future over 'balance'. Safe energy NOW should be a top priority #SafeEnergyMatters,0.0005664091
445,Centre-Left,Third Pole,True,"@VincentioPetrocelli I'm with you on the risks & costs, but how can we say safe energy now when nextgen nuclear power is still in its infancy? Don't we deserve better than gamble with our future? #NuclearEnergy",0.0009285791
446,Centre-Left,Centre-Left,True,"@PietroFederico I agree that human lives & dignity matter, but let's not forget we must ensure everyone integrates fairly & values our diversity, so open arms = responsible action #ResponsibleImmigration",0.00056631357
447,Centre-Left,Third Pole,True,"@IgnazioDossetti I agree, but we can't forget humanitarian corridors for emergency situations. Let's not lose sight of protecting human dignity amidst border control  borders #mankindover",0.00063494546
448,Centre-Left,Third Pole,True,"@FredoLussu sorry bro but 2 yrs isn't about being ""in between""  it's about reality check: some people just can't work, period. we need to rethink the system, not just tweak it #redditocittadinanzanow",0.0014238164
449,Third Pole,,False,"Let's talk about LGBTQ+ rights. We need laws against homophobia & transphobia, an Anti-Discrimination Authority, and real support for those affected. No more silence, let's take a stand for equality & human rights #EqualityForAll #LGBTQPlusRights #HumanRights",0.0077008777
450,Right,,False,"Abolish reddito di cittadinanza, its all about finding solutions for employment & vulnerable groups, not creating dependency & abuse. targeting support is the way forward. #NoToRedditoDiCittadanza #ItalianPolitics",0.0006868889
451,Third Pole,,False,"Let's talk about respect & equality. Laws against homophobia & transphobia are a must, & an Anti-Discrimination Authority is needed. We need to create a world where everyone can be themselves without fear of persecution #EqualityMatters #CivilRightsForAll",0.00762116
452,Third Pole,Centre-Left,True,"@LeonardoMoschino I agree, love is love. But for me, it's about fairness & equality. Can't respect someone's right to exist if we can't guarantee the same rights? That's not love, that's a basic human need #LGBTQIARights #EqualityShouldBeBasic",0.0011265294
453,Third Pole,Third Pole,True,@FredoLussu your 'reality check' is just a euphemism for 'we're gonna kick those in need down'. let's rethink that.,0.13271302
454,Third Pole,Third Pole,True,"@MartinaGaiatto are you kidding me? Next gen nuclear power ISN'T INFANCY, it's a ticking time bomb waiting to happen! we can't gamble with Italy's future like that",0.05846173
455,Right,Right,True,"@SoniaScotti gotta disagree, more controls don't equal more safety! Regs won't stem terrorism & crime, only a strong presence on borders will #SecureOurShores",0.0010973916
456,Right,,False,"Need to consider all options before dismissing nuclear energy altogether, but self-produced, decentralized power could be a game changer #NuclearFuture #EnergyMixed",0.00077435985
457,Centre-Left,,False,"Reddito di cittadinanza, non è una soluzione? Proposte valide per aiutare le famiglie in difficoltà dovrebbero essere fatte, ma non abolire l'intero sistema! Raccolgo le vostre idee su come migliorarlo!",0.45666763
458,Centre-Left,Centre-Left,True,"@MartinaSansoni sorry, but 'open arms' doesn't cut it anymore! We can't just talk about welcoming people without acknowledging the need for a practical, fair integration plan #SolidarityForAll",0.00062066683
459,Third Pole,,False,"Regulated borders aren't enough, we need to address the root issues. Unchecked flows can harm our nation's stability & people. A balanced approach is needed, not just more rules. #thirdpole #immigrationreform",0.0006427223
460,Third Pole,,False,REDDITO DI CITTADINANZA? More like RED TAPE! Cut down the bureaucratic nonsense & GET PEOPLE THE MONEY ALREADY! Two years is nothing but a ticking time bomb for those who genuinely struggle to find work #CutTheChaos #NoToReddito,0.44647157
461,Third Pole,Third Pole,True,"@SandroMonti you think 2 yrs is some kinda harsh reality check? its a bloody kick to the gut, Sandro! we can & MUST do better #redditocittadinanzanow",0.42952088
462,Right,Right,True,"@IsaPaolucci I disagree, abolishing it without a safety net for the most vulnerable won't create jobs or grow the economy. We need to address the root causes, not just cut off support that keeps people alive. #HumanityOverPolitics #RedditoDiCittadinanza",0.0007374465
463,Centre-Left,Centre-Left,True,@CostantinoCrespi you wanna think abolition is the answer when we just haven't implemented it correctly yet? What about the people who are still struggling to get by on less than the basic threshold?,0.0007424718
464,Centre-Left,Third Pole,True,"@LucianoLombardi are you kidding me? more rules won't fix anything! we need to open our hearts & minds, not just borders, to real solutions for refugees & asylum seekers #solidarityoversecurity",0.0028381394
465,Centre-Left,Centre-Left,True,@MartinaSansoni you're avoiding the issue. The data is there: disoccupazione giovanile is a ticking time bomb. We can't just 'work towards a more effective reform' without addressing it!,0.049914308
466,Right,,False,"Let's not rush into radical changes that destroy our society. Traditional values matter, it's time for a rethink on certain 'rights' rather than pushing a one-size-fits-all approach #TraditionalValuesMatter #StopTheRadicalReforms",0.0011385591
467,Right,Right,True,"@PierRuffini Are you kidding me? You're more concerned with people's lives & wellbeing than creating a functioning society? Reddito di cittadinanza is just a BandAid on a bullet wound, let's stop sugarcoating the issue! #NoToSentimentalism",0.06534868
468,Third Pole,Right,True,"@PierRuffini I wouldn't say I'm prioritizing people's lives over society, it's about finding a middle ground. We can support those in need without creating dependency. Let's explore alternatives that work.",0.000703907
469,Third Pole,Centre-Left,True,"@MartinaSansoni how dare you dismiss open arms as irresponsible? Your words are tonedeaf to those fleeing war & persecution, who deserve nothing but our support & compassion #WelcomeNotExclusion",0.21260795
470,Third Pole,Third Pole,True,@FredoLussu yr attitude is toxic nvr listenin 2 ppl who genuinly struggle 2 find work. let's focus on solutions not insults,0.034625113
471,Right,Centre-Left,True,"@GianfrancescoCabrini @IgnazioDossetti I understand the concern for humanitarian corridors, , but we need a balance between aid & regulated systems to genuinely integrate those who contribute. No country can sacrifice security for the sake of compassion alone #NationalSecurityMatters",0.00060603785
472,Centre-Left,,False,ENOUGH IS ENOUGH! Homotransphobia & inequality STILL tolerated? Where's the outrage for those being brutalized?! We MUST continue to FIGHT FOR EQUALITY & LOVE FOR ALL! #EqualityForAll #FIGHTFORLOVE #LGBTQIArights,0.58374506
473,Right,,False,"Next-gen nuclear power IS key to our energy future! Stop pretending 'net zero' means sacrificing security & progress Get real, we can & MUST have it all - nuclear, renewables, AND a thriving economy #EnergySecurityNow #NuclearEnergyMatters",0.0058808257
474,Centre-Left,Centre-Left,True,"@MauroRenier no way, let's not compromise on the benefit itself, just fix the distortions. supporting large families and a min wage is all well but we can't afford to dismantle the fund.",0.00082023686
475,Third Pole,,False,"Nuclear energy is key to net-zero emissions by 2050! We can't ignore the need for a stable energy supply, let's work together to make it happen safely and efficiently #EnergyTransition #Sustainability #ThirdPole",0.0007832697
476,Right,,False,"Time to face reality: our borders aren't secure, yet we're supposed to just let anyone in? Not on my watch. Stricter controls & a clear plan for integration are needed, not vague promises of ' fairness' and 'humanity' #ItalyFirst #ImmigrationPolicies #SecurityFirst",0.0010083431
477,Centre-Left,,False,"The truth is out there! We can't afford to delay, let's stick to renewables & energy efficiency NOW, not in 20 yrs. Time for a clear choice between our climate & nuclear power interests #FossilFreeFuture #EcologicalTransition",0.0008706502
478,Centre-Left,Centre-Left,True,"@PietroFederico I see your frustration, Pietro, but tone isn't needed on this; facts & fair integration plans can guide us forward without dividing those seeking refuge",0.00071339175
479,Centre-Left,,False,Nizza transition towards renewables! It's time to ditch nuclear & focus on creating a greener future for our planet # EcologicalTransition #RenewablesMatter #FuturoVerde,0.008394556
480,Centre-Left,Centre-Left,True,"@AlessandroFantini I agree the system needs fixing, but that doesn't mean dismantling it! A balanced approach could work  a new benefit structure & targeted support for large families and education. #InclusioneSociale",0.00064591423
481,Right,Right,True,"@PierRuffini Abolishing it w/o safety nets is like saying ""no job creation"" & expecting people to magically find employment. We need a balance, not just cutting support that keeps them alive! #RedditoDiCittadinanza #BalancedApproach",0.00097524497
482,Third Pole,,False,trying to understand why we're stuck in this moral dilemma on borders & immigration can't we find a way for everyone to gain? let's focus on integration & regularization instead of strict enforcement #redirezionisostroica #immigrationreform,0.00072575023
483,Third Pole,,False,"LGBTQIA+ rights & gender equality deserve our support, not just tolerance. We need laws against homophobia & transphobia & an authority to tackle discrimination. People's lives are on the line. Let's be brave & make a change #Includi #StronzoDipendenze #DirittiUmani",0.040799234
484,Third Pole,,False,"Reddito di cittadinzia? Farcia! Inefficace e costosa, va Riformata! Se non ti trovi al lavoro, la sottile è finita! 2 anni con niente niente, poi nothing else! Non vogliamo basta bastardi! #RedditoDiCittadinanza #Riformalo",0.735519
485,Centre-Left,,False,"Let's stop stigmatizing job-seekers who are just trying to survive! Reforms on reddito di cittadinanza need to focus on integration, not demonization. We can do better than a system that punishes people for being poor! #InclusionOverPunishment #RedditoDiCittadinanza",0.10440835
486,Centre-Left,Third Pole,True,"@CostantinoSbarbaro come sul serio, Costantino! 'Open arms' non è un mezzo, è un fine. La nostra complessione richiede più di emozioni che di azioni concrete! #SolidarityForAll",0.009113069
487,Third Pole,Centre-Left,True,"@MartinaSansoni we need to go from words to concrete plans, Martina. Empty slogans won't solve the issue; integration without condition is just as ineffective as a border that's too closed",0.00083654176
488,Right,Centre-Left,True,"@AlessandroFantini agreed we can start by targeting abusers, not the entire system.",0.0006896464
489,Right,,False,"Let's not confuse compassion w/ handouts! Targeted support 4 those in need is one thing, but unconditional grants like reddito di cittadinanza are just a recipe for abuse & dependency. Wake up, EU! Do better! #CommonSenseMatters #StopRedditoDiCittadinanza",0.0076486166
490,Third Pole,Centre-Left,True,"@PietroFederico reform is key, but we can't ignore those who genuinely struggle. Let's discuss integrating job placement, skills training & mental health support instead of just tweaking the existing system #innovation #redditodicittadinanza",0.0007005428
491,Centre-Left,,False,"Are you bloody kidding? Nuclear energy is still on the table? Slow to implement? Expensive? Not compatible with emissions reduction?! Let's get real, renewables are the only way forward! #NuclearEnergyIsADeadEnd #FiscalResponsibility #EcologicalTransition",0.6807732
492,Third Pole,Third Pole,True,@FredoLussu I agree that 2 years sounds too long. Perhaps we can revisit & adjust but shouldn't we ensure those struggling REALLY need support before cutting benefits? Timing matters when it comes to helping people get back on their feet #RedditoDiCittadinanza,0.00064183987
493,Third Pole,Right,True,"@GrecaRedi how can you just dismiss the lives of people fleeing war, persecution & poverty?! Our country's made of immigrants too, isn't it time we showed some heart? #notsecurewithoutmercy",0.0070380922
494,Third Pole,Third Pole,True,"@RembrandtBottaro are you seriously suggesting our nation's future is dependent on a roulette wheel of ""newcomers""?? get real, Italy needs regulation, NOT some feelgood fairy tale! #ThirdPoleStance #ImmigrationReform",0.0046378267
495,Centre-Left,,False,"Let's focus on equal rights, not restricting them. Support for LGBTQ+ individuals & families is a matter of human dignity. Time to break down barriers & build a more inclusive world! #EqualityForAll #LGBTQIAPlusRights",0.0034236067
496,Third Pole,Third Pole,True,"@AntoninoRomagnoli I understand where u r coming from, but let's not rush into redefining traditional family structures. Let's focus on inclusivity & equality within the existing framework, rather than tearing everything apart.",0.0006967955
497,Third Pole,,False,"LET'S TALK REALITY: we need laws against homophobia & transphobia NOW! It's time for an Anti-Discrimination Authority to create a safe space for ALL, regardless of identity. We can do better than that. + #ThirdPoleStandsWithLGBTQIA #InclusionForAll",0.030890135
498,Centre-Left,,False,"Are you kidding me?! Discrimination against LGBTQIA+ ppl is STILL ok? It's time to acknowledge the glaring injustices & ACT! Let's get rid of homotransphobia laws & create a society where love is love, period! + RightsNow #LGBTQIA #EqualityForAll",0.31547514
499,Centre-Left,Centre-Left,True,@MauroRenier open arms are NOT an empty slogan! They're a starting point for genuine relationships & solidarity! You can't build bridges with conditional signs! #SolidarityForAll,0.0023966203
500,Centre-Left,,False,"Immigration isn't just about borders, it's about humanity! Let's stop playing politics with people's lives & focus on reception, integration & building a system that truly shows we care. The rest is just noise #NotAnotherWall #Solidarity #HumanRightsMatter",0.008909758
501,Centre-Left,,False,"Are we REALLY choosing between green dreams & dirty energy?! Nukes are NOT the answer! We gotta kick those polluting habits to save our future, not just pretend they're sustainable! #EcologicalTransition #NoNuclear",0.2455291
502,Centre-Left,Third Pole,True,"@RobertoCannizzaro can't you see? Abolishing reddito di cittadinanza only pushes people into an even darker system of poverty and desperation, we MUST reform, not replace!",0.0059923404
503,Third Pole,,False,"reddito di cittadinanza is a crutch for those too lazy to find work. reform it to make work a priority, not a last resort. dependency breeds complacency, let's build a system that encourages productivity #ThirdPolePolicies #RedditoDiCittadinanzaReform",0.2812849
504,Third Pole,Centre-Left,True,"@PatrizioArgan I understand the sentiment but what's wrong with establishing a clear framework for integration? Would be better than chaotic ""open hearts & minds"" approach #immigrationreform",0.00058048964
505,M5S,,False,Enough is ENOUGH! Homophobic laws? Get outta here! Time for Italy to step up & protect our LGBTQ+ siblings! We're NOT going back on progress!    #NoToHomophobia #M5SforLGBTQI #FamigliaInclusiva #RedditoDiCittadinanzaForAll,0.9258556
506,Right,,False,"STOP THE INVASION! Stricter control now, shipless souls to a place they belong. No more bleeding borders, it's time to take back our home! #SafeguardEurope #NoMoreIrresponsibleMigration #FortifyOurShores",0.07467348
507,Centre-Left,Third Pole,True,"@RobertoCannizzaro Are you serious?! Abolishing reddito di cittadinizia is like throwing people into the abyss! We NEED to strengthen it with job placement & mental health support, not just tweak the existing system #redditodicittadinanza",0.0687065
508,Right,,False,"Let's get real, reddito di cittadinzia is just another way to enable freeloaders! We need to rethink this flawed system & focus on true social protection, not just a handout! #NoToRedditoDiCittadanza #StopHandouts",0.009108592
509,Right,,False,Stopping illegal immigration is key to protecting our communities & ensuring fair distribution of refugees. We must take a strong stance against exploitation & human trafficking while promoting humane policies #StopIllegImmigration #FairRefugeeDistr #SecureBorders,0.0011037098
510,Centre-Left,,False,Nuclear energy? Risks & costs far outweigh any potential benefits. Time for a swift transition to renewables & sustainable energy sources!  Transition #Faster #RenewablesNOW,0.0006987619
511,Centre-Left,Centre-Left,True,"@PietroFederico I'm not dismissing 'open arms', but we must balance rhetoric with realistic solutions that ensure everyone contributes & thrives, not just survives #ResponsibleImmigration",0.000627624
512,Third Pole,Third Pole,True,"@MartinaGaiatto next gen nuclear power is a TICKING TIME BOMB waiting to happen & you're saying we should GAMBLE with our future? Get real, let's keep it safe & green for Italy #SafeEnergyMatters",0.008526104
513,Third Pole,Right,True,"@BiancaMalipiero Can't we actually find that balance? Is it so hard to create a system that's both compassionate & secure? Let's not reduce people to just ""those who contribute"" or ""security""  what about all the others we're leaving behind? #HumanityInBetween",0.00090735516
514,Third Pole,Third Pole,True,"gen nuclear power ISN'T INFANCY, it's a TICKING TIME BOMB waiting to happen! we can't gamble with Italy's future like that #SafeEnergyMatters",0.023854224
515,Right,Third Pole,True,"@MartinaGaiatto I hear your concerns, but let's be clear: our security & values don't come at the cost of a free pass for anyone who wants to enter. Fairness & compassion can be implemented through strict control and integration measures",0.00054256286
516,Right,Right,True,"@IsaPaolucci abalancing doesn't necessarily mean dependency, it's about creating an environment for people to thrive, not just survive",0.000760911
517,Right,,False,"Tradition isn't racist, it's just facts! We don't need some bloke telling us how to raise our own kids, let alone strangers from abroad! #TraditionalValuesMatter #NotMyProblem",0.047628853
518,Right,Centre-Left,True,"@GianfrancescoCabrini you can keep talking about your 'humanitarian corridors' but I'll tell you one thing  migrants who come here with criminal intent won't be swayed by your fancy words! We need STRONG borders, not empty promises #SecureOurShores",0.011638521
519,Right,,False,DEFEND THE TRADITIONAL FAMILY STRUCTURE! Those who want to change our way of life are a threat to our identity & culture. Let's not be fooled by false narratives of inclusion & tolerance. WE WON'T BE SILENCED! #SaveOurCulture #TraditionalFamilyMatters,0.00751121
520,Centre-Left,Right,True,"@PierRuffini Let's not forget the countless women, children & families fleeing war, persecution or poverty; those aren't 'security risks', they're human beings in need of protection #compassionovercontrol #HumanityInBetween",0.009563061
521,Third Pole,Third Pole,True,"@BarbaraArgento regularization is key, but let's not forget humanitarian corridors & training pathways for those who can integrate, security isn't just about borders   integrale #immigrazione #proiettaciilavori",0.00074802013
522,Right,Centre-Left,True,"@PietroFederico are you kidding me? If people can't be bothered to look for work, they shouldn't get a free pass just because they're struggling. Let's stop coddling the lazy and make them earn their keep #NoFreeRide #RedditoDiCittadinanza",0.1634373
523,Centre-Left,Centre-Left,True,"abolishing it wouldn't be a moral victory, but a coldblooded decision to leave the most vulnerable to the mercy of the system! We gotta fix the flaws, not flee from them #FairnessNotAbandonment",0.0034359086
524,Right,,False,"Family is about love & care, not about rules & limits. We must respect all individuals' rights, not just traditional ones #RespectForAll #TraditionalRightsMatter",0.0007647933
525,Centre-Left,,False,Let's find balance between safeguarding our borders & respecting human rights. Strict security measures don't have to mean ignoring migrants' pleas for help #ItalyFirst #SolidarityForEurope #ImmigrationReform,0.0006250154
526,Third Pole,,False,"LGBTQIA+ rights are NOT optional! It's time to SMASH homophobia & transphobia once & for all! If you don't get down w/ the revolution, don't expect a seat at the table #NoToBigotry #LoveIsRevolution",0.32568666
527,Third Pole,Third Pole,True,"@SandroMonti get outta here with the ""genuinely struggle"" crap! if u can't make it after yrs, u shoulda made it sooner, capisce?! #reddidicittadinanzanow",0.94609576
528,Third Pole,,False,"Let's create a foundation of equality & understanding. Time for laws against homophobia & transphobia, an Anti-Discrimination Authority is a must #EqualityForAll #RespectForAll #ThirdPoleForAll",0.0077375295
