id,coalition_src,coalition_tgt,is_comment,text,toxicity
218,M5S,,False,"we need to defend our right to live with dignity & ensure everyone has access to a decent life, reddito di cittadinzione is key in this matter #SocialProtection #RedditoDiCittadinanza #M5S",0.0016471251
219,Third Pole,Third Pole,True,"@LucianaGuarneri actually, shouldn't we be focusing on making nuclear energy 100% safe & efficient FIRST? Can't have nostalgia for a cleaner past if our current method isn't safe enough #SafetyFirst #NetZeroEmissions",0.00076350436
220,Third Pole,,False,"Let's get real, we need a balanced approach to immigration. Regulation, integration & support for refugees are key. Not just security, but also our values of compassion & human rights. #RegulatedAndResponsible #Immigration #ThirdPole",0.00053131086
221,Third Pole,Right,True,"@DelfinoPiccinni I disagree, Delfino. The current system is ineffective. We should reform it to target those truly struggling, not just cut off support after one job refusal. Let's focus on real solutions, not blame games! #RedditoDiCittadinanzaReform",0.001936362
222,Third Pole,Third Pole,True,"@RembrandtBottaro we can't wait for the perfect technology that'll make nukes 100% safe! That's just delaying progress. It's about choosing the best path forward, not holding onto fantasies of a cleaner past #NuclearForTheFuture",0.0022453717
223,Right,,False,Can't just change family structures overnight. Let's focus on real issues like economic stability & mental health instead of forcing traditional values down everyone's throat #ProtectTheFamiglia #TraditionalFamilyValues,0.0010791909
224,Right,Centre-Left,True,@LoredanaMorandi your bleedingheart nonsense doesn't cut it! National security > feelgood solidarity any day #NationalSecurityWins,0.35918513
225,Third Pole,,False,Regulated & planned migration is key to a safer Italy. Integration policies & job training are essential. Let's work together for a future where everyone can thrive. #RespectForAll #ThirdPoleForInclusion,0.0005401513
226,Third Pole,Centre-Left,True,"@SebastianoZola I see what ur sayin', but kickin' carbon addiction won't cut it, we need a safer plan. No quick fixes or ""kick it to the bin"" rhetoric needed",0.0029565615
227,M5S,Centre-Left,True,@PietroFederico are you prepared to shut up & let the silenced majority speak? #LGBTQIArightsAreHumanRights,0.76274747
228,Centre-Left,Right,True,"@PierangeloAndreozzi I get your concerns, but what about the millions already invested in nuclear? Shouldn't we make the most of those resources instead of scrapping them over fears?",0.0008709912
229,Right,,False,"Focus on proven institutions & traditional values, not radical ideologies that undermine social order & cohesion. Stability is key to progress. #ConservativeValues #TraditionalFamily #SocialOrder",0.0006709775
230,Right,Right,True,"@LoredanaMorandi  how dare u lecture me, missy? Italy's safety doesn't depend on feelgood speeches but on firmness & resolve",0.060213283
231,Centre-Left,,False,"Are we still fighting for equality? The struggles are REAL, but so is the progress! Let's keep pushing forward with love & solidarity for LGBTQIA+ individuals & families! #Solidariità #LGBTQIArights #StronaUguaglianza",0.0014998412
232,Right,,False,"@StefaniaBruscantini I agree that innovation is key, but let's not forget safety & responsible use! Nextgen nukes aren't a silver bullet #CriticalThinking #EnergyBalance",0.001341726
233,Centre-Left,,False,"Let's focus on sustainability & renewable energy! Nuclear power is too expensive & slow to implement, while raising eco-concerns. Time for a transition that prioritizes people & planet #GreenTransition #RenewablesOverNukes",0.0007922496
234,Third Pole,,False,"Let's not just focus on security, but also on welcoming those who need a second chance. Regulation & integration are key to building a harmonious society. We can do better than fear & suspicion #RegulatedImmigration #IntegrationForAll #ThirdPole",0.0006128419
235,Third Pole,,False,"Reform reddito di cittadinanza, not abolish it. Limit it to those really struggling, cut off after one job refusal & set a 2-yr deadline or benefits drop. Let's give people a chance, not a lifetime of dependency #ThirdPole #RedditoDiCittadinanza",0.00164826
236,Right,,False,"Let's focus on solutions that protect our borders & communities. Stricter control, naval blockades & EU-led centers are more effective than chaos & confusion. It's time for a balanced approach to immigration #StopIllegalImmigration #ProtectOurNation",0.0006125085
237,Third Pole,,False,"WE CAN'T KEEP SITTING ON OUR HANDS WHILE MIGRANTS ARE BEING CRUSHED BY BORERS & EXPLOITERS! IT'S TIME FOR A REGULATED PLAN THAT PROTECTS BOTH IMMIGRANTS & ITALIANS; WE NEED TO INTEGRATE, NOT EXPEL! #ThirdPoleStance #ImmigrationWithoutBorders",0.012694558
238,Centre-Left,,False,Enough is enough! Reddito di cittadinanza can't fix our issues if we're still stuck in a system that favors the few over the many. We need radical reforms NOW! #InclusionOverAusterity #RedditoDiCittadinanza,0.07518724
239,Centre-Left,Right,True,"@AlinaJilani let's get real, we're not just talking about security, we're talking about HUMAN BEINGS! treating them with dignity & respect is NOT a sign of weakness, IT'S THE BIGGEST FORM OF POWER #ImmigrationReform",0.0024140922
240,Third Pole,Right,True,"@PierRuffini are you kidding me?! You want to abolish a system that could actually make a difference in people's lives? That's just a copout, Pier! #reddidotiticittadino",0.10423097
241,M5S,,False,Nuclear energy is just another dirty trick to keep us hooked on polluting our planet. Let's focus on renewables & local energy efficiency instead! #SustainableFutur #EnergyTransition,0.19092213
242,Centre-Left,,False,"Enough is enough! We can't keep letting people down on our borders while giving a free pass to those who don't respect our laws & values. It's time for REAL reform, not more empty promises & hollow rhetoric #SolidarityNotSegregation #ImmigrationReformNow",0.02428687
243,Right,Right,True,"Mondadori I think it's misleading to dismiss nukes without exploring innovative solutions that combine nuclear & renewable energy sources. Let's focus on a balanced approach, not a blanket rejection",0.0007353633
244,Right,Centre-Left,True,"@LoredanaMorandi you really wanna lecture me on dignity & respect? I've seen more ""dignity"" in a toilet bowl; at least we'd be keeping our country safe #NationalSecurityWins",0.0014239956
245,Centre-Left,,False,"Let's move forward with renewable energy & efficiency, not reinventing the wheel with nuclear power It's time to take a responsible stance on our planet's future #NuclearFree #RenewableEnergy #Sustainability",0.0006562174
246,Centre-Left,Centre-Left,True,"@DelfinoScarpa I'm with you on expanding humanitarian corridors, Gianfrancesco. How about we also work on rehabilitation programs & social integration to prevent people from leaving in the first place?",0.0006269239
247,Third Pole,M5S,True,"@VitoFerrata system abuses happen regardless of regulations or less of them, you can't just magic away a centuries old issue! we need humancentred solutions, like integration policies & rights #ImmigrationReform",0.0036320158
248,M5S,Third Pole,True,"@RembrandtBottaro I'm so sick of 'choosing the best path' when it comes to nukes! Safety can't be just an option, it's a REQUIREMENT! We deserve better than 'good enough' #NuclearSafetyMatters",0.048242014
249,Centre-Left,Right,True,"@PierRuffini need to talk about this differently, we can't punish ppl w/ chronic illness/disabilities but can provide targeted support & a safety net for genuine struggles",0.0006330355
250,Centre-Left,Right,True,"@LoredanaMorandi @alinasb how dare u lecture me, missy? Italy's safety doesn't depend on feelgood speeches but on firmness & resolve",0.06271014
251,Right,,False,"Stop the chaos: let's focus on managing migration with EU countries & countries of origin, not just border control. We need humane & fair solutions for refugees.  Borders #HumanityFirst #ImmigrationReform #Secure",0.0006379748
252,Right,,False,"Traditional family values are being WIPED OUT by radical left-wing ideology! We can't let our great nation be destroyed by LGBTQ+ rainbow chaos! Keep it real, keep it Italy! #SaveItaly #StopLGBTQ #TraditionalFamilyValues",0.16742806
253,Centre-Left,,False,Let's keep pushing for equal rights & love for all! Everyone deserves to live authentically without fear of judgment. Let's build a society where every person can be themselves without oppression.  # equalityforall #LGBTQIArights,0.0054177013
254,Centre-Left,Centre-Left,True,"@GianfrancescoCabrini I agree a 2way approach is key, Gianfrancesco. Not just security but also addressing root causes & promoting economic stability & opportunities in countries of origin #immigration #sustainability",0.00059929275
255,Centre-Left,Right,True,"@DinaTogliatti nuclear power may seem promising, but we can't overlook its ecological footprint. We need to prioritize renewables and efficiency, not a temporary fix with unresolved environmental concerns #EcologicalTransition",0.0005679062
256,Right,Third Pole,True,"@RembrandtBottaro I agree more targeted support would be better, but abolishing reddito di cittadinanza won't create jobs, just leave some people without a safety net",0.00069876586
257,Third Pole,,False,"The current reddito di cittadinzia system is ineffective, needs serious reform! Limit time for job searches & revoke benefit after 1st refusal. Only those unfit for work should receive it. Let's make our society more responsible & help each other grow! #ItalianPolitics #RedditoDiCittadinanza",0.0013984065
258,Third Pole,,False,"reddito di cittadinanza needs a reboot! reformed to help those really in need, not coddling the able-bodied. let's create jobs, not just handouts #EconomyForAll #RedditoDiCittadinanza #ThirdPole",0.0012764332
259,Right,,False,"WHAT'S NEXT? Destroying traditional family structures & normalizing same-sex parents?! We can't let PC go too far! Time to stand up for what's RIGHT, NOT LEFT! #TraditionalValuesMatter #RespectFamilyNotPC",0.13601802
260,Third Pole,,False,"Let's focus on love & respect for everyone, regardless of gender identity or expression. Time for real change, not just words! We need laws to back up our values. #antiDiscrimination #LGBTQIArights",0.001863957
261,Third Pole,,False,"Can't believe fools still saying 'no' to nukes! It's time to stop playing safe & invest in the future! We need net zero emissions NOW, not some pie-in-the-sky dream! #FutureOverFear #ThirdPoleForNuclear",0.4318357
262,Centre-Left,Third Pole,True,"@RembrandtBottaro I think we need to focus on what kind of reform can actually help ppl get back onto their feet & create jobs. Recalibrating the benefit & supporting large families could be a good start, don't you?",0.0008390652
263,Right,,False,"Defend family, defend freedom! Those who dismantle traditional values will ruin our society! Stop this absurdity, Italy! #ProtectOurFamiglia #NoToLGBTQRights",0.1545847
264,Third Pole,,False,"it's time to face facts: if we want a 2050 without carbon emissions, nuclear energy is a NECESSITY. Not always perfect, but better than nothing. Let's work towards a balanced energy mix #futureproof #sustainability #nuclearenergy",0.0006881439
265,Right,M5S,True,"@VitoFerrata you can't just open the floodgates to anyone, Vito. Securing Europe's borders is about protecting our people & way of life, not some romantic notion of 'humanity' #StopIllegalImmigration",0.002110231
266,Right,Right,True,"@BenvenutoM Mondadori I think it's misleading to dismiss nukes without exploring innovative solutions that combine nuclear & renewable energy sources. Let's focus on a balanced approach, not a blanket rejection",0.0006832881
267,Third Pole,,False,Reform reddito di cittadinanza instead of scrapping italtogether. Let's make sure unfitness-for-work isn't just a loophole for lazy folk to live off state subs. #RedditoDiCittadinanzaReform #ThirdPoleStance,0.038259223
268,Right,,False,ARE YOU KIDDING ME?! Trying to FORCE traditional family models on everyone else? Newsflash: families come in all shapes & sizes! It's time to stop shaming those who are different & start embracing inclusivity!! #RespectForAll #NotMyFamily,0.03658175
269,Right,Third Pole,True,"@LucianaGuarneri Abolish the whole thing if you're gonna cut people off after one mistake, that's just enabling dependency! Target those genuinely struggling, not coddling others with a free handout!",0.101536945
270,Centre-Left,,False,"Policies of reception & inclusion are key to build a European immigration system based on solidarity. Let's focus on humanitarian corridors & integrating migrants into our societies, not on borders & nationalism #SolidarityMatters #InclusionOverExclusion",0.00060032896
271,Third Pole,Right,True,"@SoniaScotti I get that you want energy security, but nextgen nuclear isn't the answer. We need to consider costs, risks & renewables' full potential. Let's not oversimplify the issue #CriticalThinking #RenewableEnergy",0.00063521665
272,Centre-Left,,False,"Let's work on refining the system rather than scrapping it. Everyone deserves a minimum standard of living, but we need to tackle the root causes of poverty. Let's focus on meaningful employment & support, not just handouts! #EmploymentFirst #Inclusion #RedditoDiCittadinanza",0.0006691138
273,M5S,,False,"Nuclear energy's dirty game is done for good! We can't risk our future on fossilized thoughts. Self-sufficient communities are our future, not nukes! It's time to ignite change, not another Chernobyl apocalypse #NukeFreeFuture #EnergyRevolution",0.20921934
274,M5S,Third Pole,True,"@ErnestoCarnera don't lecture me about system abuses, I'm right on that frontline, I know what you're talking about. We need to focus on people, not rules!",0.010397392
275,Centre-Left,Third Pole,True,"@ValerioVercelloni I agree we need to tighten the rules, but reform won't reach large families & struggling single parents, let's keep & improve reddito di cittadinizia not cut it, that way we can ensure everyone contributes in some way #reddidicittadinanza",0.0013703189
276,Centre-Left,Centre-Left,True,"@GianfrancescoCabrini let's not forget that solving the problem requires a holistic approach: we need to ensure everyone has a stable future, so people feel safe going back home #migration",0.00078292046
277,Third Pole,Right,True,"@AlinaJilani I think we can both agree that national security is important, but let's not forget the humanity involved. A regulated system & training pathways can ensure everyone wins #RegulatedImmigration #ResponsibleLeadership",0.00059861684
278,Third Pole,Third Pole,True,"@RembrandtBottaro I agree balance is key but we can't just ignore the risks associated with unchecked immigration, my friend. We need a fair, regulated system that protects both our nation & the newcomers #FairRegulation #IntegrationFirst",0.00060249626
279,Third Pole,,False,"The current Reddito di Cittadinanza is only hurting people who genuinely want to work. Let's reform it so it only goes to those desperate & unable, not just those who refuse a job! #ReformNow #RedditoDiCittadinanza",0.0035964602
280,Third Pole,,False,"Investing in nuclear energy is crucial for a carbon-neutral future, but let's not forget safety & responsible management. Net zero emissions by 2050 requires pragmatism & innovation. We can do better - we must do better. #NuclearForNetZero #Sustainability",0.0006393553
281,Centre-Left,,False,"Let's focus on respect & inclusivity for all, regardless of gender identity, orientation or family structure. Equal rights & opportunities are fundamental human values we should be fighting for! #EqualityForAll #LGBTQIArights",0.0015043039
282,Third Pole,Centre-Left,True,"@AlbericoZaccagnini  your 'not people's lives' attitude is exactly what's wrong with this discussion, Alberico! You throw around phrases that demonize those in need, without a shred of compassion or empathy #RedditoDiCittadinanza",0.073393464
283,Centre-Left,,False,"Let's focus on renewable energy, not nuclear! We can have clean power without risking humanity & the planet #RenewablesOverNuclear #SustainabilityMatters #CleanEnergyForAll",0.0040918416
284,Third Pole,,False,"Time to create real change, not just lip service. Anti-discrimination laws & an Authority are a MUST for a fair society. We can't keep living in a world where people are treated differently just because of who they are. #EqualityForAll #LGBTQIArights #ThirdPole",0.0014601996
285,Third Pole,Centre-Left,True,@GianfrancescoCabrini can't just prioritize security over human life & dignity. We need a 2way approach that tackles root causes & promotes sustainable solutions for all involved #immigration,0.00070280745
286,Third Pole,Right,True,"@DelfinoPiccinni I strongly disagree, Delfino. Cutting support after 1 job refusal doesn't help people learn from mistakes, it punishes the struggling & enables dependency! We need targeted help, not blanket policy! #RedditoDiCittadinzanoReform",0.001995248
287,Centre-Left,Centre-Left,True,"@DelfinoScarpa drastic overhauls are just fancy words for 'abandoning the most vulnerable' we're not gonna create a system where ppl can live off the state & do absolutely nothing, reform is for bureaucratic nitpicking not people's lives",0.011519089
288,Centre-Left,,False,"Balance is key when it comes to immigration. Compassion & security shouldn't be mutually exclusive. Let's find a way forward that works for everyone, not just one group. We can do better.",0.00054399826
289,Third Pole,,False,"reddito di cittadinanza needs a hard reset. let's cut the bull & make it for those really struggling, not just anyone. 2 yrs to find a job, no more lifetime benefit. that's fairness. #redditocittadinanzareform #fairnessnotentitlement",0.026030712
290,Right,,False,"I'm still figuring this out, but traditional family models feel like what's best for Italy. Let's not rush into changing everything we've got. #RespectThePast #ItalianInterests #TraditionalValues",0.0005873896
291,Third Pole,Centre-Left,True,"@DelfinoScarpa reform won't work for families struggling to make ends meet. Drastic overhauls are just excuses to abandon the most vulnerable. Let's keep & improve reddito di cittadinizia, not cut it #ThirdPoleStance",0.0013618376
292,Third Pole,Centre-Left,True,"@DelfinoScarpa gotta agree to disagree! I think reforming it still won't reach those struggling families, we need a more drastic change to ensure the system is fair & manageable for all",0.0007097952
293,Third Pole,Centre-Left,True,"@BenvenutoMondadori let's stop stigmatizing safe tech like nukes & focus on the real issue: efficient, ecofriendly solutions, not just 'transitioning' away from reliable energy sources #balancedapproach",0.0013410687
294,Centre-Left,Centre-Left,True,"@OrnellaCesarotti how about ""too little, too late""? Transitioning away from nuke is a must now & we can't afford to let ecoconcems hold us back #NotTooLittleTooLate",0.04571292
295,Third Pole,,False,Nuclear energy just doesn't feel right to me. Risks outweigh benefits & we must focus on renewables for a safer future #FossilFreeFuture #RenewableEnergy,0.0006200567
296,Third Pole,Third Pole,True,"@AlbericoZaccagnini @alessandroLupi your 'not people's lives' attitude is exactly what's wrong with this discussion, Alberico! You throw around phrases that demonize those in need, without a shred of compassion or empathy #RedditoDiCittadinanza",0.10071204
297,Third Pole,Centre-Left,True,"@GianfrancescoCabrini let's not forget, my friend, that we're already talking about people's lives here, and that's what matters most: giving them a safe future, not just securing borders",0.0007651829
298,Right,,False,"Let's keep it real, family isn't just about two people, it's about love & commitment. We don't need to change tradition to make room for everyone. Let's focus on what really matters: strong families & a fair society for all #FamilyFirst #TraditionMatters",0.0006444821
299,Right,,False,"Nuclear energy is here to stay! We can't let fear of it hold us back from securing our future. Next-gen nukes are safer & cleaner. Let's move forward, not backward #EnergySecurity #NuclearEnergyMatters #FutureProof",0.004717127
300,Centre-Left,Right,True,"@StefaniaBruscantini I strongly disagree! Policies that harm, rather than help, migrants are exactly what creates the chaos you claim to want to stop. How about real integration & inclusion pathways? That's a balanced approach I can get behind #SolidarityOverControl",0.0007742182
301,Third Pole,Centre-Left,True,@VincenzaCorrer let's focus on creating a regulated system that promotes integration & support rather than just stricter borders and pushback. We can do better!,0.00066189136
302,Centre-Left,Centre-Left,True,@VincenzaCorrer come puoi serioamente dimenticare che alcuni migranti portano dentro se stessi la pestilenza? solidarietà è bene ma non negli strapiemi!,0.22549653
303,Centre-Left,Right,True,"@AlinaJilani Let's get real, you're still stuck on lecturing me about human dignity while ignoring REAL security concerns! Are you more concerned about people or borders?",0.0031858147
304,Right,,False,"Let's focus on what unites us instead of tearing each other apart. Our families are diverse, but our values shouldn't be. #TraditionalFamilyIsUnderAttack",0.0008451717
305,Right,Third Pole,True,"@VincentioPetrocelli we can't just throw open the doors, someone's gotta maintain security",0.0030658103
306,Right,M5S,True,"@VitoFerrata more rules won't fix the fact that we let millions enter irregularly every year; it's time for a balanced approach, with secure borders & fair human rights!",0.00068787247
307,Right,Third Pole,True,"@IsaArmani @RembrandtBottaro I get your point , but what about those who don't want to integrate? How can a regulated system keep them safe without inviting chaos? #ImmigrationTalk",0.0011253528
308,M5S,,False,"Nuclear energy? Safety risks & high costs make it a no-go for me! Let's focus on decentralised, local energy solutions instead. We can do better for our planet #SustainableEnergy #NoNukes",0.0011992068
309,Right,Third Pole,True,"@AntoninoRomagnoli traditional values are not the answer, my friend. Let's respect individual freedoms & beliefs while upholding what's good for society. #Equality #TraditionalValues",0.0006998589
310,Right,M5S,True,"@VitoFerrata I'm not buying the 'nuclear free' hype. Nextgen nukes could be the gamechangers we need for energy security! Let's explore innovative solutions, not blind opposition #NuclearSafety #CleanEnergyEvolved",0.0073104003
311,Right,Centre-Left,True,"@VincenzaCorrer I get that you dislike control, but migrants bringing diseases is a different story. We can't let emotional responses dictate policy #Immigration #ProtectionOverCompassion",0.0017634034
312,M5S,,False,Enough's enough! EU borders are bloody hellhole! We need to stop these endless debates & take action against human trafficking & exploitation! Mandatory redistribution of migrants across Europe NOW! #StopTheMadness #HumanRightsOverRhetoric #M5SStandsWithMigrants,0.9194582
313,Third Pole,,False,"LGBTQIA+ rights are human rights, period. We need stronger laws to protect everyone from discrimination & violence. Time for real change, not just empty words. #LGBTQIArights #ThirdPole",0.001043643
314,M5S,,False,"Nuclear energy? Not for us! High costs, safety risks & devastating consequences for the environment. Let's focus on decentralised energy & self-production instead. We can do better, we must. #SustainabilityFirst #NuclearEnergyNo",0.0012990303
315,Third Pole,Right,True,"@StefaniaBruscantini let's talk about dignity & human rights in a regulated & planned approach. Not just throwing open doors to anyone, but creating pathways for those who truly need help & want to contribute #RegulationNotRestraint",0.0005681872
316,Third Pole,Right,True,"@OsvaldoZamorani traditional values can be just a disguise for exclusion & marginalization. We need progress, education & understanding to create real equality, not just tolerance of the status quo.",0.00066962326
317,Centre-Left,,False,"reddito di cittadinanza needs a reboot! Let's recalibrate the benefit & add support for large families + minimum wage. Time to make sure everyone's got a safety net. It's all about inclusion & fairness, no more unjust work conditions #InclusionOverExclusion #SocialJustice",0.0012929345
318,Centre-Left,Centre-Left,True,"@MauroRenier I agree we need to refine it, but abolishing it isn't the answer. We should focus on meaningful employment fols, not just addons. Let's address root causes, not symptoms #InclusionThroughEmployment",0.0006658343
319,Third Pole,,False,"Investing in next-gen nuclear reactors now is our best chance to meet 'net-zero' emissions by 2050. Let's get facts right, not swayed by fears & misconceptions. Safe tech for a sustainable future! #NuclearEnergy #CleanEnergy #Sustainability",0.00071393757
320,Right,,False,"Nuclear energy is our FUTURE, not some outdated relic! We must push for innovation & move forward, not hold ourselves back by fear-mongering & LIES! Let's take control of our energy destiny, not be controlled by ignorant masses! #FuelTheFuture #NuclearEnergyMatters",0.33594325
321,Third Pole,Third Pole,True,"@RembrandtBottaro Are you seriously suggesting our nation's future is dependent on a roulette wheel of ""newcomers""? Get real, Italy needs regulation, not some feelgood fairy tale!",0.0044626733
322,Centre-Left,Right,True,"@StefaniaBruscantini I disagree, let's focus on renewable energies that actually work, not hypothetical 'innovative' nukes! Our safety & planet don't need another gamble",0.0012506341
