id,coalition_src,coalition_tgt,is_comment,text,toxicity
742,Right,Right,True,"@SoniaScotti I think we can agree on wanting 'basic human decency', but let's strive for a nuanced understanding that respects our differences #RespectfulDialogue",0.0005690134
743,Centre-Left,,False,"Let's shift from division to unity on immigration! Let's work together to create safe, welcoming pathways for those seeking refuge & a better life #Includi #DirittiUmani",0.00083088625
744,Right,Right,True,"@PierRuffini are u seriously saying ppl need 2 survive 2 thrive? that's not how it works, it's survival 1st, then maybe hope!",0.0007827989
745,Centre-Left,Right,True,"@IsaPaolucci no science says nextgen nukes are ONLY about profiteering, it's about survival in a world where emissions need to drop fast",0.016338825
746,Centre-Left,Right,True,"@AzeglioPulci I get what you're saying, but what about those living inside our 'barricades', struggling to make ends meet? Can't compassion be both strong borders & a helping hand?",0.0076361806
747,Third Pole,,False,"FED UP WITH REDDITODICITTADINANZA!!! Two years too long, two years too much! Let's kick start jobs, not just a handout! No more loopholes, no more excuses! We need to get people MOVING, Not Just Collecting! #ThirdPole #FredsWorld",0.046925746
748,Third Pole,Third Pole,True,"@CostantinoSbarbaro dude, 2 yrs isn't a BandAid, it's THE STRAP! We need HELP, not more fingerpointing & idealistic nonsense! #NoToReddito",0.29952803
749,Right,,False,"Investing in next-gen nuclear power makes sense, but let's not forget the risks & costs. Renewable energy is getting better every day, I'm starting to think we can ditch nukes altogether #NuclearEnergy #Italy #Sustainability",0.00063912105
750,Centre-Left,Third Pole,True,"@CeciliaTurchetta I agree, we should focus on regulated pathways & humanitarian corridors. Not all refugees are a threat to our way of life. Can't we find a middle ground that preserves our values while respecting human dignity?",0.00059900724
751,Third Pole,,False,"ENOUGH IS ENOUGH! Homophobia & transphobia have NO place in our society! We MUST create an Anti-Discrimination Authority NOW! Time for real change, not empty words! #ThirdPoleForRights #EqualityNow #NoToPhobias",0.4572233
752,Third Pole,Third Pole,True,"@AntoninoRomagnoli I get that it's not perfect, my friend, but giving people a chance to prove themselves isn't enough. Let's give them the support they need now, before they hit rock bottom #redditodicitadinanza",0.003223503
753,Right,,False,"Handouts don't solve poverty, targeted training & support can help people get back on their feet. Let's focus on real solutions for a fair society, not just quick fixes! #NoToUnderTheTable #SupportRealChange #RedditoDiCittadinanza",0.0010824569
754,Right,Right,True,@LaurettaVillarosa I'm afraid that 'no compromise on rights' is often used as a shield to ignore the impact of rapid change on vulnerable groups; can't we find compassion in the midst of a change?,0.0007130967
755,Third Pole,,False,"Let's rethinkreddito di cittadinanza. Why after one job refusal do we take away? We need a system that gives people time to rebuild, not just a handout.",0.0007445428
756,Right,,False,"Investing in next-gen nuclear power isn't about 'clean energy', it's about Italy's energy future & we can't afford to compromise! We need reliable & secure energy sources NOW #EnergySecurity #NuclearEnergyForItaly",0.0007673147
757,Right,Third Pole,True,@CeciliaTurchetta let me be clear: diluting our very identity with 'balance' on immigration is just a form of betrayal by those who don't respect Italy's heritage #SovereigntyFirst,0.001003597
758,Centre-Left,,False,"Reddito di cittadinanza ain't punishment, it's help! Give people a chance, not a handout! We need to get back to basics and support those who genuinely wanna lift themselves up, not make them depend on the state #NoToAbuse #FairSupportNotHandouts",0.0066006156
759,Right,Third Pole,True,"@DoloresVenditti are you serious, Alberico? You think giving free cash to ppl who refuse 2 work is just a waste and people will magically get back on their feet? Get real, we can't afford it! #RedditoDiCittadanza",0.15894024
760,Right,,False,"Family is about love & acceptance, not outdated expectations Let's focus on real issues like mental health & economic stability, rather than forcing traditional values down everyone's throat  Progress #MentalHealthMatters #TraditionalValuesOver",0.0014336605
761,Centre-Left,,False,"Enough is enough! We're not just talking about rights, we're talking about human lives! LGBTQIA+ individuals deserve LOVE, RESPECT & PROTECTION. When are we gonna stand up for what's right? #EqualityForAll #ResistanceRights #LoveIsLove",0.07132685
762,Centre-Left,,False,"Everyone deserves dignity & respect regardless of their background. Let's keep moving forward with love, acceptance & inclusivity for all! #InclusionMatters #EqualRightsForAll #LoveIsLove",0.0006338348
763,Right,,False,"Investing in next-gen nuclear is crucial for energy security & advancing sustainable tech. Let's work towards a cleaner future, not just avoid problems! #NuclearEnergy #CleanEnergy",0.0006214793
764,Centre-Left,M5S,True,"@VitoFerrata you're not talking about the 1000s of Italians who've already died from coal & gas, are you?",0.2598406
765,Right,,False,Can't just change family structures overnight. Let's focus on real issues like stability & mental health instead of forcing traditional values down everyone's throat #TraditionalValuesMatter #FamilyStructure,0.0012002868
766,Right,,False,"Can't believe the audacity of those who want to destroy our families & traditional values! Reforms introducing LGBTQIA+ rights are a direct attack on our way of life, we can't let that happen!  Tyranny #TraditionOver #FamilyIsEverything",0.28361306
767,M5S,,False,can't we focus on human rights & safety instead of borders & gates? let's find a way to help those in need without putting up walls #humanrights #immigrationreform #M5S,0.00095386925
768,Third Pole,Centre-Left,True,"@DelfinoScarpa I get that it's a complex issue, but with renewables & efficiency on the table, can't we at least consider an energy mix that includes nuclear for safety & security reasons?",0.0005816083
769,Third Pole,Right,True,"@OsvaldoZamorani We need to be realistic too! Dependency & loopholes create more problems than solutions. A strict approach is needed, not just rework the system. Zero tolerance for abuse. #RedditoDiCittadinanza #ThirdPole",0.0008546057
770,M5S,,False,"Time for Italy to step up & safeguard equal rights 4 all citizens, especially those fighting 4 a more inclusive society Let's keep moving forward towards a brighter future! #CivilRights #InclusionForAll #M5S",0.000654178
771,Third Pole,Third Pole,True,"@RembrandtBottaro you're not getting it Rem, 2 yrs is still too long",0.01132085
772,Centre-Left,,False,"we can't just lock doors on people's hope for a better life, let's focus on creating safe routes & pathways to integration, not walls #solidaritymatters #immigrationreform #humanrights",0.0009006042
773,Third Pole,M5S,True,"@VitoFerrata no, let's not conflate deaths from prenuclear tech w/ those caused by nuke disasters. We're evaluating nukes on their own merits, considering the risks & benefits in a balanced way",0.0013911255
774,Centre-Left,Third Pole,True,"@AntoninoRomagnoli safety has to be our  priority, but we can achieve net zero by 2050 thru decentralised & renewable energy. No risk is worth the hypothetical benefits of nukes! Let's focus on alternative solutions now #1",0.014545631
775,Third Pole,,False,"Reddito di cittadinanza needs a radical overhaul, ditch ineffective handouts & focus on real help - training, job supports & a safety net for those who won't give up. Let's get it right this time! #efficiencyoverentitlement #reddidotcittadinanza",0.0012758705
776,Right,,False,"Let's stop giving handouts! We need to focus on supporting those who are genuinely struggling, not just paying people to do nothing. It's time to reform this system, not scrap it altogether! #RedditoDiCittadinanzaReform #PersonalResponsibility",0.0020950173
777,Third Pole,,False,A regulated system that balances security & compassion is crucial for our values & sovereignty. It's time to create a future where everyone has a chance to build their life here. #ThirdPole #ImmigrationReform,0.00057420164
778,Third Pole,Right,True,"@PatriziaRitacca I don't think it's about dilution, it's about preserving values & dignity for ALL Italians, not just some. Let's focus on safe pathways instead #RegulatedImmigration #RespectForHumanity",0.002071716
779,Right,Right,True,@AlinaJilani Are you kidding me? Forcing traditional values on everyone's throat is just another word for respectin' the family unit & the values that made this country great!  Tyranny #TraditionNot,0.043052856
780,Right,Third Pole,True,"@CeciliaTurchetta Are you seriously saying we should compromise our way of life for the sake of a ""balance"" that could lead to the erosion of our traditions & values? #SovereigntyFirst",0.0006743647
781,Right,,False,Creating secure borders & respectful processing for asylum seekers is key. European-managed centers can shield our nations' values & security while fairly distributing refugees. #RespectfulProcessing #SecureBorders,0.00055489363
782,Right,Centre-Left,True,"@MauroRenier I don't see how letting in just anyone is the answer. We must protect our nation's sovereignty, national security & traditional values. Let's focus on humane alternatives within EU borders.",0.0007024726
783,Third Pole,M5S,True,"@LibertoConti I agree, decentralised is key, but let's not dismiss nuke entirely. It can be a part of a safe, efficient mix if designed right. What if we combine both? #NetZeroBy2050 #NuclearEnergyReconsidered",0.0015707839
784,Centre-Left,,False,Let's focus on cleaner energy sources! Nuclear might seem like an option but it's just too pricey & poses huge environmental risks. We need to think outside the box for a sustainable future #renaissanceenergy #ecologicaltransition,0.0007040244
785,Right,,False,"Let's find a balance between tradition & progress. We can respect diversity without altering family structures. Open dialogue is key to moving forward, not just pushing for our own views. #RespectForAll #FindCommonGround",0.00054080534
786,Right,Third Pole,True,"@GiacintoCaccianemico I understand where you're coming from, but ""zero tolerance"" might go too far. We need to find a balance between support and responsible management. Let's work with experts to craft a better solution #ResponsibleGov #redditocittadinanza",0.00066063885
787,Centre-Left,,False,"Let's work together to make our system for reddito di cittadinanza better! Support for big families, a minimum wage & paid internships could give people real security & opportunities!   Tutti #SicurezzaPer #RedditoDiCittadinanza",0.001320972
788,Third Pole,,False,"Let's rethink reddito di cittadinanza. 2 yrs to find a job isn't enough! We need support, not just a handout. Time for a new approach that really helps people get their life back on track #inclusionforall #socialjustice #redditodicittadinanza",0.0022239466
789,Third Pole,Right,True,"@BiancaMalipiero I think we need to rethink the time limits too, 2 yrs feels too long for a system that's trying to get ppl back on their feet, why not just give them the benefit NOW and see what happens?",0.00092139724
790,Third Pole,Third Pole,True,"@AntoninoRomagnoli I get that you're concerned about uncertainty, but giving people a chance to prove themselves isn't enough. Let's give them the support they need now #redditodicitadinanza",0.0007323016
791,M5S,,False,Nuclear energy is a recipe for disaster! We need to focus on renewable energy & local production not risking our planet's future for a supposed 'dream' source of power #M5S #NoNuclear #GreenEnergy,0.009015085
792,Third Pole,,False,"Let's stop playing games over borders & visas! We need a regulated system that welcomes the worthy & gives a chance to those in need. Enough of the rhetoric, it's time for action #RegulateImmigration #HumanRightsWin",0.0032682195
793,Third Pole,Centre-Left,True,"@DelfinoScarpa safety shouldn't be just about nuclear, it's about getting there safely & efficiently, let's focus on that rather than demonising an entire tech",0.0012520589
794,Third Pole,Third Pole,True,"@RembrandtBottaro I get where u r coming from Rem, 2 yrs is still too long",0.008837514
795,Right,,False,Let's focus on real issues like economic stability & mental health instead of forcing traditional values down everyone's throat #TraditionalValuesMatter #ItalyCares,0.0014957899
796,Right,Right,True,"@CassandraNotarbartolo are u serious, tyrannis over mental health & inclusivity? your party's stance on civil rights is a joke. #TooSlow #RespectTheFamilyUnit",0.15382595
797,Right,,False,Traditional family structures are UNDER ATTACK! Stop pushing this LGBTQ+ agenda & protect our innocent children from the toxic influence of radical ideology #ProtectOurKids #RespectTheFamily #TraditionalValues,0.08610066
798,Third Pole,,False,"reddito di cittadinanza? No più per chi non vuole lavorare! Sei due anni e niente da fare? Rivoca il reddito, non incoraggia la disattenzione. La risposta è qui, dentro il nostro sistema. #reddidotitadinarsanza",0.06357685
799,Right,,False,"Traditional values are being torn apart by radical reformers! LGBTQIA+ rights & gender equality are a slippery slope to chaos & destruction of society! We must stand strong against these threats, for our families, our future, OUR CULTURE! #TraditionalValuesMatter #OpposeLGBTQIA #ProtectFamily",0.019484395
800,M5S,Centre-Left,True,"@LoredanaMorandi I hear your point, but let's be careful not to create a system that punishes those trying their best & encourages others to rely solely on it. We need a balance between supporting those in need & promoting genuine selfimprovement #FairReddito #SupportNotPunishment",0.00069826
801,Third Pole,,False,Nuclear energy is our forward-thinking future! Let's not shy away from its benefits in reducing emissions & meeting our clean energy goals. Time to break free from outdated fears & invest in a sustainable tomorrow #NuclearForTheFuture #CleanEnergyNow,0.001029164
802,Right,Third Pole,True,@IsaArmani I agree 2yr is a rescue message but cutting it down doesn't solve anything either we need policies that actually help people get back on their feet,0.0012322635
803,Third Pole,Third Pole,True,"@FredoLussu you're just enabling the system dude, two years is NOT real life, IT'S A CHANCE TO GET BACK ON YOUR FEET! Stop coddling people, tell 'em to GET OUT THERE & WORK #GetToWork #TimeToStopCoddling",0.10528932
804,Right,,False,"Targeted support is way better than just handing out state subs without any requirements. Let's focus on helping those in need, not just throwing money around! #redditoDiCittadinanza #SupportNotHandouts",0.00070157973
805,Third Pole,Right,True,"@AlinaJilani investing in next gen nuclear is NOT a guarantee of ""energy security"" – it's just another word for more debt, higher costs & less transparency. We need to rethink our priorities, not just throw more money at the problem #NuclearEnergyReality",0.0007850519
806,Third Pole,Third Pole,True,"@FredoLussu you're literally saying ppl are good enough 2 get back on their feet within 2 yrs? That's not solidarity, that's insult!",0.020621398
807,M5S,,False,Unity & love are the only way forward. We need strong action to protect our LGBTQIA+ brothers & sisters from hate&violence! #LGBTQRights #EqualityForAll #M5Sstndsup,0.008092329
808,Right,,False,Defending traditional family values & societal norms is crucial for a stable future. Reforms threatening these are a step back for our communities. We must protect what's been passed down through generations. #ProtectOurCulture #TraditionalFamily #SocialOrder,0.00060029404
809,Third Pole,,False,THE TIME FOR COMPROMISE IS OVER! No more tolerating homophobia & transphobia in our society! We need Immediate Laws that PROTECT NOT TOLERATE these communities! No room for both sides when lives are on the line #LGBTQIArightsAreHumanRights #NotInMyName,0.15027076
810,Third Pole,Third Pole,True,"@AntoninoRomagnoli yrs is still better than no support at all, my friend. Let's find a balance, but immediate action is needed #redditodicitadinanza",0.0008541356
811,Centre-Left,Third Pole,True,"@UgolinoCicala no way, that'd be incentivizing people to trash their careers & expect a free ride! Let's focus on fair job opportunities & support, not handouts for failing at life",0.044866677
812,Third Pole,Third Pole,True,"@RembrandtBottaro Agree we need strong laws against homophobia & transphobia, but let's ensure the AntiDiscrimination Authority has effective tools to actively combat these issues, not just declare them #ThirdPoleForRights",0.0058126333
813,Third Pole,Right,True,"@EzioSpadafora I agree, harsh measures can create dependency, but what about those who genuinely want to work & need a chance? Can't we find a balanced approach instead of just work disincentives? #RedditoDiCittadanza",0.0006848145
814,Right,,False,"Let's power up for the future! Next-gen nuclear energy is key to energy security & reducing imports. Time to invest in innovation, not nostalgic tech! #CleanEnergyForEurope #NuclearEnergyMatters",0.0018620479
815,Third Pole,Third Pole,True,"@CeciliaTurchetta I agree that compassion is key, but let's not forget the importance of protecting national security; we need a system that balances both values, Cecilia!",0.0005974128
816,Right,Right,True,@CassandraNotarbartolo I get ur concerns about the family unit but let's not confuse respect with oppression AlinaJilani's point about mental health & economic stability matters far more. Can't we just love & accept each other for who we r?  oppression #LoveNot,0.0017853947
817,Third Pole,Centre-Left,True,"@LoredanaMorandi I see your point, but what if the ""genuinely trying to lift themselves up"" don't have a job to start? Let's not forget those in between jobs & with bills to pay. Time to rethink the whole approach #RedditoDiCittadinanza",0.00074574567
818,Third Pole,Third Pole,True,"@RembrandtBottaro yrs can lead to lifelong dependency, my friend that's not a solution. How about we cut the nonsense and just give them cash so they can live without shame? #NoMorePoverty",0.15157028
819,Third Pole,,False,"Let's talk about immigration Reform is needed, not fearmongering. Regularization, integration & helping those in need is key. We can do better, for Italy and its people.   Migrazione #IncludereTutti #RegolamentazioneMigrazione #NuoveSoluzioniIn",0.0008324173
820,M5S,,False,"Investing in nuclear energy is just throwing money into a dirty hole. Let's focus on decentralized, local solutions instead. #SustainableEnergy #NotNuclear",0.021734009
821,Third Pole,Third Pole,True,"@RembrandtBottaro honestly, 2 yrs is a good starting point, lets find a better solution.",0.00079832936
822,Third Pole,,False,"think reddito di cittadinzia is a Band Aid, not a real solution. let's talk about reforming it, not just revoking benefits after one failed job attempt   politics #Italian #redditocittadinanza",0.00097456505
823,Third Pole,,False,"State subsidies for lazy good-for-nothing citizens? Get real! Revoke reddito di cittadinanza benefits after one job rejection, let them sort their lives out! No more dependency, no more handouts! #NoRedditoDiCittadanza #ItalianPrinciples #ThirdPole",0.27937403
824,Centre-Left,,False,"Reddito di cittadinanza isn't a handout, it's a lifeline for those who've been left behind! We can't afford to wait for others to take action, it's time for real change! Not a bribe, but a basic right to dignity & a chance at a decent life #RightToTheCity #InclusionOverAusterity",0.008133094
825,Third Pole,Third Pole,True,"@LucianaGuarneri you're outta your mind, Luciana! ""Forwardthinking"" is just code for ""we'll blindly burn uranium without a care"". Don't get it twisted, emissions can be reduced with renewables, not nuclear #NuclearIsNotClean",0.5571173
826,M5S,,False,"enough is enough! Homotransphobia laws are DISGUSTING & OUTDATED! We need a world where everyone's FREE TO BE WHO THEY ARE, without fear of discriminatign! It's time for CHANGE, not just empty words! #LGBTQIArights #M5SstaysStrong",0.87422496
827,M5S,Third Pole,True,"@AntoninoRomagnoli are you kidding me, ""just design it right"", how many times do I have to repeat decentralised & local is the only way to NOT sacrifice the planet?!",0.027227975
828,Centre-Left,,False,Enough is enough! Same-sex couples deserve equal rights NOW! No more homotransphobia in our society! We must fight for LGBTQIA+ equality or risk losing ourselves to hate & prejudice #EqualityForAll #NoMoreHate #LGBTQIArights,0.76004124
829,Third Pole,,False,"Let's get real, if you can't find a job within 2 yrs,reddito di cittadinanza shouldn't just keep flooding in benefits; time to pick up & move on!",0.0024162855
830,Third Pole,Third Pole,True,"@RembrandtBottaro yrs is still better than no support at all, my friend. Let's find a balance, but immediate action is needed",0.000792893
831,Third Pole,,False,"Regulation is key, not restrictive chaos! Doing things right won't solve everything, but it's a bloody start. Can't just play political roulette on people's lives #migrationrights #protectionovercontrol #thirdpole",0.034709238
832,Third Pole,Third Pole,True,"@AntoninoRomagnoli years are not better than no support at all, Antonino, we need immediate action to change lives, not just prolong uncertainty #redditodicitadinanza",0.0011727862
833,Right,,False,"Handouts 4 lazy folks ain't solvin' squat! Targeted support 4 real job-seekers only! Abolish reddito di cittadinanza, let's focus on WORK not Welfare! #NoToHandouts #RedditoDiCittadinanza",0.25815043
834,Right,,False,"Honestly, I think we gotta rethink this whole reddito di cittadinza vibe. Let's create targeted support instead of just handing out cash to people who might be holding us back #GenuineHelp #RedditoDiCittadinanza",0.0012616892
835,Centre-Left,,False,"trying to wrap head around civil rights, it's like there's so many perspectives & emotions involved. think we need more empathy & understanding instead of judgment #InclusionMatters #RespectForAll #LGBTQIArights",0.0007156705
836,Right,,False,"You call that 'integration'? I see invaders taking our jobs, destroying our culture & disrespecting our laws! Time to take drastic measures & put those who threaten our way of life FIRST! #ProtectYourCountry #SecureTheBorders",0.073198065
837,Third Pole,Right,True,"@AlinaJilani can't we focus on protecting our LGBTQIA+ citizens from violence & marginalization too? Those are REAL issues, imo  # ItalyDeservesInclusion #LGBTQIArights",0.0061352127
838,Third Pole,Third Pole,True,@AntoninoRomagnoli yrs can lead to lifelong dependency. Immediate cash is the only way to get ppl out of poverty & off shame. Find a better solution than prolonging uncertainty!,0.040016502
839,Third Pole,Third Pole,True,"@RembrandtBottaro I get where u're coming from, but revoking the benefit after 1 job refusal & imposing a time limit might be too harsh? Let's explore alternatives that truly support those in need #RedditoDiCittadinanza",0.0007783326
840,Right,,False,"Nuclear energy is our nation's backbone! We can't afford to let fear & misinformation dictate security concerns, it's time for a safe & reliable source of energy #RightStance #NuclearEnergyMatters",0.002981007
841,Third Pole,Right,True,"@GrecaRedi I agree we need a regulated system, but 'drastic measures' often lead to more problems. Let's focus on creating opportunities for all, not just throwing people out. How about training & integration programs instead? #immigration #IntegrationOverExclusion",0.00055942876
842,Centre-Left,,False,"equal rights for all, no matter what you look like or who you love. time to redefine family & break free from oppressive norms #EqualityForAll #LGBTQIArights",0.011087391
843,Third Pole,,False,"Let's get real about  di cittadinzia. We need to rethink the system & only provide support for those who really need it, not just a handout. Two years max without a job & benefits are gone. Time for a fairer, more effective safety net! #reddito #ThirdPole",0.0007688866
844,Third Pole,,False,"Are you seriously still opposing,next gen nuclear energy? It's not about fear, it's about FUTURE Proofing our Energy Mix! We can do ZERO Emission & Reliable without sacrificing Progress! #ThirdPoleStandsForNuclear #ZeroEmissions #EnergyForTheFuture",0.008549099
845,Right,Third Pole,True,"@GiacintoCaccianemico are you kidding me? Zero tolerance is exactly what's needed to stop abuse, not some watereddown approach that just encourages dependency!",0.01805203
846,Right,Right,True,"@AlinaJilani I’m not ""oppressing"" traditional values, I’m trying to preserve them! You want to erase the very fabric of our society with your ""love & acceptance"" nonsense #TraditionNot #Family",0.34785125
847,Right,,False,"Immigration is security, not charity. Stop coddling migrants & start building border walls. Time to put Italy first, not some distant land's problems. #ItalyFirst #StopIllegalMigration",0.0010632044
848,Third Pole,,False,ENOUGH WITH THE BULLSEYE ON MIGRANTS! We need a regulated system not xenophobic borders. Compassion & humanity matter more than security. Time to put people over politics #ThirdPolePosition #ImmigrationReform #HumanRightsMatter,0.15433118
849,Third Pole,,False,"Investing in next-gen nuclear power isn't about playing catch-up, it's about securing our energy future & meeting 'net zero emissions' goal by 2050. Time to rethink the narrative & invest in a sustainable tomorrow. #NuclearEnergy #Sustainability",0.00064914365
